,uri,lang,isDuplicate,date,time,dateTime,dateTimePub,dataType,sim,url,title,body,authors,concepts,image,eventUri,sentiment,wgt,relevance,source.uri,source.dataType,source.title,all_concepts,con_name,country,lang-name,language,Political-Alignment,wiki-url,Cultural-Class,Economic-Class,Continent-name,Continent,Religions,2019Rank-From,SafetyandSecurity,PersonalFreedom,Governance,SocialCapital,InvestmentEnvironment,EnterpriseConditions,MarketAccessandInfrastructure,EconomicQuality,LivingConditions,Health,Education,NaturalEnvironment,PowerDistance,Individualism,Masculinity,UncertaintyAvoidance,LongTermOrientation,Indulgence,economicblocs-name,economicblocs,militarydefenseblocs-name,militarydefenseblocs,politicalregionalblocs-name,politicalregionalblocs,linguisticblocs-name,linguisticblocs,proScore,destination,parent,count,status,year,month,day,min,hour,MD
5,7446989192,eng,False,2023-03-14,19:17:00,2023-03-14 19:17:00,2023-03-14T19:17:00Z,news,0.7137255072593689,https://www.thedailystar.net/news/world/europe/news/death-toll-malawi-jumps-190-3271606,Death toll in Malawi jumps to 190,"The death toll in Malawi from tropical storm Freddy has jumped to 190 from 99 reported previously, the country's disaster management agency said yesterday.

Freddy, one of the strongest storms ever recorded in the southern hemisphere and potentially the longest-lasting tropical cyclone, has killed scores of people and left a trail of destruction in Malawi and Mozambique after it made landfall for the second time over the weekend.

As heavy rains continued to pummel Malawi yesterday, 584 people have been injured and 37 are still reported missing, the country's Department of Disaster Management Affairs said in a statement.

It pummelled central Mozambique on Saturday, ripping roofs off buildings and bringing widespread flooding around the port of Quelimane, before moving inland towards Malawi with torrential rains that caused landslides.

The full extent of the damage and loss of life in Mozambique in particular is not yet clear.",[],"[{'uri': 'http://en.wikipedia.org/wiki/Malawi', 'type': 'loc', 'score': 5, 'label': {'eng': 'Malawi'}, 'location': {'type': 'country', 'label': {'eng': 'Malawi'}}}, {'uri': 'http://en.wikipedia.org/wiki/Tropical_cyclone', 'type': 'wiki', 'score': 4, 'label': {'eng': 'Tropical cyclone'}}, {'uri': 'http://en.wikipedia.org/wiki/Southern_Hemisphere', 'type': 'wiki', 'score': 3, 'label': {'eng': 'Southern Hemisphere'}}, {'uri': 'http://en.wikipedia.org/wiki/Landfall', 'type': 'wiki', 'score': 2, 'label': {'eng': 'Landfall'}}, {'uri': 'http://en.wikipedia.org/wiki/Mozambique', 'type': 'loc', 'score': 2, 'label': {'eng': 'Mozambique'}, 'location': {'type': 'country', 'label': {'eng': 'Mozambique'}}}, {'uri': 'http://en.wikipedia.org/wiki/Flood', 'type': 'wiki', 'score': 1, 'label': {'eng': 'Flood'}}, {'uri': 'http://en.wikipedia.org/wiki/Landslide', 'type': 'wiki', 'score': 1, 'label': {'eng': 'Landslide'}}, {'uri': 'http://en.wikipedia.org/wiki/Port', 'type': 'wiki', 'score': 1, 'label': {'eng': 'Port'}}, {'uri': 'http://en.wikipedia.org/wiki/Quelimane', 'type': 'loc', 'score': 1, 'label': {'eng': 'Quelimane'}, 'location': {'type': 'place', 'label': {'eng': 'Quelimane'}, 'country': {'type': 'country', 'label': {'eng': 'Mozambique'}}}}]",,eng-8467663,-0.6392156862745098,416517420,1,thedailystar.net,news,The Daily Star,Malawi Tropical cyclone Southern Hemisphere Landfall Mozambique Flood Landslide Port Quelimane,Bangladesh,BD,Bengali,ben,Center-left,ChatGPT,C20,C5,Asia,AS,Muslim,124.0,141.0,125.0,133.0,112.0,133.0,91.0,106.0,103.0,121.0,106.0,126.0,151.0,80.0,20.0,55.0,60.0,47.0,20.0,,,,,,,,,-1,,,0,False,2023,3,14,17,19,2023-03-14
