,uri,lang,isDuplicate,date,time,dateTime,dateTimePub,dataType,sim,url,title,body,authors,concepts,image,eventUri,sentiment,wgt,relevance,source.uri,source.dataType,source.title,all_concepts,con-name,country,lang-name,language,Political-Alignment,wiki-url,Cultural-Class,Economic-Class,Continent-name,Continent,Religions,2019Rank-From,SafetyandSecurity,PersonalFreedom,Governance,SocialCapital,InvestmentEnvironment,EnterpriseConditions,MarketAccessandInfrastructure,EconomicQuality,LivingConditions,Health,Education,NaturalEnvironment,PowerDistance,Individualism,Masculinity,UncertaintyAvoidance,LongTermOrientation,Indulgence,economicblocs-name,economicblocs,militarydefenseblocs-name,militarydefenseblocs,politicalregionalblocs-name,politicalregionalblocs,linguisticblocs-name,linguisticblocs,proScore,destination,parent,count,status,year,month,day,min,hour,MD
495,714099647,eng,False,2017-08-23,16:41:00,2017-08-23 16:41:00,,news,0.6274510025978088,https://www.rt.com/news/400671-pakistan-scapegoat-us-afghanistan/,"Pakistan fires back at US, asks not to be made 'scapegoat' for Afghan failures  --  RT News","On Monday, Trump presented a new strategy for Afghanistan at the US Army's Joint Base Myer-Henderson Hall. During his speech, the US leader criticized Pakistan by saying it has ""safe havens"" for terrorists. Trump added that the US is running out of patience and wants to see more commitment to peace from the Pakistani government.

US Secretary of State Rex Tillerson later followed Trump's line, saying aid to Pakistan might be reviewed, as well as Islamabad's status as a major non-NATO ally.

""The amount of aid and military assistance we give them, their status as non-NATO alliance partner - all of that can be put on the table,"" he said.

Islamabad condemned the US criticism of its fight against terrorism, accusing Washington of shifting the blame for its own failures.

""They should not make Pakistan a scapegoat for their failures in Afghanistan,"" Pakistani Foreign Minister Khawaja Asif said on Tuesday in an interview with Geo TV, as cited by Reuters. He added that its ""commitment to war against terrorism is unmatched and unshaken.""

Pakistan had earlier called Trump's claims of ""safe havens"" for the Taliban and other terrorist groups a ""false narrative.""

""No country in the world has suffered more than Pakistan from the scourge of terrorism, often perpetrated from outside our borders. It is, therefore disappointing that the US policy statement ignores the enormous sacrifices rendered by the Pakistani nation in this effort,"" the Pakistani foreign minister said in a statement.

Islamabad also said the protracted war in Afghanistan had failed to bring peace to the country and was not likely to succeed soon.

""The military action during the last 17 years has not brought peace to Afghanistan, and it is not likely to do so in the future. Only an Afghan-led, Afghan-owned politically negotiated solution can lead to sustainable peace in Afghanistan,"" it stated. The ministry added that any ""exclusive military solution to the crisis in Afghanistan"" would be fruitless.

China backed Pakistan, urging other nations to ""fully recognize"" its efforts in fighting terrorism.

""Pakistan is at the forefront of the counterterrorism efforts. For many years, it has made positive efforts and great sacrifices for combating terrorism and made important contributions to upholding world peace and regional stability,"" Chinese Foreign Ministry spokeswoman Hua Chunying stated on Tuesday.

At the same time, Trump called on another key player in the region, India, to ""help more"" with Afghanistan, as it ""makes billions of dollars in trade with the United States.""

""We appreciate India's important contributions to stability in Afghanistan, but India makes billions of dollars in trade with the United States, and we want them to help us more with Afghanistan, especially in the area of economic assistance and development,"" Trump said Monday.

The necessity to pressure India over Afghanistan was also voiced by the US envoy to the UN, Nikki Haley.

""We've got to put the pressure on India that they have to be part of the political solution,"" Haley told CNN.

The US campaign in Afghanistan has long been criticized, having continued under three American leaders, including Trump. When Trump took office, the Taliban controlled more territory than it did at any time since 2001 and Islamic State (IS, formerly ISIS/ISIL), which didn't even exist before the invasion, already had a foothold in eastern Afghanistan.

Richard Becker from the anti-war Answer Coalition told RT: ""We must recall that the rise of these organizations [Al-Qaeda, Islamic State] to prominence really came about because of the US invasion in Iraq, the destruction of the government of Libya and the war sponsored by the outside forces against the government of Syria. That is an open space for the real growth and development.""

During the last 12 months the US-backed government in Kabul has lost another 5 percent of the country's territory, and now controls about 60 percent of Afghanistan.

Trump did not promise to withdraw US personnel any time soon, saying ""conditions on the ground - not arbitrary timetables - will guide our strategy from now on.""

From now on, it's ""Trump's war,"" says former US diplomat Jim Jatras.",[],"[{'uri': 'http://en.wikipedia.org/wiki/Terrorism', 'type': 'wiki', 'score': 5, 'label': {'eng': 'Terrorism'}}, {'uri': 'http://en.wikipedia.org/wiki/Islamabad', 'type': 'loc', 'score': 5, 'label': {'eng': 'Islamabad'}, 'location': {'type': 'place', 'label': {'eng': 'Islamabad'}, 'country': {'type': 'country', 'label': {'eng': 'Pakistan'}}}}, {'uri': 'http://en.wikipedia.org/wiki/United_States', 'type': 'loc', 'score': 5, 'label': {'eng': 'United States'}, 'location': {'type': 'country', 'label': {'eng': 'United States'}}}, {'uri': 'http://en.wikipedia.org/wiki/Pakistan', 'type': 'loc', 'score': 5, 'label': {'eng': 'Pakistan'}, 'location': {'type': 'country', 'label': {'eng': 'Pakistan'}}}, {'uri': 'http://en.wikipedia.org/wiki/Afghanistan', 'type': 'loc', 'score': 5, 'label': {'eng': 'Afghanistan'}, 'location': {'type': 'country', 'label': {'eng': 'Afghanistan'}}}, {'uri': 'http://en.wikipedia.org/wiki/United_States_Army', 'type': 'org', 'score': 4, 'label': {'eng': 'United States Army'}}, {'uri': 'http://en.wikipedia.org/wiki/Foreign_minister', 'type': 'wiki', 'score': 4, 'label': {'eng': 'Foreign minister'}}, {'uri': 'http://en.wikipedia.org/wiki/India', 'type': 'loc', 'score': 4, 'label': {'eng': 'India'}, 'location': {'type': 'country', 'label': {'eng': 'India'}}}, {'uri': 'http://en.wikipedia.org/wiki/Major_non-NATO_ally', 'type': 'org', 'score': 3, 'label': {'eng': 'Major non-NATO ally'}}, {'uri': 'http://en.wikipedia.org/wiki/Rex_Tillerson', 'type': 'person', 'score': 3, 'label': {'eng': 'Rex Tillerson'}}, {'uri': 'http://en.wikipedia.org/wiki/Khawaja_Muhammad_Asif', 'type': 'person', 'score': 3, 'label': {'eng': 'Khawaja Muhammad Asif'}}, {'uri': 'http://en.wikipedia.org/wiki/Government_of_Pakistan', 'type': 'org', 'score': 3, 'label': {'eng': 'Government of Pakistan'}}, {'uri': 'http://en.wikipedia.org/wiki/War_on_Terror', 'type': 'loc', 'score': 3, 'label': {'eng': 'War on Terror'}, 'location': None}, {'uri': 'http://en.wikipedia.org/wiki/Taliban', 'type': 'org', 'score': 3, 'label': {'eng': 'Taliban'}}, {'uri': 'http://en.wikipedia.org/wiki/United_States_Secretary_of_State', 'type': 'wiki', 'score': 3, 'label': {'eng': 'United States Secretary of State'}}, {'uri': 'http://en.wikipedia.org/wiki/Reuters', 'type': 'org', 'score': 3, 'label': {'eng': 'Reuters'}}, {'uri': 'http://en.wikipedia.org/wiki/RT_(TV_network)', 'type': 'org', 'score': 3, 'label': {'eng': 'RT (TV network)'}}, {'uri': 'http://en.wikipedia.org/wiki/Washington,_D.C.', 'type': 'loc', 'score': 3, 'label': {'eng': 'Washington, D.C.'}, 'location': {'type': 'place', 'label': {'eng': 'Washington, D.C.'}, 'country': {'type': 'country', 'label': {'eng': 'United States'}}}}, {'uri': 'http://en.wikipedia.org/wiki/Islamic_State_of_Iraq_and_the_Levant', 'type': 'loc', 'score': 2, 'label': {'eng': 'Islamic State of Iraq and the Levant'}, 'location': None}, {'uri': ""http://en.wikipedia.org/wiki/Ministry_of_Foreign_Affairs_of_the_People's_Republic_of_China"", 'type': 'org', 'score': 2, 'label': {'eng': ""Ministry of Foreign Affairs of the People's Republic of China""}}, {'uri': 'http://en.wikipedia.org/wiki/Counter-terrorism', 'type': 'wiki', 'score': 2, 'label': {'eng': 'Counter-terrorism'}}, {'uri': 'http://en.wikipedia.org/wiki/Nikki_Haley', 'type': 'person', 'score': 2, 'label': {'eng': 'Nikki Haley'}}, {'uri': 'http://en.wikipedia.org/wiki/United_Nations', 'type': 'org', 'score': 2, 'label': {'eng': 'United Nations'}}, {'uri': 'http://en.wikipedia.org/wiki/CNN', 'type': 'org', 'score': 2, 'label': {'eng': 'CNN'}}, {'uri': 'http://en.wikipedia.org/wiki/China', 'type': 'loc', 'score': 2, 'label': {'eng': 'China'}, 'location': {'type': 'country', 'label': {'eng': 'China'}}}, {'uri': 'http://en.wikipedia.org/wiki/Diplomat', 'type': 'wiki', 'score': 1, 'label': {'eng': 'Diplomat'}}, {'uri': 'http://en.wikipedia.org/wiki/Al-Qaeda', 'type': 'org', 'score': 1, 'label': {'eng': 'Al-Qaeda'}}, {'uri': 'http://en.wikipedia.org/wiki/Iraq', 'type': 'loc', 'score': 1, 'label': {'eng': 'Iraq'}, 'location': {'type': 'country', 'label': {'eng': 'Iraq'}}}, {'uri': 'http://en.wikipedia.org/wiki/Kabul', 'type': 'loc', 'score': 1, 'label': {'eng': 'Kabul'}, 'location': {'type': 'place', 'label': {'eng': 'Kabul'}, 'country': {'type': 'country', 'label': {'eng': 'Afghanistan'}}}}, {'uri': 'http://en.wikipedia.org/wiki/Syria', 'type': 'loc', 'score': 1, 'label': {'eng': 'Syria'}, 'location': {'type': 'country', 'label': {'eng': 'Syria'}}}, {'uri': 'http://en.wikipedia.org/wiki/Libya', 'type': 'loc', 'score': 1, 'label': {'eng': 'Libya'}, 'location': {'type': 'country', 'label': {'eng': 'Libya'}}}]",https://img.rt.com/files/2017.08/article/599d921cfc7e9361758b4567.jpg,eng-3382459,-0.3254901960784313,241202460,1,rt.com,news,RT,"Terrorism Islamabad United States Pakistan Afghanistan United States Army Foreign minister India Major non-NATO ally Rex Tillerson Khawaja Muhammad Asif Government of Pakistan War on Terror Taliban United States Secretary of State Reuters RT (TV network) Washington, D.C. Islamic State of Iraq and the Levant Ministry of Foreign Affairs of the People's Republic of China Counter-terrorism Nikki Haley United Nations CNN China Diplomat Al-Qaeda Iraq Kabul Syria Libya",Russia,RU,,,State-controlled,ChatGPT,C16,C12,Asia,AS,Christian,77.0,139.0,140.0,111.0,54.0,85.0,97.0,60.0,41.0,68.0,84.0,23.0,76.0,93.0,39.0,36.0,95.0,81.0,20.0,,,Collective Security Treaty Organization (CSTO),CSTO,Commonwealth of Independent States (CIS),CIS,,,-1,,,0,False,2017,8,23,41,16,2017-08-23
