,uri,lang,isDuplicate,date,time,dateTime,dateTimePub,dataType,sim,url,title,body,authors,concepts,image,eventUri,sentiment,wgt,relevance,source.uri,source.dataType,source.title,all_concepts,con_name,country,lang-name,language,Political-Alignment,wiki-url,Cultural-Class,Economic-Class,Continent-name,Continent,Religions,2019Rank-From,SafetyandSecurity,PersonalFreedom,Governance,SocialCapital,InvestmentEnvironment,EnterpriseConditions,MarketAccessandInfrastructure,EconomicQuality,LivingConditions,Health,Education,NaturalEnvironment,PowerDistance,Individualism,Masculinity,UncertaintyAvoidance,LongTermOrientation,Indulgence,economicblocs-name,economicblocs,militarydefenseblocs-name,militarydefenseblocs,politicalregionalblocs-name,politicalregionalblocs,linguisticblocs-name,linguisticblocs,proScore,destination,parent,count,status,year,month,day,min,hour,MD
32,7447326557,eng,False,2023-03-15,00:53:00,2023-03-15 00:53:00,2023-03-15T00:28:00Z,news,0.4549019634723663,https://www.straitstimes.com/world/united-states/soggy-california-drenched-anew-as-noreaster-storm-buries-new-england-new-york,"Soggy California drenched anew as Nor'easter storm buries New England, New York","NEW YORK - The latest in a series of atmospheric river storms soaked California on Tuesday, bringing another deluge of rain to the already-saturated state, while a Nor'easter swirling over New York and New England prompted emergency orders and closed roads.

Up to 25cm of rain was forecast in some areas of California, while up to 0.9m of fresh snow was expected to hit high-mountain elevations where snowdrifts already reach rooftops, according to the National Weather Service (NWS).

Along California's coast and lower inland areas, the heavy rain and melting alpine snow triggered a renewed threat of flooding from rain-swollen rivers and streams, compromising levees. Forecasts warned of widespread uprooting of trees and down power lines from winds gusting up to 113kmh.

""Lives and property are in great danger from Tuesday into Wednesday,"" the weather service said in its California forecast, warning residents to expect flash flooding in areas that do not normally experience it.

In anticipation of the ""atmospheric river"" - a current of air laden with dense tropical moisture from the Pacific - emergency crews filled sandbags and patrolled levees and riverbanks around the clock.

Nine atmospheric rivers lashed California in rapid succession from late December through mid-January, triggering widespread flooding, levee failures, mudslides and punishing surf. At least 20 people perished.

Another such storm drenched much of the state last Thursday night and Friday, causing levee failures along the Pajaro River in Monterey County and flooding entire communities made of predominantly of migrant farm workers.

Even as the 11th atmospheric river of the season soaked the region once more on Tuesday, emergency crews scrambled to patch the Parajo's earthen levee with rocks and fill. Some 21,000 people in the flood zone remained under evacuation orders or warnings, officials said.

""The impact of this is really ramping up today,"" said Mr Marc Chenard, a meteorologist with the NWS Weather Prediction Centre in College Park, Maryland. Most of the heavy weather would occur on Tuesday and Wednesday, he said, but flooding will persist.

Mandatory evacuation orders remained in effect for residents in 10 California counties on Tuesday, according to the Federal Emergency Management Agency. The greatest flood risks are from California's Central Coast to the southern Sierra Nevada foothills.

Chenard said that at elevations higher than 1,500m, the snowpack absorbs rain like a sponge. But the real risk is at lower elevations where rain runs off the snow, melting much of it and bringing floods and mudslides.

At Front Porch Farms in Healdsburg about 70 miles north of San Francisco, Mr Tommy Otey said he was glad to see his 11 million-gallon reservoir filling, after years of historic drought that parched California and forced his farm to downsize.

""This should last us the whole season,"" said Mr Otey, who primarily sells flowers to Bay Area florists.",[],"[{'uri': 'http://en.wikipedia.org/wiki/Levee', 'type': 'wiki', 'score': 5, 'label': {'eng': 'Levee'}}, {'uri': 'http://en.wikipedia.org/wiki/Atmospheric_river', 'type': 'wiki', 'score': 5, 'label': {'eng': 'Atmospheric river'}}, {'uri': 'http://en.wikipedia.org/wiki/New_York_(state)', 'type': 'wiki', 'score': 5, 'label': {'eng': 'New York (state)'}}, {'uri': 'http://en.wikipedia.org/wiki/California', 'type': 'loc', 'score': 5, 'label': {'eng': 'California'}, 'location': {'type': 'place', 'label': {'eng': 'California'}, 'country': {'type': 'country', 'label': {'eng': 'United States'}}}}, {'uri': 'http://en.wikipedia.org/wiki/Flood', 'type': 'wiki', 'score': 4, 'label': {'eng': 'Flood'}}, {'uri': 'http://en.wikipedia.org/wiki/Snow', 'type': 'wiki', 'score': 4, 'label': {'eng': 'Snow'}}, {'uri': ""http://en.wikipedia.org/wiki/Nor'easter"", 'type': 'wiki', 'score': 3, 'label': {'eng': ""Nor'easter""}}, {'uri': 'http://en.wikipedia.org/wiki/Alpine_climate', 'type': 'wiki', 'score': 3, 'label': {'eng': 'Alpine climate'}}, {'uri': 'http://en.wikipedia.org/wiki/Snowdrift', 'type': 'wiki', 'score': 3, 'label': {'eng': 'Snowdrift'}}, {'uri': 'http://en.wikipedia.org/wiki/River', 'type': 'wiki', 'score': 3, 'label': {'eng': 'River'}}, {'uri': 'http://en.wikipedia.org/wiki/National_Weather_Service', 'type': 'org', 'score': 3, 'label': {'eng': 'National Weather Service'}}, {'uri': 'http://en.wikipedia.org/wiki/New_England', 'type': 'loc', 'score': 3, 'label': {'eng': 'New England'}, 'location': {'type': 'place', 'label': {'eng': 'New England'}, 'country': {'type': 'country', 'label': {'eng': 'United States'}}}}, {'uri': 'http://en.wikipedia.org/wiki/Pajaro_River', 'type': 'wiki', 'score': 2, 'label': {'eng': 'Pajaro River'}}, {'uri': 'http://en.wikipedia.org/wiki/Flash_flood', 'type': 'wiki', 'score': 2, 'label': {'eng': 'Flash flood'}}, {'uri': 'http://en.wikipedia.org/wiki/Tropics', 'type': 'wiki', 'score': 2, 'label': {'eng': 'Tropics'}}, {'uri': 'http://en.wikipedia.org/wiki/Surfing', 'type': 'wiki', 'score': 2, 'label': {'eng': 'Surfing'}}, {'uri': 'http://en.wikipedia.org/wiki/Pacific_Ocean', 'type': 'loc', 'score': 2, 'label': {'eng': 'Pacific Ocean'}, 'location': None}, {'uri': 'http://en.wikipedia.org/wiki/Mudflow', 'type': 'wiki', 'score': 2, 'label': {'eng': 'Mudflow'}}, {'uri': 'http://en.wikipedia.org/wiki/Refugee', 'type': 'wiki', 'score': 2, 'label': {'eng': 'Refugee'}}, {'uri': 'http://en.wikipedia.org/wiki/Monterey_County,_California', 'type': 'loc', 'score': 2, 'label': {'eng': 'Monterey County, California'}, 'location': {'type': 'place', 'label': {'eng': 'Monterey County, California'}, 'country': {'type': 'country', 'label': {'eng': 'United States'}}}}, {'uri': 'http://en.wikipedia.org/wiki/Central_Coast_(California)', 'type': 'wiki', 'score': 1, 'label': {'eng': 'Central Coast (California)'}}, {'uri': 'http://en.wikipedia.org/wiki/Snowpack', 'type': 'wiki', 'score': 1, 'label': {'eng': 'Snowpack'}}, {'uri': 'http://en.wikipedia.org/wiki/Federal_Emergency_Management_Agency', 'type': 'org', 'score': 1, 'label': {'eng': 'Federal Emergency Management Agency'}}, {'uri': 'http://en.wikipedia.org/wiki/Reservoir', 'type': 'wiki', 'score': 1, 'label': {'eng': 'Reservoir'}}, {'uri': 'http://en.wikipedia.org/wiki/Sierra_Nevada', 'type': 'wiki', 'score': 1, 'label': {'eng': 'Sierra Nevada'}}, {'uri': 'http://en.wikipedia.org/wiki/Drought', 'type': 'wiki', 'score': 1, 'label': {'eng': 'Drought'}}, {'uri': 'http://en.wikipedia.org/wiki/San_Francisco', 'type': 'loc', 'score': 1, 'label': {'eng': 'San Francisco'}, 'location': {'type': 'place', 'label': {'eng': 'San Francisco'}, 'country': {'type': 'country', 'label': {'eng': 'United States'}}}}, {'uri': 'http://en.wikipedia.org/wiki/Healdsburg,_California', 'type': 'loc', 'score': 1, 'label': {'eng': 'Healdsburg, California'}, 'location': {'type': 'place', 'label': {'eng': 'Healdsburg, California'}, 'country': {'type': 'country', 'label': {'eng': 'United States'}}}}, {'uri': 'http://en.wikipedia.org/wiki/College_Park,_Maryland', 'type': 'loc', 'score': 1, 'label': {'eng': 'College Park, Maryland'}, 'location': {'type': 'place', 'label': {'eng': 'College Park, Maryland'}, 'country': {'type': 'country', 'label': {'eng': 'United States'}}}}]",https://static1.straitstimes.com.sg/s3fs-public/styles/large30x20/public/articles/2023/03/15/2023-03-14T232829Z2083099145RC2XTZ9RTMSLRTRMADP3USA-WEATHER-CALIFORNIA.JPG?VersionId=RZc6q9nzdyF9UVgpZyBouwgPyRjcOGpy,eng-8468865,-0.2941176470588235,416537580,1,straitstimes.com,news,The Straits Times,"Levee Atmospheric river New York (state) California Flood Snow Nor'easter Alpine climate Snowdrift River National Weather Service New England Pajaro River Flash flood Tropics Surfing Pacific Ocean Mudflow Refugee Monterey County, California Central Coast (California) Snowpack Federal Emergency Management Agency Reservoir Sierra Nevada Drought San Francisco Healdsburg, California College Park, Maryland",Singapore,SG,,,Center-right,ChatGPT,C18,C2,Asia,AS,Buddhist,17.0,best,average,best,best,best,best,best,best,best,best,best,average,high,low,low,low,high,low,Association of Southeast Asian Nations (ASEAN) ,ASEAN,,,,,,,-1,,,0,False,2023,3,15,53,0,2023-03-15
