,uri,lang,isDuplicate,date,time,dateTime,dateTimePub,dataType,sim,url,title,body,authors,concepts,image,eventUri,sentiment,wgt,relevance,source.uri,source.dataType,source.title,all_concepts,con-name,country,lang-name,language,Political-Alignment,wiki-url,Cultural-Class,Economic-Class,Continent-name,Continent,Religions,2019Rank-From,SafetyandSecurity,PersonalFreedom,Governance,SocialCapital,InvestmentEnvironment,EnterpriseConditions,MarketAccessandInfrastructure,EconomicQuality,LivingConditions,Health,Education,NaturalEnvironment,PowerDistance,Individualism,Masculinity,UncertaintyAvoidance,LongTermOrientation,Indulgence,economicblocs-name,economicblocs,militarydefenseblocs-name,militarydefenseblocs,politicalregionalblocs-name,politicalregionalblocs,linguisticblocs-name,linguisticblocs,proScore,destination,parent,count,status,year,month,day,min,hour,MD
130,7441435057,eng,False,2023-03-11,08:18:00,2023-03-11 08:18:00,2023-03-11T08:17:00Z,news,0.9098039269447327,https://www.bangkokpost.com/world/2525554/merapi-volcano-erupts-on-java,Merapi volcano erupts on Java,"JAKARTA: Indonesia's Merapi volcano erupted on Saturday, spewing hot cloud up to seven kilometres into the air, the country's disaster management agency said.

The volcano located in the Yogyakarta special region on the island of Java erupted around noon local time and a lava flow of 1.5 kilometres was observed, the local authority said.

Residents in the nearby community have been warned to stop any activities in the danger zones, range between three to seven kilometres radius from the crater, the statement said.

The 2,963 metre-high Merapi is one of Indonesia's most active volcanoes and was already on the country's second-highest alert level.

An official at local monitoring post said no residents have been evacuated.

""This has only been observed as a one-time event, there have been five or six avalanches. If the coverage continues to increase and the distance is further than 7 kilometres, it is likely that the residents will be recommended to evacuate,"" said the official, identified as Yulianto.

Located on the Pacific Ring of Fire, Indonesia has more volcanoes than any other country. Merapi last erupted violently in 2010, killing more than 350 people and forcing the the evacuation of around 280,000 residents.

That was its most powerful eruption since an event in 1930 that killed around 1,300 people. An eruption in 1994 left about 60 people dead.",[],"[{'uri': 'http://en.wikipedia.org/wiki/Mount_Merapi', 'type': 'loc', 'score': 4, 'label': {'eng': 'Mount Merapi'}, 'location': None}, {'uri': 'http://en.wikipedia.org/wiki/Volcano', 'type': 'wiki', 'score': 4, 'label': {'eng': 'Volcano'}}, {'uri': 'http://en.wikipedia.org/wiki/Indonesia', 'type': 'loc', 'score': 4, 'label': {'eng': 'Indonesia'}, 'location': {'type': 'country', 'label': {'eng': 'Indonesia'}}}, {'uri': 'http://en.wikipedia.org/wiki/Lava', 'type': 'org', 'score': 3, 'label': {'eng': 'Lava'}}, {'uri': 'http://en.wikipedia.org/wiki/Emergency_management', 'type': 'wiki', 'score': 3, 'label': {'eng': 'Emergency management'}}, {'uri': 'http://en.wikipedia.org/wiki/Local_government', 'type': 'wiki', 'score': 3, 'label': {'eng': 'Local government'}}, {'uri': 'http://en.wikipedia.org/wiki/Jakarta', 'type': 'loc', 'score': 3, 'label': {'eng': 'Jakarta'}, 'location': {'type': 'place', 'label': {'eng': 'Jakarta'}, 'country': {'type': 'country', 'label': {'eng': 'Indonesia'}}}}, {'uri': 'http://en.wikipedia.org/wiki/Java', 'type': 'loc', 'score': 3, 'label': {'eng': 'Java'}, 'location': {'type': 'place', 'label': {'eng': 'Java'}, 'country': {'type': 'country', 'label': {'eng': 'Indonesia'}}}}, {'uri': 'http://en.wikipedia.org/wiki/Yogyakarta', 'type': 'loc', 'score': 3, 'label': {'eng': 'Yogyakarta'}, 'location': {'type': 'place', 'label': {'eng': 'Yogyakarta'}, 'country': {'type': 'country', 'label': {'eng': 'Indonesia'}}}}, {'uri': 'http://en.wikipedia.org/wiki/Volcanic_crater', 'type': 'wiki', 'score': 2, 'label': {'eng': 'Volcanic crater'}}, {'uri': 'http://en.wikipedia.org/wiki/Ring_of_Fire', 'type': 'wiki', 'score': 1, 'label': {'eng': 'Ring of Fire'}}, {'uri': 'http://en.wikipedia.org/wiki/Avalanche', 'type': 'org', 'score': 1, 'label': {'eng': 'Avalanche'}}]",https://static.bangkokpost.com/media/content/20230311/c1_2525554_700.jpeg,eng-8468195,-0.1686274509803921,416218680,1,bangkokpost.com,news,Bangkok Post,Mount Merapi Volcano Indonesia Lava Emergency management Local government Jakarta Java Yogyakarta Volcanic crater Ring of Fire Avalanche,Thailand,TH,,,Center-right,ChatGPT,C20,C9,Asia,AS,Buddhist,64.0,117.0,118.0,114.0,28.0,46.0,64.0,51.0,40.0,69.0,31.0,72.0,111.0,64.0,20.0,34.0,64.0,32.0,45.0,Association of Southeast Asian Nations (ASEAN) ,ASEAN,,,,,,,-1,,,0,False,2023,3,11,18,8,2023-03-11
