,uri,lang,isDuplicate,date,time,dateTime,dateTimePub,dataType,sim,url,title,body,authors,concepts,image,eventUri,sentiment,wgt,relevance,source.uri,source.dataType,source.title,all_concepts,con_name,country,lang-name,language,Political-Alignment,wiki-url,Cultural-Class,Economic-Class,Continent-name,Continent,Religions,2019Rank-From,SafetyandSecurity,PersonalFreedom,Governance,SocialCapital,InvestmentEnvironment,EnterpriseConditions,MarketAccessandInfrastructure,EconomicQuality,LivingConditions,Health,Education,NaturalEnvironment,PowerDistance,Individualism,Masculinity,UncertaintyAvoidance,LongTermOrientation,Indulgence,economicblocs-name,economicblocs,militarydefenseblocs-name,militarydefenseblocs,politicalregionalblocs-name,politicalregionalblocs,linguisticblocs-name,linguisticblocs,proScore,destination,parent,count,status,year,month,day,min,hour,MD
216,7443181462,eng,False,2023-03-12,15:13:00,2023-03-12 15:13:00,2023-03-12T15:12:00Z,news,0.5764706134796143,https://www.ctvnews.ca/climate-and-environment/15-million-californians-are-under-flood-watches-as-another-atmospheric-river-takes-aim-at-a-storm-battered-state-1.6309866,15 million Californians are under flood watches as another atmospheric river takes aim at a storm-battered state,"Another round of storms is heading to flood-ravaged California, where residents are still grappling with impassable roads, overflowing rivers, inundated neighbourhoods and a levee breach that forced hundreds to evacuate.

A new atmospheric river is expected to slam the state Monday, threatening heavy rain and even more flooding in central and Northern California just as another atmospheric river winds down, the National Weather Service said. Atmospheric rivers are long, narrow bands of moisture that can carry saturated air thousands of miles like a fire hose.

About 15 million people remain under flood watches in California and Nevada as the storm approaches.

""Rainfall totals exceeding 6 inches are possible across portions of central and Northern California through this event,"" CNN Meteorologist Haley Brink said Sunday.

Starting Monday night, ""the rain will impact increasingly sensitive portions of central California that were hit hard by the rainfall on Friday and early Saturday,"" the Weather Prediction Center said. As a result, it ""won't take long once the steady heavy rain gets started for flooding impacts to resume.""

More flooding could make for a dire situation in some neighbourhoods, where torrential walls of rain in recent days turned streets into rivers and damaged roads, stranding people and prompting rescues. At least two people have died as a result of the storms, officials said.

Among the hardest-hit areas is Monterey County, where the swollen Pajaro River breached a levee at around midnight Friday. Water gushed uncontrollably into nearby Pajaro, forcing residents to flee -- the ""worst case scenario"" for the community, said Luis Alejo, chair of the Monterey County board of supervisors.

Some people weren't able to evacuate before the floodwater arrived, and crews were still out performing high-water rescues Saturday, Cal Fire Capt. Curtis Rhodes told CNN.

Many Pajaro residents are farm workers who may not only lose property, but also not be able to make a living for some time if the continued flooding impacts agriculture, Alejo said.

""These are the folks who can least afford this type of hardship,"" he said.

As residents crowd emergency shelters, efforts to stop the flooding from the breach are complicated by the approaching second atmospheric river.

""This weekend is a very brief respite,"" said David King with the National Weather Service. ""The weather will turn, expected Monday night.""

While eyes were on the Pajaro River, the Salinas River to the south was also overflowing -- prompting more evacuation orders in Monterey County. The rising river water had already flooded homes and businesses around the San Ardo community.

Emergency crews have rescued more than 90 people in Monterey County, Sheriff Tina Nieto said. ""We even rescued a man floating down one of the areas in a tube with his pet on top of him,"" she said.

To the north, as Friday's heavy rains pummelled Santa Cruz County, about 700 residents in Soquel got trapped after a pipe failure led to severe flooding and the collapse of the one road linking the community to the rest of the region, said Steve Wiesner, the county's assistant public works director.

Residents will remain isolated until a new crossing can be created -- which could take days, Wiesner said.

""We are now an island,"" resident Molly Watson told CNN.

Another hard hit area was Tulare County, where evacuation orders were expanded to include the Teviston community as well as parts of Cutler and Exeter when river flow increased, the county sheriff's office announced Friday night. Officials urged residents to stay clear of waterways and avoid all unnecessary travel.

In Tulare County, video from Springville showed devastating damage after Friday's severe flooding.

""It's quite heart breaking,"" Hatti Shepard told CNN. ""Many hard-working people displaced with losses of home and possessions.""

The recent atmospheric rivers are the latest to bedevil the state after an onslaught of similar storms in December and January also resulted in deadly flooding.

But this new wave of storms is pummelling areas already buried by heavy snowfall from the past two weeks. Melting snowpack will play a role in prolonging flooding over the upcoming days, forecasters said.

President Joe Biden has approved a state of emergency declaration requested by Gov. Gavin Newsom. The move frees funds for the millions of residents who have been hit with severe weather since the beginning of the year.

Meanwhile, Nevada Gov. Joe Lombardo expanded a state of emergency to include more counties due to flooding associated with the same storm.

""As this severe weather continues to impact more residents across northern Nevada I again urge all Nevadans to stay safe, travel cautiously, and to follow all local guidance,"" Lombardo said in a statement. ""State and federal partners will continue to monitor local damage and will work quickly to assess needed repairs across northern Nevada.""",[],"[{'uri': 'http://en.wikipedia.org/wiki/Pajaro_River', 'type': 'wiki', 'score': 5, 'label': {'eng': 'Pajaro River'}}, {'uri': 'http://en.wikipedia.org/wiki/Northern_California', 'type': 'wiki', 'score': 5, 'label': {'eng': 'Northern California'}}, {'uri': 'http://en.wikipedia.org/wiki/Flood', 'type': 'wiki', 'score': 5, 'label': {'eng': 'Flood'}}, {'uri': 'http://en.wikipedia.org/wiki/Atmospheric_river', 'type': 'wiki', 'score': 5, 'label': {'eng': 'Atmospheric river'}}, {'uri': 'http://en.wikipedia.org/wiki/Monterey_County,_California', 'type': 'loc', 'score': 5, 'label': {'eng': 'Monterey County, California'}, 'location': {'type': 'place', 'label': {'eng': 'Monterey County, California'}, 'country': {'type': 'country', 'label': {'eng': 'United States'}}}}, {'uri': 'http://en.wikipedia.org/wiki/California', 'type': 'loc', 'score': 5, 'label': {'eng': 'California'}, 'location': {'type': 'place', 'label': {'eng': 'California'}, 'country': {'type': 'country', 'label': {'eng': 'United States'}}}}, {'uri': 'http://en.wikipedia.org/wiki/Levee', 'type': 'wiki', 'score': 4, 'label': {'eng': 'Levee'}}, {'uri': 'http://en.wikipedia.org/wiki/CNN', 'type': 'org', 'score': 4, 'label': {'eng': 'CNN'}}, {'uri': 'http://en.wikipedia.org/wiki/River', 'type': 'wiki', 'score': 4, 'label': {'eng': 'River'}}, {'uri': 'http://en.wikipedia.org/wiki/National_Weather_Service', 'type': 'org', 'score': 4, 'label': {'eng': 'National Weather Service'}}, {'uri': 'http://en.wikipedia.org/wiki/Luis_Alejo', 'type': 'person', 'score': 3, 'label': {'eng': 'Luis Alejo'}}, {'uri': 'http://en.wikipedia.org/wiki/Central_California', 'type': 'wiki', 'score': 3, 'label': {'eng': 'Central California'}}, {'uri': 'http://en.wikipedia.org/wiki/Weather_Prediction_Center', 'type': 'org', 'score': 3, 'label': {'eng': 'Weather Prediction Center'}}, {'uri': 'http://en.wikipedia.org/wiki/Aquifer', 'type': 'wiki', 'score': 3, 'label': {'eng': 'Aquifer'}}, {'uri': 'http://en.wikipedia.org/wiki/Rain', 'type': 'wiki', 'score': 3, 'label': {'eng': 'Rain'}}, {'uri': 'http://en.wikipedia.org/wiki/Salinas_River_(California)', 'type': 'loc', 'score': 2, 'label': {'eng': 'Salinas River (California)'}, 'location': None}, {'uri': 'http://en.wikipedia.org/wiki/Board_of_supervisors', 'type': 'wiki', 'score': 2, 'label': {'eng': 'Board of supervisors'}}, {'uri': 'http://en.wikipedia.org/wiki/California_Department_of_Forestry_and_Fire_Protection', 'type': 'org', 'score': 2, 'label': {'eng': 'California Department of Forestry and Fire Protection'}}, {'uri': 'http://en.wikipedia.org/wiki/Agriculture', 'type': 'wiki', 'score': 2, 'label': {'eng': 'Agriculture'}}, {'uri': 'http://en.wikipedia.org/wiki/Nevada', 'type': 'loc', 'score': 2, 'label': {'eng': 'Nevada'}, 'location': {'type': 'place', 'label': {'eng': 'Nevada'}, 'country': {'type': 'country', 'label': {'eng': 'United States'}}}}, {'uri': 'http://en.wikipedia.org/wiki/Tulare_County,_California', 'type': 'loc', 'score': 2, 'label': {'eng': 'Tulare County, California'}, 'location': {'type': 'place', 'label': {'eng': 'Tulare County, California'}, 'country': {'type': 'country', 'label': {'eng': 'United States'}}}}, {'uri': 'http://en.wikipedia.org/wiki/San_Ardo,_California', 'type': 'loc', 'score': 2, 'label': {'eng': 'San Ardo, California'}, 'location': {'type': 'place', 'label': {'eng': 'San Ardo, California'}, 'country': {'type': 'country', 'label': {'eng': 'United States'}}}}, {'uri': 'http://en.wikipedia.org/wiki/Gavin_Newsom', 'type': 'person', 'score': 1, 'label': {'eng': 'Gavin Newsom'}}, {'uri': 'http://en.wikipedia.org/wiki/Snowpack', 'type': 'wiki', 'score': 1, 'label': {'eng': 'Snowpack'}}, {'uri': 'http://en.wikipedia.org/wiki/Waterway', 'type': 'wiki', 'score': 1, 'label': {'eng': 'Waterway'}}, {'uri': 'http://en.wikipedia.org/wiki/Sheriff', 'type': 'wiki', 'score': 1, 'label': {'eng': 'Sheriff'}}, {'uri': 'http://en.wikipedia.org/wiki/Severe_weather', 'type': 'wiki', 'score': 1, 'label': {'eng': 'Severe weather'}}, {'uri': 'http://en.wikipedia.org/wiki/U.S._state', 'type': 'wiki', 'score': 1, 'label': {'eng': 'U.S. state'}}, {'uri': 'http://en.wikipedia.org/wiki/State_of_emergency', 'type': 'wiki', 'score': 1, 'label': {'eng': 'State of emergency'}}, {'uri': 'http://en.wikipedia.org/wiki/County_(United_States)', 'type': 'wiki', 'score': 1, 'label': {'eng': 'County (United States)'}}, {'uri': 'http://en.wikipedia.org/wiki/Joe_Biden', 'type': 'person', 'score': 1, 'label': {'eng': 'Joe Biden'}}, {'uri': 'http://en.wikipedia.org/wiki/Snow', 'type': 'wiki', 'score': 1, 'label': {'eng': 'Snow'}}, {'uri': 'http://en.wikipedia.org/wiki/Teviston,_California', 'type': 'loc', 'score': 1, 'label': {'eng': 'Teviston, California'}, 'location': {'type': 'place', 'label': {'eng': 'Teviston, California'}, 'country': {'type': 'country', 'label': {'eng': 'United States'}}}}, {'uri': 'http://en.wikipedia.org/wiki/Springville,_California', 'type': 'loc', 'score': 1, 'label': {'eng': 'Springville, California'}, 'location': {'type': 'place', 'label': {'eng': 'Springville, California'}, 'country': {'type': 'country', 'label': {'eng': 'United States'}}}}, {'uri': 'http://en.wikipedia.org/wiki/Soquel,_California', 'type': 'loc', 'score': 1, 'label': {'eng': 'Soquel, California'}, 'location': {'type': 'place', 'label': {'eng': 'Soquel, California'}, 'country': {'type': 'country', 'label': {'eng': 'United States'}}}}, {'uri': 'http://en.wikipedia.org/wiki/Santa_Cruz_County,_California', 'type': 'loc', 'score': 1, 'label': {'eng': 'Santa Cruz County, California'}, 'location': {'type': 'place', 'label': {'eng': 'Santa Cruz County, California'}, 'country': {'type': 'country', 'label': {'eng': 'United States'}}}}, {'uri': 'http://en.wikipedia.org/wiki/Exeter', 'type': 'loc', 'score': 1, 'label': {'eng': 'Exeter'}, 'location': {'type': 'place', 'label': {'eng': 'Exeter'}, 'country': {'type': 'country', 'label': {'eng': 'United Kingdom'}}}}]",https://www.ctvnews.ca/content/dam/ctvnews/en/images/2023/3/12/watsonville--calif---flooding-1-6309868-1678633668263.jpg,eng-8468865,-0.2392156862745098,416329980,1,ctvnews.ca,news,CTV News,"Pajaro River Northern California Flood Atmospheric river Monterey County, California California Levee CNN River National Weather Service Luis Alejo Central California Weather Prediction Center Aquifer Rain Salinas River (California) Board of supervisors California Department of Forestry and Fire Protection Agriculture Nevada Tulare County, California San Ardo, California Gavin Newsom Snowpack Waterway Sheriff Severe weather U.S. state State of emergency County (United States) Joe Biden Snow Teviston, California Springville, California Soquel, California Santa Cruz County, California Exeter",Canada,CA,,,Center,ChatGPT,C4,C2,North America,,Christian,13.0,best,best,best,best,best,best,best,best,best,best,best,best,low,high,high,low,low,high,North American Free Trade Agreement (NAFTA),NAFTA,North Atlantic Treaty Organization (NATO),NATO,,,English-speaking,Eng,-1,,,0,False,2023,3,12,13,15,2023-03-12
9,7448275366,eng,False,2023-03-15,13:10:00,2023-03-15 13:10:00,2023-03-15T13:00:00Z,news,0.4470588266849518,https://www.nationalobserver.com/2023/03/15/news/thousands-californians-evacuate-atmospheric-river-pounds-state,Thousands of Californians evacuate as another atmospheric river,"The latest powerful atmospheric river to drench California put nearly 27,000 people under evacuation orders Tuesday due to flooding and landslide risks. On the central coast, workers hauled truckloads of rocks to plug a broken river levee amid steady rain and wind.

Damaging winds with gusts topping 70 mph (113 kph) blew out windows, and there were numerous reports of falling trees. Power outages hit more than 330,000 utility customers in northern and central areas, according to poweroutage.us, which tracks outages nationwide.

Crews raced to stabilize the Pajaro River's ruptured levee Tuesday, placing rocks and boulders to finish filling the gap that opened late Friday, about 70 miles (110 kilometers) south of San Francisco. Workers will then raise that portion's elevation to match the rest of the levee over the next few weeks to make it impermeable, officials said.

Tuesday's storm initially spread light to moderate rain over the state's north and center. But the National Weather Service said the storm was moving faster than expected and that most of the precipitation would shift southward.

""Even a small amount of rain could potentially have larger impacts,"" Shaunna Murray of the Monterey County Water Resources Agency said Tuesday during a news conference.",[],"[{'uri': 'http://en.wikipedia.org/wiki/Levee', 'type': 'wiki', 'score': 4, 'label': {'eng': 'Levee'}}, {'uri': 'http://en.wikipedia.org/wiki/Flood', 'type': 'wiki', 'score': 3, 'label': {'eng': 'Flood'}}, {'uri': 'http://en.wikipedia.org/wiki/Landslide', 'type': 'wiki', 'score': 3, 'label': {'eng': 'Landslide'}}, {'uri': 'http://en.wikipedia.org/wiki/Atmospheric_river', 'type': 'wiki', 'score': 3, 'label': {'eng': 'Atmospheric river'}}, {'uri': 'http://en.wikipedia.org/wiki/California', 'type': 'loc', 'score': 3, 'label': {'eng': 'California'}, 'location': {'type': 'place', 'label': {'eng': 'California'}, 'country': {'type': 'country', 'label': {'eng': 'United States'}}}}, {'uri': 'http://en.wikipedia.org/wiki/Pajaro_River', 'type': 'wiki', 'score': 2, 'label': {'eng': 'Pajaro River'}}, {'uri': 'http://en.wikipedia.org/wiki/Power_outage', 'type': 'wiki', 'score': 2, 'label': {'eng': 'Power outage'}}, {'uri': 'http://en.wikipedia.org/wiki/Precipitation', 'type': 'wiki', 'score': 1, 'label': {'eng': 'Precipitation'}}, {'uri': 'http://en.wikipedia.org/wiki/National_Weather_Service', 'type': 'org', 'score': 1, 'label': {'eng': 'National Weather Service'}}, {'uri': 'http://en.wikipedia.org/wiki/San_Francisco', 'type': 'loc', 'score': 1, 'label': {'eng': 'San Francisco'}, 'location': {'type': 'place', 'label': {'eng': 'San Francisco'}, 'country': {'type': 'country', 'label': {'eng': 'United States'}}}}, {'uri': 'http://en.wikipedia.org/wiki/Monterey_County,_California', 'type': 'loc', 'score': 1, 'label': {'eng': 'Monterey County, California'}, 'location': {'type': 'place', 'label': {'eng': 'Monterey County, California'}, 'country': {'type': 'country', 'label': {'eng': 'United States'}}}}]",https://www.nationalobserver.com/sites/nationalobserver.com/files/styles/nat_social/public/img/2023/03/15/20230314160324-6410d7ff038221d7b3fa3816jpeg.jpg?itok=YhJRo74B,eng-8468865,-0.0980392156862745,416581800,1,nationalobserver.com,news,National Observer,"Levee Flood Landslide Atmospheric river California Pajaro River Power outage Precipitation National Weather Service San Francisco Monterey County, California",Canada,CA,,,,,C4,C2,North America,,Christian,13.0,best,best,best,best,best,best,best,best,best,best,best,best,low,high,high,low,low,high,North American Free Trade Agreement (NAFTA),NAFTA,North Atlantic Treaty Organization (NATO),NATO,,,English-speaking,Eng,-1,,,0,False,2023,3,15,10,13,2023-03-15
