,uri,lang,isDuplicate,date,time,dateTime,dateTimePub,dataType,sim,url,title,body,authors,concepts,image,eventUri,sentiment,wgt,relevance,source.uri,source.dataType,source.title,all_concepts,con-name,country,lang-name,language,Political-Alignment,wiki-url,Cultural-Class,Economic-Class,Continent-name,Continent,Religions,2019Rank-From,SafetyandSecurity,PersonalFreedom,Governance,SocialCapital,InvestmentEnvironment,EnterpriseConditions,MarketAccessandInfrastructure,EconomicQuality,LivingConditions,Health,Education,NaturalEnvironment,PowerDistance,Individualism,Masculinity,UncertaintyAvoidance,LongTermOrientation,Indulgence,economicblocs-name,economicblocs,militarydefenseblocs-name,militarydefenseblocs,politicalregionalblocs-name,politicalregionalblocs,linguisticblocs-name,linguisticblocs,proScore,destination,parent,count,status,year,month,day,min,hour,MD
168,7443566370,eng,False,2023-03-12,22:05:00,2023-03-12 22:05:00,2023-03-12T22:01:00Z,news,0.572549045085907,https://www.herald.co.zw/indian-superstar-saluted-after-ending-drought/,Indian superstar saluted after ending drought,"AHMEDABAD. -- Indian superstar Virat Kohli hit his first Test cricket century in over three years yesterday, ending his long drought and sparking raucous celebrations at the world's biggest cricket stadium in Ahmedabad.

""King Kohli"", one of cricket's biggest names, admitted last year to mental health struggles as his magic with the bat deserted him. He also lost the Indian captaincy, one of the most high-pressure jobs in world sport.

But yesterday, having already returned to form with ODI and T20 centuries in recent months, the long wait for his 28th Test ton ended in the fourth Test against Australia. Resuming on 59 after reaching his first test half-century on Saturday since January 2022, the landmark came after a patient innings of 241 balls as he eased Nathan Lyon for a single.

Appearing to tear up, the heavily tattooed 34-year-old acknowledged the crowd and the dressing room before kissing the locket on his gold chain as he smiled and looked up to the sky.

""A 600-kilo gorilla is off his back. He will grow a couple of inches taller by this evening,"" shouted commentator and former India coach Ravi Shastri.

Australia's stand-in-skipper Steve Smith applauded on the ground, and a placard in the crowd read ""Here to see King Kohli ruling in his kingdom"", as children in India shirts bowed in respect.

Former England captain Michael Vaughan tweeted: ""Good to see @imVkohli back scoring a test ton .. Love watching him Bat .. Over 3 yrs since his last one .. My guess is a few might come along now"".

Kohli had a tough 2021 and 2022, failing to reach three figures in over 1 000 days.

He quit as Twenty20 skipper in late 2021 and in January 2022 was sacked from the one-day captaincy and gave up leading the test side too. But he hit his first ton after 1 020 days in the Asia Cup T20 tournament in September last year and hasn't looked back since.

Kohli finished the T20 World Cup in Australia last year as the leading run-scorer and then hit three ODI centuries including two -- 113 and 166 not out -- against Sri Lanka in January. Kohli is one of the best batsmen of his generation in world cricket. But the brash celebrity, who has 54 million Twitter followers and ubiquitously graces advertising campaigns, has had his share of run-ins with umpires and opponents alike along the way.

The former captain has a Test average of over 48 in 108 matches since making his debut in 2011 and has struck 75 centuries across the three international formats.

Kohli remains behind Australia's Smith and England's Joe Root in the number of test centuries between the ""fabulous four"" -- the leading four batsmen of the modern era.

Smith overtook Kohli during the Indian batsman's lean phase and now has 30 test centuries. Root -- who made five hundreds in 2022 -- has 29 and New Zealand's Kane Williamson has 26.

Kohli's previous Test hundred dates back to November 2019 against Bangladesh in a day-night game in India. -- AFP.",[],"[{'uri': 'http://en.wikipedia.org/wiki/Virat_Kohli', 'type': 'person', 'score': 5, 'label': {'eng': 'Virat Kohli'}}, {'uri': 'http://en.wikipedia.org/wiki/Captain_(cricket)', 'type': 'wiki', 'score': 5, 'label': {'eng': 'Captain (cricket)'}}, {'uri': 'http://en.wikipedia.org/wiki/Test_cricket', 'type': 'wiki', 'score': 5, 'label': {'eng': 'Test cricket'}}, {'uri': 'http://en.wikipedia.org/wiki/Ahmedabad', 'type': 'loc', 'score': 5, 'label': {'eng': 'Ahmedabad'}, 'location': {'type': 'place', 'label': {'eng': 'Ahmedabad'}, 'country': {'type': 'country', 'label': {'eng': 'India'}}}}, {'uri': 'http://en.wikipedia.org/wiki/India', 'type': 'loc', 'score': 5, 'label': {'eng': 'India'}, 'location': {'type': 'country', 'label': {'eng': 'India'}}}, {'uri': 'http://en.wikipedia.org/wiki/One_Day_International', 'type': 'wiki', 'score': 4, 'label': {'eng': 'One Day International'}}, {'uri': 'http://en.wikipedia.org/wiki/Twenty20', 'type': 'wiki', 'score': 4, 'label': {'eng': 'Twenty20'}}, {'uri': 'http://en.wikipedia.org/wiki/Australian_cricket_team_in_Sri_Lanka_in_2016', 'type': 'wiki', 'score': 3, 'label': {'eng': 'Australian cricket team in Sri Lanka in 2016'}}, {'uri': 'http://en.wikipedia.org/wiki/Innings', 'type': 'wiki', 'score': 3, 'label': {'eng': 'Innings'}}, {'uri': 'http://en.wikipedia.org/wiki/Cricket_bat', 'type': 'wiki', 'score': 3, 'label': {'eng': 'Cricket bat'}}, {'uri': 'http://en.wikipedia.org/wiki/Cricket', 'type': 'wiki', 'score': 3, 'label': {'eng': 'Cricket'}}, {'uri': 'http://en.wikipedia.org/wiki/Australia', 'type': 'loc', 'score': 3, 'label': {'eng': 'Australia'}, 'location': {'type': 'country', 'label': {'eng': 'Australia'}}}, {'uri': 'http://en.wikipedia.org/wiki/Michael_Vaughan', 'type': 'person', 'score': 2, 'label': {'eng': 'Michael Vaughan'}}, {'uri': 'http://en.wikipedia.org/wiki/Ravi_Shastri', 'type': 'person', 'score': 2, 'label': {'eng': 'Ravi Shastri'}}, {'uri': 'http://en.wikipedia.org/wiki/Nathan_Lyon', 'type': 'wiki', 'score': 2, 'label': {'eng': 'Nathan Lyon'}}, {'uri': 'http://en.wikipedia.org/wiki/Steve_Smith_(cricketer)', 'type': 'wiki', 'score': 2, 'label': {'eng': 'Steve Smith (cricketer)'}}, {'uri': 'http://en.wikipedia.org/wiki/England_cricket_team', 'type': 'loc', 'score': 2, 'label': {'eng': 'England cricket team'}, 'location': None}, {'uri': 'http://en.wikipedia.org/wiki/Twitter', 'type': 'org', 'score': 2, 'label': {'eng': 'Twitter'}}, {'uri': 'http://en.wikipedia.org/wiki/Joe_Root', 'type': 'person', 'score': 1, 'label': {'eng': 'Joe Root'}}, {'uri': 'http://en.wikipedia.org/wiki/Sri_Lankan_cricket_team_in_Bangladesh_in_2017–18', 'type': 'wiki', 'score': 1, 'label': {'eng': 'Sri Lankan cricket team in Bangladesh in 2017–18'}}, {'uri': 'http://en.wikipedia.org/wiki/Asia_Cup', 'type': 'wiki', 'score': 1, 'label': {'eng': 'Asia Cup'}}, {'uri': 'http://en.wikipedia.org/wiki/Kane_Williamson', 'type': 'person', 'score': 1, 'label': {'eng': 'Kane Williamson'}}, {'uri': 'http://en.wikipedia.org/wiki/Umpire_(cricket)', 'type': 'wiki', 'score': 1, 'label': {'eng': 'Umpire (cricket)'}}, {'uri': 'http://en.wikipedia.org/wiki/Bangladeshi_cricket_team_in_Sri_Lanka_in_2020–21', 'type': 'wiki', 'score': 1, 'label': {'eng': 'Bangladeshi cricket team in Sri Lanka in 2020–21'}}, {'uri': 'http://en.wikipedia.org/wiki/Cricket_World_Cup', 'type': 'wiki', 'score': 1, 'label': {'eng': 'Cricket World Cup'}}, {'uri': 'http://en.wikipedia.org/wiki/Batting_(cricket)', 'type': 'wiki', 'score': 1, 'label': {'eng': 'Batting (cricket)'}}, {'uri': 'http://en.wikipedia.org/wiki/Agence_France-Presse', 'type': 'org', 'score': 1, 'label': {'eng': 'Agence France-Presse'}}, {'uri': 'http://en.wikipedia.org/wiki/New_Zealand', 'type': 'loc', 'score': 1, 'label': {'eng': 'New Zealand'}, 'location': {'type': 'country', 'label': {'eng': 'New Zealand'}}}]",https://www.herald.co.zw/wp-content/uploads/sites/2/2019/09/cricket.jpg,eng-8469535,0.1372549019607843,416354700,1,herald.co.zw,news,Zimbabwe Herald Online,Virat Kohli Captain (cricket) Test cricket Ahmedabad India One Day International Twenty20 Australian cricket team in Sri Lanka in 2016 Innings Cricket bat Cricket Australia Michael Vaughan Ravi Shastri Nathan Lyon Steve Smith (cricketer) England cricket team Twitter Joe Root Sri Lankan cricket team in Bangladesh in 2017–18 Asia Cup Kane Williamson Umpire (cricket) Bangladeshi cricket team in Sri Lanka in 2020–21 Cricket World Cup Batting (cricket) Agence France-Presse New Zealand,Zimbabwe,ZW,English,eng,Pro-government,ChatGPT,,C8,Africa,AF,Christian,139.0,110.0,134.0,147.0,135.0,156.0,147.0,132.0,145.0,139.0,141.0,98.0,110.0,,,,,,,,,,,African Union,AU,,,-1,,,0,False,2023,3,12,5,22,2023-03-12
169,7443566372,eng,False,2023-03-12,22:05:00,2023-03-12 22:05:00,2023-03-12T22:00:00Z,news,0.6980392336845398,https://www.herald.co.zw/king-kohli-gets-monster-test-ton-after-three-year-wait/,'King Kohli' gets monster Test ton after three-year wait,"AHMEDABAD. -- Virat Kohli reached triple figures for the first time in 41 innings and a wait of more than three years to nudge India ahad of Australia on day four of the fourth Test cricket yesterday.

Kohli scored 186 runs, his 28th Test hundred and his highest Test score against Australia, as India finished with 571 (178.5 overs) runs in their first innings to take a lead of 91 runs over Australia's first-innings total of 480 runs.

At stumps, Matthew Kuhnemann and Travis Head (3 not out) negotiated six overs with Australia at 3-0 in their second innings, trailing by 88 runs.

First innings centurion Usman Khawaja did not open the innings after suffering a suspected knee injury while fielding with Kuhnemann a surprising choice to replace him. The night-watchman survived as Srikar Bharat missed a sharp catching chance in the penultimate over.

Kohli's last Test hundred came against Bangladesh in November 2019.

Post lunch, Kohli got to his 75th international hundred off 241 balls, including five fours. He had faced 162 deliveries without hitting a boundary, and after reaching his milestone, started playing more attacking strokes. Overall, he hit 15 fours.

It was Kohli's 16th international hundred against Australia, and second slowest Test hundred in terms of balls faced.

Srikar Bharat meanwhile scored 44 runs off 88 balls, including two fours and three sixes. He added 84 runs for the fifth wicket with Kohli, before falling to Nathan Lyon.

There was no respite for Australia though as India's highest scorer in this series, Axar Patel, stitched up another long partnership with Kohli.

India went to tea at 472-5, with Kohli-Patel adding 162 runs for the sixth wicket. The duo batted for 37.1 overs while chasing down the Australian lead.

The hosts were ahead by 75 runs by the time Patel got out after scoring 79 off 113 balls.

Kohli also picked up the slack and reached 150 off 313 balls, adding seven more fours since reaching his century.

Mitchell Starc (1-97) finally bowled Patel in the 173rd over, and the Indian lower order suffered a mini collapse thereafter.

Ravichandran Ashwin (7) holed out to midwicket off Lyon, while Umesh Yadav was run out without troubling the scorers.

Kohli was last man out, caught in the deep off Todd Murphy (3-113) with Shreyas Iyer failing to come out to bat owing to a lower-back issue. He reportedly went to a local hospital for scans and is being monitored by the Indian medical team.

Lyon finished with 3-151 from 65 overs, the most he has ever bowled for Australia in a single test innings. -- AP.",[],"[{'uri': 'http://en.wikipedia.org/wiki/Boundary_(cricket)', 'type': 'wiki', 'score': 5, 'label': {'eng': 'Boundary (cricket)'}}, {'uri': 'http://en.wikipedia.org/wiki/Innings', 'type': 'wiki', 'score': 5, 'label': {'eng': 'Innings'}}, {'uri': 'http://en.wikipedia.org/wiki/Virat_Kohli', 'type': 'person', 'score': 5, 'label': {'eng': 'Virat Kohli'}}, {'uri': 'http://en.wikipedia.org/wiki/Test_cricket', 'type': 'wiki', 'score': 5, 'label': {'eng': 'Test cricket'}}, {'uri': 'http://en.wikipedia.org/wiki/India', 'type': 'loc', 'score': 5, 'label': {'eng': 'India'}, 'location': {'type': 'country', 'label': {'eng': 'India'}}}, {'uri': 'http://en.wikipedia.org/wiki/Australia', 'type': 'loc', 'score': 5, 'label': {'eng': 'Australia'}, 'location': {'type': 'country', 'label': {'eng': 'Australia'}}}, {'uri': 'http://en.wikipedia.org/wiki/Over_(cricket)', 'type': 'wiki', 'score': 4, 'label': {'eng': 'Over (cricket)'}}, {'uri': 'http://en.wikipedia.org/wiki/Travis_Head', 'type': 'wiki', 'score': 3, 'label': {'eng': 'Travis Head'}}, {'uri': 'http://en.wikipedia.org/wiki/Usman_Khawaja', 'type': 'wiki', 'score': 3, 'label': {'eng': 'Usman Khawaja'}}, {'uri': 'http://en.wikipedia.org/wiki/Century_(cricket)', 'type': 'wiki', 'score': 3, 'label': {'eng': 'Century (cricket)'}}, {'uri': 'http://en.wikipedia.org/wiki/Stump_(cricket)', 'type': 'wiki', 'score': 3, 'label': {'eng': 'Stump (cricket)'}}, {'uri': 'http://en.wikipedia.org/wiki/Ahmedabad', 'type': 'loc', 'score': 3, 'label': {'eng': 'Ahmedabad'}, 'location': {'type': 'place', 'label': {'eng': 'Ahmedabad'}, 'country': {'type': 'country', 'label': {'eng': 'India'}}}}, {'uri': 'http://en.wikipedia.org/wiki/Bangladeshi_cricket_team_in_India_in_2019–20', 'type': 'wiki', 'score': 2, 'label': {'eng': 'Bangladeshi cricket team in India in 2019–20'}}, {'uri': 'http://en.wikipedia.org/wiki/Wicket', 'type': 'wiki', 'score': 2, 'label': {'eng': 'Wicket'}}, {'uri': 'http://en.wikipedia.org/wiki/Umesh_Yadav', 'type': 'person', 'score': 1, 'label': {'eng': 'Umesh Yadav'}}, {'uri': 'http://en.wikipedia.org/wiki/Nathan_Lyon', 'type': 'wiki', 'score': 1, 'label': {'eng': 'Nathan Lyon'}}, {'uri': 'http://en.wikipedia.org/wiki/Ravichandran_Ashwin', 'type': 'person', 'score': 1, 'label': {'eng': 'Ravichandran Ashwin'}}, {'uri': 'http://en.wikipedia.org/wiki/Axar_Patel', 'type': 'wiki', 'score': 1, 'label': {'eng': 'Axar Patel'}}, {'uri': 'http://en.wikipedia.org/wiki/Mitchell_Starc', 'type': 'person', 'score': 1, 'label': {'eng': 'Mitchell Starc'}}, {'uri': 'http://en.wikipedia.org/wiki/Batting_order_(cricket)', 'type': 'wiki', 'score': 1, 'label': {'eng': 'Batting order (cricket)'}}, {'uri': 'http://en.wikipedia.org/wiki/Run_out', 'type': 'wiki', 'score': 1, 'label': {'eng': 'Run out'}}, {'uri': 'http://en.wikipedia.org/wiki/Cricket_bat', 'type': 'wiki', 'score': 1, 'label': {'eng': 'Cricket bat'}}, {'uri': 'http://en.wikipedia.org/wiki/Shreyas_Iyer', 'type': 'wiki', 'score': 1, 'label': {'eng': 'Shreyas Iyer'}}, {'uri': 'http://en.wikipedia.org/wiki/Bowling_(cricket)', 'type': 'wiki', 'score': 1, 'label': {'eng': 'Bowling (cricket)'}}, {'uri': 'http://en.wikipedia.org/wiki/Batting_(cricket)', 'type': 'wiki', 'score': 1, 'label': {'eng': 'Batting (cricket)'}}]",https://www.herald.co.zw/wp-content/uploads/sites/2/2023/03/Untitled-6-1.jpg,eng-8469535,-0.02745098039215688,416354700,1,herald.co.zw,news,Zimbabwe Herald Online,Boundary (cricket) Innings Virat Kohli Test cricket India Australia Over (cricket) Travis Head Usman Khawaja Century (cricket) Stump (cricket) Ahmedabad Bangladeshi cricket team in India in 2019–20 Wicket Umesh Yadav Nathan Lyon Ravichandran Ashwin Axar Patel Mitchell Starc Batting order (cricket) Run out Cricket bat Shreyas Iyer Bowling (cricket) Batting (cricket),Zimbabwe,ZW,English,eng,Pro-government,ChatGPT,,C8,Africa,AF,Christian,139.0,110.0,134.0,147.0,135.0,156.0,147.0,132.0,145.0,139.0,141.0,98.0,110.0,,,,,,,,,,,African Union,AU,,,-1,,,0,False,2023,3,12,5,22,2023-03-12
128,7443986641,eng,False,2023-03-13,06:06:00,2023-03-13 06:06:00,2023-03-13T06:06:00Z,news,0.6549019813537598,https://guyanachronicle.com/2023/03/13/australia-in-india-virat-kohli-hits-first-test-century-since-2019-on-day-four/,Australia in India: Virat Kohli hits first Test century since 2019 on day four - Guyana Chronicle,"INDIA's Virat Kohli ended his long wait for a Test century with a superb 186 which enabled the hosts to build a lead over Australia in the fourth Test.

Kohli, whose last ton came in November 2019, hit 15 fours in a 364-ball innings which saw him spend over eight hours at the crease in India's 571.

The 34-year-old superstar fell short of the double century when he was caught by Marnus Labuschagne off Todd Murphy.

He received a rapturous reception having put India in a healthy position.

India, who lead the series 2-1, effectively put themselves in an unbeatable position heading into the final day of the contest.

Having started the day on 59, Kohli continued to be the inspiration and provided more evidence that he has recaptured his form in a patient innings.

After a barren spell in 2021 and 2022 with the bat, which led to him losing the captaincy and also open up about his mental health struggles, Kohli has knocked one-day and T20 centuries in recent months.

Now his long wait for a 28th Test hundred has ended - and his relief was clear to see.

An emotional Kohli kissed the locket on his gold chain, smiling and looking up to the sky, as the crowd jubilantly celebrated his achievement.

Axar Patel, who hit four sixes and five fours in his 79, worked with Kohli to put on a sixth-wicket partnership of 162 and once he departed, Australia quickly took the wickets of Ravichandran Ashwin and Umesh Yadav.

Kohli played less cautiously when he realised he was running out of partners and became the last Indian wicket to fall when he was caught by Labuschagne at long-on.

Trailing by 91 runs on first innings, Australia finished the day on 3-0.

The tourists decided to send out nightwatchman Matt Kuhnemann to open with Travis Head after Usman Khawaja hurt his knee while fielding.

Kuhnemann survived 18 balls, despite being nearly caught on two occasions, as Australia came through the final six overs without loss. (BBC Sport)",[],"[{'uri': 'http://en.wikipedia.org/wiki/Virat_Kohli', 'type': 'person', 'score': 5, 'label': {'eng': 'Virat Kohli'}}, {'uri': 'http://en.wikipedia.org/wiki/Test_cricket', 'type': 'wiki', 'score': 5, 'label': {'eng': 'Test cricket'}}, {'uri': 'http://en.wikipedia.org/wiki/India', 'type': 'loc', 'score': 5, 'label': {'eng': 'India'}, 'location': {'type': 'country', 'label': {'eng': 'India'}}}, {'uri': 'http://en.wikipedia.org/wiki/Boundary_(cricket)', 'type': 'wiki', 'score': 4, 'label': {'eng': 'Boundary (cricket)'}}, {'uri': 'http://en.wikipedia.org/wiki/Innings', 'type': 'wiki', 'score': 4, 'label': {'eng': 'Innings'}}, {'uri': 'http://en.wikipedia.org/wiki/Marnus_Labuschagne', 'type': 'wiki', 'score': 3, 'label': {'eng': 'Marnus Labuschagne'}}, {'uri': 'http://en.wikipedia.org/wiki/Century_(cricket)', 'type': 'wiki', 'score': 3, 'label': {'eng': 'Century (cricket)'}}, {'uri': 'http://en.wikipedia.org/wiki/Australia', 'type': 'loc', 'score': 3, 'label': {'eng': 'Australia'}, 'location': {'type': 'country', 'label': {'eng': 'Australia'}}}, {'uri': 'http://en.wikipedia.org/wiki/Cricket_bat', 'type': 'wiki', 'score': 2, 'label': {'eng': 'Cricket bat'}}, {'uri': 'http://en.wikipedia.org/wiki/Captain_(cricket)', 'type': 'wiki', 'score': 2, 'label': {'eng': 'Captain (cricket)'}}, {'uri': 'http://en.wikipedia.org/wiki/Limited_overs_cricket', 'type': 'wiki', 'score': 2, 'label': {'eng': 'Limited overs cricket'}}, {'uri': 'http://en.wikipedia.org/wiki/Twenty20', 'type': 'wiki', 'score': 2, 'label': {'eng': 'Twenty20'}}, {'uri': 'http://en.wikipedia.org/wiki/Umesh_Yadav', 'type': 'person', 'score': 1, 'label': {'eng': 'Umesh Yadav'}}, {'uri': 'http://en.wikipedia.org/wiki/Nightwatchman_(cricket)', 'type': 'wiki', 'score': 1, 'label': {'eng': 'Nightwatchman (cricket)'}}, {'uri': 'http://en.wikipedia.org/wiki/Travis_Head', 'type': 'wiki', 'score': 1, 'label': {'eng': 'Travis Head'}}, {'uri': 'http://en.wikipedia.org/wiki/Usman_Khawaja', 'type': 'wiki', 'score': 1, 'label': {'eng': 'Usman Khawaja'}}, {'uri': 'http://en.wikipedia.org/wiki/Ravichandran_Ashwin', 'type': 'person', 'score': 1, 'label': {'eng': 'Ravichandran Ashwin'}}, {'uri': 'http://en.wikipedia.org/wiki/Axar_Patel', 'type': 'wiki', 'score': 1, 'label': {'eng': 'Axar Patel'}}, {'uri': 'http://en.wikipedia.org/wiki/Fielding_(cricket)', 'type': 'wiki', 'score': 1, 'label': {'eng': 'Fielding (cricket)'}}, {'uri': 'http://en.wikipedia.org/wiki/Over_(cricket)', 'type': 'wiki', 'score': 1, 'label': {'eng': 'Over (cricket)'}}, {'uri': 'http://en.wikipedia.org/wiki/Wicket', 'type': 'wiki', 'score': 1, 'label': {'eng': 'Wicket'}}, {'uri': 'http://en.wikipedia.org/wiki/BBC_Sport', 'type': 'org', 'score': 1, 'label': {'eng': 'BBC Sport'}}]",https://guyanachronicle.com/wp-content/uploads/2023/03/Kohli.jpg,eng-8469535,0.3176470588235294,416383560,1,guyanachronicle.com,news,Guyana Chronicle,Virat Kohli Test cricket India Boundary (cricket) Innings Marnus Labuschagne Century (cricket) Australia Cricket bat Captain (cricket) Limited overs cricket Twenty20 Umesh Yadav Nightwatchman (cricket) Travis Head Usman Khawaja Ravichandran Ashwin Axar Patel Fielding (cricket) Over (cricket) Wicket BBC Sport,Ghana,GH,,,,,C10,C16,Africa,AF,Christian,98.0,79.0,50.0,58.0,114.0,98.0,50.0,114.0,134.0,115.0,119.0,118.0,106.0,80.0,15.0,40.0,65.0,4.0,72.0,African Continental Free Trade Area (AfCFTA),AfCFTA,,,African Union,AU,,,-1,,,0,False,2023,3,13,6,6,2023-03-13
