,uri,lang,isDuplicate,date,time,dateTime,dateTimePub,dataType,sim,url,title,body,authors,concepts,image,eventUri,sentiment,wgt,relevance,source.uri,source.dataType,source.title,all_concepts,con-name,country,lang-name,language,Political-Alignment,wiki-url,Cultural-Class,Economic-Class,Continent-name,Continent,Religions,2019Rank-From,SafetyandSecurity,PersonalFreedom,Governance,SocialCapital,InvestmentEnvironment,EnterpriseConditions,MarketAccessandInfrastructure,EconomicQuality,LivingConditions,Health,Education,NaturalEnvironment,PowerDistance,Individualism,Masculinity,UncertaintyAvoidance,LongTermOrientation,Indulgence,economicblocs-name,economicblocs,militarydefenseblocs-name,militarydefenseblocs,politicalregionalblocs-name,politicalregionalblocs,linguisticblocs-name,linguisticblocs,proScore,destination,parent,count,status,year,month,day,min,hour,MD
294,7442989882,eng,False,2023-03-12,12:17:00,2023-03-12 12:17:00,2023-03-12T12:17:00Z,news,0.6941176652908325,https://www.news24.com/sport/cricket/king-kohli-gets-monster-test-ton-after-three-year-wait-20230312,'King Kohli' gets monster Test ton after three-year wait | Sport,"Virat Kohli scored his first Test century in over three years in the fourth Test against Australia.

Indian superstar Virat Kohli hit his first Test century in over three years on Sunday, ending his long drought with an imperious 186 and sparking raucous celebrations at the world's biggest cricket stadium.

Scorecard

""King Kohli"", one of cricket's biggest names, admitted last year to mental health struggles as his magic with the bat deserted him. He also lost the Indian captaincy, one of the most high-pressure jobs in world sport.

But on Sunday, having already returned to form with ODI and T20 centuries in recent months, the long wait for his 28th Test hundred ended in the fourth Test against Australia in Ahmedabad.

Resuming on 59 after reaching his first Test half-century on Saturday since January 2022, the landmark came after a patient innings of 241 balls as he eased Nathan Lyon for a single.

Appearing to tear up, the heavily tattooed 34-year-old acknowledged the crowd and the dressing room before kissing the locket on his gold chain as he smiled and looked up to the sky.

""A 600-kilo gorilla is off his back. He will grow a couple of inches taller by this evening,"" shouted commentator and former India coach Ravi Shastri.

Australia's stand-in-skipper Steve Smith applauded on the ground, and a placard in the crowd read ""Here to see King Kohli ruling in his kingdom"", as children in India shirts bowed in respect.

Former England captain Michael Vaughan tweeted: ""Good to see @imVkohli back scoring a Test ton .. Love watching him Bat .. Over 3 yrs since his last one .. My guess is a few might come along now"".

Kohli then accelerated and made Australia's bowlers pay, in the end finally falling to off-spinner Todd Murphy in the final session as India's innings finished on 571 in response to Australia's 480.

Kohli had a tough 2021 and 2022, failing to reach three figures in over 1,000 days.

He quit as Twenty20 skipper in late 2021 and in January 2022 was sacked from the one-day captaincy and gave up leading the Test side too.

But he hit his first ton after 1,020 days in the Asia Cup T20 tournament in September last year and hasn't looked back since.

Kohli finished the T20 World Cup in Australia last year as the leading run-scorer and then hit three ODI centuries including two - 113 and 166 not out - against Sri Lanka in January.

The brash celebrity, who has 54 million Twitter followers and ubiquitously graces advertising campaigns, is one of the best batsmen of his generation in world cricket.

But he has had his share of run-ins with umpires and opponents alike along the way.

The former captain has a Test average of over 48 in 108 matches since making his debut in 2011 and has struck 75 centuries across the three international formats.

Kohli remains behind Australia's Smith and England's Joe Root in the number of Test centuries between the ""fabulous four"" - the leading four batsmen of the modern era.

Smith overtook Kohli during the Indian batsman's lean phase and now has 30 Test centuries. Root -- who made five hundreds in 2022 - has 29 and New Zealand's Kane Williamson has 26.

Kohli's previous Test hundred dates back to November 2019 against Bangladesh in a day-night game in India.

Kohli now stands fourth in the all-time Test century makers for India behind Sachin Tendulkar (51 - the highest overall), Rahul Dravid (36) and Sunil Gavaskar (34).

Kohli had spoken about his mental health struggles during his dry phase, including how he had been ""snappy"" around his Bollywood actor wife Anushka Sharma, with whom he has a young daughter.

Pundits, among them former World Cup-winning captain Kapil Dev, even suggested Kohli should be dropped during his lean phase last year.

The former top-ranked batsman revealed during the 2022 Asia Cup that only Mahendra Singh Dhoni sent him messages of support during a tough phase of mental struggle after quitting the Test captaincy.","[{'uri': 'agence_france_presse@news24.com', 'name': 'Agence France-Presse', 'type': 'author', 'isAgency': False}]","[{'uri': 'http://en.wikipedia.org/wiki/Virat_Kohli', 'type': 'person', 'score': 5, 'label': {'eng': 'Virat Kohli'}}, {'uri': 'http://en.wikipedia.org/wiki/Captain_(cricket)', 'type': 'wiki', 'score': 5, 'label': {'eng': 'Captain (cricket)'}}, {'uri': 'http://en.wikipedia.org/wiki/Twenty20', 'type': 'wiki', 'score': 5, 'label': {'eng': 'Twenty20'}}, {'uri': 'http://en.wikipedia.org/wiki/Test_cricket', 'type': 'wiki', 'score': 5, 'label': {'eng': 'Test cricket'}}, {'uri': 'http://en.wikipedia.org/wiki/India', 'type': 'loc', 'score': 5, 'label': {'eng': 'India'}, 'location': {'type': 'country', 'label': {'eng': 'India'}}}, {'uri': 'http://en.wikipedia.org/wiki/Australia', 'type': 'loc', 'score': 5, 'label': {'eng': 'Australia'}, 'location': {'type': 'country', 'label': {'eng': 'Australia'}}}, {'uri': 'http://en.wikipedia.org/wiki/One_Day_International', 'type': 'wiki', 'score': 4, 'label': {'eng': 'One Day International'}}, {'uri': 'http://en.wikipedia.org/wiki/Nathan_Lyon', 'type': 'wiki', 'score': 3, 'label': {'eng': 'Nathan Lyon'}}, {'uri': 'http://en.wikipedia.org/wiki/Innings', 'type': 'wiki', 'score': 3, 'label': {'eng': 'Innings'}}, {'uri': 'http://en.wikipedia.org/wiki/Cricket_bat', 'type': 'wiki', 'score': 3, 'label': {'eng': 'Cricket bat'}}, {'uri': 'http://en.wikipedia.org/wiki/Cricket', 'type': 'wiki', 'score': 3, 'label': {'eng': 'Cricket'}}, {'uri': 'http://en.wikipedia.org/wiki/Twitter', 'type': 'org', 'score': 3, 'label': {'eng': 'Twitter'}}, {'uri': 'http://en.wikipedia.org/wiki/Ahmedabad', 'type': 'loc', 'score': 3, 'label': {'eng': 'Ahmedabad'}, 'location': {'type': 'place', 'label': {'eng': 'Ahmedabad'}, 'country': {'type': 'country', 'label': {'eng': 'India'}}}}, {'uri': 'http://en.wikipedia.org/wiki/Michael_Vaughan', 'type': 'person', 'score': 2, 'label': {'eng': 'Michael Vaughan'}}, {'uri': 'http://en.wikipedia.org/wiki/Ravi_Shastri', 'type': 'person', 'score': 2, 'label': {'eng': 'Ravi Shastri'}}, {'uri': 'http://en.wikipedia.org/wiki/Sri_Lankan_cricket_team_in_Bangladesh_in_2017–18', 'type': 'wiki', 'score': 2, 'label': {'eng': 'Sri Lankan cricket team in Bangladesh in 2017–18'}}, {'uri': 'http://en.wikipedia.org/wiki/Steve_Smith_(cricketer)', 'type': 'wiki', 'score': 2, 'label': {'eng': 'Steve Smith (cricketer)'}}, {'uri': 'http://en.wikipedia.org/wiki/England_cricket_team', 'type': 'loc', 'score': 2, 'label': {'eng': 'England cricket team'}, 'location': None}, {'uri': 'http://en.wikipedia.org/wiki/Off_spin', 'type': 'wiki', 'score': 2, 'label': {'eng': 'Off spin'}}, {'uri': 'http://en.wikipedia.org/wiki/Batting_(cricket)', 'type': 'wiki', 'score': 2, 'label': {'eng': 'Batting (cricket)'}}, {'uri': 'http://en.wikipedia.org/wiki/Joe_Root', 'type': 'person', 'score': 1, 'label': {'eng': 'Joe Root'}}, {'uri': 'http://en.wikipedia.org/wiki/Sunil_Gavaskar', 'type': 'person', 'score': 1, 'label': {'eng': 'Sunil Gavaskar'}}, {'uri': 'http://en.wikipedia.org/wiki/Asia_Cup', 'type': 'wiki', 'score': 1, 'label': {'eng': 'Asia Cup'}}, {'uri': 'http://en.wikipedia.org/wiki/Rahul_Dravid', 'type': 'person', 'score': 1, 'label': {'eng': 'Rahul Dravid'}}, {'uri': 'http://en.wikipedia.org/wiki/Kapil_Dev', 'type': 'person', 'score': 1, 'label': {'eng': 'Kapil Dev'}}, {'uri': 'http://en.wikipedia.org/wiki/MS_Dhoni', 'type': 'wiki', 'score': 1, 'label': {'eng': 'MS Dhoni'}}, {'uri': 'http://en.wikipedia.org/wiki/Kane_Williamson', 'type': 'person', 'score': 1, 'label': {'eng': 'Kane Williamson'}}, {'uri': 'http://en.wikipedia.org/wiki/Umpire_(cricket)', 'type': 'wiki', 'score': 1, 'label': {'eng': 'Umpire (cricket)'}}, {'uri': 'http://en.wikipedia.org/wiki/Sachin_Tendulkar', 'type': 'person', 'score': 1, 'label': {'eng': 'Sachin Tendulkar'}}, {'uri': 'http://en.wikipedia.org/wiki/Cricket_World_Cup', 'type': 'wiki', 'score': 1, 'label': {'eng': 'Cricket World Cup'}}, {'uri': 'http://en.wikipedia.org/wiki/Bollywood', 'type': 'wiki', 'score': 1, 'label': {'eng': 'Bollywood'}}, {'uri': 'http://en.wikipedia.org/wiki/New_Zealand', 'type': 'loc', 'score': 1, 'label': {'eng': 'New Zealand'}, 'location': {'type': 'country', 'label': {'eng': 'New Zealand'}}}]",https://cdn.24.co.za/files/Cms/General/d/2938/a381947f017b48d790a65f85a85c6c0e.jpg,eng-8469535,0.1372549019607843,416319420,1,news24.com,news,news24,Virat Kohli Captain (cricket) Twenty20 Test cricket India Australia One Day International Nathan Lyon Innings Cricket bat Cricket Twitter Ahmedabad Michael Vaughan Ravi Shastri Sri Lankan cricket team in Bangladesh in 2017–18 Steve Smith (cricketer) England cricket team Off spin Batting (cricket) Joe Root Sunil Gavaskar Asia Cup Rahul Dravid Kapil Dev MS Dhoni Kane Williamson Umpire (cricket) Sachin Tendulkar Cricket World Cup Bollywood New Zealand,South-Africa,ZA,,,,,C4,C17,Africa,AF,Christian,75.0,136.0,38.0,49.0,40.0,48.0,63.0,68.0,74.0,102.0,129.0,102.0,140.0,49.0,65.0,63.0,49.0,34.0,63.0,African Continental Free Trade Area (AfCFTA),AfCFTA,,,African Union,AU,,,-1,,,0,False,2023,3,12,17,12,2023-03-12
260,7443025704,eng,False,2023-03-12,12:51:00,2023-03-12 12:51:00,2023-03-12T12:35:00Z,news,0.7333333492279053,https://www.enca.com/sport/kohli-ends-test-ton-drought-186-india-dominate-australia,Kohli ends Test ton drought with 186 as India dominate Australia,"Virat Kohli hit his first Test century in more than three years

Virat Kohli hit his first Test century in more than three years with a towering 186 as India batted themselves out of danger of a series-levelling defeat to Australia in the fourth Test on Sunday.

The hosts finished their first innings on 571 to overhaul Australia's 480 and get a first-innings lead of 91 on another run-filled day four at the world's biggest cricket stadium in Ahmedabad.

Kohli was the last man out after he fell to Todd Murphy in the final session of play as India lost their ninth wicket and Shreyas Iyer did not bat due to back pain.

Australia reached three for no loss at stumps with Travis Head getting the runs while alongside nightwatchman Matthew Kuhnemann.

The left-handed Kuhnemann made a surprise entry to the crease after opener Usman Khawaja, who hit 180 in Australia's innings, did not come out to bat after getting hurt on the field.

Kohli ruled the day with his 28th Test ton after he got a single off spinner Nathan Lyon in the second session to bring the house down as fans went wild with celebration.

Kohli, who now has 75 international tons across three international formats, kissed his locket before looking up to the sky.

Resuming on 59 after reaching his first Test half-century on Saturday since January 2022, the landmark came after a patient innings of 241 balls.

Kohli then hit a flurry of fours after reaching his hundred and along with an attacking Axar Patel, who made 79, put on a marathon stand of 162 for the sixth wicket.

Khawaja attempted to catch an Axar six at the boundary but could not stay inside the rope, hurting his foot in the process and limping off the field.

Kohli got past 150 after tea and Axar raised his third half-century of the series to wear down the opposition bowlers on a pitch vastly different from the rank turners in the previous three matches.

Spinners Lyon and Murphy bowled 110.5 overs between to get three wickets each on another day of hard grind for the bowlers.

Axar went into fifth gear after his fifty as he slogged and smashed Kuhnemann for two sixes in an over before being bowled off an inside edge by Mitchell Starc.

Kohli lost his overnight partner Ravindra Jadeja for 28 in the morning session and Srikar Bharat fell in the afternoon after the wicketkeeper-batsman hit 44 in an 84-run partnership with the former captain.

Iyer didn't come out to bat after he went for scans following complaints of lower back pain after the end of day three.

Opener Shubman Gill led India's strong reply on Saturday with his 128 before he fell to Lyon, who returned with figures of 3-151 from 65 overs.

India need a win to clinch the series and be sure of a berth in the World Test Championship final in June.",[],"[{'uri': 'http://en.wikipedia.org/wiki/Innings', 'type': 'wiki', 'score': 5, 'label': {'eng': 'Innings'}}, {'uri': 'http://en.wikipedia.org/wiki/Virat_Kohli', 'type': 'person', 'score': 5, 'label': {'eng': 'Virat Kohli'}}, {'uri': 'http://en.wikipedia.org/wiki/Test_cricket', 'type': 'wiki', 'score': 5, 'label': {'eng': 'Test cricket'}}, {'uri': 'http://en.wikipedia.org/wiki/Australia', 'type': 'loc', 'score': 5, 'label': {'eng': 'Australia'}, 'location': {'type': 'country', 'label': {'eng': 'Australia'}}}, {'uri': 'http://en.wikipedia.org/wiki/Cricket_bat', 'type': 'wiki', 'score': 4, 'label': {'eng': 'Cricket bat'}}, {'uri': 'http://en.wikipedia.org/wiki/India', 'type': 'loc', 'score': 4, 'label': {'eng': 'India'}, 'location': {'type': 'country', 'label': {'eng': 'India'}}}, {'uri': 'http://en.wikipedia.org/wiki/Travis_Head', 'type': 'wiki', 'score': 3, 'label': {'eng': 'Travis Head'}}, {'uri': 'http://en.wikipedia.org/wiki/Usman_Khawaja', 'type': 'wiki', 'score': 3, 'label': {'eng': 'Usman Khawaja'}}, {'uri': 'http://en.wikipedia.org/wiki/Stump_(cricket)', 'type': 'wiki', 'score': 3, 'label': {'eng': 'Stump (cricket)'}}, {'uri': 'http://en.wikipedia.org/wiki/Shreyas_Iyer', 'type': 'wiki', 'score': 3, 'label': {'eng': 'Shreyas Iyer'}}, {'uri': 'http://en.wikipedia.org/wiki/Wicket', 'type': 'wiki', 'score': 3, 'label': {'eng': 'Wicket'}}, {'uri': 'http://en.wikipedia.org/wiki/Batting_(cricket)', 'type': 'wiki', 'score': 3, 'label': {'eng': 'Batting (cricket)'}}, {'uri': 'http://en.wikipedia.org/wiki/Cricket', 'type': 'wiki', 'score': 3, 'label': {'eng': 'Cricket'}}, {'uri': 'http://en.wikipedia.org/wiki/Ahmedabad', 'type': 'loc', 'score': 3, 'label': {'eng': 'Ahmedabad'}, 'location': {'type': 'place', 'label': {'eng': 'Ahmedabad'}, 'country': {'type': 'country', 'label': {'eng': 'India'}}}}, {'uri': 'http://en.wikipedia.org/wiki/Nightwatchman_(cricket)', 'type': 'wiki', 'score': 2, 'label': {'eng': 'Nightwatchman (cricket)'}}, {'uri': 'http://en.wikipedia.org/wiki/Nathan_Lyon', 'type': 'wiki', 'score': 2, 'label': {'eng': 'Nathan Lyon'}}, {'uri': 'http://en.wikipedia.org/wiki/Axar_Patel', 'type': 'wiki', 'score': 2, 'label': {'eng': 'Axar Patel'}}, {'uri': 'http://en.wikipedia.org/wiki/Boundary_(cricket)', 'type': 'wiki', 'score': 2, 'label': {'eng': 'Boundary (cricket)'}}, {'uri': 'http://en.wikipedia.org/wiki/Crease_(cricket)', 'type': 'wiki', 'score': 2, 'label': {'eng': 'Crease (cricket)'}}, {'uri': 'http://en.wikipedia.org/wiki/Off_spin', 'type': 'wiki', 'score': 2, 'label': {'eng': 'Off spin'}}, {'uri': 'http://en.wikipedia.org/wiki/K._S._Bharat', 'type': 'wiki', 'score': 1, 'label': {'eng': 'K. S. Bharat'}}, {'uri': 'http://en.wikipedia.org/wiki/Ravindra_Jadeja', 'type': 'wiki', 'score': 1, 'label': {'eng': 'Ravindra Jadeja'}}, {'uri': 'http://en.wikipedia.org/wiki/Mitchell_Starc', 'type': 'person', 'score': 1, 'label': {'eng': 'Mitchell Starc'}}, {'uri': 'http://en.wikipedia.org/wiki/ICC_World_Test_Championship', 'type': 'wiki', 'score': 1, 'label': {'eng': 'ICC World Test Championship'}}, {'uri': 'http://en.wikipedia.org/wiki/Spin_bowling', 'type': 'wiki', 'score': 1, 'label': {'eng': 'Spin bowling'}}]",https://www.enca.com/sites/default/files/styles/twitter/public/afp/2023-03/doc-33B24E4-%40photo0.jpg?h=4bf1c8f5&itok=77lvOCZA,eng-8469535,-0.1843137254901961,416321460,1,enca.com,news,eNCAnews,Innings Virat Kohli Test cricket Australia Cricket bat India Travis Head Usman Khawaja Stump (cricket) Shreyas Iyer Wicket Batting (cricket) Cricket Ahmedabad Nightwatchman (cricket) Nathan Lyon Axar Patel Boundary (cricket) Crease (cricket) Off spin K. S. Bharat Ravindra Jadeja Mitchell Starc ICC World Test Championship Spin bowling,South-Africa,ZA,,,,,C4,C17,Africa,AF,Christian,75.0,136.0,38.0,49.0,40.0,48.0,63.0,68.0,74.0,102.0,129.0,102.0,140.0,49.0,65.0,63.0,49.0,34.0,63.0,African Continental Free Trade Area (AfCFTA),AfCFTA,,,African Union,AU,,,-1,,,0,False,2023,3,12,51,12,2023-03-12
185,7443340646,eng,False,2023-03-12,17:45:00,2023-03-12 17:45:00,2023-03-12T17:44:00Z,news,0.5686274766921997,https://www.thesouthafrican.com/sport/cricket/virat-kohli-sick-during-epic-test-century-knock-says-wife-anushka-sharma-breaking-12-march-2023/,"Virat Kohli 'sick' during epic Test century knock, says wife Anushka","Virat Kohli's Bollywood actor wife Anushka Sharma on Sunday claimed her husband was unwell during his huge knock of 186 against Australia, his triumphant first Test ton in over three years.

The star batsman ended his long drought with the bat on day four of the fourth Test against Australia to power India's first innings reply in Ahmedabad.

Kohli finally fell to Todd Murphy's off spin in the final session after playing 364 deliveries in a marathon innings in front of a rapturous crowd at the world's biggest cricket stadium.

ALSO READ: Kagiso Rabada wants Proteas to play more Tests

In an Instagram story posted after the superstar cricketer's 75th international ton, Anushka wrote: ""Playing through sickness with this composure. Inspiring me always.""

Axar Patel, who shared a 162-run sixth-wicket stand with Kohli in India's 571 all out in response to 480 by Australia, said Kohli appeared to be anything but unwell.

ALSO READ: Proteas complete series whitewash of West Indies

""That (he was ill) I don't know, but the way he was running between the wickets, it didn't seem he was unwell,"" Axar told reporters.

""The way he got the partnership in this heat and ran between the wickets, it was good batting alongside him.""

Called ""King Kohli"" for his prolific run-making, the maestro racked up his 28th Test ton with a single off spinner Nathan Lyon in the second session to bring the house down in Ahmedabad.

ALSO READ: Proteas star opens up about addiction

Kohli went through an extended batting slump in 2021 and 2022, during which time he lost the Indian captaincy, one of the most high-pressure jobs in world sport.

Kohli, 34, had spoken about his mental health struggles during his dry phase, including how he had been ""snappy"" to Sharma, with whom he has a young daughter.","[{'uri': 'agence_france_presse@thesouthafrican.com', 'name': 'Agence France-Presse', 'type': 'author', 'isAgency': False}]","[{'uri': 'http://en.wikipedia.org/wiki/Test_cricket', 'type': 'wiki', 'score': 5, 'label': {'eng': 'Test cricket'}}, {'uri': 'http://en.wikipedia.org/wiki/Australia', 'type': 'loc', 'score': 5, 'label': {'eng': 'Australia'}, 'location': {'type': 'country', 'label': {'eng': 'Australia'}}}, {'uri': 'http://en.wikipedia.org/wiki/Innings', 'type': 'wiki', 'score': 4, 'label': {'eng': 'Innings'}}, {'uri': 'http://en.wikipedia.org/wiki/Anushka_Sharma', 'type': 'person', 'score': 4, 'label': {'eng': 'Anushka Sharma'}}, {'uri': 'http://en.wikipedia.org/wiki/South_Africa_national_cricket_team', 'type': 'loc', 'score': 3, 'label': {'eng': 'South Africa national cricket team'}, 'location': None}, {'uri': 'http://en.wikipedia.org/wiki/Virat_Kohli', 'type': 'person', 'score': 3, 'label': {'eng': 'Virat Kohli'}}, {'uri': 'http://en.wikipedia.org/wiki/Off_spin', 'type': 'wiki', 'score': 3, 'label': {'eng': 'Off spin'}}, {'uri': 'http://en.wikipedia.org/wiki/Cricket_bat', 'type': 'wiki', 'score': 3, 'label': {'eng': 'Cricket bat'}}, {'uri': 'http://en.wikipedia.org/wiki/Batting_(cricket)', 'type': 'wiki', 'score': 3, 'label': {'eng': 'Batting (cricket)'}}, {'uri': 'http://en.wikipedia.org/wiki/Bollywood', 'type': 'wiki', 'score': 3, 'label': {'eng': 'Bollywood'}}, {'uri': 'http://en.wikipedia.org/wiki/Ahmedabad', 'type': 'loc', 'score': 3, 'label': {'eng': 'Ahmedabad'}, 'location': {'type': 'place', 'label': {'eng': 'Ahmedabad'}, 'country': {'type': 'country', 'label': {'eng': 'India'}}}}, {'uri': 'http://en.wikipedia.org/wiki/India', 'type': 'loc', 'score': 3, 'label': {'eng': 'India'}, 'location': {'type': 'country', 'label': {'eng': 'India'}}}, {'uri': 'http://en.wikipedia.org/wiki/Kagiso_Rabada', 'type': 'wiki', 'score': 2, 'label': {'eng': 'Kagiso Rabada'}}, {'uri': 'http://en.wikipedia.org/wiki/Axar_Patel', 'type': 'wiki', 'score': 2, 'label': {'eng': 'Axar Patel'}}, {'uri': 'http://en.wikipedia.org/wiki/West_Indies', 'type': 'loc', 'score': 2, 'label': {'eng': 'West Indies'}, 'location': None}, {'uri': 'http://en.wikipedia.org/wiki/Whitewash_(sport)', 'type': 'wiki', 'score': 2, 'label': {'eng': 'Whitewash (sport)'}}, {'uri': 'http://en.wikipedia.org/wiki/Wicket', 'type': 'wiki', 'score': 2, 'label': {'eng': 'Wicket'}}, {'uri': 'http://en.wikipedia.org/wiki/Cricket', 'type': 'wiki', 'score': 2, 'label': {'eng': 'Cricket'}}, {'uri': 'http://en.wikipedia.org/wiki/Instagram', 'type': 'org', 'score': 2, 'label': {'eng': 'Instagram'}}, {'uri': 'http://en.wikipedia.org/wiki/Nathan_Lyon', 'type': 'wiki', 'score': 1, 'label': {'eng': 'Nathan Lyon'}}, {'uri': 'http://en.wikipedia.org/wiki/Captain_(cricket)', 'type': 'wiki', 'score': 1, 'label': {'eng': 'Captain (cricket)'}}]",http://www.thesouthafrican.com/wp-content/uploads/2022/03/Virat-Kohli-2.jpg,eng-8469535,0.2784313725490195,416339100,1,thesouthafrican.com,news,The South African,Test cricket Australia Innings Anushka Sharma South Africa national cricket team Virat Kohli Off spin Cricket bat Batting (cricket) Bollywood Ahmedabad India Kagiso Rabada Axar Patel West Indies Whitewash (sport) Wicket Cricket Instagram Nathan Lyon Captain (cricket),South-Africa,ZA,English,eng,,,C4,C17,Africa,AF,Christian,75.0,136.0,38.0,49.0,40.0,48.0,63.0,68.0,74.0,102.0,129.0,102.0,140.0,49.0,65.0,63.0,49.0,34.0,63.0,African Continental Free Trade Area (AfCFTA),AfCFTA,,,African Union,AU,,,-1,,,0,False,2023,3,12,45,17,2023-03-12
