,uri,lang,dateTime,sim,url,title,body,source,concepts,categories,links,videos,image,eventUri,location,sentiment,keyword,source.uri,year_month,con_name,country,lang-name,language,Political_Alignment,wiki-url,Cultural_Class,Economic_Class,Continent-name,Continent,Religions,2019Rank-From,SafetyandSecurity,PersonalFreedom,Governance,SocialCapital,InvestmentEnvironment,EnterpriseConditions,MarketAccessandInfrastructure,EconomicQuality,LivingConditions,Health,Education,NaturalEnvironment,PowerDistance,Individualism,Masculinity,UncertaintyAvoidance,LongTermOrientation,Indulgence,economicblocs-name,economicblocs,militarydefenseblocs-name,militarydefenseblocs,politicalregionalblocs-name,politicalregionalblocs,linguisticblocs-name,linguisticblocs,concepts_str,all_concepts,year,month,day,date,min,hour,MD
3778,7509481554,eng,2023-04-22 08:00:00+00:00,0.5215686559677124,https://cyprus-mail.com/2023/04/22/china-europe-together-to-build-a-better-future/,"China, Europe: together to build a better future |  Cyprus Mail","President Xi Jinping meeting French President Emmanuel Macron

Last February a new fleet of King Long Chinese vehicles arrived in Cyprus, and have since become part of the island's public bus service. The environmentally-friendly buses not only meet the Euro6 standard but also have an automated cleaning process, air conditioning, Wi-Fi, USB charging points and mobile apps for real-time information. Like the previous batch, the new buses are expected to provide a ""first-class travel"" experience, as one Cypriot student put it.

Strategically located at the crossroads of Asia, Europe and Africa and as an EU member and a strong shipping hub, Cyprus also has huge potential to deepen cooperation with China in ports, sea transportation and infrastructure to further drive the local economy. Enormous opportunities lie ahead as the Belt and Road Initiative celebrates its tenth anniversary.

The mutually-beneficial cooperation between China and Cyprus is an example of how much can be achieved if the potential of China-EU cooperation is further unleashed. On China's part, its EU policy is stable and consistent, always welcoming stronger communication and cooperation with the world's largest trading bloc.

As it reopens after the Covid-19 pandemic, Beijing has rolled out red carpets for a stream of visiting VIPs from Europe in recent months, including German Chancellor Olaf Scholz, President of the European Council Charles Michel, Spanish Prime Minister Pedro Sánchez Pérez-Castejón and, most recently, French President Emmanuel Macron, along with Ursula von der Leyen, head of the European Commission.

Chinese and European leaders maintained close contact through video meetings and phone calls during the pandemic. Now, with the pandemic subsiding, there is a great urgency for face-to-face interactions. So, in their talks, one of the first things that leaders from both sides agreed on is to fully resume in-person exchanges in all fields and at all levels.

Not least in the business sector. At the China Development Forum and Boao Forum for Asia annual conference that China held last month, there was an impressive turnout of European business leaders. Having seen with their own eyes China's vigour and vitality beyond the pandemic, they expressed optimism about the growth potential of the world's second-largest economy. The desire to further explore opportunities of China-EU cooperation is palpable.

China and the EU are now each other's second-largest trading partner. Two-way trade maintained steady growth despite the pandemic, and now exceeds €2 billion on a daily basis. After the China-EU geographical indications agreement entered into force on March 1, 2021, the two sides have achieved mutual recognition and protection of 244 products, with the publishing of a second batch of 350 mutually-recognised products also completed. This is a concrete example of win-win cooperation.

Indeed, with the strong recovery of the Chinese economy, more cooperation opportunities abound. China's middle income population already exceeds 400 million, and is expected to double in the next 15 years. The demand for high-quality products and services is simply humongous. During President Macron's visit, China and France reached an agreement called ""from French farm to Chinese table"". One can confidently expect to see more of Cyprus' distinctive agricultural products like halloumi on Chinese dining tables.

Overall, China and the EU are highly complementary in terms of markets, capital and technology. There is also huge potential for cooperation in emerging fields such as the digital economy, new energy and artificial intelligence.

It is also in the interests of the world that China and the EU work together. Both sides are committed to seeking multilateral solutions to global problems and have carried out fruitful cooperation in climate response, biodiversity, the Iranian nuclear issue, and many other areas. As the international landscape gets more turbulent and challenges even greater, there is an urgent need for Beijing and Brussels to work more closely in a wide range of areas and bring more certainty to an uncertain world.

Undoubtedly, the ongoing conflict in Ukraine is high on the minds of European leaders visiting China, who expect their Chinese interlocutors to play a bigger mediating role. China has made clear its position many times, facilitating talks for peace, and the most urgent thing now is to stop the fighting to save lives. At the same time, there needs to be a long-term solution to the problem, where the security concerns of all parties must be addressed.

Importantly, there is one common denominator that binds China and the EU together: peace. As President von der Leyen and President Macron said to President Xi Jinping, they are prepared to work with China to find a way to facilitate talks for peace. China also supports the EU in building a balanced, effective and sustainable European security framework, which serves the EU's fundamental and long-term interests.

China and Cyprus enjoy more than five decades of fruitful cooperation. The China-EU relationship is also celebrating its 20th anniversary of comprehensive strategic partnership this year. Given the myriad challenges facing humanity, it is imperative that China and the EU step up and together bring more peace, stability and certainty to our world.","{'uri': 'cyprus-mail.com', 'dataType': 'news', 'title': 'Cyprus Mail', 'description': 'Keep up to date with Cyprus, world and sports news', 'location': {'type': 'place', 'geoNamesId': '146267', 'wikiUri': 'http://en.wikipedia.org/wiki/Nicosia_District', 'label': {'eng': 'Nicosia District'}, 'population': 326980, 'lat': 35.06667, 'long': 33.1, 'featureCode': 'A.ADM1', 'country': {'type': 'country', 'geoNamesId': '146669', 'wikiUri': 'http://en.wikipedia.org/wiki/Cyprus', 'label': {'eng': 'Cyprus'}, 'population': 1102677, 'lat': 35, 'long': 33, 'area': 9250, 'code2': 'CY', 'code3': 'CYP', 'webExt': '.cy', 'currencyCode': 'EUR', 'currencyName': 'Euro', 'continent': 'Europe'}}, 'locationValidated': False, 'image': None, 'thumbImage': None, 'favicon': None, 'ranking': {'importanceRank': 377787, 'alexaGlobalRank': 96404, 'alexaCountryRank': 251}, 'socialMedia': {'twitter': 'cyprusmail', 'facebook': 'CyprusMail'}}","[{'uri': 'http://en.wikipedia.org/wiki/Bus', 'type': 'wiki', 'score': 5, 'label': {'eng': 'Bus'}, 'synonyms': {'eng': ['Omnibus', 'Multibus', 'Autobus']}, 'trendingScore': {'news': {'score': 0, 'testPopFq': 0, 'nullPopFq': 0}}}, {'uri': 'http://en.wikipedia.org/wiki/European_Union', 'type': 'loc', 'score': 5, 'label': {'eng': 'European Union'}, 'synonyms': {'eng': ['EU', 'E.U.', 'Eu']}, 'trendingScore': {'news': {'score': 0, 'testPopFq': 0, 'nullPopFq': 0}}, 'location': None}, {'uri': 'http://en.wikipedia.org/wiki/Cyprus', 'type': 'loc', 'score': 5, 'label': {'eng': 'Cyprus'}, 'synonyms': {'eng': ['Republic of Cyprus', 'Cy']}, 'trendingScore': {'news': {'score': 0, 'testPopFq': 0, 'nullPopFq': 0}}, 'location': {'type': 'country', 'geoNamesId': '146669', 'wikiUri': 'http://en.wikipedia.org/wiki/Cyprus', 'label': {'eng': 'Cyprus'}, 'population': 1102677, 'lat': 35, 'long': 33, 'area': 9250, 'code2': 'CY', 'code3': 'CYP', 'webExt': '.cy', 'currencyCode': 'EUR', 'currencyName': 'Euro', 'continent': 'Europe'}}, {'uri': 'http://en.wikipedia.org/wiki/China', 'type': 'loc', 'score': 5, 'label': {'eng': 'China'}, 'synonyms': {'eng': ['CN', 'PR China', 'PRC', 'Cn']}, 'trendingScore': {'news': {'score': 0, 'testPopFq': 0, 'nullPopFq': 0}}, 'location': {'type': 'country', 'geoNamesId': '1814991', 'wikiUri': 'http://en.wikipedia.org/wiki/China', 'label': {'eng': 'China'}, 'population': 1330044000, 'lat': 35, 'long': 105, 'area': 9596960, 'code2': 'CN', 'code3': 'CHN', 'webExt': '.cn', 'currencyCode': 'CNY', 'currencyName': 'Yuan Renminbi', 'continent': 'Asia'}}, {'uri': 'http://en.wikipedia.org/wiki/Emmanuel_Macron', 'type': 'person', 'score': 4, 'label': {'eng': 'Emmanuel Macron'}, 'synonyms': {}, 'trendingScore': {'news': {'score': 0, 'testPopFq': 0, 'nullPopFq': 0}}}, {'uri': 'http://en.wikipedia.org/wiki/Europe', 'type': 'loc', 'score': 4, 'label': {'eng': 'Europe'}, 'synonyms': {'eng': ['Europea']}, 'trendingScore': {'news': {'score': 0, 'testPopFq': 0, 'nullPopFq': 0}}, 'location': None}, {'uri': 'http://en.wikipedia.org/wiki/President_of_France', 'type': 'wiki', 'score': 4, 'label': {'eng': 'President of France'}, 'synonyms': {}, 'trendingScore': {'news': {'score': 0, 'testPopFq': 0, 'nullPopFq': 0}}}, {'uri': 'http://en.wikipedia.org/wiki/Trade_bloc', 'type': 'wiki', 'score': 3, 'label': {'eng': 'Trade bloc'}, 'synonyms': {}, 'trendingScore': {'news': {'score': 0, 'testPopFq': 0, 'nullPopFq': 0}}}, {'uri': 'http://en.wikipedia.org/wiki/Belt_and_Road_Initiative', 'type': 'wiki', 'score': 3, 'label': {'eng': 'Belt and Road Initiative'}, 'synonyms': {}, 'trendingScore': {'news': {'score': 0, 'testPopFq': 0, 'nullPopFq': 0}}}, {'uri': 'http://en.wikipedia.org/wiki/Air_conditioning', 'type': 'wiki', 'score': 3, 'label': {'eng': 'Air conditioning'}, 'synonyms': {'eng': ['A/C', 'AC']}, 'trendingScore': {'news': {'score': 0, 'testPopFq': 0, 'nullPopFq': 0}}}, {'uri': 'http://en.wikipedia.org/wiki/Mobile_app', 'type': 'wiki', 'score': 3, 'label': {'eng': 'Mobile app'}, 'synonyms': {'eng': ['App', 'Mobile application']}, 'trendingScore': {'news': {'score': 0, 'testPopFq': 0, 'nullPopFq': 0}}}, {'uri': 'http://en.wikipedia.org/wiki/Coronavirus', 'type': 'wiki', 'score': 3, 'label': {'eng': 'Coronavirus'}, 'synonyms': {'_ANY_': ['COVID-19', 'COVID19']}, 'trendingScore': {'news': {'score': 0, 'testPopFq': 0, 'nullPopFq': 0}}}, {'uri': 'http://en.wikipedia.org/wiki/Xi_Jinping', 'type': 'person', 'score': 3, 'label': {'eng': 'Xi Jinping'}, 'synonyms': {'eng': ['Jinping Xi', 'Xi Jin Ping', 'Xijinping']}, 'trendingScore': {'news': {'score': 0, 'testPopFq': 0, 'nullPopFq': 0}}}, {'uri': 'http://en.wikipedia.org/wiki/Asia', 'type': 'loc', 'score': 3, 'label': {'eng': 'Asia'}, 'synonyms': {}, 'trendingScore': {'news': {'score': 0, 'testPopFq': 0, 'nullPopFq': 0}}, 'location': None}, {'uri': 'http://en.wikipedia.org/wiki/Africa', 'type': 'loc', 'score': 3, 'label': {'eng': 'Africa'}, 'synonyms': {'eng': ['African continent']}, 'trendingScore': {'news': {'score': 0, 'testPopFq': 0, 'nullPopFq': 0}}, 'location': None}, {'uri': 'http://en.wikipedia.org/wiki/Wi-Fi', 'type': 'wiki', 'score': 3, 'label': {'eng': 'Wi-Fi'}, 'synonyms': {'eng': ['WiFi', 'Wi Fi']}, 'trendingScore': {'news': {'score': 0, 'testPopFq': 0, 'nullPopFq': 0}}}, {'uri': 'http://en.wikipedia.org/wiki/Beijing', 'type': 'loc', 'score': 3, 'label': {'eng': 'Beijing'}, 'synonyms': {'eng': ['Peking', 'Beiping', 'Peiping', 'Yanjing', 'Zhongdu', 'Khanbaliq', 'BJ']}, 'trendingScore': {'news': {'score': 0, 'testPopFq': 0, 'nullPopFq': 0}}, 'location': {'type': 'place', 'geoNamesId': '1816670', 'wikiUri': 'http://en.wikipedia.org/wiki/Beijing', 'label': {'eng': 'Beijing'}, 'population': 11716620, 'lat': 39.9075, 'long': 116.39723, 'featureCode': 'P.PPLC', 'country': {'type': 'country', 'geoNamesId': '1814991', 'wikiUri': 'http://en.wikipedia.org/wiki/China', 'label': {'eng': 'China'}, 'population': 1330044000, 'lat': 35, 'long': 105, 'area': 9596960, 'code2': 'CN', 'code3': 'CHN', 'webExt': '.cn', 'currencyCode': 'CNY', 'currencyName': 'Yuan Renminbi', 'continent': 'Asia'}}}, {'uri': 'http://en.wikipedia.org/wiki/Charles_Michel', 'type': 'wiki', 'score': 2, 'label': {'eng': 'Charles Michel'}, 'synonyms': {}, 'trendingScore': {'news': {'score': 0, 'testPopFq': 0, 'nullPopFq': 0}}}, {'uri': 'http://en.wikipedia.org/wiki/President_of_the_European_Council', 'type': 'wiki', 'score': 2, 'label': {'eng': 'President of the European Council'}, 'synonyms': {}, 'trendingScore': {'news': {'score': 0, 'testPopFq': 0, 'nullPopFq': 0}}}, {'uri': 'http://en.wikipedia.org/wiki/Prime_Minister_of_Spain', 'type': 'wiki', 'score': 2, 'label': {'eng': 'Prime Minister of Spain'}, 'synonyms': {}, 'trendingScore': {'news': {'score': 0, 'testPopFq': 0, 'nullPopFq': 0}}}, {'uri': 'http://en.wikipedia.org/wiki/Ursula_von_der_Leyen', 'type': 'wiki', 'score': 2, 'label': {'eng': 'Ursula von der Leyen'}, 'synonyms': {}, 'trendingScore': {'news': {'score': 0, 'testPopFq': 0, 'nullPopFq': 0}}}, {'uri': 'http://en.wikipedia.org/wiki/Boao_Forum_for_Asia', 'type': 'org', 'score': 2, 'label': {'eng': 'Boao Forum for Asia'}, 'synonyms': {}, 'trendingScore': {'news': {'score': 0, 'testPopFq': 0, 'nullPopFq': 0}}}, {'uri': 'http://en.wikipedia.org/wiki/Economy_of_China', 'type': 'wiki', 'score': 2, 'label': {'eng': 'Economy of China'}, 'synonyms': {}, 'trendingScore': {'news': {'score': 0, 'testPopFq': 0, 'nullPopFq': 0}}}, {'uri': 'http://en.wikipedia.org/wiki/Chancellor_of_Germany', 'type': 'wiki', 'score': 2, 'label': {'eng': 'Chancellor of Germany'}, 'synonyms': {}, 'trendingScore': {'news': {'score': 0, 'testPopFq': 0, 'nullPopFq': 0}}}, {'uri': 'http://en.wikipedia.org/wiki/Euro', 'type': 'wiki', 'score': 2, 'label': {'eng': 'Euro'}, 'synonyms': {'eng': ['€', 'EUR']}, 'trendingScore': {'news': {'score': 0, 'testPopFq': 0, 'nullPopFq': 0}}}, {'uri': 'http://en.wikipedia.org/wiki/European_Commission', 'type': 'org', 'score': 2, 'label': {'eng': 'European Commission'}, 'synonyms': {'eng': ['EC']}, 'trendingScore': {'news': {'score': 0, 'testPopFq': 0, 'nullPopFq': 0}}}, {'uri': 'http://en.wikipedia.org/wiki/Olaf_Scholz', 'type': 'person', 'score': 2, 'label': {'eng': 'Olaf Scholz'}, 'synonyms': {}, 'trendingScore': {'news': {'score': 0, 'testPopFq': 0, 'nullPopFq': 0}}}, {'uri': 'http://en.wikipedia.org/wiki/Pedro_Sánchez', 'type': 'loc', 'score': 2, 'label': {'eng': 'Pedro Sánchez'}, 'synonyms': {}, 'trendingScore': {'news': {'score': 0, 'testPopFq': 0, 'nullPopFq': 0}}, 'location': {'type': 'place', 'geoNamesId': '3495102', 'wikiUri': 'http://en.wikipedia.org/wiki/Pedro_Sánchez', 'label': {'eng': 'Pedro Sánchez'}, 'population': 1621, 'lat': 18.86375, 'long': -69.10868, 'featureCode': 'P.PPL', 'country': {'type': 'country', 'geoNamesId': '3508796', 'wikiUri': 'http://en.wikipedia.org/wiki/Dominican_Republic', 'label': {'eng': 'Dominican Republic'}, 'population': 9823821, 'lat': 19, 'long': -70.66667, 'area': 48730, 'code2': 'DO', 'code3': 'DOM', 'webExt': '.do', 'currencyCode': 'DOP', 'currencyName': 'Peso', 'continent': 'Noth America'}}}, {'uri': 'http://en.wikipedia.org/wiki/France', 'type': 'loc', 'score': 2, 'label': {'eng': 'France'}, 'synonyms': {'eng': ['Fr', 'FR', 'République française', 'La France', 'Republic of France', 'French Republic']}, 'trendingScore': {'news': {'score': 0, 'testPopFq': 0, 'nullPopFq': 0}}, 'location': {'type': 'country', 'geoNamesId': '3017382', 'wikiUri': 'http://en.wikipedia.org/wiki/France', 'label': {'eng': 'France'}, 'population': 64768389, 'lat': 46, 'long': 2, 'area': 547030, 'code2': 'FR', 'code3': 'FRA', 'webExt': '.fr', 'currencyCode': 'EUR', 'currencyName': 'Euro', 'continent': 'Europe'}}, {'uri': 'http://en.wikipedia.org/wiki/Strategic_partnership', 'type': 'wiki', 'score': 1, 'label': {'eng': 'Strategic partnership'}, 'synonyms': {}, 'trendingScore': {'news': {'score': 0, 'testPopFq': 0, 'nullPopFq': 0}}}, {'uri': 'http://en.wikipedia.org/wiki/Multilateralism', 'type': 'wiki', 'score': 1, 'label': {'eng': 'Multilateralism'}, 'synonyms': {}, 'trendingScore': {'news': {'score': 0, 'testPopFq': 0, 'nullPopFq': 0}}}, {'uri': 'http://en.wikipedia.org/wiki/Digital_economy', 'type': 'wiki', 'score': 1, 'label': {'eng': 'Digital economy'}, 'synonyms': {'eng': ['New economy', 'Internet economy']}, 'trendingScore': {'news': {'score': 0, 'testPopFq': 0, 'nullPopFq': 0}}}, {'uri': 'http://en.wikipedia.org/wiki/Nuclear_program_of_Iran', 'type': 'wiki', 'score': 1, 'label': {'eng': 'Nuclear program of Iran'}, 'synonyms': {}, 'trendingScore': {'news': {'score': 0, 'testPopFq': 0, 'nullPopFq': 0}}}, {'uri': 'http://en.wikipedia.org/wiki/Israeli–Palestinian_conflict', 'type': 'wiki', 'score': 1, 'label': {'eng': 'Israeli–Palestinian conflict'}, 'synonyms': {'eng': ['Israeli-Palestinian conflict']}, 'trendingScore': {'news': {'score': 0, 'testPopFq': 0, 'nullPopFq': 0}}}, {'uri': 'http://en.wikipedia.org/wiki/Brussels', 'type': 'loc', 'score': 1, 'label': {'eng': 'Brussels'}, 'synonyms': {'eng': ['Brussels Region', 'Brussels Capital Region']}, 'trendingScore': {'news': {'score': 0, 'testPopFq': 0, 'nullPopFq': 0}}, 'location': {'type': 'place', 'geoNamesId': '2800866', 'wikiUri': 'http://en.wikipedia.org/wiki/Brussels', 'label': {'eng': 'Brussels'}, 'population': 1019022, 'lat': 50.85045, 'long': 4.34878, 'featureCode': 'P.PPLC', 'country': {'type': 'country', 'geoNamesId': '2802361', 'wikiUri': 'http://en.wikipedia.org/wiki/Belgium', 'label': {'eng': 'Belgium'}, 'population': 10403000, 'lat': 50.75, 'long': 4.5, 'area': 30510, 'code2': 'BE', 'code3': 'BEL', 'webExt': '.be', 'currencyCode': 'EUR', 'currencyName': 'Euro', 'continent': 'Europe'}}}, {'uri': 'http://en.wikipedia.org/wiki/Ukraine', 'type': 'loc', 'score': 1, 'label': {'eng': 'Ukraine'}, 'synonyms': {'eng': ['UA', 'UKR', 'Ua', 'Ukrainia']}, 'trendingScore': {'news': {'score': 0, 'testPopFq': 0, 'nullPopFq': 0}}, 'location': {'type': 'country', 'geoNamesId': '690791', 'wikiUri': 'http://en.wikipedia.org/wiki/Ukraine', 'label': {'eng': 'Ukraine'}, 'population': 45415596, 'lat': 49, 'long': 32, 'area': 603700, 'code2': 'UA', 'code3': 'UKR', 'webExt': '.ua', 'currencyCode': 'UAH', 'currencyName': 'Hryvnia', 'continent': 'Europe'}}, {'uri': 'http://en.wikipedia.org/wiki/Iran', 'type': 'loc', 'score': 1, 'label': {'eng': 'Iran'}, 'synonyms': {'eng': ['Islamic Republic of Iran', 'Persia', 'Ir']}, 'trendingScore': {'news': {'score': 0, 'testPopFq': 0, 'nullPopFq': 0}}, 'location': {'type': 'country', 'geoNamesId': '130758', 'wikiUri': 'http://en.wikipedia.org/wiki/Iran', 'label': {'eng': 'Iran'}, 'population': 76923300, 'lat': 32, 'long': 53, 'area': 1648000, 'code2': 'IR', 'code3': 'IRN', 'webExt': '.ir', 'currencyCode': 'IRR', 'currencyName': 'Rial', 'continent': 'Asia'}}]","[{'uri': 'news/Business', 'label': 'news/Business', 'wgt': 94}, {'uri': 'dmoz/Society/Issues/Global', 'label': 'dmoz/Society/Issues/Global', 'wgt': 17}, {'uri': 'dmoz/Society/Government/Multilateral', 'label': 'dmoz/Society/Government/Multilateral', 'wgt': 19}, {'uri': 'dmoz/Business/Agriculture_and_Forestry/Cooperatives', 'label': 'dmoz/Business/Agriculture and Forestry/Cooperatives', 'wgt': 18}, {'uri': 'dmoz/Business/Chemicals/Biochemical', 'label': 'dmoz/Business/Chemicals/Biochemical', 'wgt': 18}, {'uri': 'dmoz/Business/Chemicals/Fine-Chemical_Intermediates', 'label': 'dmoz/Business/Chemicals/Fine-Chemical Intermediates', 'wgt': 17}]",[],[],https://cyprus-mail.com/wp-content/uploads/2023/04/0420_1.jpg,eng-8563257,,0.3176470588235294,Ukraine,cyprus-mail.com,2023-04,Cyprus,CY,,,,,,C4,Europe,EU,Christian,34.0,best,best,best,average,best,best,best,best,best,best,best,best,,,,,,,European Union (EU),EU,,,,,,,"[{'uri': 'http://en.wikipedia.org/wiki/Bus', 'type': 'wiki', 'score': 5, 'label': {'eng': 'Bus'}, 'synonyms': {'eng': ['Omnibus', 'Multibus', 'Autobus']}, 'trendingScore': {'news': {'score': 0, 'testPopFq': 0, 'nullPopFq': 0}}}, {'uri': 'http://en.wikipedia.org/wiki/European_Union', 'type': 'loc', 'score': 5, 'label': {'eng': 'European Union'}, 'synonyms': {'eng': ['EU', 'E.U.', 'Eu']}, 'trendingScore': {'news': {'score': 0, 'testPopFq': 0, 'nullPopFq': 0}}, 'location': None}, {'uri': 'http://en.wikipedia.org/wiki/Cyprus', 'type': 'loc', 'score': 5, 'label': {'eng': 'Cyprus'}, 'synonyms': {'eng': ['Republic of Cyprus', 'Cy']}, 'trendingScore': {'news': {'score': 0, 'testPopFq': 0, 'nullPopFq': 0}}, 'location': {'type': 'country', 'geoNamesId': '146669', 'wikiUri': 'http://en.wikipedia.org/wiki/Cyprus', 'label': {'eng': 'Cyprus'}, 'population': 1102677, 'lat': 35, 'long': 33, 'area': 9250, 'code2': 'CY', 'code3': 'CYP', 'webExt': '.cy', 'currencyCode': 'EUR', 'currencyName': 'Euro', 'continent': 'Europe'}}, {'uri': 'http://en.wikipedia.org/wiki/China', 'type': 'loc', 'score': 5, 'label': {'eng': 'China'}, 'synonyms': {'eng': ['CN', 'PR China', 'PRC', 'Cn']}, 'trendingScore': {'news': {'score': 0, 'testPopFq': 0, 'nullPopFq': 0}}, 'location': {'type': 'country', 'geoNamesId': '1814991', 'wikiUri': 'http://en.wikipedia.org/wiki/China', 'label': {'eng': 'China'}, 'population': 1330044000, 'lat': 35, 'long': 105, 'area': 9596960, 'code2': 'CN', 'code3': 'CHN', 'webExt': '.cn', 'currencyCode': 'CNY', 'currencyName': 'Yuan Renminbi', 'continent': 'Asia'}}, {'uri': 'http://en.wikipedia.org/wiki/Emmanuel_Macron', 'type': 'person', 'score': 4, 'label': {'eng': 'Emmanuel Macron'}, 'synonyms': {}, 'trendingScore': {'news': {'score': 0, 'testPopFq': 0, 'nullPopFq': 0}}}, {'uri': 'http://en.wikipedia.org/wiki/Europe', 'type': 'loc', 'score': 4, 'label': {'eng': 'Europe'}, 'synonyms': {'eng': ['Europea']}, 'trendingScore': {'news': {'score': 0, 'testPopFq': 0, 'nullPopFq': 0}}, 'location': None}, {'uri': 'http://en.wikipedia.org/wiki/President_of_France', 'type': 'wiki', 'score': 4, 'label': {'eng': 'President of France'}, 'synonyms': {}, 'trendingScore': {'news': {'score': 0, 'testPopFq': 0, 'nullPopFq': 0}}}, {'uri': 'http://en.wikipedia.org/wiki/Trade_bloc', 'type': 'wiki', 'score': 3, 'label': {'eng': 'Trade bloc'}, 'synonyms': {}, 'trendingScore': {'news': {'score': 0, 'testPopFq': 0, 'nullPopFq': 0}}}, {'uri': 'http://en.wikipedia.org/wiki/Belt_and_Road_Initiative', 'type': 'wiki', 'score': 3, 'label': {'eng': 'Belt and Road Initiative'}, 'synonyms': {}, 'trendingScore': {'news': {'score': 0, 'testPopFq': 0, 'nullPopFq': 0}}}, {'uri': 'http://en.wikipedia.org/wiki/Air_conditioning', 'type': 'wiki', 'score': 3, 'label': {'eng': 'Air conditioning'}, 'synonyms': {'eng': ['A/C', 'AC']}, 'trendingScore': {'news': {'score': 0, 'testPopFq': 0, 'nullPopFq': 0}}}, {'uri': 'http://en.wikipedia.org/wiki/Mobile_app', 'type': 'wiki', 'score': 3, 'label': {'eng': 'Mobile app'}, 'synonyms': {'eng': ['App', 'Mobile application']}, 'trendingScore': {'news': {'score': 0, 'testPopFq': 0, 'nullPopFq': 0}}}, {'uri': 'http://en.wikipedia.org/wiki/Coronavirus', 'type': 'wiki', 'score': 3, 'label': {'eng': 'Coronavirus'}, 'synonyms': {'_ANY_': ['COVID-19', 'COVID19']}, 'trendingScore': {'news': {'score': 0, 'testPopFq': 0, 'nullPopFq': 0}}}, {'uri': 'http://en.wikipedia.org/wiki/Xi_Jinping', 'type': 'person', 'score': 3, 'label': {'eng': 'Xi Jinping'}, 'synonyms': {'eng': ['Jinping Xi', 'Xi Jin Ping', 'Xijinping']}, 'trendingScore': {'news': {'score': 0, 'testPopFq': 0, 'nullPopFq': 0}}}, {'uri': 'http://en.wikipedia.org/wiki/Asia', 'type': 'loc', 'score': 3, 'label': {'eng': 'Asia'}, 'synonyms': {}, 'trendingScore': {'news': {'score': 0, 'testPopFq': 0, 'nullPopFq': 0}}, 'location': None}, {'uri': 'http://en.wikipedia.org/wiki/Africa', 'type': 'loc', 'score': 3, 'label': {'eng': 'Africa'}, 'synonyms': {'eng': ['African continent']}, 'trendingScore': {'news': {'score': 0, 'testPopFq': 0, 'nullPopFq': 0}}, 'location': None}, {'uri': 'http://en.wikipedia.org/wiki/Wi-Fi', 'type': 'wiki', 'score': 3, 'label': {'eng': 'Wi-Fi'}, 'synonyms': {'eng': ['WiFi', 'Wi Fi']}, 'trendingScore': {'news': {'score': 0, 'testPopFq': 0, 'nullPopFq': 0}}}, {'uri': 'http://en.wikipedia.org/wiki/Beijing', 'type': 'loc', 'score': 3, 'label': {'eng': 'Beijing'}, 'synonyms': {'eng': ['Peking', 'Beiping', 'Peiping', 'Yanjing', 'Zhongdu', 'Khanbaliq', 'BJ']}, 'trendingScore': {'news': {'score': 0, 'testPopFq': 0, 'nullPopFq': 0}}, 'location': {'type': 'place', 'geoNamesId': '1816670', 'wikiUri': 'http://en.wikipedia.org/wiki/Beijing', 'label': {'eng': 'Beijing'}, 'population': 11716620, 'lat': 39.9075, 'long': 116.39723, 'featureCode': 'P.PPLC', 'country': {'type': 'country', 'geoNamesId': '1814991', 'wikiUri': 'http://en.wikipedia.org/wiki/China', 'label': {'eng': 'China'}, 'population': 1330044000, 'lat': 35, 'long': 105, 'area': 9596960, 'code2': 'CN', 'code3': 'CHN', 'webExt': '.cn', 'currencyCode': 'CNY', 'currencyName': 'Yuan Renminbi', 'continent': 'Asia'}}}, {'uri': 'http://en.wikipedia.org/wiki/Charles_Michel', 'type': 'wiki', 'score': 2, 'label': {'eng': 'Charles Michel'}, 'synonyms': {}, 'trendingScore': {'news': {'score': 0, 'testPopFq': 0, 'nullPopFq': 0}}}, {'uri': 'http://en.wikipedia.org/wiki/President_of_the_European_Council', 'type': 'wiki', 'score': 2, 'label': {'eng': 'President of the European Council'}, 'synonyms': {}, 'trendingScore': {'news': {'score': 0, 'testPopFq': 0, 'nullPopFq': 0}}}, {'uri': 'http://en.wikipedia.org/wiki/Prime_Minister_of_Spain', 'type': 'wiki', 'score': 2, 'label': {'eng': 'Prime Minister of Spain'}, 'synonyms': {}, 'trendingScore': {'news': {'score': 0, 'testPopFq': 0, 'nullPopFq': 0}}}, {'uri': 'http://en.wikipedia.org/wiki/Ursula_von_der_Leyen', 'type': 'wiki', 'score': 2, 'label': {'eng': 'Ursula von der Leyen'}, 'synonyms': {}, 'trendingScore': {'news': {'score': 0, 'testPopFq': 0, 'nullPopFq': 0}}}, {'uri': 'http://en.wikipedia.org/wiki/Boao_Forum_for_Asia', 'type': 'org', 'score': 2, 'label': {'eng': 'Boao Forum for Asia'}, 'synonyms': {}, 'trendingScore': {'news': {'score': 0, 'testPopFq': 0, 'nullPopFq': 0}}}, {'uri': 'http://en.wikipedia.org/wiki/Economy_of_China', 'type': 'wiki', 'score': 2, 'label': {'eng': 'Economy of China'}, 'synonyms': {}, 'trendingScore': {'news': {'score': 0, 'testPopFq': 0, 'nullPopFq': 0}}}, {'uri': 'http://en.wikipedia.org/wiki/Chancellor_of_Germany', 'type': 'wiki', 'score': 2, 'label': {'eng': 'Chancellor of Germany'}, 'synonyms': {}, 'trendingScore': {'news': {'score': 0, 'testPopFq': 0, 'nullPopFq': 0}}}, {'uri': 'http://en.wikipedia.org/wiki/Euro', 'type': 'wiki', 'score': 2, 'label': {'eng': 'Euro'}, 'synonyms': {'eng': ['€', 'EUR']}, 'trendingScore': {'news': {'score': 0, 'testPopFq': 0, 'nullPopFq': 0}}}, {'uri': 'http://en.wikipedia.org/wiki/European_Commission', 'type': 'org', 'score': 2, 'label': {'eng': 'European Commission'}, 'synonyms': {'eng': ['EC']}, 'trendingScore': {'news': {'score': 0, 'testPopFq': 0, 'nullPopFq': 0}}}, {'uri': 'http://en.wikipedia.org/wiki/Olaf_Scholz', 'type': 'person', 'score': 2, 'label': {'eng': 'Olaf Scholz'}, 'synonyms': {}, 'trendingScore': {'news': {'score': 0, 'testPopFq': 0, 'nullPopFq': 0}}}, {'uri': 'http://en.wikipedia.org/wiki/Pedro_Sánchez', 'type': 'loc', 'score': 2, 'label': {'eng': 'Pedro Sánchez'}, 'synonyms': {}, 'trendingScore': {'news': {'score': 0, 'testPopFq': 0, 'nullPopFq': 0}}, 'location': {'type': 'place', 'geoNamesId': '3495102', 'wikiUri': 'http://en.wikipedia.org/wiki/Pedro_Sánchez', 'label': {'eng': 'Pedro Sánchez'}, 'population': 1621, 'lat': 18.86375, 'long': -69.10868, 'featureCode': 'P.PPL', 'country': {'type': 'country', 'geoNamesId': '3508796', 'wikiUri': 'http://en.wikipedia.org/wiki/Dominican_Republic', 'label': {'eng': 'Dominican Republic'}, 'population': 9823821, 'lat': 19, 'long': -70.66667, 'area': 48730, 'code2': 'DO', 'code3': 'DOM', 'webExt': '.do', 'currencyCode': 'DOP', 'currencyName': 'Peso', 'continent': 'Noth America'}}}, {'uri': 'http://en.wikipedia.org/wiki/France', 'type': 'loc', 'score': 2, 'label': {'eng': 'France'}, 'synonyms': {'eng': ['Fr', 'FR', 'République française', 'La France', 'Republic of France', 'French Republic']}, 'trendingScore': {'news': {'score': 0, 'testPopFq': 0, 'nullPopFq': 0}}, 'location': {'type': 'country', 'geoNamesId': '3017382', 'wikiUri': 'http://en.wikipedia.org/wiki/France', 'label': {'eng': 'France'}, 'population': 64768389, 'lat': 46, 'long': 2, 'area': 547030, 'code2': 'FR', 'code3': 'FRA', 'webExt': '.fr', 'currencyCode': 'EUR', 'currencyName': 'Euro', 'continent': 'Europe'}}, {'uri': 'http://en.wikipedia.org/wiki/Strategic_partnership', 'type': 'wiki', 'score': 1, 'label': {'eng': 'Strategic partnership'}, 'synonyms': {}, 'trendingScore': {'news': {'score': 0, 'testPopFq': 0, 'nullPopFq': 0}}}, {'uri': 'http://en.wikipedia.org/wiki/Multilateralism', 'type': 'wiki', 'score': 1, 'label': {'eng': 'Multilateralism'}, 'synonyms': {}, 'trendingScore': {'news': {'score': 0, 'testPopFq': 0, 'nullPopFq': 0}}}, {'uri': 'http://en.wikipedia.org/wiki/Digital_economy', 'type': 'wiki', 'score': 1, 'label': {'eng': 'Digital economy'}, 'synonyms': {'eng': ['New economy', 'Internet economy']}, 'trendingScore': {'news': {'score': 0, 'testPopFq': 0, 'nullPopFq': 0}}}, {'uri': 'http://en.wikipedia.org/wiki/Nuclear_program_of_Iran', 'type': 'wiki', 'score': 1, 'label': {'eng': 'Nuclear program of Iran'}, 'synonyms': {}, 'trendingScore': {'news': {'score': 0, 'testPopFq': 0, 'nullPopFq': 0}}}, {'uri': 'http://en.wikipedia.org/wiki/Israeli–Palestinian_conflict', 'type': 'wiki', 'score': 1, 'label': {'eng': 'Israeli–Palestinian conflict'}, 'synonyms': {'eng': ['Israeli-Palestinian conflict']}, 'trendingScore': {'news': {'score': 0, 'testPopFq': 0, 'nullPopFq': 0}}}, {'uri': 'http://en.wikipedia.org/wiki/Brussels', 'type': 'loc', 'score': 1, 'label': {'eng': 'Brussels'}, 'synonyms': {'eng': ['Brussels Region', 'Brussels Capital Region']}, 'trendingScore': {'news': {'score': 0, 'testPopFq': 0, 'nullPopFq': 0}}, 'location': {'type': 'place', 'geoNamesId': '2800866', 'wikiUri': 'http://en.wikipedia.org/wiki/Brussels', 'label': {'eng': 'Brussels'}, 'population': 1019022, 'lat': 50.85045, 'long': 4.34878, 'featureCode': 'P.PPLC', 'country': {'type': 'country', 'geoNamesId': '2802361', 'wikiUri': 'http://en.wikipedia.org/wiki/Belgium', 'label': {'eng': 'Belgium'}, 'population': 10403000, 'lat': 50.75, 'long': 4.5, 'area': 30510, 'code2': 'BE', 'code3': 'BEL', 'webExt': '.be', 'currencyCode': 'EUR', 'currencyName': 'Euro', 'continent': 'Europe'}}}, {'uri': 'http://en.wikipedia.org/wiki/Ukraine', 'type': 'loc', 'score': 1, 'label': {'eng': 'Ukraine'}, 'synonyms': {'eng': ['UA', 'UKR', 'Ua', 'Ukrainia']}, 'trendingScore': {'news': {'score': 0, 'testPopFq': 0, 'nullPopFq': 0}}, 'location': {'type': 'country', 'geoNamesId': '690791', 'wikiUri': 'http://en.wikipedia.org/wiki/Ukraine', 'label': {'eng': 'Ukraine'}, 'population': 45415596, 'lat': 49, 'long': 32, 'area': 603700, 'code2': 'UA', 'code3': 'UKR', 'webExt': '.ua', 'currencyCode': 'UAH', 'currencyName': 'Hryvnia', 'continent': 'Europe'}}, {'uri': 'http://en.wikipedia.org/wiki/Iran', 'type': 'loc', 'score': 1, 'label': {'eng': 'Iran'}, 'synonyms': {'eng': ['Islamic Republic of Iran', 'Persia', 'Ir']}, 'trendingScore': {'news': {'score': 0, 'testPopFq': 0, 'nullPopFq': 0}}, 'location': {'type': 'country', 'geoNamesId': '130758', 'wikiUri': 'http://en.wikipedia.org/wiki/Iran', 'label': {'eng': 'Iran'}, 'population': 76923300, 'lat': 32, 'long': 53, 'area': 1648000, 'code2': 'IR', 'code3': 'IRN', 'webExt': '.ir', 'currencyCode': 'IRR', 'currencyName': 'Rial', 'continent': 'Asia'}}]",Bus European_Union Cyprus Cyprus China China Emmanuel_Macron Europe President_of_France Trade_bloc Belt_and_Road_Initiative Air_conditioning Mobile_app Coronavirus Xi_Jinping Asia Africa Wi-Fi Beijing Beijing China Charles_Michel President_of_the_European_Council Prime_Minister_of_Spain Ursula_von_der_Leyen Boao_Forum_for_Asia Economy_of_China Chancellor_of_Germany Euro European_Commission Olaf_Scholz Pedro_Sánchez Pedro_Sánchez Dominican_Republic France France Strategic_partnership Multilateralism Digital_economy Nuclear_program_of_Iran Israeli–Palestinian_conflict Brussels Brussels Belgium Ukraine Ukraine Iran Iran,2023,4,22,2023-04-22,0,8,2023-04-22
