,uri,lang,dateTime,sim,url,title,body,source,concepts,categories,links,videos,image,eventUri,location,sentiment,keyword,source.uri,year_month,con_name,country,lang-name,language,Political_Alignment,wiki-url,Cultural_Class,Economic_Class,Continent-name,Continent,Religions,2019Rank-From,SafetyandSecurity,PersonalFreedom,Governance,SocialCapital,InvestmentEnvironment,EnterpriseConditions,MarketAccessandInfrastructure,EconomicQuality,LivingConditions,Health,Education,NaturalEnvironment,PowerDistance,Individualism,Masculinity,UncertaintyAvoidance,LongTermOrientation,Indulgence,economicblocs-name,economicblocs,militarydefenseblocs-name,militarydefenseblocs,politicalregionalblocs-name,politicalregionalblocs,linguisticblocs-name,linguisticblocs,concepts_str,all_concepts,year,month,day,date,min,hour,MD
2423,7488479026,eng,2023-04-09 06:55:00+00:00,0.0,https://www.thedailystar.net/opinion/views/project-syndicate/news/the-post-human-desert-3292651,The Post-Human Desert,"The Future of Life Institute's open letter demanding a six-month precautionary pause on artificial-intelligence development has already been signed by thousands of high-profile figures, including Elon Musk. The signatories worry that AI labs are ""locked in an out-of-control race"" to develop and deploy increasingly powerful systems that no one - including their creators - can understand, predict, or control.

What explains this outburst of panic among a certain cohort of elites? Control and regulation are obviously at the centre of the story, but whose? During the proposed half-year pause when humanity can take stock of the risks, who will stand for humanity? Since AI labs in China, India, and Russia will continue their work (perhaps in secret), a global public debate on the issue is inconceivable.

Still, we should consider what is at stake, here. In his 2015 book, Homo Deus, the historian Yuval Harari predicted that the most likely outcome of AI would be a radical division - much stronger than the class divide - within human society. Soon enough, biotechnology and computer algorithms will join their powers in producing ""bodies, brains, and minds,"" resulting in a widening gap ""between those who know how to engineer bodies and brains and those who do not."" In such a world, ""those who ride the train of progress will acquire divine abilities of creation and destruction, while those left behind will face extinction.""

The panic reflected in the AI letter stems from the fear that even those who are on the ""train of progress"" will be unable to steer it. Our current digital feudal masters are scared. What they want, however, is not public debate, but rather an agreement among governments and tech corporations to keep power where it belongs.

A massive expansion of AI capabilities is a serious threat to those in power - including those who develop, own, and control AI. It points to nothing less than the end of capitalism as we know it, manifest in the prospect of a self-reproducing AI system that will need less and less input from human agents (algorithmic market trading is merely the first step in this direction). The choice left to us will be between a new form of communism and uncontrollable chaos.

The new chatbots will offer many lonely (or not so lonely) people endless evenings of friendly dialogue about movies, books, cooking, or politics. To reuse an old metaphor of mine, what people will get is the AI version of decaffeinated coffee or sugar-free soda: a friendly neighbour with no skeletons in its closet, an Other that will simply accommodate itself to your own needs. There is a structure of fetishist disavowal here: ""I know very well that I am not talking to a real person, but it feels as though I am - and without any of the accompanying risks!""

In any case, a close examination of the AI letter shows it to be yet another attempt at prohibiting the impossible. This is an old paradox: it is impossible for us, as humans, to participate in a post-human future, so we must prohibit its development. To orient ourselves around these technologies, we should ask Lenin's old question: Freedom for whom to do what? In what sense were we free before? Were we not already controlled much more than we realised? Instead of complaining about the threat to our freedom and dignity in the future, perhaps we should first consider what freedom means now. Until we do this, we will act like hysterics who, according to the French psychoanalyst Jacques Lacan, are desperate for a master, but only one that we can dominate.

The futurist Ray Kurzweil predicts that, owing to the exponential nature of technological progress, we will soon be dealing with ""spiritual"" machines that will not only display all the signs of self-awareness but also far surpass human intelligence. But one should not confuse this ""post-human"" stance for the paradigmatically modern preoccupation with achieving total technological domination over nature. What we are witnessing, instead, is a dialectical reversal of this process.

Today's ""post-human"" sciences are no longer about domination. Their credo is surprise: what kind of contingent, unplanned emergent properties might ""black-box"" AI models acquire for themselves? No one knows, and therein lies the thrill - or, indeed, the banality - of the entire enterprise.

Hence, earlier this century, the French philosopher-engineer Jean-Pierre Dupuy discerned in the new robotics, genetics, nanotechnology, artificial life, and AI a strange inversion of the traditional anthropocentric arrogance that technology enables:

""How are we to explain that science became such a 'risky' activity that, according to some top scientists, it poses today the principal threat to the survival of humanity? Some philosophers reply to this question by saying that Descartes's dream - 'to become master and possessor of nature' - has turned wrong, and that we should urgently return to the 'mastery of mastery.' They have understood nothing. They don't see that the technology profiling itself at our horizon through 'convergence' of all disciplines aims precisely at nonmastery. The engineer of tomorrow will not be a sorcerer's apprentice because of his negligence or ignorance, but by choice.""

Humanity is creating its own god or devil. While the outcome cannot be predicted, one thing is certain. If something resembling ""post-humanity"" emerges as a collective fact, our worldview will lose all three of its defining, overlapping subjects: humanity, nature, and divinity. Our identity as humans can exist only against the background of impenetrable nature, but if life becomes something that can be fully manipulated by technology, it will lose its ""natural"" character. A fully controlled existence is one bereft of meaning, not to mention serendipity and wonder.

The same, of course, holds for any sense of the divine. The human experience of ""god"" has meaning only from the standpoint of human finitude and mortality. Once we become homo deus and create properties that seem ""supernatural"" from our old human standpoint, ""gods"" as we knew them will disappear. The question is what, if anything, will be left. Will we worship the AIs that we created?

There is every reason to worry that tech-gnostic visions of a post-human world are ideological fantasies obfuscating the abyss that awaits us. Needless to say, it would take more than a six-month pause to ensure that humans do not become irrelevant, and their lives meaningless, in the not-too-distant future.","{'uri': 'thedailystar.net', 'dataType': 'news', 'title': 'The Daily Star', 'description': ""Bangladesh's largest English Daily. The latest & breaking news, features, analysis and more from @dailystarnews."", 'location': {'type': 'place', 'geoNamesId': '1185241', 'wikiUri': 'http://en.wikipedia.org/wiki/Dhaka', 'label': {'eng': 'Dhaka'}, 'population': 10356500, 'lat': 23.7104, 'long': 90.40744, 'featureCode': 'P.PPLC', 'country': {'type': 'country', 'geoNamesId': '1210997', 'wikiUri': 'http://en.wikipedia.org/wiki/Bangladesh', 'label': {'eng': 'Bangladesh'}, 'population': 156118464, 'lat': 24, 'long': 90, 'area': 144000, 'code2': 'BD', 'code3': 'BGD', 'webExt': '.bd', 'currencyCode': 'BDT', 'currencyName': 'Taka', 'continent': 'Asia'}}, 'locationValidated': True, 'image': None, 'thumbImage': None, 'favicon': None, 'ranking': {'importanceRank': 209602, 'alexaGlobalRank': 5306, 'alexaCountryRank': 33}, 'socialMedia': {'twitter': 'dailystarnews', 'facebook': 'dailystarnews'}}","[{'uri': 'http://en.wikipedia.org/wiki/Artificial_intelligence', 'type': 'wiki', 'score': 5, 'label': {'eng': 'Artificial intelligence'}, 'synonyms': {'eng': ['AI', 'MI', 'Machine intelligence']}, 'trendingScore': {'news': {'score': 0, 'testPopFq': 0, 'nullPopFq': 0}}}, {'uri': 'http://en.wikipedia.org/wiki/Algorithm', 'type': 'wiki', 'score': 4, 'label': {'eng': 'Algorithm'}, 'synonyms': {}, 'trendingScore': {'news': {'score': 0, 'testPopFq': 0, 'nullPopFq': 0}}}, {'uri': 'http://en.wikipedia.org/wiki/Future_of_Life_Institute', 'type': 'wiki', 'score': 3, 'label': {'eng': 'Future of Life Institute'}, 'synonyms': {}, 'trendingScore': {'news': {'score': 0, 'testPopFq': 0, 'nullPopFq': 0}}}, {'uri': 'http://en.wikipedia.org/wiki/Yuval_Noah_Harari', 'type': 'wiki', 'score': 3, 'label': {'eng': 'Yuval Noah Harari'}, 'synonyms': {}, 'trendingScore': {'news': {'score': 0, 'testPopFq': 0, 'nullPopFq': 0}}}, {'uri': 'http://en.wikipedia.org/wiki/Posthuman', 'type': 'wiki', 'score': 3, 'label': {'eng': 'Posthuman'}, 'synonyms': {}, 'trendingScore': {'news': {'score': 0, 'testPopFq': 0, 'nullPopFq': 0}}}, {'uri': 'http://en.wikipedia.org/wiki/Feudalism', 'type': 'wiki', 'score': 3, 'label': {'eng': 'Feudalism'}, 'synonyms': {}, 'trendingScore': {'news': {'score': 0, 'testPopFq': 0, 'nullPopFq': 0}}}, {'uri': 'http://en.wikipedia.org/wiki/Engineer', 'type': 'wiki', 'score': 3, 'label': {'eng': 'Engineer'}, 'synonyms': {}, 'trendingScore': {'news': {'score': 0, 'testPopFq': 0, 'nullPopFq': 0}}}, {'uri': 'http://en.wikipedia.org/wiki/Historian', 'type': 'wiki', 'score': 3, 'label': {'eng': 'Historian'}, 'synonyms': {'eng': ['Historiographer', 'Historians']}, 'trendingScore': {'news': {'score': 0, 'testPopFq': 0, 'nullPopFq': 0}}}, {'uri': 'http://en.wikipedia.org/wiki/Homo', 'type': 'wiki', 'score': 3, 'label': {'eng': 'Homo'}, 'synonyms': {}, 'trendingScore': {'news': {'score': 0, 'testPopFq': 0, 'nullPopFq': 0}}}, {'uri': 'http://en.wikipedia.org/wiki/Demography', 'type': 'wiki', 'score': 3, 'label': {'eng': 'Demography'}, 'synonyms': {}, 'trendingScore': {'news': {'score': 0, 'testPopFq': 0, 'nullPopFq': 0}}}, {'uri': 'http://en.wikipedia.org/wiki/Biotechnology', 'type': 'wiki', 'score': 3, 'label': {'eng': 'Biotechnology'}, 'synonyms': {'eng': ['Biotech']}, 'trendingScore': {'news': {'score': 0, 'testPopFq': 0, 'nullPopFq': 0}}}, {'uri': 'http://en.wikipedia.org/wiki/Radicalism_(historical)', 'type': 'wiki', 'score': 3, 'label': {'eng': 'Radicalism (historical)'}, 'synonyms': {}, 'trendingScore': {'news': {'score': 0, 'testPopFq': 0, 'nullPopFq': 0}}}, {'uri': 'http://en.wikipedia.org/wiki/Digital_data', 'type': 'wiki', 'score': 3, 'label': {'eng': 'Digital data'}, 'synonyms': {'eng': ['Digital information']}, 'trendingScore': {'news': {'score': 0, 'testPopFq': 0, 'nullPopFq': 0}}}, {'uri': 'http://en.wikipedia.org/wiki/Extinction', 'type': 'wiki', 'score': 3, 'label': {'eng': 'Extinction'}, 'synonyms': {'eng': ['EX', 'Species extinction']}, 'trendingScore': {'news': {'score': 0, 'testPopFq': 0, 'nullPopFq': 0}}}, {'uri': 'http://en.wikipedia.org/wiki/Elon_Musk', 'type': 'wiki', 'score': 3, 'label': {'eng': 'Elon Musk'}, 'synonyms': {'eng': ['Elon Reeve Musk']}, 'trendingScore': {'news': {'score': 0, 'testPopFq': 0, 'nullPopFq': 0}}}, {'uri': 'http://en.wikipedia.org/wiki/Russia', 'type': 'loc', 'score': 3, 'label': {'eng': 'Russia'}, 'synonyms': {'_ANY_': ['Russian Federation'], 'eng': ['Rossiya', 'RU', 'Ru', 'Russian Federation', 'Rus']}, 'trendingScore': {'news': {'score': 0, 'testPopFq': 0, 'nullPopFq': 0}}, 'location': {'type': 'country', 'geoNamesId': '2017370', 'wikiUri': 'http://en.wikipedia.org/wiki/Russia', 'label': {'eng': 'Russia'}, 'population': 140702000, 'lat': 60, 'long': 100, 'area': 17100000, 'code2': 'RU', 'code3': 'RUS', 'webExt': '.ru', 'currencyCode': 'RUB', 'currencyName': 'Ruble', 'continent': 'Europe'}}, {'uri': 'http://en.wikipedia.org/wiki/India', 'type': 'loc', 'score': 3, 'label': {'eng': 'India'}, 'synonyms': {'eng': ['Bharat', 'Hindustan', 'In', 'IN', 'Republic of India']}, 'trendingScore': {'news': {'score': 0, 'testPopFq': 0, 'nullPopFq': 0}}, 'location': {'type': 'country', 'geoNamesId': '1269750', 'wikiUri': 'http://en.wikipedia.org/wiki/India', 'label': {'eng': 'India'}, 'population': 1173108018, 'lat': 22, 'long': 79, 'area': 3287590, 'code2': 'IN', 'code3': 'IND', 'webExt': '.in', 'currencyCode': 'INR', 'currencyName': 'Rupee', 'continent': 'Asia'}}, {'uri': 'http://en.wikipedia.org/wiki/China', 'type': 'loc', 'score': 3, 'label': {'eng': 'China'}, 'synonyms': {'eng': ['CN', 'PR China', 'PRC', 'Cn']}, 'trendingScore': {'news': {'score': 0, 'testPopFq': 0, 'nullPopFq': 0}}, 'location': {'type': 'country', 'geoNamesId': '1814991', 'wikiUri': 'http://en.wikipedia.org/wiki/China', 'label': {'eng': 'China'}, 'population': 1330044000, 'lat': 35, 'long': 105, 'area': 9596960, 'code2': 'CN', 'code3': 'CHN', 'webExt': '.cn', 'currencyCode': 'CNY', 'currencyName': 'Yuan Renminbi', 'continent': 'Asia'}}, {'uri': 'http://en.wikipedia.org/wiki/Ray_Kurzweil', 'type': 'person', 'score': 2, 'label': {'eng': 'Ray Kurzweil'}, 'synonyms': {'eng': ['Raymond Kurzweil']}, 'trendingScore': {'news': {'score': 0, 'testPopFq': 0, 'nullPopFq': 0}}}, {'uri': 'http://en.wikipedia.org/wiki/Jacques_Lacan', 'type': 'person', 'score': 2, 'label': {'eng': 'Jacques Lacan'}, 'synonyms': {'eng': ['Lacan']}, 'trendingScore': {'news': {'score': 0, 'testPopFq': 0, 'nullPopFq': 0}}}, {'uri': 'http://en.wikipedia.org/wiki/Futurist', 'type': 'wiki', 'score': 2, 'label': {'eng': 'Futurist'}, 'synonyms': {'eng': ['Futurologist']}, 'trendingScore': {'news': {'score': 0, 'testPopFq': 0, 'nullPopFq': 0}}}, {'uri': 'http://en.wikipedia.org/wiki/Fetishism', 'type': 'wiki', 'score': 2, 'label': {'eng': 'Fetishism'}, 'synonyms': {}, 'trendingScore': {'news': {'score': 0, 'testPopFq': 0, 'nullPopFq': 0}}}, {'uri': 'http://en.wikipedia.org/wiki/Metaphor', 'type': 'wiki', 'score': 2, 'label': {'eng': 'Metaphor'}, 'synonyms': {}, 'trendingScore': {'news': {'score': 0, 'testPopFq': 0, 'nullPopFq': 0}}}, {'uri': 'http://en.wikipedia.org/wiki/Paradox', 'type': 'org', 'score': 2, 'label': {'eng': 'Paradox'}, 'synonyms': {'eng': ['Contradiction']}, 'trendingScore': {'news': {'score': 0, 'testPopFq': 0, 'nullPopFq': 0}}}, {'uri': 'http://en.wikipedia.org/wiki/Reproduction', 'type': 'wiki', 'score': 2, 'label': {'eng': 'Reproduction'}, 'synonyms': {}, 'trendingScore': {'news': {'score': 0, 'testPopFq': 0, 'nullPopFq': 0}}}, {'uri': 'http://en.wikipedia.org/wiki/Vladimir_Lenin', 'type': 'person', 'score': 2, 'label': {'eng': 'Vladimir Lenin'}, 'synonyms': {'eng': ['Vladimir Ilyich Lenin', 'Vladimir Ilyich Ulyanov', 'V. I. Lenin', 'Lenin']}, 'trendingScore': {'news': {'score': 0, 'testPopFq': 0, 'nullPopFq': 0}}}, {'uri': 'http://en.wikipedia.org/wiki/Psychoanalysis', 'type': 'wiki', 'score': 2, 'label': {'eng': 'Psychoanalysis'}, 'synonyms': {}, 'trendingScore': {'news': {'score': 0, 'testPopFq': 0, 'nullPopFq': 0}}}, {'uri': 'http://en.wikipedia.org/wiki/René_Descartes', 'type': 'person', 'score': 1, 'label': {'eng': 'René Descartes'}, 'synonyms': {'eng': ['Descartes', 'Cartesius']}, 'trendingScore': {'news': {'score': 0, 'testPopFq': 0, 'nullPopFq': 0}}}]","[{'uri': 'news/Arts_and_Entertainment', 'label': 'news/Arts and Entertainment', 'wgt': 76}, {'uri': 'dmoz/Society/Future/Transhumanism', 'label': 'dmoz/Society/Future/Transhumanism', 'wgt': 100}, {'uri': 'dmoz/Society/Future/Essays', 'label': 'dmoz/Society/Future/Essays', 'wgt': 100}, {'uri': 'dmoz/Society/Religion_and_Spirituality/Morality', 'label': 'dmoz/Society/Religion and Spirituality/Morality', 'wgt': 100}, {'uri': 'dmoz/Society/Philosophy/Ethics', 'label': 'dmoz/Society/Philosophy/Ethics', 'wgt': 100}]",['http://www.project-syndicate.org'],[],https://tds-images.thedailystar.net/sites/default/files/styles/social_share/public/images/2023/04/09/artificial_intelligence-web.jpg?itok=PnDAKt-c,,,0.0274509803921567,Russia,thedailystar.net,2023-04,Bangladesh,BD,Bengali,ben,Center-left,ChatGPT,C20,C5,Asia,AS,Muslim,124.0,worst,average,worst,worst,worst,average,average,average,worst,average,worst,worst,high,low,high,high,low,low,,,,,,,,,"[{'uri': 'http://en.wikipedia.org/wiki/Artificial_intelligence', 'type': 'wiki', 'score': 5, 'label': {'eng': 'Artificial intelligence'}, 'synonyms': {'eng': ['AI', 'MI', 'Machine intelligence']}, 'trendingScore': {'news': {'score': 0, 'testPopFq': 0, 'nullPopFq': 0}}}, {'uri': 'http://en.wikipedia.org/wiki/Algorithm', 'type': 'wiki', 'score': 4, 'label': {'eng': 'Algorithm'}, 'synonyms': {}, 'trendingScore': {'news': {'score': 0, 'testPopFq': 0, 'nullPopFq': 0}}}, {'uri': 'http://en.wikipedia.org/wiki/Future_of_Life_Institute', 'type': 'wiki', 'score': 3, 'label': {'eng': 'Future of Life Institute'}, 'synonyms': {}, 'trendingScore': {'news': {'score': 0, 'testPopFq': 0, 'nullPopFq': 0}}}, {'uri': 'http://en.wikipedia.org/wiki/Yuval_Noah_Harari', 'type': 'wiki', 'score': 3, 'label': {'eng': 'Yuval Noah Harari'}, 'synonyms': {}, 'trendingScore': {'news': {'score': 0, 'testPopFq': 0, 'nullPopFq': 0}}}, {'uri': 'http://en.wikipedia.org/wiki/Posthuman', 'type': 'wiki', 'score': 3, 'label': {'eng': 'Posthuman'}, 'synonyms': {}, 'trendingScore': {'news': {'score': 0, 'testPopFq': 0, 'nullPopFq': 0}}}, {'uri': 'http://en.wikipedia.org/wiki/Feudalism', 'type': 'wiki', 'score': 3, 'label': {'eng': 'Feudalism'}, 'synonyms': {}, 'trendingScore': {'news': {'score': 0, 'testPopFq': 0, 'nullPopFq': 0}}}, {'uri': 'http://en.wikipedia.org/wiki/Engineer', 'type': 'wiki', 'score': 3, 'label': {'eng': 'Engineer'}, 'synonyms': {}, 'trendingScore': {'news': {'score': 0, 'testPopFq': 0, 'nullPopFq': 0}}}, {'uri': 'http://en.wikipedia.org/wiki/Historian', 'type': 'wiki', 'score': 3, 'label': {'eng': 'Historian'}, 'synonyms': {'eng': ['Historiographer', 'Historians']}, 'trendingScore': {'news': {'score': 0, 'testPopFq': 0, 'nullPopFq': 0}}}, {'uri': 'http://en.wikipedia.org/wiki/Homo', 'type': 'wiki', 'score': 3, 'label': {'eng': 'Homo'}, 'synonyms': {}, 'trendingScore': {'news': {'score': 0, 'testPopFq': 0, 'nullPopFq': 0}}}, {'uri': 'http://en.wikipedia.org/wiki/Demography', 'type': 'wiki', 'score': 3, 'label': {'eng': 'Demography'}, 'synonyms': {}, 'trendingScore': {'news': {'score': 0, 'testPopFq': 0, 'nullPopFq': 0}}}, {'uri': 'http://en.wikipedia.org/wiki/Biotechnology', 'type': 'wiki', 'score': 3, 'label': {'eng': 'Biotechnology'}, 'synonyms': {'eng': ['Biotech']}, 'trendingScore': {'news': {'score': 0, 'testPopFq': 0, 'nullPopFq': 0}}}, {'uri': 'http://en.wikipedia.org/wiki/Radicalism_(historical)', 'type': 'wiki', 'score': 3, 'label': {'eng': 'Radicalism (historical)'}, 'synonyms': {}, 'trendingScore': {'news': {'score': 0, 'testPopFq': 0, 'nullPopFq': 0}}}, {'uri': 'http://en.wikipedia.org/wiki/Digital_data', 'type': 'wiki', 'score': 3, 'label': {'eng': 'Digital data'}, 'synonyms': {'eng': ['Digital information']}, 'trendingScore': {'news': {'score': 0, 'testPopFq': 0, 'nullPopFq': 0}}}, {'uri': 'http://en.wikipedia.org/wiki/Extinction', 'type': 'wiki', 'score': 3, 'label': {'eng': 'Extinction'}, 'synonyms': {'eng': ['EX', 'Species extinction']}, 'trendingScore': {'news': {'score': 0, 'testPopFq': 0, 'nullPopFq': 0}}}, {'uri': 'http://en.wikipedia.org/wiki/Elon_Musk', 'type': 'wiki', 'score': 3, 'label': {'eng': 'Elon Musk'}, 'synonyms': {'eng': ['Elon Reeve Musk']}, 'trendingScore': {'news': {'score': 0, 'testPopFq': 0, 'nullPopFq': 0}}}, {'uri': 'http://en.wikipedia.org/wiki/Russia', 'type': 'loc', 'score': 3, 'label': {'eng': 'Russia'}, 'synonyms': {'_ANY_': ['Russian Federation'], 'eng': ['Rossiya', 'RU', 'Ru', 'Russian Federation', 'Rus']}, 'trendingScore': {'news': {'score': 0, 'testPopFq': 0, 'nullPopFq': 0}}, 'location': {'type': 'country', 'geoNamesId': '2017370', 'wikiUri': 'http://en.wikipedia.org/wiki/Russia', 'label': {'eng': 'Russia'}, 'population': 140702000, 'lat': 60, 'long': 100, 'area': 17100000, 'code2': 'RU', 'code3': 'RUS', 'webExt': '.ru', 'currencyCode': 'RUB', 'currencyName': 'Ruble', 'continent': 'Europe'}}, {'uri': 'http://en.wikipedia.org/wiki/India', 'type': 'loc', 'score': 3, 'label': {'eng': 'India'}, 'synonyms': {'eng': ['Bharat', 'Hindustan', 'In', 'IN', 'Republic of India']}, 'trendingScore': {'news': {'score': 0, 'testPopFq': 0, 'nullPopFq': 0}}, 'location': {'type': 'country', 'geoNamesId': '1269750', 'wikiUri': 'http://en.wikipedia.org/wiki/India', 'label': {'eng': 'India'}, 'population': 1173108018, 'lat': 22, 'long': 79, 'area': 3287590, 'code2': 'IN', 'code3': 'IND', 'webExt': '.in', 'currencyCode': 'INR', 'currencyName': 'Rupee', 'continent': 'Asia'}}, {'uri': 'http://en.wikipedia.org/wiki/China', 'type': 'loc', 'score': 3, 'label': {'eng': 'China'}, 'synonyms': {'eng': ['CN', 'PR China', 'PRC', 'Cn']}, 'trendingScore': {'news': {'score': 0, 'testPopFq': 0, 'nullPopFq': 0}}, 'location': {'type': 'country', 'geoNamesId': '1814991', 'wikiUri': 'http://en.wikipedia.org/wiki/China', 'label': {'eng': 'China'}, 'population': 1330044000, 'lat': 35, 'long': 105, 'area': 9596960, 'code2': 'CN', 'code3': 'CHN', 'webExt': '.cn', 'currencyCode': 'CNY', 'currencyName': 'Yuan Renminbi', 'continent': 'Asia'}}, {'uri': 'http://en.wikipedia.org/wiki/Ray_Kurzweil', 'type': 'person', 'score': 2, 'label': {'eng': 'Ray Kurzweil'}, 'synonyms': {'eng': ['Raymond Kurzweil']}, 'trendingScore': {'news': {'score': 0, 'testPopFq': 0, 'nullPopFq': 0}}}, {'uri': 'http://en.wikipedia.org/wiki/Jacques_Lacan', 'type': 'person', 'score': 2, 'label': {'eng': 'Jacques Lacan'}, 'synonyms': {'eng': ['Lacan']}, 'trendingScore': {'news': {'score': 0, 'testPopFq': 0, 'nullPopFq': 0}}}, {'uri': 'http://en.wikipedia.org/wiki/Futurist', 'type': 'wiki', 'score': 2, 'label': {'eng': 'Futurist'}, 'synonyms': {'eng': ['Futurologist']}, 'trendingScore': {'news': {'score': 0, 'testPopFq': 0, 'nullPopFq': 0}}}, {'uri': 'http://en.wikipedia.org/wiki/Fetishism', 'type': 'wiki', 'score': 2, 'label': {'eng': 'Fetishism'}, 'synonyms': {}, 'trendingScore': {'news': {'score': 0, 'testPopFq': 0, 'nullPopFq': 0}}}, {'uri': 'http://en.wikipedia.org/wiki/Metaphor', 'type': 'wiki', 'score': 2, 'label': {'eng': 'Metaphor'}, 'synonyms': {}, 'trendingScore': {'news': {'score': 0, 'testPopFq': 0, 'nullPopFq': 0}}}, {'uri': 'http://en.wikipedia.org/wiki/Paradox', 'type': 'org', 'score': 2, 'label': {'eng': 'Paradox'}, 'synonyms': {'eng': ['Contradiction']}, 'trendingScore': {'news': {'score': 0, 'testPopFq': 0, 'nullPopFq': 0}}}, {'uri': 'http://en.wikipedia.org/wiki/Reproduction', 'type': 'wiki', 'score': 2, 'label': {'eng': 'Reproduction'}, 'synonyms': {}, 'trendingScore': {'news': {'score': 0, 'testPopFq': 0, 'nullPopFq': 0}}}, {'uri': 'http://en.wikipedia.org/wiki/Vladimir_Lenin', 'type': 'person', 'score': 2, 'label': {'eng': 'Vladimir Lenin'}, 'synonyms': {'eng': ['Vladimir Ilyich Lenin', 'Vladimir Ilyich Ulyanov', 'V. I. Lenin', 'Lenin']}, 'trendingScore': {'news': {'score': 0, 'testPopFq': 0, 'nullPopFq': 0}}}, {'uri': 'http://en.wikipedia.org/wiki/Psychoanalysis', 'type': 'wiki', 'score': 2, 'label': {'eng': 'Psychoanalysis'}, 'synonyms': {}, 'trendingScore': {'news': {'score': 0, 'testPopFq': 0, 'nullPopFq': 0}}}, {'uri': 'http://en.wikipedia.org/wiki/René_Descartes', 'type': 'person', 'score': 1, 'label': {'eng': 'René Descartes'}, 'synonyms': {'eng': ['Descartes', 'Cartesius']}, 'trendingScore': {'news': {'score': 0, 'testPopFq': 0, 'nullPopFq': 0}}}]",Artificial_intelligence Algorithm Future_of_Life_Institute Yuval_Noah_Harari Posthuman Feudalism Engineer Historian Homo Demography Biotechnology Radicalism_(historical) Digital_data Extinction Elon_Musk Russia Russia India India China China Ray_Kurzweil Jacques_Lacan Futurist Fetishism Metaphor Paradox Reproduction Vladimir_Lenin Psychoanalysis René_Descartes,2023,4,9,2023-04-09,55,6,2023-04-09
