,uri,lang,isDuplicate,date,time,dateTime,dateTimePub,dataType,sim,url,title,body,authors,concepts,image,eventUri,sentiment,wgt,relevance,source.uri,source.dataType,source.title,all_concepts,con-name,country,lang-name,language,Political-Alignment,wiki-url,Cultural-Class,Economic-Class,Continent-name,Continent,Religions,2019Rank-From,SafetyandSecurity,PersonalFreedom,Governance,SocialCapital,InvestmentEnvironment,EnterpriseConditions,MarketAccessandInfrastructure,EconomicQuality,LivingConditions,Health,Education,NaturalEnvironment,PowerDistance,Individualism,Masculinity,UncertaintyAvoidance,LongTermOrientation,Indulgence,economicblocs-name,economicblocs,militarydefenseblocs-name,militarydefenseblocs,politicalregionalblocs-name,politicalregionalblocs,linguisticblocs-name,linguisticblocs,proScore,destination,parent,count,status,year,month,day,min,hour,MD
316,7442255112,eng,False,2023-03-11,21:43:00,2023-03-11 21:43:00,2023-03-11T21:17:00Z,news,0.5647059082984924,https://www.straitstimes.com/world/united-states/latest-california-storm-leaves-at-least-two-dead-breaks-levee,"Latest California storm leaves at least two dead, breaks levee","PAJARO, United States - Another powerful storm pummelled California overnight into Saturday, forcing thousands to evacuate and resulting in at least two deaths, while causing a levee to give way in coastal Monterey County.

""We were hoping to avoid and prevent this situation, but the worst case scenario has arrived with the Pajaro River overtopping and levee breaching at about midnight,"" Mr Luis Alejo, a Monterey County supervisor, said on Saturday on Twitter.

On Friday, state emergency services director Nancy Ward announced that the storm had already claimed at least two lives.

Images posted on Twitter by the state's National Guard account showed guardsmen rescuing residents trapped in their cars by high water.

At least one road was washed away in Santa Cruz County, just north of Monterey.

Residents in several towns, mostly in the north, have been ordered to evacuate.

An unusually intense and seemingly endless series of storms has battered California for weeks.

The latest storm was expected to dump as much as 23cm of rain on already saturated grounds.

Part of a powerful atmospheric river known as a ""Pineapple express"" - for the warm, subtropical moisture it brings from Hawaii - this latest storm will speed the melting of the enormous snowpack that has built up in higher elevations.",[],"[{'uri': 'http://en.wikipedia.org/wiki/Pajaro_River', 'type': 'wiki', 'score': 4, 'label': {'eng': 'Pajaro River'}}, {'uri': 'http://en.wikipedia.org/wiki/Levee', 'type': 'wiki', 'score': 4, 'label': {'eng': 'Levee'}}, {'uri': 'http://en.wikipedia.org/wiki/Monterey_County,_California', 'type': 'loc', 'score': 4, 'label': {'eng': 'Monterey County, California'}, 'location': {'type': 'place', 'label': {'eng': 'Monterey County, California'}, 'country': {'type': 'country', 'label': {'eng': 'United States'}}}}, {'uri': 'http://en.wikipedia.org/wiki/Twitter', 'type': 'org', 'score': 3, 'label': {'eng': 'Twitter'}}, {'uri': 'http://en.wikipedia.org/wiki/California', 'type': 'loc', 'score': 3, 'label': {'eng': 'California'}, 'location': {'type': 'place', 'label': {'eng': 'California'}, 'country': {'type': 'country', 'label': {'eng': 'United States'}}}}, {'uri': 'http://en.wikipedia.org/wiki/United_States', 'type': 'loc', 'score': 3, 'label': {'eng': 'United States'}, 'location': {'type': 'country', 'label': {'eng': 'United States'}}}, {'uri': 'http://en.wikipedia.org/wiki/Luis_Alejo', 'type': 'person', 'score': 2, 'label': {'eng': 'Luis Alejo'}}, {'uri': 'http://en.wikipedia.org/wiki/State_of_emergency', 'type': 'wiki', 'score': 2, 'label': {'eng': 'State of emergency'}}, {'uri': 'http://en.wikipedia.org/wiki/Subtropics', 'type': 'wiki', 'score': 1, 'label': {'eng': 'Subtropics'}}, {'uri': 'http://en.wikipedia.org/wiki/Snowpack', 'type': 'wiki', 'score': 1, 'label': {'eng': 'Snowpack'}}, {'uri': 'http://en.wikipedia.org/wiki/Pineapple_Express', 'type': 'wiki', 'score': 1, 'label': {'eng': 'Pineapple Express'}}, {'uri': 'http://en.wikipedia.org/wiki/Aquifer', 'type': 'wiki', 'score': 1, 'label': {'eng': 'Aquifer'}}, {'uri': 'http://en.wikipedia.org/wiki/Atmospheric_river', 'type': 'wiki', 'score': 1, 'label': {'eng': 'Atmospheric river'}}, {'uri': 'http://en.wikipedia.org/wiki/Hawaii', 'type': 'loc', 'score': 1, 'label': {'eng': 'Hawaii'}, 'location': {'type': 'place', 'label': {'eng': 'Hawaii'}, 'country': {'type': 'country', 'label': {'eng': 'United States'}}}}, {'uri': 'http://en.wikipedia.org/wiki/Santa_Cruz_County,_California', 'type': 'loc', 'score': 1, 'label': {'eng': 'Santa Cruz County, California'}, 'location': {'type': 'place', 'label': {'eng': 'Santa Cruz County, California'}, 'country': {'type': 'country', 'label': {'eng': 'United States'}}}}, {'uri': 'http://en.wikipedia.org/wiki/Monterey,_California', 'type': 'loc', 'score': 1, 'label': {'eng': 'Monterey, California'}, 'location': {'type': 'place', 'label': {'eng': 'Monterey, California'}, 'country': {'type': 'country', 'label': {'eng': 'United States'}}}}]",https://static1.straitstimes.com.sg/s3fs-public/styles/large30x20/public/articles/2023/03/12/2023-03-10T153055Z665089584RC23RZ9AJL4GRTRMADP3USA-WEATHER-CALIFORNIA.JPG?VersionId=z_p.ITPu4YkB0Ruugx91JZ0ifFYQaAb7,eng-8468865,-0.06666666666666665,416266980,1,straitstimes.com,news,The Straits Times,"Pajaro River Levee Monterey County, California Twitter California United States Luis Alejo State of emergency Subtropics Snowpack Pineapple Express Aquifer Atmospheric river Hawaii Santa Cruz County, California Monterey, California",Singapore,SG,,,Center-right,ChatGPT,C18,C2,Asia,AS,Buddhist,17.0,7.0,107.0,18.0,21.0,4.0,11.0,1.0,1.0,14.0,1.0,1.0,87.0,74.0,20.0,48.0,8.0,72.0,46.0,Association of Southeast Asian Nations (ASEAN) ,ASEAN,,,,,,,-1,,,0,False,2023,3,11,43,21,2023-03-11
264,7442478545,eng,False,2023-03-12,03:21:00,2023-03-12 03:21:00,2023-03-12T03:20:00Z,news,0.6627451181411743,https://www.thaipbsworld.com/latest-california-storm-leaves-at-least-two-dead-breaks-levee/,"Latest California storm leaves at least two dead, breaks levee","An aerial view of a flooded neighbourhood in Pajaro, Watsonville, California, on Saturday. Residents are forced to evacuate in the middle of the night after an atmospheric river surge broke the Pajaro levee and sent flood waters flowing into the community. - AFP pic, March 12, 2023.

Another powerful storm pummeled California overnight into Saturday, forcing thousands to evacuate and resulting in at least two deaths, while causing a levee to give way in coastal Monterey County.

""We were hoping to avoid and prevent this situation, but the worst case scenario has arrived with the Pajaro River overtopping and levee breaching at about midnight,"" Luis Alejo, a Monterey County supervisor, said Saturday on Twitter.

Residents told AFP they were alerted by local fire officials in the middle of the night that they needed to evacuate.

""Just the noise of the fire department -- their sirens and all -- woke us up,"" said Moses, a resident of the area for around 20 years who preferred to give only his first name.

He said officials later came and knocked on his door multiple times, but that he decided to wait until 5:00 AM to make a decision.

After returning home from surveying the flooding, Moses said water was beginning to cover his street.

""That's when I told my wife, 'hey, we got to get out of here,'"" he said.

The area remained under a flood warning Saturday afternoon, the National Weather Service said.

Friday night, state emergency services director Nancy Ward announced that the storm had already claimed at least two lives.

Images posted on Twitter by the state's National Guard account showed guardsmen rescuing residents trapped in their cars by high water.

At least one road was washed away in Santa Cruz County, just north of Monterey.

Residents in several towns, mostly in the north, have been ordered to evacuate.

An unusually intense and seemingly endless series of storms has battered California for weeks.

The latest storm was expected to dump as much as nine inches (23 centimeters) of rain on already saturated ground.

Part of a powerful atmospheric river known as a ""Pineapple express"" -- for the warm, subtropical moisture it brings from Hawaii -- this latest storm will speed the melting of the enormous snowpack that has built up in higher elevations.

The resulting runoff threatens to aggravate already serious flooding.

In Pajaro on Saturday, the fire department and national guard used drones to survey the flooded areas, checking for people stranded in their homes, AFP reporters saw.

Two cousins, Angel Martinez and Christian Garcia, waded through the water carrying a plastic bag of food salvaged from the kitchen.

They told AFP their neighborhood was a ""wreck,"" with water three-feet (one-meter) deep in their backyard.

They were only able to grab phone chargers, some blankets and a first aid kit when they hastily evacuated.

US President Joe Biden on Friday approved an emergency declaration that clears the way to expedite federal aid to the western state.

Biden called Governor Gavin Newsom on Saturday to reaffirm full federal support for the impact of flooding and landslides on the state, a White House pool report said.

Newsom said California was ""deploying every tool we have to protect communities from the relentless and deadly storms battering our state.""

Storms in January were blamed for the loss of 20 lives.",[],"[{'uri': 'http://en.wikipedia.org/wiki/Pajaro_River', 'type': 'wiki', 'score': 5, 'label': {'eng': 'Pajaro River'}}, {'uri': 'http://en.wikipedia.org/wiki/Levee', 'type': 'wiki', 'score': 5, 'label': {'eng': 'Levee'}}, {'uri': 'http://en.wikipedia.org/wiki/Moses', 'type': 'person', 'score': 4, 'label': {'eng': 'Moses'}}, {'uri': 'http://en.wikipedia.org/wiki/Monterey_County,_California', 'type': 'loc', 'score': 4, 'label': {'eng': 'Monterey County, California'}, 'location': {'type': 'place', 'label': {'eng': 'Monterey County, California'}, 'country': {'type': 'country', 'label': {'eng': 'United States'}}}}, {'uri': 'http://en.wikipedia.org/wiki/Luis_Alejo', 'type': 'person', 'score': 3, 'label': {'eng': 'Luis Alejo'}}, {'uri': 'http://en.wikipedia.org/wiki/Atmospheric_river', 'type': 'wiki', 'score': 3, 'label': {'eng': 'Atmospheric river'}}, {'uri': 'http://en.wikipedia.org/wiki/Fire_department', 'type': 'wiki', 'score': 3, 'label': {'eng': 'Fire department'}}, {'uri': 'http://en.wikipedia.org/wiki/Twitter', 'type': 'org', 'score': 3, 'label': {'eng': 'Twitter'}}, {'uri': 'http://en.wikipedia.org/wiki/Watsonville,_California', 'type': 'loc', 'score': 3, 'label': {'eng': 'Watsonville, California'}, 'location': {'type': 'place', 'label': {'eng': 'Watsonville, California'}, 'country': {'type': 'country', 'label': {'eng': 'United States'}}}}, {'uri': 'http://en.wikipedia.org/wiki/California', 'type': 'loc', 'score': 3, 'label': {'eng': 'California'}, 'location': {'type': 'place', 'label': {'eng': 'California'}, 'country': {'type': 'country', 'label': {'eng': 'United States'}}}}, {'uri': 'http://en.wikipedia.org/wiki/National_Guard_(United_States)', 'type': 'org', 'score': 2, 'label': {'eng': 'National Guard (United States)'}}, {'uri': 'http://en.wikipedia.org/wiki/Surveying', 'type': 'wiki', 'score': 2, 'label': {'eng': 'Surveying'}}, {'uri': 'http://en.wikipedia.org/wiki/State_of_emergency', 'type': 'wiki', 'score': 2, 'label': {'eng': 'State of emergency'}}, {'uri': 'http://en.wikipedia.org/wiki/Flood', 'type': 'wiki', 'score': 2, 'label': {'eng': 'Flood'}}, {'uri': 'http://en.wikipedia.org/wiki/National_Weather_Service', 'type': 'org', 'score': 2, 'label': {'eng': 'National Weather Service'}}, {'uri': 'http://en.wikipedia.org/wiki/Santa_Cruz_County,_California', 'type': 'loc', 'score': 2, 'label': {'eng': 'Santa Cruz County, California'}, 'location': {'type': 'place', 'label': {'eng': 'Santa Cruz County, California'}, 'country': {'type': 'country', 'label': {'eng': 'United States'}}}}, {'uri': 'http://en.wikipedia.org/wiki/Monterey,_California', 'type': 'loc', 'score': 2, 'label': {'eng': 'Monterey, California'}, 'location': {'type': 'place', 'label': {'eng': 'Monterey, California'}, 'country': {'type': 'country', 'label': {'eng': 'United States'}}}}, {'uri': 'http://en.wikipedia.org/wiki/Subtropics', 'type': 'wiki', 'score': 1, 'label': {'eng': 'Subtropics'}}, {'uri': 'http://en.wikipedia.org/wiki/Gavin_Newsom', 'type': 'person', 'score': 1, 'label': {'eng': 'Gavin Newsom'}}, {'uri': 'http://en.wikipedia.org/wiki/Snowpack', 'type': 'wiki', 'score': 1, 'label': {'eng': 'Snowpack'}}, {'uri': 'http://en.wikipedia.org/wiki/First_aid', 'type': 'wiki', 'score': 1, 'label': {'eng': 'First aid'}}, {'uri': 'http://en.wikipedia.org/wiki/White_House', 'type': 'loc', 'score': 1, 'label': {'eng': 'White House'}, 'location': None}, {'uri': 'http://en.wikipedia.org/wiki/Unmanned_aerial_vehicle', 'type': 'wiki', 'score': 1, 'label': {'eng': 'Unmanned aerial vehicle'}}, {'uri': 'http://en.wikipedia.org/wiki/Pineapple_Express', 'type': 'wiki', 'score': 1, 'label': {'eng': 'Pineapple Express'}}, {'uri': 'http://en.wikipedia.org/wiki/Landslide', 'type': 'wiki', 'score': 1, 'label': {'eng': 'Landslide'}}, {'uri': 'http://en.wikipedia.org/wiki/Surface_runoff', 'type': 'wiki', 'score': 1, 'label': {'eng': 'Surface runoff'}}, {'uri': 'http://en.wikipedia.org/wiki/Aquifer', 'type': 'wiki', 'score': 1, 'label': {'eng': 'Aquifer'}}, {'uri': 'http://en.wikipedia.org/wiki/Subsidy', 'type': 'wiki', 'score': 1, 'label': {'eng': 'Subsidy'}}, {'uri': 'http://en.wikipedia.org/wiki/Joe_Biden', 'type': 'person', 'score': 1, 'label': {'eng': 'Joe Biden'}}, {'uri': 'http://en.wikipedia.org/wiki/Agence_France-Presse', 'type': 'org', 'score': 1, 'label': {'eng': 'Agence France-Presse'}}, {'uri': 'http://en.wikipedia.org/wiki/Plastic', 'type': 'wiki', 'score': 1, 'label': {'eng': 'Plastic'}}, {'uri': 'http://en.wikipedia.org/wiki/Christianity', 'type': 'wiki', 'score': 1, 'label': {'eng': 'Christianity'}}, {'uri': 'http://en.wikipedia.org/wiki/Hawaii', 'type': 'loc', 'score': 1, 'label': {'eng': 'Hawaii'}, 'location': {'type': 'place', 'label': {'eng': 'Hawaii'}, 'country': {'type': 'country', 'label': {'eng': 'United States'}}}}]",https://www.thaipbsworld.com/wp-content/uploads/2023/03/Thai-PBS-World-logo-2023-03-12T101924.619-600x338.png,eng-8468865,-0.1686274509803921,416287260,1,thaipbsworld.com,news,thaipbsworld.com,"Pajaro River Levee Moses Monterey County, California Luis Alejo Atmospheric river Fire department Twitter Watsonville, California California National Guard (United States) Surveying State of emergency Flood National Weather Service Santa Cruz County, California Monterey, California Subtropics Gavin Newsom Snowpack First aid White House Unmanned aerial vehicle Pineapple Express Landslide Surface runoff Aquifer Subsidy Joe Biden Agence France-Presse Plastic Christianity Hawaii",Thailand,TH,,,,,C20,C9,Asia,AS,Buddhist,64.0,117.0,118.0,114.0,28.0,46.0,64.0,51.0,40.0,69.0,31.0,72.0,111.0,64.0,20.0,34.0,64.0,32.0,45.0,Association of Southeast Asian Nations (ASEAN) ,ASEAN,,,,,,,-1,,,0,False,2023,3,12,21,3,2023-03-12
32,7447326557,eng,False,2023-03-15,00:53:00,2023-03-15 00:53:00,2023-03-15T00:28:00Z,news,0.4549019634723663,https://www.straitstimes.com/world/united-states/soggy-california-drenched-anew-as-noreaster-storm-buries-new-england-new-york,"Soggy California drenched anew as Nor'easter storm buries New England, New York","NEW YORK - The latest in a series of atmospheric river storms soaked California on Tuesday, bringing another deluge of rain to the already-saturated state, while a Nor'easter swirling over New York and New England prompted emergency orders and closed roads.

Up to 25cm of rain was forecast in some areas of California, while up to 0.9m of fresh snow was expected to hit high-mountain elevations where snowdrifts already reach rooftops, according to the National Weather Service (NWS).

Along California's coast and lower inland areas, the heavy rain and melting alpine snow triggered a renewed threat of flooding from rain-swollen rivers and streams, compromising levees. Forecasts warned of widespread uprooting of trees and down power lines from winds gusting up to 113kmh.

""Lives and property are in great danger from Tuesday into Wednesday,"" the weather service said in its California forecast, warning residents to expect flash flooding in areas that do not normally experience it.

In anticipation of the ""atmospheric river"" - a current of air laden with dense tropical moisture from the Pacific - emergency crews filled sandbags and patrolled levees and riverbanks around the clock.

Nine atmospheric rivers lashed California in rapid succession from late December through mid-January, triggering widespread flooding, levee failures, mudslides and punishing surf. At least 20 people perished.

Another such storm drenched much of the state last Thursday night and Friday, causing levee failures along the Pajaro River in Monterey County and flooding entire communities made of predominantly of migrant farm workers.

Even as the 11th atmospheric river of the season soaked the region once more on Tuesday, emergency crews scrambled to patch the Parajo's earthen levee with rocks and fill. Some 21,000 people in the flood zone remained under evacuation orders or warnings, officials said.

""The impact of this is really ramping up today,"" said Mr Marc Chenard, a meteorologist with the NWS Weather Prediction Centre in College Park, Maryland. Most of the heavy weather would occur on Tuesday and Wednesday, he said, but flooding will persist.

Mandatory evacuation orders remained in effect for residents in 10 California counties on Tuesday, according to the Federal Emergency Management Agency. The greatest flood risks are from California's Central Coast to the southern Sierra Nevada foothills.

Chenard said that at elevations higher than 1,500m, the snowpack absorbs rain like a sponge. But the real risk is at lower elevations where rain runs off the snow, melting much of it and bringing floods and mudslides.

At Front Porch Farms in Healdsburg about 70 miles north of San Francisco, Mr Tommy Otey said he was glad to see his 11 million-gallon reservoir filling, after years of historic drought that parched California and forced his farm to downsize.

""This should last us the whole season,"" said Mr Otey, who primarily sells flowers to Bay Area florists.",[],"[{'uri': 'http://en.wikipedia.org/wiki/Levee', 'type': 'wiki', 'score': 5, 'label': {'eng': 'Levee'}}, {'uri': 'http://en.wikipedia.org/wiki/Atmospheric_river', 'type': 'wiki', 'score': 5, 'label': {'eng': 'Atmospheric river'}}, {'uri': 'http://en.wikipedia.org/wiki/New_York_(state)', 'type': 'wiki', 'score': 5, 'label': {'eng': 'New York (state)'}}, {'uri': 'http://en.wikipedia.org/wiki/California', 'type': 'loc', 'score': 5, 'label': {'eng': 'California'}, 'location': {'type': 'place', 'label': {'eng': 'California'}, 'country': {'type': 'country', 'label': {'eng': 'United States'}}}}, {'uri': 'http://en.wikipedia.org/wiki/Flood', 'type': 'wiki', 'score': 4, 'label': {'eng': 'Flood'}}, {'uri': 'http://en.wikipedia.org/wiki/Snow', 'type': 'wiki', 'score': 4, 'label': {'eng': 'Snow'}}, {'uri': ""http://en.wikipedia.org/wiki/Nor'easter"", 'type': 'wiki', 'score': 3, 'label': {'eng': ""Nor'easter""}}, {'uri': 'http://en.wikipedia.org/wiki/Alpine_climate', 'type': 'wiki', 'score': 3, 'label': {'eng': 'Alpine climate'}}, {'uri': 'http://en.wikipedia.org/wiki/Snowdrift', 'type': 'wiki', 'score': 3, 'label': {'eng': 'Snowdrift'}}, {'uri': 'http://en.wikipedia.org/wiki/River', 'type': 'wiki', 'score': 3, 'label': {'eng': 'River'}}, {'uri': 'http://en.wikipedia.org/wiki/National_Weather_Service', 'type': 'org', 'score': 3, 'label': {'eng': 'National Weather Service'}}, {'uri': 'http://en.wikipedia.org/wiki/New_England', 'type': 'loc', 'score': 3, 'label': {'eng': 'New England'}, 'location': {'type': 'place', 'label': {'eng': 'New England'}, 'country': {'type': 'country', 'label': {'eng': 'United States'}}}}, {'uri': 'http://en.wikipedia.org/wiki/Pajaro_River', 'type': 'wiki', 'score': 2, 'label': {'eng': 'Pajaro River'}}, {'uri': 'http://en.wikipedia.org/wiki/Flash_flood', 'type': 'wiki', 'score': 2, 'label': {'eng': 'Flash flood'}}, {'uri': 'http://en.wikipedia.org/wiki/Tropics', 'type': 'wiki', 'score': 2, 'label': {'eng': 'Tropics'}}, {'uri': 'http://en.wikipedia.org/wiki/Surfing', 'type': 'wiki', 'score': 2, 'label': {'eng': 'Surfing'}}, {'uri': 'http://en.wikipedia.org/wiki/Pacific_Ocean', 'type': 'loc', 'score': 2, 'label': {'eng': 'Pacific Ocean'}, 'location': None}, {'uri': 'http://en.wikipedia.org/wiki/Mudflow', 'type': 'wiki', 'score': 2, 'label': {'eng': 'Mudflow'}}, {'uri': 'http://en.wikipedia.org/wiki/Refugee', 'type': 'wiki', 'score': 2, 'label': {'eng': 'Refugee'}}, {'uri': 'http://en.wikipedia.org/wiki/Monterey_County,_California', 'type': 'loc', 'score': 2, 'label': {'eng': 'Monterey County, California'}, 'location': {'type': 'place', 'label': {'eng': 'Monterey County, California'}, 'country': {'type': 'country', 'label': {'eng': 'United States'}}}}, {'uri': 'http://en.wikipedia.org/wiki/Central_Coast_(California)', 'type': 'wiki', 'score': 1, 'label': {'eng': 'Central Coast (California)'}}, {'uri': 'http://en.wikipedia.org/wiki/Snowpack', 'type': 'wiki', 'score': 1, 'label': {'eng': 'Snowpack'}}, {'uri': 'http://en.wikipedia.org/wiki/Federal_Emergency_Management_Agency', 'type': 'org', 'score': 1, 'label': {'eng': 'Federal Emergency Management Agency'}}, {'uri': 'http://en.wikipedia.org/wiki/Reservoir', 'type': 'wiki', 'score': 1, 'label': {'eng': 'Reservoir'}}, {'uri': 'http://en.wikipedia.org/wiki/Sierra_Nevada', 'type': 'wiki', 'score': 1, 'label': {'eng': 'Sierra Nevada'}}, {'uri': 'http://en.wikipedia.org/wiki/Drought', 'type': 'wiki', 'score': 1, 'label': {'eng': 'Drought'}}, {'uri': 'http://en.wikipedia.org/wiki/San_Francisco', 'type': 'loc', 'score': 1, 'label': {'eng': 'San Francisco'}, 'location': {'type': 'place', 'label': {'eng': 'San Francisco'}, 'country': {'type': 'country', 'label': {'eng': 'United States'}}}}, {'uri': 'http://en.wikipedia.org/wiki/Healdsburg,_California', 'type': 'loc', 'score': 1, 'label': {'eng': 'Healdsburg, California'}, 'location': {'type': 'place', 'label': {'eng': 'Healdsburg, California'}, 'country': {'type': 'country', 'label': {'eng': 'United States'}}}}, {'uri': 'http://en.wikipedia.org/wiki/College_Park,_Maryland', 'type': 'loc', 'score': 1, 'label': {'eng': 'College Park, Maryland'}, 'location': {'type': 'place', 'label': {'eng': 'College Park, Maryland'}, 'country': {'type': 'country', 'label': {'eng': 'United States'}}}}]",https://static1.straitstimes.com.sg/s3fs-public/styles/large30x20/public/articles/2023/03/15/2023-03-14T232829Z2083099145RC2XTZ9RTMSLRTRMADP3USA-WEATHER-CALIFORNIA.JPG?VersionId=RZc6q9nzdyF9UVgpZyBouwgPyRjcOGpy,eng-8468865,-0.2941176470588235,416537580,1,straitstimes.com,news,The Straits Times,"Levee Atmospheric river New York (state) California Flood Snow Nor'easter Alpine climate Snowdrift River National Weather Service New England Pajaro River Flash flood Tropics Surfing Pacific Ocean Mudflow Refugee Monterey County, California Central Coast (California) Snowpack Federal Emergency Management Agency Reservoir Sierra Nevada Drought San Francisco Healdsburg, California College Park, Maryland",Singapore,SG,,,Center-right,ChatGPT,C18,C2,Asia,AS,Buddhist,17.0,7.0,107.0,18.0,21.0,4.0,11.0,1.0,1.0,14.0,1.0,1.0,87.0,74.0,20.0,48.0,8.0,72.0,46.0,Association of Southeast Asian Nations (ASEAN) ,ASEAN,,,,,,,-1,,,0,False,2023,3,15,53,0,2023-03-15
