,uri,lang,dateTime,sim,url,title,body,source,concepts,categories,links,videos,image,eventUri,location,sentiment,keyword,source.uri,year_month,con_name,country,lang-name,language,Political_Alignment,wiki-url,Cultural_Class,Economic_Class,Continent-name,Continent,Religions,2019Rank-From,SafetyandSecurity,PersonalFreedom,Governance,SocialCapital,InvestmentEnvironment,EnterpriseConditions,MarketAccessandInfrastructure,EconomicQuality,LivingConditions,Health,Education,NaturalEnvironment,PowerDistance,Individualism,Masculinity,UncertaintyAvoidance,LongTermOrientation,Indulgence,economicblocs-name,economicblocs,militarydefenseblocs-name,militarydefenseblocs,politicalregionalblocs-name,politicalregionalblocs,linguisticblocs-name,linguisticblocs,concepts_str,all_concepts,year,month,day,date,min,hour,MD
3304,7476191432,eng,2023-04-01 08:27:00+00:00,0.7254902124404907,https://tribune.com.pk/story/2409390/italy-curbs-chatgpt-starts-probe-over-privacy-concerns,"Italy curbs ChatGPT, starts probe over privacy concerns","Agency accused OpenAI of failing to check age of ChatGPT's users who are supposed to be aged 13 or above

OpenAI has taken ChatGPT offline in Italy after the government's Data Protection Authority on Friday temporarily banned the chatbot and launched a probe over the artificial intelligence application's suspected breach of privacy rules.

The agency, also known as Garante, accused Microsoft-backed OpenAI of failing to check the age of ChatGPT's users who are supposed to be aged 13 or above.

ChatGPT has an ""absence of any legal basis that justifies the massive collection and storage of personal data"" to ""train"" the chatbot, Garante said. OpenAI has 20 days to respond with remedies or could risk a fine of up to 20 million euros ($21.68 million) or 4% of its annual worldwide turnover.

OpenAI said it has disabled ChatGPT for users in Italy at the request of the Garante.

The website could not be reached in Italy. A notice on the ChatGPT webpage said the website's owner may have set restrictions that prevent users from accessing the site.

""We actively work to reduce personal data in training our AI systems like ChatGPT because we want our AI to learn about the world, not about private individuals,"" OpenAI added.

Italy, which has provisionally restricted ChatGPT's use of domestic users' personal data, became the first Western country to take action against a chatbot powered by artificial intelligence.

The chatbot is also unavailable in mainland China, Hong Kong, Iran and Russia and parts of Africa where residents cannot create OpenAI accounts.

Since its release last year, ChatGPT has set off a tech craze, prompting rivals to launch similar products and companies to integrate it or similar technologies into their apps and products.

The rapid development of the technology has attracted attention from lawmakers in several countries. Many experts say new regulations are needed to govern AI because of its potential impact on national security, jobs and education.

""We expect all companies active in the EU to respect EU data protection rules. The enforcement of the General Data Protection Regulation is the responsibility of EU data protection authorities,"" a European Commission spokesperson said.

The Commission, which is debating the EU AI Act, may not be inclined to ban AI, European Commission Executive Vice President Margrethe Vestager tweeted.

""No matter which #tech we use, we have to continue to advance our freedoms & protect our rights. That's why we don't regulate #AI technologies, we regulate the uses of #AI,"" she said. ""Let's not throw away in a few years what has taken decades to build.""

On Wednesday, Elon Musk and a group of artificial intelligence experts and industry executives called for a six-month pause in developing systems more powerful than OpenAI's newly launched GPT-4, in an open letter citing potential risks to society.

OpenAI has not provided details on how it trains its AI model.

""The lack of transparency is the real problem,"" said Johanna Björklund, AI researcher and associate professor at Umeå University in Sweden. ""If you do AI research, you should be very transparent about how you do it.""

ChatGPT is estimated to have reached 100 million monthly active users in January, just two months after launch, making it the fastest-growing consumer application in history, according to a UBS study published last month.","{'uri': 'tribune.com.pk', 'dataType': 'news', 'title': 'The Express Tribune', 'description': 'Global Standard, Local Perspective. Follow for breaking news, special reports and more from https://t.co/KGnqS44Rap', 'location': {'type': 'place', 'geoNamesId': '1174872', 'wikiUri': 'http://en.wikipedia.org/wiki/Karachi', 'label': {'eng': 'Karachi'}, 'population': 11624219, 'lat': 24.9056, 'long': 67.0822, 'featureCode': 'P.PPLA', 'country': {'type': 'country', 'geoNamesId': '1168579', 'wikiUri': 'http://en.wikipedia.org/wiki/Pakistan', 'label': {'eng': 'Pakistan'}, 'population': 184404791, 'lat': 30, 'long': 70, 'area': 803940, 'code2': 'PK', 'code3': 'PAK', 'webExt': '.pk', 'currencyCode': 'PKR', 'currencyName': 'Rupee', 'continent': 'Asia'}}, 'locationValidated': True, 'image': None, 'thumbImage': None, 'favicon': None, 'ranking': {'importanceRank': 189456, 'alexaGlobalRank': 3092, 'alexaCountryRank': 36}, 'socialMedia': {'twitter': 'etribune', 'facebook': 'etribune'}}","[{'uri': 'http://en.wikipedia.org/wiki/ChatGPT', 'type': 'wiki', 'score': 5, 'label': {'eng': 'ChatGPT'}, 'synonyms': {}, 'trendingScore': {'news': {'score': 0, 'testPopFq': 0, 'nullPopFq': 0}}}, {'uri': 'http://en.wikipedia.org/wiki/OpenAI', 'type': 'wiki', 'score': 5, 'label': {'eng': 'OpenAI'}, 'synonyms': {}, 'trendingScore': {'news': {'score': 0, 'testPopFq': 0, 'nullPopFq': 0}}}, {'uri': 'http://en.wikipedia.org/wiki/Chatbot', 'type': 'wiki', 'score': 5, 'label': {'eng': 'Chatbot'}, 'synonyms': {'eng': ['Chat bot', 'Bot']}, 'trendingScore': {'news': {'score': 0, 'testPopFq': 0, 'nullPopFq': 0}}}, {'uri': 'http://en.wikipedia.org/wiki/Artificial_intelligence', 'type': 'wiki', 'score': 5, 'label': {'eng': 'Artificial intelligence'}, 'synonyms': {'eng': ['AI', 'MI', 'Machine intelligence']}, 'trendingScore': {'news': {'score': 0, 'testPopFq': 0, 'nullPopFq': 0}}}, {'uri': 'http://en.wikipedia.org/wiki/Personal_data', 'type': 'wiki', 'score': 5, 'label': {'eng': 'Personal data'}, 'synonyms': {}, 'trendingScore': {'news': {'score': 0, 'testPopFq': 0, 'nullPopFq': 0}}}, {'uri': 'http://en.wikipedia.org/wiki/Italy', 'type': 'loc', 'score': 5, 'label': {'eng': 'Italy'}, 'synonyms': {'eng': ['Italia', 'Italian Republic', 'IT', 'It']}, 'trendingScore': {'news': {'score': 0, 'testPopFq': 0, 'nullPopFq': 0}}, 'location': {'type': 'country', 'geoNamesId': '3175395', 'wikiUri': 'http://en.wikipedia.org/wiki/Italy', 'label': {'eng': 'Italy'}, 'population': 60340328, 'lat': 42.83333, 'long': 12.83333, 'area': 301230, 'code2': 'IT', 'code3': 'ITA', 'webExt': '.it', 'currencyCode': 'EUR', 'currencyName': 'Euro', 'continent': 'Europe'}}, {'uri': 'http://en.wikipedia.org/wiki/Privacy', 'type': 'wiki', 'score': 3, 'label': {'eng': 'Privacy'}, 'synonyms': {}, 'trendingScore': {'news': {'score': 0, 'testPopFq': 0, 'nullPopFq': 0}}}, {'uri': 'http://en.wikipedia.org/wiki/Euro', 'type': 'wiki', 'score': 3, 'label': {'eng': 'Euro'}, 'synonyms': {'eng': ['€', 'EUR']}, 'trendingScore': {'news': {'score': 0, 'testPopFq': 0, 'nullPopFq': 0}}}, {'uri': 'http://en.wikipedia.org/wiki/European_Union', 'type': 'loc', 'score': 3, 'label': {'eng': 'European Union'}, 'synonyms': {'eng': ['EU', 'E.U.', 'Eu']}, 'trendingScore': {'news': {'score': 0, 'testPopFq': 0, 'nullPopFq': 0}}, 'location': None}, {'uri': 'http://en.wikipedia.org/wiki/Mainland_China', 'type': 'loc', 'score': 2, 'label': {'eng': 'Mainland China'}, 'synonyms': {'eng': ['Chinese mainland', 'Mainland']}, 'trendingScore': {'news': {'score': 0, 'testPopFq': 0, 'nullPopFq': 0}}, 'location': None}, {'uri': 'http://en.wikipedia.org/wiki/Information_privacy', 'type': 'wiki', 'score': 2, 'label': {'eng': 'Information privacy'}, 'synonyms': {'eng': ['Data privacy']}, 'trendingScore': {'news': {'score': 0, 'testPopFq': 0, 'nullPopFq': 0}}}, {'uri': 'http://en.wikipedia.org/wiki/Western_world', 'type': 'loc', 'score': 2, 'label': {'eng': 'Western world'}, 'synonyms': {'eng': ['The West', 'Occident']}, 'trendingScore': {'news': {'score': 0, 'testPopFq': 0, 'nullPopFq': 0}}, 'location': None}, {'uri': 'http://en.wikipedia.org/wiki/European_Commission', 'type': 'org', 'score': 2, 'label': {'eng': 'European Commission'}, 'synonyms': {'eng': ['EC']}, 'trendingScore': {'news': {'score': 0, 'testPopFq': 0, 'nullPopFq': 0}}}, {'uri': 'http://en.wikipedia.org/wiki/Africa', 'type': 'loc', 'score': 2, 'label': {'eng': 'Africa'}, 'synonyms': {'eng': ['African continent']}, 'trendingScore': {'news': {'score': 0, 'testPopFq': 0, 'nullPopFq': 0}}, 'location': None}, {'uri': 'http://en.wikipedia.org/wiki/Russia', 'type': 'loc', 'score': 2, 'label': {'eng': 'Russia'}, 'synonyms': {'_ANY_': ['Russian Federation'], 'eng': ['Rossiya', 'RU', 'Ru', 'Russian Federation', 'Rus']}, 'trendingScore': {'news': {'score': 0, 'testPopFq': 0, 'nullPopFq': 0}}, 'location': {'type': 'country', 'geoNamesId': '2017370', 'wikiUri': 'http://en.wikipedia.org/wiki/Russia', 'label': {'eng': 'Russia'}, 'population': 140702000, 'lat': 60, 'long': 100, 'area': 17100000, 'code2': 'RU', 'code3': 'RUS', 'webExt': '.ru', 'currencyCode': 'RUB', 'currencyName': 'Ruble', 'continent': 'Europe'}}, {'uri': 'http://en.wikipedia.org/wiki/Iran', 'type': 'loc', 'score': 2, 'label': {'eng': 'Iran'}, 'synonyms': {'eng': ['Islamic Republic of Iran', 'Persia', 'Ir']}, 'trendingScore': {'news': {'score': 0, 'testPopFq': 0, 'nullPopFq': 0}}, 'location': {'type': 'country', 'geoNamesId': '130758', 'wikiUri': 'http://en.wikipedia.org/wiki/Iran', 'label': {'eng': 'Iran'}, 'population': 76923300, 'lat': 32, 'long': 53, 'area': 1648000, 'code2': 'IR', 'code3': 'IRN', 'webExt': '.ir', 'currencyCode': 'IRR', 'currencyName': 'Rial', 'continent': 'Asia'}}, {'uri': 'http://en.wikipedia.org/wiki/Hong_Kong', 'type': 'loc', 'score': 2, 'label': {'eng': 'Hong Kong'}, 'synonyms': {'eng': ['HKSAR', 'HKG', 'HK', 'Hong Kong SAR', 'Hong Kong, China', 'Hk', 'Hong Kong SAR, China', 'Hong Kong Special Administrative Region']}, 'trendingScore': {'news': {'score': 0, 'testPopFq': 0, 'nullPopFq': 0}}, 'location': {'type': 'country', 'geoNamesId': '1819730', 'wikiUri': 'http://en.wikipedia.org/wiki/Hong_Kong', 'label': {'eng': 'Hong Kong'}, 'population': 6898686, 'lat': 22.25, 'long': 114.16667, 'area': 1092, 'code2': 'HK', 'code3': 'HKG', 'webExt': '.hk', 'currencyCode': 'HKD', 'currencyName': 'Dollar', 'continent': 'Asia'}}, {'uri': 'http://en.wikipedia.org/wiki/Margrethe_Vestager', 'type': 'person', 'score': 1, 'label': {'eng': 'Margrethe Vestager'}, 'synonyms': {}, 'trendingScore': {'news': {'score': 0, 'testPopFq': 0, 'nullPopFq': 0}}}, {'uri': 'http://en.wikipedia.org/wiki/General_Data_Protection_Regulation', 'type': 'wiki', 'score': 1, 'label': {'eng': 'General Data Protection Regulation'}, 'synonyms': {'eng': ['GDPR']}, 'trendingScore': {'news': {'score': 0, 'testPopFq': 0, 'nullPopFq': 0}}}, {'uri': 'http://en.wikipedia.org/wiki/UBS', 'type': 'org', 'score': 1, 'label': {'eng': 'UBS'}, 'synonyms': {'eng': ['UBS AG'], '_ANY_': ['CH0244767585', 'CH0402227554']}, 'trendingScore': {'news': {'score': 0, 'testPopFq': 0, 'nullPopFq': 0}}}, {'uri': 'http://en.wikipedia.org/wiki/Debate', 'type': 'wiki', 'score': 1, 'label': {'eng': 'Debate'}, 'synonyms': {}, 'trendingScore': {'news': {'score': 0, 'testPopFq': 0, 'nullPopFq': 0}}}, {'uri': 'http://en.wikipedia.org/wiki/Open_letter', 'type': 'wiki', 'score': 1, 'label': {'eng': 'Open letter'}, 'synonyms': {}, 'trendingScore': {'news': {'score': 0, 'testPopFq': 0, 'nullPopFq': 0}}}, {'uri': 'http://en.wikipedia.org/wiki/Transparency_(behavior)', 'type': 'wiki', 'score': 1, 'label': {'eng': 'Transparency (behavior)'}, 'synonyms': {}, 'trendingScore': {'news': {'score': 0, 'testPopFq': 0, 'nullPopFq': 0}}}, {'uri': 'http://en.wikipedia.org/wiki/National_security', 'type': 'wiki', 'score': 1, 'label': {'eng': 'National security'}, 'synonyms': {}, 'trendingScore': {'news': {'score': 0, 'testPopFq': 0, 'nullPopFq': 0}}}, {'uri': 'http://en.wikipedia.org/wiki/Vice_president', 'type': 'wiki', 'score': 1, 'label': {'eng': 'Vice president'}, 'synonyms': {'eng': ['Vice-president', 'Director']}, 'trendingScore': {'news': {'score': 0, 'testPopFq': 0, 'nullPopFq': 0}}}, {'uri': 'http://en.wikipedia.org/wiki/Elon_Musk', 'type': 'wiki', 'score': 1, 'label': {'eng': 'Elon Musk'}, 'synonyms': {'eng': ['Elon Reeve Musk']}, 'trendingScore': {'news': {'score': 0, 'testPopFq': 0, 'nullPopFq': 0}}}, {'uri': 'http://en.wikipedia.org/wiki/Twitter', 'type': 'org', 'score': 1, 'label': {'eng': 'Twitter'}, 'synonyms': {'_ANY_': ['TWTR', 'TWTR34.SA'], 'eng': ['Twttr', 'Twitter.com']}, 'trendingScore': {'news': {'score': 0, 'testPopFq': 0, 'nullPopFq': 0}}}, {'uri': 'http://en.wikipedia.org/wiki/Umeå', 'type': 'loc', 'score': 1, 'label': {'eng': 'Umeå'}, 'synonyms': {'eng': ['Ume', 'Umea']}, 'trendingScore': {'news': {'score': 0, 'testPopFq': 0, 'nullPopFq': 0}}, 'location': {'type': 'place', 'geoNamesId': '602150', 'wikiUri': 'http://en.wikipedia.org/wiki/Umeå', 'label': {'eng': 'Umeå'}, 'population': 74005, 'lat': 63.82842, 'long': 20.25972, 'featureCode': 'P.PPLA', 'country': {'type': 'country', 'geoNamesId': '2661886', 'wikiUri': 'http://en.wikipedia.org/wiki/Sweden', 'label': {'eng': 'Sweden'}, 'population': 9828655, 'lat': 62, 'long': 15, 'area': 449964, 'code2': 'SE', 'code3': 'SWE', 'webExt': '.se', 'currencyCode': 'SEK', 'currencyName': 'Krona', 'continent': 'Europe'}}}, {'uri': 'http://en.wikipedia.org/wiki/Sweden', 'type': 'loc', 'score': 1, 'label': {'eng': 'Sweden'}, 'synonyms': {'eng': ['Kingdom of Sweden', 'SE', 'Se']}, 'trendingScore': {'news': {'score': 0, 'testPopFq': 0, 'nullPopFq': 0}}, 'location': {'type': 'country', 'geoNamesId': '2661886', 'wikiUri': 'http://en.wikipedia.org/wiki/Sweden', 'label': {'eng': 'Sweden'}, 'population': 9828655, 'lat': 62, 'long': 15, 'area': 449964, 'code2': 'SE', 'code3': 'SWE', 'webExt': '.se', 'currencyCode': 'SEK', 'currencyName': 'Krona', 'continent': 'Europe'}}]","[{'uri': 'dmoz/Society/Issues', 'label': 'dmoz/Society/Issues', 'wgt': 100}, {'uri': 'news/Technology', 'label': 'news/Technology', 'wgt': 74}, {'uri': 'dmoz/Society/Work', 'label': 'dmoz/Society/Work', 'wgt': 100}, {'uri': 'dmoz/Society/Issues/Business', 'label': 'dmoz/Society/Issues/Business', 'wgt': 100}, {'uri': 'dmoz/Society/Issues/Intellectual_Property', 'label': 'dmoz/Society/Issues/Intellectual Property', 'wgt': 100}, {'uri': 'dmoz/Society/Issues/Fraud', 'label': 'dmoz/Society/Issues/Fraud', 'wgt': 100}]",[],[],https://i.tribune.com.pk/media/images/chatgpt-(1)1674717934-0/chatgpt-(1)1674717934-0.jpg,eng-8519047,,-0.0666666666666666,Russia,tribune.com.pk,2023-04,Pakistan,PK,,,,,C20,C5,Asia,AS,Muslim,136.0,worst,average,worst,worst,average,average,worst,worst,worst,worst,worst,worst,high,low,low,high,low,low,,,,,,,,,"[{'uri': 'http://en.wikipedia.org/wiki/ChatGPT', 'type': 'wiki', 'score': 5, 'label': {'eng': 'ChatGPT'}, 'synonyms': {}, 'trendingScore': {'news': {'score': 0, 'testPopFq': 0, 'nullPopFq': 0}}}, {'uri': 'http://en.wikipedia.org/wiki/OpenAI', 'type': 'wiki', 'score': 5, 'label': {'eng': 'OpenAI'}, 'synonyms': {}, 'trendingScore': {'news': {'score': 0, 'testPopFq': 0, 'nullPopFq': 0}}}, {'uri': 'http://en.wikipedia.org/wiki/Chatbot', 'type': 'wiki', 'score': 5, 'label': {'eng': 'Chatbot'}, 'synonyms': {'eng': ['Chat bot', 'Bot']}, 'trendingScore': {'news': {'score': 0, 'testPopFq': 0, 'nullPopFq': 0}}}, {'uri': 'http://en.wikipedia.org/wiki/Artificial_intelligence', 'type': 'wiki', 'score': 5, 'label': {'eng': 'Artificial intelligence'}, 'synonyms': {'eng': ['AI', 'MI', 'Machine intelligence']}, 'trendingScore': {'news': {'score': 0, 'testPopFq': 0, 'nullPopFq': 0}}}, {'uri': 'http://en.wikipedia.org/wiki/Personal_data', 'type': 'wiki', 'score': 5, 'label': {'eng': 'Personal data'}, 'synonyms': {}, 'trendingScore': {'news': {'score': 0, 'testPopFq': 0, 'nullPopFq': 0}}}, {'uri': 'http://en.wikipedia.org/wiki/Italy', 'type': 'loc', 'score': 5, 'label': {'eng': 'Italy'}, 'synonyms': {'eng': ['Italia', 'Italian Republic', 'IT', 'It']}, 'trendingScore': {'news': {'score': 0, 'testPopFq': 0, 'nullPopFq': 0}}, 'location': {'type': 'country', 'geoNamesId': '3175395', 'wikiUri': 'http://en.wikipedia.org/wiki/Italy', 'label': {'eng': 'Italy'}, 'population': 60340328, 'lat': 42.83333, 'long': 12.83333, 'area': 301230, 'code2': 'IT', 'code3': 'ITA', 'webExt': '.it', 'currencyCode': 'EUR', 'currencyName': 'Euro', 'continent': 'Europe'}}, {'uri': 'http://en.wikipedia.org/wiki/Privacy', 'type': 'wiki', 'score': 3, 'label': {'eng': 'Privacy'}, 'synonyms': {}, 'trendingScore': {'news': {'score': 0, 'testPopFq': 0, 'nullPopFq': 0}}}, {'uri': 'http://en.wikipedia.org/wiki/Euro', 'type': 'wiki', 'score': 3, 'label': {'eng': 'Euro'}, 'synonyms': {'eng': ['€', 'EUR']}, 'trendingScore': {'news': {'score': 0, 'testPopFq': 0, 'nullPopFq': 0}}}, {'uri': 'http://en.wikipedia.org/wiki/European_Union', 'type': 'loc', 'score': 3, 'label': {'eng': 'European Union'}, 'synonyms': {'eng': ['EU', 'E.U.', 'Eu']}, 'trendingScore': {'news': {'score': 0, 'testPopFq': 0, 'nullPopFq': 0}}, 'location': None}, {'uri': 'http://en.wikipedia.org/wiki/Mainland_China', 'type': 'loc', 'score': 2, 'label': {'eng': 'Mainland China'}, 'synonyms': {'eng': ['Chinese mainland', 'Mainland']}, 'trendingScore': {'news': {'score': 0, 'testPopFq': 0, 'nullPopFq': 0}}, 'location': None}, {'uri': 'http://en.wikipedia.org/wiki/Information_privacy', 'type': 'wiki', 'score': 2, 'label': {'eng': 'Information privacy'}, 'synonyms': {'eng': ['Data privacy']}, 'trendingScore': {'news': {'score': 0, 'testPopFq': 0, 'nullPopFq': 0}}}, {'uri': 'http://en.wikipedia.org/wiki/Western_world', 'type': 'loc', 'score': 2, 'label': {'eng': 'Western world'}, 'synonyms': {'eng': ['The West', 'Occident']}, 'trendingScore': {'news': {'score': 0, 'testPopFq': 0, 'nullPopFq': 0}}, 'location': None}, {'uri': 'http://en.wikipedia.org/wiki/European_Commission', 'type': 'org', 'score': 2, 'label': {'eng': 'European Commission'}, 'synonyms': {'eng': ['EC']}, 'trendingScore': {'news': {'score': 0, 'testPopFq': 0, 'nullPopFq': 0}}}, {'uri': 'http://en.wikipedia.org/wiki/Africa', 'type': 'loc', 'score': 2, 'label': {'eng': 'Africa'}, 'synonyms': {'eng': ['African continent']}, 'trendingScore': {'news': {'score': 0, 'testPopFq': 0, 'nullPopFq': 0}}, 'location': None}, {'uri': 'http://en.wikipedia.org/wiki/Russia', 'type': 'loc', 'score': 2, 'label': {'eng': 'Russia'}, 'synonyms': {'_ANY_': ['Russian Federation'], 'eng': ['Rossiya', 'RU', 'Ru', 'Russian Federation', 'Rus']}, 'trendingScore': {'news': {'score': 0, 'testPopFq': 0, 'nullPopFq': 0}}, 'location': {'type': 'country', 'geoNamesId': '2017370', 'wikiUri': 'http://en.wikipedia.org/wiki/Russia', 'label': {'eng': 'Russia'}, 'population': 140702000, 'lat': 60, 'long': 100, 'area': 17100000, 'code2': 'RU', 'code3': 'RUS', 'webExt': '.ru', 'currencyCode': 'RUB', 'currencyName': 'Ruble', 'continent': 'Europe'}}, {'uri': 'http://en.wikipedia.org/wiki/Iran', 'type': 'loc', 'score': 2, 'label': {'eng': 'Iran'}, 'synonyms': {'eng': ['Islamic Republic of Iran', 'Persia', 'Ir']}, 'trendingScore': {'news': {'score': 0, 'testPopFq': 0, 'nullPopFq': 0}}, 'location': {'type': 'country', 'geoNamesId': '130758', 'wikiUri': 'http://en.wikipedia.org/wiki/Iran', 'label': {'eng': 'Iran'}, 'population': 76923300, 'lat': 32, 'long': 53, 'area': 1648000, 'code2': 'IR', 'code3': 'IRN', 'webExt': '.ir', 'currencyCode': 'IRR', 'currencyName': 'Rial', 'continent': 'Asia'}}, {'uri': 'http://en.wikipedia.org/wiki/Hong_Kong', 'type': 'loc', 'score': 2, 'label': {'eng': 'Hong Kong'}, 'synonyms': {'eng': ['HKSAR', 'HKG', 'HK', 'Hong Kong SAR', 'Hong Kong, China', 'Hk', 'Hong Kong SAR, China', 'Hong Kong Special Administrative Region']}, 'trendingScore': {'news': {'score': 0, 'testPopFq': 0, 'nullPopFq': 0}}, 'location': {'type': 'country', 'geoNamesId': '1819730', 'wikiUri': 'http://en.wikipedia.org/wiki/Hong_Kong', 'label': {'eng': 'Hong Kong'}, 'population': 6898686, 'lat': 22.25, 'long': 114.16667, 'area': 1092, 'code2': 'HK', 'code3': 'HKG', 'webExt': '.hk', 'currencyCode': 'HKD', 'currencyName': 'Dollar', 'continent': 'Asia'}}, {'uri': 'http://en.wikipedia.org/wiki/Margrethe_Vestager', 'type': 'person', 'score': 1, 'label': {'eng': 'Margrethe Vestager'}, 'synonyms': {}, 'trendingScore': {'news': {'score': 0, 'testPopFq': 0, 'nullPopFq': 0}}}, {'uri': 'http://en.wikipedia.org/wiki/General_Data_Protection_Regulation', 'type': 'wiki', 'score': 1, 'label': {'eng': 'General Data Protection Regulation'}, 'synonyms': {'eng': ['GDPR']}, 'trendingScore': {'news': {'score': 0, 'testPopFq': 0, 'nullPopFq': 0}}}, {'uri': 'http://en.wikipedia.org/wiki/UBS', 'type': 'org', 'score': 1, 'label': {'eng': 'UBS'}, 'synonyms': {'eng': ['UBS AG'], '_ANY_': ['CH0244767585', 'CH0402227554']}, 'trendingScore': {'news': {'score': 0, 'testPopFq': 0, 'nullPopFq': 0}}}, {'uri': 'http://en.wikipedia.org/wiki/Debate', 'type': 'wiki', 'score': 1, 'label': {'eng': 'Debate'}, 'synonyms': {}, 'trendingScore': {'news': {'score': 0, 'testPopFq': 0, 'nullPopFq': 0}}}, {'uri': 'http://en.wikipedia.org/wiki/Open_letter', 'type': 'wiki', 'score': 1, 'label': {'eng': 'Open letter'}, 'synonyms': {}, 'trendingScore': {'news': {'score': 0, 'testPopFq': 0, 'nullPopFq': 0}}}, {'uri': 'http://en.wikipedia.org/wiki/Transparency_(behavior)', 'type': 'wiki', 'score': 1, 'label': {'eng': 'Transparency (behavior)'}, 'synonyms': {}, 'trendingScore': {'news': {'score': 0, 'testPopFq': 0, 'nullPopFq': 0}}}, {'uri': 'http://en.wikipedia.org/wiki/National_security', 'type': 'wiki', 'score': 1, 'label': {'eng': 'National security'}, 'synonyms': {}, 'trendingScore': {'news': {'score': 0, 'testPopFq': 0, 'nullPopFq': 0}}}, {'uri': 'http://en.wikipedia.org/wiki/Vice_president', 'type': 'wiki', 'score': 1, 'label': {'eng': 'Vice president'}, 'synonyms': {'eng': ['Vice-president', 'Director']}, 'trendingScore': {'news': {'score': 0, 'testPopFq': 0, 'nullPopFq': 0}}}, {'uri': 'http://en.wikipedia.org/wiki/Elon_Musk', 'type': 'wiki', 'score': 1, 'label': {'eng': 'Elon Musk'}, 'synonyms': {'eng': ['Elon Reeve Musk']}, 'trendingScore': {'news': {'score': 0, 'testPopFq': 0, 'nullPopFq': 0}}}, {'uri': 'http://en.wikipedia.org/wiki/Twitter', 'type': 'org', 'score': 1, 'label': {'eng': 'Twitter'}, 'synonyms': {'_ANY_': ['TWTR', 'TWTR34.SA'], 'eng': ['Twttr', 'Twitter.com']}, 'trendingScore': {'news': {'score': 0, 'testPopFq': 0, 'nullPopFq': 0}}}, {'uri': 'http://en.wikipedia.org/wiki/Umeå', 'type': 'loc', 'score': 1, 'label': {'eng': 'Umeå'}, 'synonyms': {'eng': ['Ume', 'Umea']}, 'trendingScore': {'news': {'score': 0, 'testPopFq': 0, 'nullPopFq': 0}}, 'location': {'type': 'place', 'geoNamesId': '602150', 'wikiUri': 'http://en.wikipedia.org/wiki/Umeå', 'label': {'eng': 'Umeå'}, 'population': 74005, 'lat': 63.82842, 'long': 20.25972, 'featureCode': 'P.PPLA', 'country': {'type': 'country', 'geoNamesId': '2661886', 'wikiUri': 'http://en.wikipedia.org/wiki/Sweden', 'label': {'eng': 'Sweden'}, 'population': 9828655, 'lat': 62, 'long': 15, 'area': 449964, 'code2': 'SE', 'code3': 'SWE', 'webExt': '.se', 'currencyCode': 'SEK', 'currencyName': 'Krona', 'continent': 'Europe'}}}, {'uri': 'http://en.wikipedia.org/wiki/Sweden', 'type': 'loc', 'score': 1, 'label': {'eng': 'Sweden'}, 'synonyms': {'eng': ['Kingdom of Sweden', 'SE', 'Se']}, 'trendingScore': {'news': {'score': 0, 'testPopFq': 0, 'nullPopFq': 0}}, 'location': {'type': 'country', 'geoNamesId': '2661886', 'wikiUri': 'http://en.wikipedia.org/wiki/Sweden', 'label': {'eng': 'Sweden'}, 'population': 9828655, 'lat': 62, 'long': 15, 'area': 449964, 'code2': 'SE', 'code3': 'SWE', 'webExt': '.se', 'currencyCode': 'SEK', 'currencyName': 'Krona', 'continent': 'Europe'}}]",ChatGPT OpenAI Chatbot Artificial_intelligence Personal_data Italy Italy Privacy Euro European_Union Mainland_China Information_privacy Western_world European_Commission Africa Russia Russia Iran Iran Hong_Kong Hong_Kong Margrethe_Vestager General_Data_Protection_Regulation UBS Debate Open_letter Transparency_(behavior) National_security Vice_president Elon_Musk Twitter Umeå Umeå Sweden Sweden Sweden,2023,4,1,2023-04-01,27,8,2023-04-01
