,uri,lang,dateTime,sim,url,title,body,source,concepts,categories,links,videos,image,eventUri,location,sentiment,keyword,source.uri,year_month,con_name,country,lang-name,language,Political_Alignment,wiki-url,Cultural_Class,Economic_Class,Continent-name,Continent,Religions,2019Rank-From,SafetyandSecurity,PersonalFreedom,Governance,SocialCapital,InvestmentEnvironment,EnterpriseConditions,MarketAccessandInfrastructure,EconomicQuality,LivingConditions,Health,Education,NaturalEnvironment,PowerDistance,Individualism,Masculinity,UncertaintyAvoidance,LongTermOrientation,Indulgence,economicblocs-name,economicblocs,militarydefenseblocs-name,militarydefenseblocs,politicalregionalblocs-name,politicalregionalblocs,linguisticblocs-name,linguisticblocs,concepts_str,all_concepts,year,month,day,date,min,hour,MD
1513,7504661407,eng,2023-04-19 10:48:00+00:00,0.0,https://thefrontierpost.com/eu-seeks-cyber-shield-to-ward-off-online-attacks/,EU seeks 'cyber shield' to ward off online attacks,"BRUSSELS (AFP): The European Union on Tuesday unveiled a 1.1-billion-euro ($1.2 billion) plan to help stave off cross-border hacking attacks as the threat from Russia grows.

Europe is looking to shore up its online defences as Moscow's war on Ukraine has raised fears that Russian hackers could target critical infrastructure.

The European Commission, the EU's executive arm, said the ""Cyber Shield"" plan would look to link up capabilities at designated ""Security Operations Centres"" across member states.

It said the first centres could be operational by 2024 and would use artificial intelligence and advanced data analytics to track threats.

The aim of plan -- which still has to be negotiated with EU states -- is to help deal with a large-scale attack targeting multiple countries.

But EU states have been sceptical about handing too much power to Brussels to tackle emerging threats in sensitive areas of their national infrastructure.

""Sometimes there was a reluctance between member states to share,"" said European competition commissioner Margrethe Vestager.

""But the thing is, I think it has become increasingly clear that no one can solve this alone.""

The initiative also foresees setting up a ""cybersecurity reserve"" of private providers that would be able to intervene to help a country targeted by a major attack.

The threat from Russia was demonstrated at the start of its invasion on Ukraine when the West says Moscow carried out a cyberattack against a US satellite network.

Washington said the attack against satellite operator Viasat was designed to disrupt Ukrainian command and control just as the Kremlin was sending in its tanks.

European providers said the incident also threw thousands of internet users offline in France, Germany, Greece, Hungary, Italy and Poland.","{'uri': 'thefrontierpost.com', 'dataType': 'news', 'title': 'The Frontier Post', 'description': 'Welcome to The Frontier Post an English newspaper focusing on News from Pakistan and Afghanistan, Global plus Business, Fashion, and Sports News!', 'location': {'type': 'place', 'geoNamesId': '1168197', 'wikiUri': 'http://en.wikipedia.org/wiki/Peshawar', 'label': {'eng': 'Peshawar'}, 'population': 1218773, 'lat': 34.008, 'long': 71.57849, 'featureCode': 'P.PPLA', 'country': {'type': 'country', 'geoNamesId': '1168579', 'wikiUri': 'http://en.wikipedia.org/wiki/Pakistan', 'label': {'eng': 'Pakistan'}, 'population': 184404791, 'lat': 30, 'long': 70, 'area': 803940, 'code2': 'PK', 'code3': 'PAK', 'webExt': '.pk', 'currencyCode': 'PKR', 'currencyName': 'Rupee', 'continent': 'Asia'}}, 'locationValidated': True, 'image': None, 'thumbImage': None, 'favicon': None, 'ranking': {'importanceRank': 540301, 'alexaGlobalRank': 477071, 'alexaCountryRank': 198841}, 'socialMedia': {'twitter': 'TheFrontierPost', 'facebook': 'thefrontierpost'}}","[{'uri': 'http://en.wikipedia.org/wiki/Member_state_of_the_European_Union', 'type': 'wiki', 'score': 5, 'label': {'eng': 'Member state of the European Union'}, 'synonyms': {'eng': ['European Union member state']}, 'trendingScore': {'news': {'score': 0, 'testPopFq': 0, 'nullPopFq': 0}}}, {'uri': 'http://en.wikipedia.org/wiki/Russia', 'type': 'loc', 'score': 5, 'label': {'eng': 'Russia'}, 'synonyms': {'_ANY_': ['Russian Federation'], 'eng': ['Rossiya', 'RU', 'Ru', 'Russian Federation', 'Rus']}, 'trendingScore': {'news': {'score': 0, 'testPopFq': 0, 'nullPopFq': 0}}, 'location': {'type': 'country', 'geoNamesId': '2017370', 'wikiUri': 'http://en.wikipedia.org/wiki/Russia', 'label': {'eng': 'Russia'}, 'population': 140702000, 'lat': 60, 'long': 100, 'area': 17100000, 'code2': 'RU', 'code3': 'RUS', 'webExt': '.ru', 'currencyCode': 'RUB', 'currencyName': 'Ruble', 'continent': 'Europe'}}, {'uri': 'http://en.wikipedia.org/wiki/Brussels', 'type': 'loc', 'score': 4, 'label': {'eng': 'Brussels'}, 'synonyms': {'eng': ['Brussels Region', 'Brussels Capital Region']}, 'trendingScore': {'news': {'score': 0, 'testPopFq': 0, 'nullPopFq': 0}}, 'location': {'type': 'place', 'geoNamesId': '2800866', 'wikiUri': 'http://en.wikipedia.org/wiki/Brussels', 'label': {'eng': 'Brussels'}, 'population': 1019022, 'lat': 50.85045, 'long': 4.34878, 'featureCode': 'P.PPLC', 'country': {'type': 'country', 'geoNamesId': '2802361', 'wikiUri': 'http://en.wikipedia.org/wiki/Belgium', 'label': {'eng': 'Belgium'}, 'population': 10403000, 'lat': 50.75, 'long': 4.5, 'area': 30510, 'code2': 'BE', 'code3': 'BEL', 'webExt': '.be', 'currencyCode': 'EUR', 'currencyName': 'Euro', 'continent': 'Europe'}}}, {'uri': 'http://en.wikipedia.org/wiki/European_Commission', 'type': 'org', 'score': 3, 'label': {'eng': 'European Commission'}, 'synonyms': {'eng': ['EC']}, 'trendingScore': {'news': {'score': 0, 'testPopFq': 0, 'nullPopFq': 0}}}, {'uri': 'http://en.wikipedia.org/wiki/Europe', 'type': 'loc', 'score': 3, 'label': {'eng': 'Europe'}, 'synonyms': {'eng': ['Europea']}, 'trendingScore': {'news': {'score': 0, 'testPopFq': 0, 'nullPopFq': 0}}, 'location': None}, {'uri': 'http://en.wikipedia.org/wiki/European_Union', 'type': 'loc', 'score': 3, 'label': {'eng': 'European Union'}, 'synonyms': {'eng': ['EU', 'E.U.', 'Eu']}, 'trendingScore': {'news': {'score': 0, 'testPopFq': 0, 'nullPopFq': 0}}, 'location': None}, {'uri': 'http://en.wikipedia.org/wiki/Moscow', 'type': 'loc', 'score': 3, 'label': {'eng': 'Moscow'}, 'synonyms': {'eng': ['Moskva', 'Москва', 'Moscow, Russia', 'City of Moscow', 'Moscow, Soviet Union']}, 'trendingScore': {'news': {'score': 0, 'testPopFq': 0, 'nullPopFq': 0}}, 'location': {'type': 'place', 'geoNamesId': '524894', 'wikiUri': 'http://en.wikipedia.org/wiki/Moscow', 'label': {'eng': 'Moscow'}, 'population': 11503501, 'lat': 55.76167, 'long': 37.60667, 'featureCode': 'A.ADM1', 'country': {'type': 'country', 'geoNamesId': '2017370', 'wikiUri': 'http://en.wikipedia.org/wiki/Russia', 'label': {'eng': 'Russia'}, 'population': 140702000, 'lat': 60, 'long': 100, 'area': 17100000, 'code2': 'RU', 'code3': 'RUS', 'webExt': '.ru', 'currencyCode': 'RUB', 'currencyName': 'Ruble', 'continent': 'Europe'}}}, {'uri': 'http://en.wikipedia.org/wiki/Ukraine', 'type': 'loc', 'score': 3, 'label': {'eng': 'Ukraine'}, 'synonyms': {'eng': ['UA', 'UKR', 'Ua', 'Ukrainia']}, 'trendingScore': {'news': {'score': 0, 'testPopFq': 0, 'nullPopFq': 0}}, 'location': {'type': 'country', 'geoNamesId': '690791', 'wikiUri': 'http://en.wikipedia.org/wiki/Ukraine', 'label': {'eng': 'Ukraine'}, 'population': 45415596, 'lat': 49, 'long': 32, 'area': 603700, 'code2': 'UA', 'code3': 'UKR', 'webExt': '.ua', 'currencyCode': 'UAH', 'currencyName': 'Hryvnia', 'continent': 'Europe'}}, {'uri': 'http://en.wikipedia.org/wiki/Artificial_intelligence', 'type': 'wiki', 'score': 2, 'label': {'eng': 'Artificial intelligence'}, 'synonyms': {'eng': ['AI', 'MI', 'Machine intelligence']}, 'trendingScore': {'news': {'score': 0, 'testPopFq': 0, 'nullPopFq': 0}}}, {'uri': 'http://en.wikipedia.org/wiki/Margrethe_Vestager', 'type': 'person', 'score': 1, 'label': {'eng': 'Margrethe Vestager'}, 'synonyms': {}, 'trendingScore': {'news': {'score': 0, 'testPopFq': 0, 'nullPopFq': 0}}}, {'uri': 'http://en.wikipedia.org/wiki/Command_and_control', 'type': 'wiki', 'score': 1, 'label': {'eng': 'Command and control'}, 'synonyms': {'eng': ['C2']}, 'trendingScore': {'news': {'score': 0, 'testPopFq': 0, 'nullPopFq': 0}}}, {'uri': 'http://en.wikipedia.org/wiki/Cyberattack', 'type': 'wiki', 'score': 1, 'label': {'eng': 'Cyberattack'}, 'synonyms': {'eng': ['Cyber-attack', 'Cyber attack']}, 'trendingScore': {'news': {'score': 0, 'testPopFq': 0, 'nullPopFq': 0}}}, {'uri': 'http://en.wikipedia.org/wiki/Computer_security', 'type': 'wiki', 'score': 1, 'label': {'eng': 'Computer security'}, 'synonyms': {'eng': ['IT security', 'Cybersecurity', 'Cyber security']}, 'trendingScore': {'news': {'score': 0, 'testPopFq': 0, 'nullPopFq': 0}}}, {'uri': 'http://en.wikipedia.org/wiki/Satellite', 'type': 'wiki', 'score': 1, 'label': {'eng': 'Satellite'}, 'synonyms': {'eng': ['Space satellite']}, 'trendingScore': {'news': {'score': 0, 'testPopFq': 0, 'nullPopFq': 0}}}, {'uri': 'http://en.wikipedia.org/wiki/Internet', 'type': 'wiki', 'score': 1, 'label': {'eng': 'Internet'}, 'synonyms': {'eng': ['The Internet', 'Net', 'The Net', 'Interweb']}, 'trendingScore': {'news': {'score': 0, 'testPopFq': 0, 'nullPopFq': 0}}}, {'uri': 'http://en.wikipedia.org/wiki/Agence_France-Presse', 'type': 'org', 'score': 1, 'label': {'eng': 'Agence France-Presse'}, 'synonyms': {'eng': ['AFP']}, 'trendingScore': {'news': {'score': 0, 'testPopFq': 0, 'nullPopFq': 0}}}, {'uri': 'http://en.wikipedia.org/wiki/Moscow_Kremlin', 'type': 'loc', 'score': 1, 'label': {'eng': 'Moscow Kremlin'}, 'synonyms': {'eng': ['Kremlin']}, 'trendingScore': {'news': {'score': 0, 'testPopFq': 0, 'nullPopFq': 0}}, 'location': None}, {'uri': 'http://en.wikipedia.org/wiki/UEFA', 'type': 'org', 'score': 1, 'label': {'eng': 'UEFA'}, 'synonyms': {}, 'trendingScore': {'news': {'score': 0, 'testPopFq': 0, 'nullPopFq': 0}}}, {'uri': 'http://en.wikipedia.org/wiki/Washington,_D.C.', 'type': 'loc', 'score': 1, 'label': {'eng': 'Washington, D.C.'}, 'synonyms': {'eng': ['Washington', 'Washington DC', 'Washington, DC', 'DC', 'D.C.', 'District of Columbia', 'Washington, District of Columbia', 'Washington D.C.']}, 'trendingScore': {'news': {'score': 0, 'testPopFq': 0, 'nullPopFq': 0}}, 'location': {'type': 'place', 'geoNamesId': '4138106', 'wikiUri': 'http://en.wikipedia.org/wiki/Washington,_D.C.', 'label': {'eng': 'Washington, D.C.'}, 'population': 552433, 'lat': 38.91706, 'long': -77.00025, 'featureCode': 'A.ADM1', 'country': {'type': 'country', 'geoNamesId': '6252001', 'wikiUri': 'http://en.wikipedia.org/wiki/United_States', 'label': {'eng': 'United States'}, 'population': 310232863, 'lat': 39.76, 'long': -98.5, 'area': 9629091, 'code2': 'US', 'code3': 'USA', 'webExt': '.us', 'currencyCode': 'USD', 'currencyName': 'Dollar', 'continent': 'Noth America'}}}, {'uri': 'http://en.wikipedia.org/wiki/United_States', 'type': 'loc', 'score': 1, 'label': {'eng': 'United States'}, 'synonyms': {'eng': ['USA', 'U.S.A.', 'America', 'The States', 'U.S.', 'US', 'The US', 'The United States', 'The United States of America', '🇺🇸']}, 'trendingScore': {'news': {'score': 0, 'testPopFq': 0, 'nullPopFq': 0}}, 'location': {'type': 'country', 'geoNamesId': '6252001', 'wikiUri': 'http://en.wikipedia.org/wiki/United_States', 'label': {'eng': 'United States'}, 'population': 310232863, 'lat': 39.76, 'long': -98.5, 'area': 9629091, 'code2': 'US', 'code3': 'USA', 'webExt': '.us', 'currencyCode': 'USD', 'currencyName': 'Dollar', 'continent': 'Noth America'}}, {'uri': 'http://en.wikipedia.org/wiki/Poland', 'type': 'loc', 'score': 1, 'label': {'eng': 'Poland'}, 'synonyms': {'eng': ['POL', 'Republic of Poland', 'Pl', 'PL', 'Polska']}, 'trendingScore': {'news': {'score': 0, 'testPopFq': 0, 'nullPopFq': 0}}, 'location': {'type': 'country', 'geoNamesId': '798544', 'wikiUri': 'http://en.wikipedia.org/wiki/Poland', 'label': {'eng': 'Poland'}, 'population': 38500000, 'lat': 52, 'long': 20, 'area': 312685, 'code2': 'PL', 'code3': 'POL', 'webExt': '.pl', 'currencyCode': 'PLN', 'currencyName': 'Zloty', 'continent': 'Europe'}}, {'uri': 'http://en.wikipedia.org/wiki/Italy', 'type': 'loc', 'score': 1, 'label': {'eng': 'Italy'}, 'synonyms': {'eng': ['Italia', 'Italian Republic', 'IT', 'It']}, 'trendingScore': {'news': {'score': 0, 'testPopFq': 0, 'nullPopFq': 0}}, 'location': {'type': 'country', 'geoNamesId': '3175395', 'wikiUri': 'http://en.wikipedia.org/wiki/Italy', 'label': {'eng': 'Italy'}, 'population': 60340328, 'lat': 42.83333, 'long': 12.83333, 'area': 301230, 'code2': 'IT', 'code3': 'ITA', 'webExt': '.it', 'currencyCode': 'EUR', 'currencyName': 'Euro', 'continent': 'Europe'}}, {'uri': 'http://en.wikipedia.org/wiki/Hungary', 'type': 'loc', 'score': 1, 'label': {'eng': 'Hungary'}, 'synonyms': {'eng': ['Hu']}, 'trendingScore': {'news': {'score': 0, 'testPopFq': 0, 'nullPopFq': 0}}, 'location': {'type': 'country', 'geoNamesId': '719819', 'wikiUri': 'http://en.wikipedia.org/wiki/Hungary', 'label': {'eng': 'Hungary'}, 'population': 9982000, 'lat': 47, 'long': 20, 'area': 93030, 'code2': 'HU', 'code3': 'HUN', 'webExt': '.hu', 'currencyCode': 'HUF', 'currencyName': 'Forint', 'continent': 'Europe'}}, {'uri': 'http://en.wikipedia.org/wiki/Greece', 'type': 'loc', 'score': 1, 'label': {'eng': 'Greece'}, 'synonyms': {'eng': ['Hellenic Republic', 'Hellas', 'Gr']}, 'trendingScore': {'news': {'score': 0, 'testPopFq': 0, 'nullPopFq': 0}}, 'location': {'type': 'country', 'geoNamesId': '390903', 'wikiUri': 'http://en.wikipedia.org/wiki/Greece', 'label': {'eng': 'Greece'}, 'population': 11000000, 'lat': 39, 'long': 22, 'area': 131940, 'code2': 'GR', 'code3': 'GRC', 'webExt': '.gr', 'currencyCode': 'EUR', 'currencyName': 'Euro', 'continent': 'Europe'}}, {'uri': 'http://en.wikipedia.org/wiki/France', 'type': 'loc', 'score': 1, 'label': {'eng': 'France'}, 'synonyms': {'eng': ['Fr', 'FR', 'République française', 'La France', 'Republic of France', 'French Republic']}, 'trendingScore': {'news': {'score': 0, 'testPopFq': 0, 'nullPopFq': 0}}, 'location': {'type': 'country', 'geoNamesId': '3017382', 'wikiUri': 'http://en.wikipedia.org/wiki/France', 'label': {'eng': 'France'}, 'population': 64768389, 'lat': 46, 'long': 2, 'area': 547030, 'code2': 'FR', 'code3': 'FRA', 'webExt': '.fr', 'currencyCode': 'EUR', 'currencyName': 'Euro', 'continent': 'Europe'}}, {'uri': 'http://en.wikipedia.org/wiki/Germany', 'type': 'loc', 'score': 1, 'label': {'eng': 'Germany'}, 'synonyms': {'eng': ['FRG', 'BRD', 'Bundesrepublik Deutschland', 'Federal Republic of Germany', 'De']}, 'trendingScore': {'news': {'score': 0, 'testPopFq': 0, 'nullPopFq': 0}}, 'location': {'type': 'country', 'geoNamesId': '2921044', 'wikiUri': 'http://en.wikipedia.org/wiki/Germany', 'label': {'eng': 'Germany'}, 'population': 81802257, 'lat': 51.5, 'long': 10.5, 'area': 357021, 'code2': 'DE', 'code3': 'DEU', 'webExt': '.de', 'currencyCode': 'EUR', 'currencyName': 'Euro', 'continent': 'Europe'}}]","[{'uri': 'news/Technology', 'label': 'news/Technology', 'wgt': 78}, {'uri': 'dmoz/Society/Government/Multilateral', 'label': 'dmoz/Society/Government/Multilateral', 'wgt': 100}]",[],[],,,"{'type': 'place', 'geoNamesId': '2800866', 'wikiUri': 'http://en.wikipedia.org/wiki/Brussels', 'label': {'eng': 'Brussels'}, 'population': 1019022, 'lat': 50.85045, 'long': 4.34878, 'featureCode': 'P.PPLC', 'country': {'type': 'country', 'geoNamesId': '2802361', 'wikiUri': 'http://en.wikipedia.org/wiki/Belgium', 'label': {'eng': 'Belgium'}, 'population': 10403000, 'lat': 50.75, 'long': 4.5, 'area': 30510, 'code2': 'BE', 'code3': 'BEL', 'webExt': '.be', 'currencyCode': 'EUR', 'currencyName': 'Euro', 'continent': 'Europe'}}",-0.2156862745098039,Russia,thefrontierpost.com,2023-04,Pakistan,PK,,,,,C20,C5,Asia,AS,Muslim,136.0,worst,average,worst,worst,average,average,worst,worst,worst,worst,worst,worst,high,low,low,high,low,low,,,,,,,,,"[{'uri': 'http://en.wikipedia.org/wiki/Member_state_of_the_European_Union', 'type': 'wiki', 'score': 5, 'label': {'eng': 'Member state of the European Union'}, 'synonyms': {'eng': ['European Union member state']}, 'trendingScore': {'news': {'score': 0, 'testPopFq': 0, 'nullPopFq': 0}}}, {'uri': 'http://en.wikipedia.org/wiki/Russia', 'type': 'loc', 'score': 5, 'label': {'eng': 'Russia'}, 'synonyms': {'_ANY_': ['Russian Federation'], 'eng': ['Rossiya', 'RU', 'Ru', 'Russian Federation', 'Rus']}, 'trendingScore': {'news': {'score': 0, 'testPopFq': 0, 'nullPopFq': 0}}, 'location': {'type': 'country', 'geoNamesId': '2017370', 'wikiUri': 'http://en.wikipedia.org/wiki/Russia', 'label': {'eng': 'Russia'}, 'population': 140702000, 'lat': 60, 'long': 100, 'area': 17100000, 'code2': 'RU', 'code3': 'RUS', 'webExt': '.ru', 'currencyCode': 'RUB', 'currencyName': 'Ruble', 'continent': 'Europe'}}, {'uri': 'http://en.wikipedia.org/wiki/Brussels', 'type': 'loc', 'score': 4, 'label': {'eng': 'Brussels'}, 'synonyms': {'eng': ['Brussels Region', 'Brussels Capital Region']}, 'trendingScore': {'news': {'score': 0, 'testPopFq': 0, 'nullPopFq': 0}}, 'location': {'type': 'place', 'geoNamesId': '2800866', 'wikiUri': 'http://en.wikipedia.org/wiki/Brussels', 'label': {'eng': 'Brussels'}, 'population': 1019022, 'lat': 50.85045, 'long': 4.34878, 'featureCode': 'P.PPLC', 'country': {'type': 'country', 'geoNamesId': '2802361', 'wikiUri': 'http://en.wikipedia.org/wiki/Belgium', 'label': {'eng': 'Belgium'}, 'population': 10403000, 'lat': 50.75, 'long': 4.5, 'area': 30510, 'code2': 'BE', 'code3': 'BEL', 'webExt': '.be', 'currencyCode': 'EUR', 'currencyName': 'Euro', 'continent': 'Europe'}}}, {'uri': 'http://en.wikipedia.org/wiki/European_Commission', 'type': 'org', 'score': 3, 'label': {'eng': 'European Commission'}, 'synonyms': {'eng': ['EC']}, 'trendingScore': {'news': {'score': 0, 'testPopFq': 0, 'nullPopFq': 0}}}, {'uri': 'http://en.wikipedia.org/wiki/Europe', 'type': 'loc', 'score': 3, 'label': {'eng': 'Europe'}, 'synonyms': {'eng': ['Europea']}, 'trendingScore': {'news': {'score': 0, 'testPopFq': 0, 'nullPopFq': 0}}, 'location': None}, {'uri': 'http://en.wikipedia.org/wiki/European_Union', 'type': 'loc', 'score': 3, 'label': {'eng': 'European Union'}, 'synonyms': {'eng': ['EU', 'E.U.', 'Eu']}, 'trendingScore': {'news': {'score': 0, 'testPopFq': 0, 'nullPopFq': 0}}, 'location': None}, {'uri': 'http://en.wikipedia.org/wiki/Moscow', 'type': 'loc', 'score': 3, 'label': {'eng': 'Moscow'}, 'synonyms': {'eng': ['Moskva', 'Москва', 'Moscow, Russia', 'City of Moscow', 'Moscow, Soviet Union']}, 'trendingScore': {'news': {'score': 0, 'testPopFq': 0, 'nullPopFq': 0}}, 'location': {'type': 'place', 'geoNamesId': '524894', 'wikiUri': 'http://en.wikipedia.org/wiki/Moscow', 'label': {'eng': 'Moscow'}, 'population': 11503501, 'lat': 55.76167, 'long': 37.60667, 'featureCode': 'A.ADM1', 'country': {'type': 'country', 'geoNamesId': '2017370', 'wikiUri': 'http://en.wikipedia.org/wiki/Russia', 'label': {'eng': 'Russia'}, 'population': 140702000, 'lat': 60, 'long': 100, 'area': 17100000, 'code2': 'RU', 'code3': 'RUS', 'webExt': '.ru', 'currencyCode': 'RUB', 'currencyName': 'Ruble', 'continent': 'Europe'}}}, {'uri': 'http://en.wikipedia.org/wiki/Ukraine', 'type': 'loc', 'score': 3, 'label': {'eng': 'Ukraine'}, 'synonyms': {'eng': ['UA', 'UKR', 'Ua', 'Ukrainia']}, 'trendingScore': {'news': {'score': 0, 'testPopFq': 0, 'nullPopFq': 0}}, 'location': {'type': 'country', 'geoNamesId': '690791', 'wikiUri': 'http://en.wikipedia.org/wiki/Ukraine', 'label': {'eng': 'Ukraine'}, 'population': 45415596, 'lat': 49, 'long': 32, 'area': 603700, 'code2': 'UA', 'code3': 'UKR', 'webExt': '.ua', 'currencyCode': 'UAH', 'currencyName': 'Hryvnia', 'continent': 'Europe'}}, {'uri': 'http://en.wikipedia.org/wiki/Artificial_intelligence', 'type': 'wiki', 'score': 2, 'label': {'eng': 'Artificial intelligence'}, 'synonyms': {'eng': ['AI', 'MI', 'Machine intelligence']}, 'trendingScore': {'news': {'score': 0, 'testPopFq': 0, 'nullPopFq': 0}}}, {'uri': 'http://en.wikipedia.org/wiki/Margrethe_Vestager', 'type': 'person', 'score': 1, 'label': {'eng': 'Margrethe Vestager'}, 'synonyms': {}, 'trendingScore': {'news': {'score': 0, 'testPopFq': 0, 'nullPopFq': 0}}}, {'uri': 'http://en.wikipedia.org/wiki/Command_and_control', 'type': 'wiki', 'score': 1, 'label': {'eng': 'Command and control'}, 'synonyms': {'eng': ['C2']}, 'trendingScore': {'news': {'score': 0, 'testPopFq': 0, 'nullPopFq': 0}}}, {'uri': 'http://en.wikipedia.org/wiki/Cyberattack', 'type': 'wiki', 'score': 1, 'label': {'eng': 'Cyberattack'}, 'synonyms': {'eng': ['Cyber-attack', 'Cyber attack']}, 'trendingScore': {'news': {'score': 0, 'testPopFq': 0, 'nullPopFq': 0}}}, {'uri': 'http://en.wikipedia.org/wiki/Computer_security', 'type': 'wiki', 'score': 1, 'label': {'eng': 'Computer security'}, 'synonyms': {'eng': ['IT security', 'Cybersecurity', 'Cyber security']}, 'trendingScore': {'news': {'score': 0, 'testPopFq': 0, 'nullPopFq': 0}}}, {'uri': 'http://en.wikipedia.org/wiki/Satellite', 'type': 'wiki', 'score': 1, 'label': {'eng': 'Satellite'}, 'synonyms': {'eng': ['Space satellite']}, 'trendingScore': {'news': {'score': 0, 'testPopFq': 0, 'nullPopFq': 0}}}, {'uri': 'http://en.wikipedia.org/wiki/Internet', 'type': 'wiki', 'score': 1, 'label': {'eng': 'Internet'}, 'synonyms': {'eng': ['The Internet', 'Net', 'The Net', 'Interweb']}, 'trendingScore': {'news': {'score': 0, 'testPopFq': 0, 'nullPopFq': 0}}}, {'uri': 'http://en.wikipedia.org/wiki/Agence_France-Presse', 'type': 'org', 'score': 1, 'label': {'eng': 'Agence France-Presse'}, 'synonyms': {'eng': ['AFP']}, 'trendingScore': {'news': {'score': 0, 'testPopFq': 0, 'nullPopFq': 0}}}, {'uri': 'http://en.wikipedia.org/wiki/Moscow_Kremlin', 'type': 'loc', 'score': 1, 'label': {'eng': 'Moscow Kremlin'}, 'synonyms': {'eng': ['Kremlin']}, 'trendingScore': {'news': {'score': 0, 'testPopFq': 0, 'nullPopFq': 0}}, 'location': None}, {'uri': 'http://en.wikipedia.org/wiki/UEFA', 'type': 'org', 'score': 1, 'label': {'eng': 'UEFA'}, 'synonyms': {}, 'trendingScore': {'news': {'score': 0, 'testPopFq': 0, 'nullPopFq': 0}}}, {'uri': 'http://en.wikipedia.org/wiki/Washington,_D.C.', 'type': 'loc', 'score': 1, 'label': {'eng': 'Washington, D.C.'}, 'synonyms': {'eng': ['Washington', 'Washington DC', 'Washington, DC', 'DC', 'D.C.', 'District of Columbia', 'Washington, District of Columbia', 'Washington D.C.']}, 'trendingScore': {'news': {'score': 0, 'testPopFq': 0, 'nullPopFq': 0}}, 'location': {'type': 'place', 'geoNamesId': '4138106', 'wikiUri': 'http://en.wikipedia.org/wiki/Washington,_D.C.', 'label': {'eng': 'Washington, D.C.'}, 'population': 552433, 'lat': 38.91706, 'long': -77.00025, 'featureCode': 'A.ADM1', 'country': {'type': 'country', 'geoNamesId': '6252001', 'wikiUri': 'http://en.wikipedia.org/wiki/United_States', 'label': {'eng': 'United States'}, 'population': 310232863, 'lat': 39.76, 'long': -98.5, 'area': 9629091, 'code2': 'US', 'code3': 'USA', 'webExt': '.us', 'currencyCode': 'USD', 'currencyName': 'Dollar', 'continent': 'Noth America'}}}, {'uri': 'http://en.wikipedia.org/wiki/United_States', 'type': 'loc', 'score': 1, 'label': {'eng': 'United States'}, 'synonyms': {'eng': ['USA', 'U.S.A.', 'America', 'The States', 'U.S.', 'US', 'The US', 'The United States', 'The United States of America', '🇺🇸']}, 'trendingScore': {'news': {'score': 0, 'testPopFq': 0, 'nullPopFq': 0}}, 'location': {'type': 'country', 'geoNamesId': '6252001', 'wikiUri': 'http://en.wikipedia.org/wiki/United_States', 'label': {'eng': 'United States'}, 'population': 310232863, 'lat': 39.76, 'long': -98.5, 'area': 9629091, 'code2': 'US', 'code3': 'USA', 'webExt': '.us', 'currencyCode': 'USD', 'currencyName': 'Dollar', 'continent': 'Noth America'}}, {'uri': 'http://en.wikipedia.org/wiki/Poland', 'type': 'loc', 'score': 1, 'label': {'eng': 'Poland'}, 'synonyms': {'eng': ['POL', 'Republic of Poland', 'Pl', 'PL', 'Polska']}, 'trendingScore': {'news': {'score': 0, 'testPopFq': 0, 'nullPopFq': 0}}, 'location': {'type': 'country', 'geoNamesId': '798544', 'wikiUri': 'http://en.wikipedia.org/wiki/Poland', 'label': {'eng': 'Poland'}, 'population': 38500000, 'lat': 52, 'long': 20, 'area': 312685, 'code2': 'PL', 'code3': 'POL', 'webExt': '.pl', 'currencyCode': 'PLN', 'currencyName': 'Zloty', 'continent': 'Europe'}}, {'uri': 'http://en.wikipedia.org/wiki/Italy', 'type': 'loc', 'score': 1, 'label': {'eng': 'Italy'}, 'synonyms': {'eng': ['Italia', 'Italian Republic', 'IT', 'It']}, 'trendingScore': {'news': {'score': 0, 'testPopFq': 0, 'nullPopFq': 0}}, 'location': {'type': 'country', 'geoNamesId': '3175395', 'wikiUri': 'http://en.wikipedia.org/wiki/Italy', 'label': {'eng': 'Italy'}, 'population': 60340328, 'lat': 42.83333, 'long': 12.83333, 'area': 301230, 'code2': 'IT', 'code3': 'ITA', 'webExt': '.it', 'currencyCode': 'EUR', 'currencyName': 'Euro', 'continent': 'Europe'}}, {'uri': 'http://en.wikipedia.org/wiki/Hungary', 'type': 'loc', 'score': 1, 'label': {'eng': 'Hungary'}, 'synonyms': {'eng': ['Hu']}, 'trendingScore': {'news': {'score': 0, 'testPopFq': 0, 'nullPopFq': 0}}, 'location': {'type': 'country', 'geoNamesId': '719819', 'wikiUri': 'http://en.wikipedia.org/wiki/Hungary', 'label': {'eng': 'Hungary'}, 'population': 9982000, 'lat': 47, 'long': 20, 'area': 93030, 'code2': 'HU', 'code3': 'HUN', 'webExt': '.hu', 'currencyCode': 'HUF', 'currencyName': 'Forint', 'continent': 'Europe'}}, {'uri': 'http://en.wikipedia.org/wiki/Greece', 'type': 'loc', 'score': 1, 'label': {'eng': 'Greece'}, 'synonyms': {'eng': ['Hellenic Republic', 'Hellas', 'Gr']}, 'trendingScore': {'news': {'score': 0, 'testPopFq': 0, 'nullPopFq': 0}}, 'location': {'type': 'country', 'geoNamesId': '390903', 'wikiUri': 'http://en.wikipedia.org/wiki/Greece', 'label': {'eng': 'Greece'}, 'population': 11000000, 'lat': 39, 'long': 22, 'area': 131940, 'code2': 'GR', 'code3': 'GRC', 'webExt': '.gr', 'currencyCode': 'EUR', 'currencyName': 'Euro', 'continent': 'Europe'}}, {'uri': 'http://en.wikipedia.org/wiki/France', 'type': 'loc', 'score': 1, 'label': {'eng': 'France'}, 'synonyms': {'eng': ['Fr', 'FR', 'République française', 'La France', 'Republic of France', 'French Republic']}, 'trendingScore': {'news': {'score': 0, 'testPopFq': 0, 'nullPopFq': 0}}, 'location': {'type': 'country', 'geoNamesId': '3017382', 'wikiUri': 'http://en.wikipedia.org/wiki/France', 'label': {'eng': 'France'}, 'population': 64768389, 'lat': 46, 'long': 2, 'area': 547030, 'code2': 'FR', 'code3': 'FRA', 'webExt': '.fr', 'currencyCode': 'EUR', 'currencyName': 'Euro', 'continent': 'Europe'}}, {'uri': 'http://en.wikipedia.org/wiki/Germany', 'type': 'loc', 'score': 1, 'label': {'eng': 'Germany'}, 'synonyms': {'eng': ['FRG', 'BRD', 'Bundesrepublik Deutschland', 'Federal Republic of Germany', 'De']}, 'trendingScore': {'news': {'score': 0, 'testPopFq': 0, 'nullPopFq': 0}}, 'location': {'type': 'country', 'geoNamesId': '2921044', 'wikiUri': 'http://en.wikipedia.org/wiki/Germany', 'label': {'eng': 'Germany'}, 'population': 81802257, 'lat': 51.5, 'long': 10.5, 'area': 357021, 'code2': 'DE', 'code3': 'DEU', 'webExt': '.de', 'currencyCode': 'EUR', 'currencyName': 'Euro', 'continent': 'Europe'}}]","Member_state_of_the_European_Union Russia Russia Brussels Brussels Belgium European_Commission Europe European_Union Moscow Moscow Russia Ukraine Ukraine Artificial_intelligence Margrethe_Vestager Command_and_control Cyberattack Computer_security Satellite Internet Agence_France-Presse Moscow_Kremlin UEFA Washington,_D.C. Washington,_D.C. United_States United_States United_States Poland Poland Italy Italy Hungary Hungary Greece Greece France France Germany Germany",2023,4,19,2023-04-19,48,10,2023-04-19
