,uri,lang,isDuplicate,date,time,dateTime,dateTimePub,dataType,sim,url,title,body,authors,concepts,image,eventUri,sentiment,wgt,relevance,source.uri,source.dataType,source.title,all_concepts,con_name,country,lang-name,language,Political-Alignment,wiki-url,Cultural-Class,Economic-Class,Continent-name,Continent,Religions,2019Rank-From,SafetyandSecurity,PersonalFreedom,Governance,SocialCapital,InvestmentEnvironment,EnterpriseConditions,MarketAccessandInfrastructure,EconomicQuality,LivingConditions,Health,Education,NaturalEnvironment,PowerDistance,Individualism,Masculinity,UncertaintyAvoidance,LongTermOrientation,Indulgence,economicblocs-name,economicblocs,militarydefenseblocs-name,militarydefenseblocs,politicalregionalblocs-name,politicalregionalblocs,linguisticblocs-name,linguisticblocs,proScore,destination,parent,count,status,year,month,day,min,hour,MD
31,7444110711,eng,False,2023-03-13,07:40:00,2023-03-13 07:40:00,2023-03-13T07:40:00Z,news,0.9647058844566345,https://english.ahram.org.eg/NewsContent/2/9/491590/World/International/Governments-to-vet-crucial-UN-climate-science-repo.aspx,Governments to vet crucial UN climate science report - International - World,"The UN Intergovernmental Panel on Climate Change's synthesis report -- to be released on March 20 -- will detail observed and projected changes in Earth's climate system; past and future impacts such as devastating heatwaves, flooding and rising seas; and ways to halt the carbon pollution pushing Earth toward an unlivable state.

""It's a massive moment, seven years since the Paris Agreement and nine years since the last IPCC assessment report,"" Greenpeace Nordic senior policy advisor Kaisa Kosonen, an official observer at IPCC meetings, told AFP.

Since its creation in 1988, the IPCC -- an intergovernmental body staffed by hundreds of volunteer scientists -- has released six, three-part assessments, the most recent in 2021-2022.

""It is scientists telling governments how they are doing during these crucial defining years,"" Kosonen said.

The report card is not good: global greenhouse gas emissions have continued to grow, even as science has cautioned that deadly consequences are coming sooner and at lower levels of warming than previously thought.

Since the late 19th century, Earth's average surface temperature has risen more than 1.1 degrees Celsius, enough to amplify a crescendo of weather catastrophes on every continent.

Carbon budgets

Under the 2015 Paris treaty, nations promised to collectively cap the rise at ""well below"" 2C, and at 1.5C if possible.

An IPCC special report in 2018 made it alarmingly clear that the more ambitious aspirational goal -- since adopted by governments and business as a hard target -- was a better bet for a climate-safe world.

But an already narrow pathway has become a tightrope: humanity's ""carbon budget"" for staying under the 1.5C barrier is less than 300 billion tonnes of CO2, barely seven times current yearly emissions, according to the IPCC.

Two other special reports -- one on oceans and Earth's frozen zones, the other on forests and land use -- will also be covered in the summary for policymakers under review in Interlaken.

""The synthesis report matters because it will be the last IPCC product for some years, and one of the major sources of knowledge to be considered in the first Global Stocktake under the Paris Agreement,"" Oliver Geden, one of report's lead authors and a senior fellow at the German Institute for International Security Affairs, told AFP.

Unveiled ahead of COP28 UN climate talks in Dubai in December, the global stocktake will confront nations with the deep inadequacy of their Paris pledges to cut emissions, which would allow global temperatures to rise 2.8C above the preindustrial benchmark.

Among the IPCC findings that could be highlighted in the synthesis report is the looming threat of deadly heat.

'More politicised'

Even in an 1.8C world -- an optimistic scenario, according to some scientists -- half of humanity could, by 2100, be exposed to periods of life-threatening climate conditions arising from the coupled impacts of extreme heat and humidity.

There are similarly dire projections for health, the global food system, and economic productivity.

""What is at stake matters to everyone on the planet -- our ability to have healthy, nutritious and affordable food, both now and in the future,"" said Rachel Bezner Kerr, a professor at Cornell University and an IPCC lead author for the most recent report on climate impacts.

Floods last year that covered a third of Pakistan, and ongoing drought in East Africa, both bear the fingerprint of climate change.

The synthesis report will also reflect debate over the best way to decarbonise the global economy, with some emphasising the need to rapidly phase out fossil fuel use and reduce consumer demand, and others the potential of technological solutions.

Diplomats in Interlaken vetting the text line-by-line cannot change the science in the underlying reports' 10,750 pages, but they can decide what to leave in or out, and can highlight -- or obscure -- things through wording.

""Over time, IPCC meetings became more politicised as government representatives -- mainly, but not exclusively, from oil-producing states -- interfered in the scientists' discussions,"" the journal Nature said in a recent editorial.

Despite that, ""the main IPCC studies have an extraordinary reach, informing everything from global climate agreements ... to the school climate strikes movement Fridays of Future,"" the journal said.",[],"[{'uri': 'http://en.wikipedia.org/wiki/Intergovernmental_Panel_on_Climate_Change', 'type': 'wiki', 'score': 5, 'label': {'eng': 'Intergovernmental Panel on Climate Change'}}, {'uri': 'http://en.wikipedia.org/wiki/Earth', 'type': 'loc', 'score': 5, 'label': {'eng': 'Earth'}, 'location': None}, {'uri': 'http://en.wikipedia.org/wiki/Paris_Agreement', 'type': 'wiki', 'score': 4, 'label': {'eng': 'Paris Agreement'}}, {'uri': 'http://en.wikipedia.org/wiki/Carbon', 'type': 'wiki', 'score': 4, 'label': {'eng': 'Carbon'}}, {'uri': 'http://en.wikipedia.org/wiki/United_Nations', 'type': 'org', 'score': 4, 'label': {'eng': 'United Nations'}}, {'uri': 'http://en.wikipedia.org/wiki/Instrumental_temperature_record', 'type': 'wiki', 'score': 3, 'label': {'eng': 'Instrumental temperature record'}}, {'uri': 'http://en.wikipedia.org/wiki/Climate_system', 'type': 'wiki', 'score': 3, 'label': {'eng': 'Climate system'}}, {'uri': 'http://en.wikipedia.org/wiki/Greenpeace', 'type': 'org', 'score': 3, 'label': {'eng': 'Greenpeace'}}, {'uri': 'http://en.wikipedia.org/wiki/Intergovernmental_organization', 'type': 'wiki', 'score': 3, 'label': {'eng': 'Intergovernmental organization'}}, {'uri': 'http://en.wikipedia.org/wiki/Nordic_countries', 'type': 'loc', 'score': 3, 'label': {'eng': 'Nordic countries'}, 'location': None}, {'uri': 'http://en.wikipedia.org/wiki/Heat_wave', 'type': 'wiki', 'score': 3, 'label': {'eng': 'Heat wave'}}, {'uri': 'http://en.wikipedia.org/wiki/Pollution', 'type': 'wiki', 'score': 3, 'label': {'eng': 'Pollution'}}, {'uri': 'http://en.wikipedia.org/wiki/Greenhouse_gas_emissions', 'type': 'wiki', 'score': 3, 'label': {'eng': 'Greenhouse gas emissions'}}, {'uri': 'http://en.wikipedia.org/wiki/Flood', 'type': 'wiki', 'score': 3, 'label': {'eng': 'Flood'}}, {'uri': 'http://en.wikipedia.org/wiki/Paris', 'type': 'loc', 'score': 3, 'label': {'eng': 'Paris'}, 'location': {'type': 'place', 'label': {'eng': 'Paris'}, 'country': {'type': 'country', 'label': {'eng': 'France'}}}}, {'uri': 'http://en.wikipedia.org/wiki/Land_use', 'type': 'wiki', 'score': 2, 'label': {'eng': 'Land use'}}, {'uri': 'http://en.wikipedia.org/wiki/Ocean', 'type': 'wiki', 'score': 2, 'label': {'eng': 'Ocean'}}, {'uri': 'http://en.wikipedia.org/wiki/Treaty', 'type': 'wiki', 'score': 2, 'label': {'eng': 'Treaty'}}, {'uri': 'http://en.wikipedia.org/wiki/Carbon_cycle', 'type': 'wiki', 'score': 2, 'label': {'eng': 'Carbon cycle'}}, {'uri': 'http://en.wikipedia.org/wiki/Forest', 'type': 'wiki', 'score': 2, 'label': {'eng': 'Forest'}}, {'uri': 'http://en.wikipedia.org/wiki/Carbon_dioxide', 'type': 'wiki', 'score': 2, 'label': {'eng': 'Carbon dioxide'}}, {'uri': 'http://en.wikipedia.org/wiki/Tonne', 'type': 'wiki', 'score': 2, 'label': {'eng': 'Tonne'}}, {'uri': 'http://en.wikipedia.org/wiki/Celsius', 'type': 'wiki', 'score': 2, 'label': {'eng': 'Celsius'}}, {'uri': 'http://en.wikipedia.org/wiki/Interlaken', 'type': 'loc', 'score': 2, 'label': {'eng': 'Interlaken'}, 'location': {'type': 'place', 'label': {'eng': 'Interlaken'}, 'country': {'type': 'country', 'label': {'eng': 'Switzerland'}}}}, {'uri': 'http://en.wikipedia.org/wiki/Dubai', 'type': 'loc', 'score': 2, 'label': {'eng': 'Dubai'}, 'location': {'type': 'place', 'label': {'eng': 'Dubai'}, 'country': {'type': 'country', 'label': {'eng': 'United Arab Emirates'}}}}, {'uri': 'http://en.wikipedia.org/wiki/Germany', 'type': 'loc', 'score': 2, 'label': {'eng': 'Germany'}, 'location': {'type': 'country', 'label': {'eng': 'Germany'}}}, {'uri': 'http://en.wikipedia.org/wiki/Food_system', 'type': 'wiki', 'score': 1, 'label': {'eng': 'Food system'}}, {'uri': 'http://en.wikipedia.org/wiki/Humidity', 'type': 'wiki', 'score': 1, 'label': {'eng': 'Humidity'}}, {'uri': 'http://en.wikipedia.org/wiki/Cornell_University', 'type': 'loc', 'score': 1, 'label': {'eng': 'Cornell University'}, 'location': None}, {'uri': 'http://en.wikipedia.org/wiki/East_Africa', 'type': 'loc', 'score': 1, 'label': {'eng': 'East Africa'}, 'location': None}, {'uri': 'http://en.wikipedia.org/wiki/Agence_France-Presse', 'type': 'org', 'score': 1, 'label': {'eng': 'Agence France-Presse'}}, {'uri': 'http://en.wikipedia.org/wiki/Pakistan', 'type': 'loc', 'score': 1, 'label': {'eng': 'Pakistan'}, 'location': {'type': 'country', 'label': {'eng': 'Pakistan'}}}]",https://english.ahram.org.eg/Media/News/2023/3/13/41_2023-638142951786131010-613.jpg,eng-8471343,0.1058823529411765,416389200,1,english.ahram.org.eg,news,جريدة الأهرام,Intergovernmental Panel on Climate Change Earth Paris Agreement Carbon United Nations Instrumental temperature record Climate system Greenpeace Intergovernmental organization Nordic countries Heat wave Pollution Greenhouse gas emissions Flood Paris Land use Ocean Treaty Carbon cycle Forest Carbon dioxide Tonne Celsius Interlaken Dubai Germany Food system Humidity Cornell University East Africa Agence France-Presse Pakistan,Egypt,EG,Ara-Eng,ara-eng,Uncertain,https:en.wikipedia.orgwikiAl-Ahram,C19,C5,Africa,AF,Muslim,121.0,worst,average,worst,worst,average,average,average,worst,average,average,average,worst,high,low,high,high,low,low,African Continental Free Trade Area (AfCFTA),AfCFTA,,,African Union,AU,Arabic-speaking,Ara,-1,,,0,False,2023,3,13,40,7,2023-03-13
