,uri,lang,isDuplicate,date,time,dateTime,dateTimePub,dataType,sim,url,title,body,authors,concepts,image,eventUri,sentiment,wgt,relevance,source.uri,source.dataType,source.title,all_concepts,con-name,country,lang-name,language,Political-Alignment,wiki-url,Cultural-Class,Economic-Class,Continent-name,Continent,Religions,2019Rank-From,SafetyandSecurity,PersonalFreedom,Governance,SocialCapital,InvestmentEnvironment,EnterpriseConditions,MarketAccessandInfrastructure,EconomicQuality,LivingConditions,Health,Education,NaturalEnvironment,PowerDistance,Individualism,Masculinity,UncertaintyAvoidance,LongTermOrientation,Indulgence,economicblocs-name,economicblocs,militarydefenseblocs-name,militarydefenseblocs,politicalregionalblocs-name,politicalregionalblocs,linguisticblocs-name,linguisticblocs,proScore,destination,parent,count,status,year,month,day,min,hour,MD
307,7442599333,eng,False,2023-03-12,06:08:00,2023-03-12 06:08:00,2023-03-12T06:04:00Z,news,0.6313725709915161,https://www.stabroeknews.com/2023/03/12/news/world/cyclone-freddy-pummels-mozambique-for-a-second-time-killing-one/," Cyclone Freddy pummels Mozambique for a second time, killing one - Stabroek News","MAPUTO, (Reuters) - Cyclone Freddy pummeled Mozambique yesterday, killing one person, ripping roofs off houses and triggering a lockdown in one port town, a resident and local media said, two weeks after 27 died when the storm first made landfall.

Freddy, one of the strongest storms ever recorded in the southern hemisphere, started sweeping onshore by 10pm local time (2000 GMT), satellite data showed, after hours of battering the southern African coast with rain.

It was the second time the cyclone has struck the country since it was named after being spotted near Indonesia on Feb. 6.

""The town is a no-go zone; no shops or businesses open. Everything is closed. We're locked up,"" resident Vania Massingue said by telephone from her house in the port settlement of Quelimane, located in the storm's path in the central Zambezia province.

""I can see some houses with roofs torn apart, broken windows and the streets flooded. It's really scary.""

After swirling for 34 days, the weather system is likely to have broken the record for the longest-lasting tropical cyclone. According to the World Meteorological Organization, the previous record was held by a 31-day hurricane in 1994.

State broadcaster TVM said one person died when his house collapsed, and that the power utility had switched off the electricity completely as a precaution. All flights were suspended, it added.

The cyclone is slow-moving, which meteorological experts say means it will pick up more moisture off the sea, bringing heavy rainfall.

Around the world, climate change is making hurricanes wetter, windier and stronger, scientists say. Oceans absorb much of the heat from greenhouse gas emissions, and when warm seawater evaporates its heat energy is transferred to the atmosphere, fuelling more destructive storms.

More than 171,000 people were affected after the cyclone swept through southern Mozambique last month, bringing heavy rains and floods that damaged crops and destroyed houses, with OCHA putting its death toll at 27 so far -- 10 in Mozambique and 17 in Madagascar.

More than half a million people are at risk in Mozambique this time, notably in Zambezia, Tete, Sofala and Nampula provinces.",[],"[{'uri': 'http://en.wikipedia.org/wiki/Cyclone', 'type': 'wiki', 'score': 5, 'label': {'eng': 'Cyclone'}}, {'uri': 'http://en.wikipedia.org/wiki/Port', 'type': 'wiki', 'score': 4, 'label': {'eng': 'Port'}}, {'uri': 'http://en.wikipedia.org/wiki/Landfall', 'type': 'wiki', 'score': 3, 'label': {'eng': 'Landfall'}}, {'uri': 'http://en.wikipedia.org/wiki/Southern_Africa', 'type': 'loc', 'score': 3, 'label': {'eng': 'Southern Africa'}, 'location': None}, {'uri': 'http://en.wikipedia.org/wiki/Southern_Hemisphere', 'type': 'wiki', 'score': 3, 'label': {'eng': 'Southern Hemisphere'}}, {'uri': 'http://en.wikipedia.org/wiki/Tropical_cyclone', 'type': 'wiki', 'score': 3, 'label': {'eng': 'Tropical cyclone'}}, {'uri': 'http://en.wikipedia.org/wiki/Satellite', 'type': 'wiki', 'score': 3, 'label': {'eng': 'Satellite'}}, {'uri': 'http://en.wikipedia.org/wiki/Maputo', 'type': 'loc', 'score': 3, 'label': {'eng': 'Maputo'}, 'location': {'type': 'place', 'label': {'eng': 'Maputo'}, 'country': {'type': 'country', 'label': {'eng': 'Mozambique'}}}}, {'uri': 'http://en.wikipedia.org/wiki/Mozambique', 'type': 'loc', 'score': 3, 'label': {'eng': 'Mozambique'}, 'location': {'type': 'country', 'label': {'eng': 'Mozambique'}}}, {'uri': 'http://en.wikipedia.org/wiki/Low-pressure_area', 'type': 'wiki', 'score': 2, 'label': {'eng': 'Low-pressure area'}}, {'uri': 'http://en.wikipedia.org/wiki/World_Meteorological_Organization', 'type': 'org', 'score': 2, 'label': {'eng': 'World Meteorological Organization'}}, {'uri': 'http://en.wikipedia.org/wiki/Province', 'type': 'wiki', 'score': 2, 'label': {'eng': 'Province'}}, {'uri': 'http://en.wikipedia.org/wiki/Quelimane', 'type': 'loc', 'score': 2, 'label': {'eng': 'Quelimane'}, 'location': {'type': 'place', 'label': {'eng': 'Quelimane'}, 'country': {'type': 'country', 'label': {'eng': 'Mozambique'}}}}, {'uri': 'http://en.wikipedia.org/wiki/Zambezia_Province', 'type': 'loc', 'score': 2, 'label': {'eng': 'Zambezia Province'}, 'location': {'type': 'place', 'label': {'eng': 'Zambezia Province'}, 'country': {'type': 'country', 'label': {'eng': 'Mozambique'}}}}, {'uri': 'http://en.wikipedia.org/wiki/Indonesia', 'type': 'loc', 'score': 2, 'label': {'eng': 'Indonesia'}, 'location': {'type': 'country', 'label': {'eng': 'Indonesia'}}}, {'uri': 'http://en.wikipedia.org/wiki/Evaporation', 'type': 'wiki', 'score': 1, 'label': {'eng': 'Evaporation'}}, {'uri': 'http://en.wikipedia.org/wiki/Seawater', 'type': 'wiki', 'score': 1, 'label': {'eng': 'Seawater'}}, {'uri': 'http://en.wikipedia.org/wiki/United_Nations_Office_for_the_Coordination_of_Humanitarian_Affairs', 'type': 'wiki', 'score': 1, 'label': {'eng': 'United Nations Office for the Coordination of Humanitarian Affairs'}}, {'uri': 'http://en.wikipedia.org/wiki/Greenhouse_gas_emissions', 'type': 'wiki', 'score': 1, 'label': {'eng': 'Greenhouse gas emissions'}}, {'uri': 'http://en.wikipedia.org/wiki/Flood', 'type': 'wiki', 'score': 1, 'label': {'eng': 'Flood'}}, {'uri': 'http://en.wikipedia.org/wiki/Climate_change', 'type': 'wiki', 'score': 1, 'label': {'eng': 'Climate change'}}, {'uri': 'http://en.wikipedia.org/wiki/Meteorology', 'type': 'wiki', 'score': 1, 'label': {'eng': 'Meteorology'}}, {'uri': 'http://en.wikipedia.org/wiki/Rain', 'type': 'wiki', 'score': 1, 'label': {'eng': 'Rain'}}, {'uri': 'http://en.wikipedia.org/wiki/Atmosphere', 'type': 'wiki', 'score': 1, 'label': {'eng': 'Atmosphere'}}, {'uri': 'http://en.wikipedia.org/wiki/Reuters', 'type': 'wiki', 'score': 1, 'label': {'eng': 'Reuters'}}, {'uri': 'http://en.wikipedia.org/wiki/Electricity', 'type': 'wiki', 'score': 1, 'label': {'eng': 'Electricity'}}, {'uri': 'http://en.wikipedia.org/wiki/Nampula', 'type': 'loc', 'score': 1, 'label': {'eng': 'Nampula'}, 'location': {'type': 'place', 'label': {'eng': 'Nampula'}, 'country': {'type': 'country', 'label': {'eng': 'Mozambique'}}}}, {'uri': 'http://en.wikipedia.org/wiki/Sofala', 'type': 'loc', 'score': 1, 'label': {'eng': 'Sofala'}, 'location': {'type': 'place', 'label': {'eng': 'Sofala'}, 'country': {'type': 'country', 'label': {'eng': 'Mozambique'}}}}, {'uri': 'http://en.wikipedia.org/wiki/Tete,_Mozambique', 'type': 'loc', 'score': 1, 'label': {'eng': 'Tete, Mozambique'}, 'location': {'type': 'place', 'label': {'eng': 'Tete, Mozambique'}, 'country': {'type': 'country', 'label': {'eng': 'Mozambique'}}}}, {'uri': 'http://en.wikipedia.org/wiki/Madagascar', 'type': 'loc', 'score': 1, 'label': {'eng': 'Madagascar'}, 'location': {'type': 'country', 'label': {'eng': 'Madagascar'}}}]",https://s1.stabroeknews.com/images/2019/06/sn-article-default.png,eng-8467663,-0.207843137254902,416297280,1,stabroeknews.com,news,Stabroek News,"Cyclone Port Landfall Southern Africa Southern Hemisphere Tropical cyclone Satellite Maputo Mozambique Low-pressure area World Meteorological Organization Province Quelimane Zambezia Province Indonesia Evaporation Seawater United Nations Office for the Coordination of Humanitarian Affairs Greenhouse gas emissions Flood Climate change Meteorology Rain Atmosphere Reuters Electricity Nampula Sofala Tete, Mozambique Madagascar",Guyana,GY,,,,,,C20,South America,SA,Christian,89.0,96.0,61.0,71.0,96.0,101.0,113.0,109.0,64.0,85.0,120.0,96.0,47.0,,,,,,,,,,,,,Portuguese-speaking,Por,-1,,,0,False,2023,3,12,8,6,2023-03-12
