,Unnamed: 0,uri,lang,isDuplicate,date,time,dateTime,dateTimePub,dataType,sim,url,title,body,authors,concepts,image,eventUri,sentiment,wgt,relevance,source.uri,source.dataType,source.title,all_concepts,url2,word_count,Category,year,month,day,min,hour,MD
215,14508,8114576764,eng,False,2024-05-06,23:38:31,5/6/2024 23:38,2024-05-06 23:37:07,news,0.752941191,http://hosted.ap.org/article/59c2a6eda826993d394efa6b979df691/latest-israel-launches-strikes-rafah-hours-after-hamas,"The Latest | Israel launches strikes in Rafah, hours after Hamas agrees to a Gaza cease-fire","Israel's military says it is conducting ""targeted strikes"" against Hamas in the southern Gaza city of Rafah after the country's War Cabinet approved a military operation there, officials said late Monday.

Hours earlier, the Hamas militant group announced it had accepted a cease-fire proposal brought forward by mediators Egypt and Qatar. A cease-fire could end seven months of war in Gaza -- however it's uncertain whether a deal had been sealed. Israel responded by saying the proposal did not meet its ""core demands.""

More than a million people are huddled in tents and overcrowded apartments in Rafah after fleeing Israel's military offensive in other parts of the Gaza Strip. Israel says Rafah is Hamas' last stronghold, but the United States opposes a full-scale invasion of the city bordering Egyptian unless Israel provides a ""credible"" plan for protecting civilians there.

The war in Gaza has driven around 80% of the territory's population of 2.3 million from their homes and caused vast destruction to homes, hospitals, mosques and schools across several cities. The death toll in Gaza has soared to more than 34,500 people, according to local health officials.

The war began Oct. 7 when Hamas attacked southern Israel, killing around 1,200 people, mostly civilians, and abducting about 250 others. Israel says militants still hold around 100 hostages and the remains of more than 30 others.

-- Biden speaks with Netanyahu as Israelis appear closer to major Rafah offensive

-- Israel orders Al Jazeera to close its local operation and seizes some of its equipment.

-- Netanyahu uses Holocaust ceremony to brush off international pressure against Gaza offensive.

CAIRO -- A Palestinian security official and an Egyptian official say Israeli tanks entered the southern Gaza town of Rafah, reaching as close as 200 meters (yards) from its crossing with neighboring Egypt.

The Egyptian official said the operation appeared to be limited in scope. He and Hamas' Al-Aqsa TV said Israeli officials informed the Egyptians that the troops would withdraw after completing the operation.

The Israeli military declined to comment. On Sunday, Hamas fighters near the Rafah crossing fired mortars into southern Israel, killing four Israeli soldiers.

The Egyptian official, located on the Egyptian side of Rafah, and the Palestinian security official spoke on condition of anonymity because they were not authorized to talk to the press.

The Associated Press could not independently verify the scope of the operation.

Earlier Monday, Israel's War Cabinet decided to push ahead with a military operation in Rafah, after Hamas announced its acceptance of an Egyptian-Qatari proposal for a cease-fire deal. The Israeli military said it was conducting ""targeted strikes"" against Hamas in Rafah without providing details.

The Rafah border crossing is a critical entry point for humanitarian aid into Gaza.

___

Associated Press writer Lee Keath contributed to this report.

WASHINGTON -- Biden administration officials on Monday continued to express concerns to the Israelis that a major military operation into Rafah's densely populated areas could be catastrophic.

White House officials on Monday also were privately concerned about the latest strikes on Rafah -- although the strikes did not appear to be the widescale attack Israeli Prime Minister Benjamin Netanyahu has been threatening., according to a person familiar with Biden administration thinking who was not authorized to comment publicly.

___

Associated Press writer Zeke Miller contributed to this report.

BEIRUT -- Hamas has published a copy of the cease-fire and hostage release proposal that the militant group said it had agreed to on Monday.

The framework brought forward by Qatar and Egypt aims to bring a halt to seven months of war in Gaza. However, it's unclear if Israel will agree to the terms.

The proposal outlines a phased release of Israeli hostages held in Gaza alongside the gradual withdrawal of Israeli troops from the entire enclave and ending with a ""sustainable calm"" or ""permanent cessation of military and hostile operations.""

Israel has previously said it would not agree to either a full withdrawal of its forces or a permanent cease-fire as part of a hostage release deal.

The first stage would last 42 days and would involve a partial withdrawal of Israeli forces from the Gaza Strip and the release of about 33 hostages held in the territory, including the remaining Israeli women -- both civilians and soldiers -- as well as children, older adults and people who are ill.

Thirty Palestinian prisoners held in Israel would be released in exchange for each Israeli civilian hostage and 50 in exchange for each female soldier.

Palestinians displaced in Gaza would be allowed to return to their home neighborhoods during that time.

The parties would then negotiate the terms of the next stage, under which the remaining civilian men and soldiers would be released, while Israeli forces would withdraw from the rest of Gaza. This phase would be conditioned on achievement of a ""sustainable calm.""

The final stage would involve exchange of the bodies of hostages who died in captivity and the beginning of a reconstruction plan for the enclave that would take place over three to five years ""under the supervision of a number of countries and organizations, including: Egypt, Qatar and the United Nations.""

TEL AVIV, Israel -- Thousands of Israelis rallied around the country Monday night calling for an immediate deal to release the hostages still held in the Gaza Strip.

The protests came as Israel's War Cabinet voted to begin an operation on the city of Rafah, saying that a cease-fire proposal Hamas accepted earlier in the night was not in line with Israeli demands.

In Tel Aviv, about 1,000 protesters swelled near Israel's military headquarters, some blocking the city's main highway until late into the night. Police tried to clear the road, lifting some protesters off the street and extinguishing fires lit during the demonstration. Other officers on horseback surrounded crowds who chanted ""deal now!""

In Jerusalem, hundreds of protesters called for a hostage deal. They marched toward the home of Israeli Prime Minister Benjamin Netanyahu, holding a banner reading ""the blood is on your hands.""

There were also smaller protests in the cities of Haifa, Beersheba and Raanana.

Israeli police did not immediately respond to a request about the number of people arrested.

In front of Netanyahu's house stood Mai Albini Peri, the grandson of Haim Peri, a hostage in Gaza. He held a sign that read, ""Rafah, not at the expense of my grandfather.""

JERUSALEM -- Israeli leaders have approved a military operation into the Gaza Strip city of Rafah, and Israeli forces are now striking targets in the area, officials announced Monday.

The move came hours after Hamas announced it had accepted an Egyptian-Qatari cease-fire proposal.

Prime Minister Benjamin Netanyahu's office said that the proposal was ""far from Israel's essential demands,"" but that it would nonetheless send negotiators to continue talks on a cease-fire agreement.

The United States says it opposes a Rafah invasion unless Israel provides a ""credible"" plan for protecting civilians there. More than a million people in Rafah are huddled in tents and overcrowded apartments after fleeing Israel's military offensive in other parts of the territory.

Earlier Monday, Israel's military said it ordered around 100,000 people to evacuate Rafah, signaling the long-promised ground invasion could be imminent. Israel says Rafah is Hamas' last stronghold.

JERUSALEM -- Israel will keep carrying out operations in Gaza as officials deliberate over a cease-fire proposal approved by Hamas, an Israeli military spokesperson says.

Rear Adm. Daniel Hagari spoke after the Hamas militant group said it accepted an Egyptian-Qatari cease-fire proposal to halt the seven-month war with Israel. Israeli officials were studying the proposal late Monday and did not immediately comment.

""We examine every answer and reply very seriously,"" said Hagari. ""At the same time, we continue our operations in the Gaza Strip and will continue to do so.""

During the same address, Hagari said that Israel would reopen a major crossing for humanitarian aid to pass into Gaza as soon as possible, without specifying exactly when.

Israel closed the Kerem Shalom crossing Sunday after a Hamas mortar attack in the area killed four Israeli soldiers.

The White House said earlier Monday that Israeli Prime Minister Benjamin Netanyahu had agreed to reopen the crossing on a phone call with President Joe Biden.

WASHINGTON -- President Joe Biden has been briefed on Hamas' response in ongoing cease-fire talks, White House National Security Council spokesman John Kirby said, adding only that the U.S. and its partners were still reviewing that response.

CIA Director Bill Burns was actively engaged with partners in the region to evaluate the Hamas statement and next steps, Kirby said.

Hamas announced Monday it has accepted an Egyptian-Qatari cease-fire proposal, but Israel said it was studying the offer, leaving it uncertain whether a deal had been sealed to bring a halt to the seven-month-long war in Gaza.

ANKARA, Turkey -- Turkish President Recep Tayyip Erdogan welcomed a statement by the Hamas militant group that it has accepted a cease-fire proposal, and he called on Israel to also accept the deal.

Speaking at the end of Cabinet meeting Monday, Erdogan also urged Western nations to exert pressure on Israeli to accept the deal. He suggested that Turkey had urged Hamas to accept the proposal.

""We were happy by the statement from Hamas that it accepted the cease-fire with our recommendations. The same step must now be also taken by Israel. I call on all Western actors to exert pressure on Israel,"" Erdogan said.

Turkey, a vocal critic of Israel's military actions in Gaza, suspended trade relations with Israel last week. It said the commercial ties won't be restored until a permanent cease-fire is installed and obstructions to the flow of aid into Gaza are removed.

JERUSALEM -- An official familiar with Israeli thinking says Israeli officials are examining the cease-fire proposal approved by Hamas.

But the official warns that the plan approved by Hamas ""is not the framework Israel proposed.""

The official, speaking on condition of anonymity because Israel is still formulating a formal response, did not elaborate.

The language signaled that a deal could still be a ways off.

___

Associated Press writer Josef Federman contributed to this report.

WASHINGTON -- A U.S. official said that Washington was still waiting to learn more about the Hamas position and whether it reflected an agreement to what had already been signed off on by Israel and international negotiators or to something else.

Details of the proposal haven't been released. The official was speaking on condition of anonymity because they weren't authorized to publicly discuss the matter.

Hamas announced Monday it has accepted an Egyptian-Qatari cease-fire proposal, but there was no immediate word from Israel, leaving it uncertain whether a deal had been sealed to bring a halt to the seven-month-long war in Gaza.

___

Associated Press writer Zeke Miller contributed to this report.

The Hamas militant group says it has accepted an Egyptian-Qatari cease-fire proposal to halt the seven-month war with Israel.

It issued a statement Monday saying its supreme leader, Ismail Haniyeh, had delivered the news in a phone call with Qatar's prime minister and Egypt's intelligence minister. The two Middle Eastern nations have been mediating months of talks between Israel and Hamas. There was no immediate comment from Israel.

The announcement came hours after Israel ordered Palestinians to begin evacuating the southern Gaza town of Rafah ahead of an Israeli military operation. Israel says Rafah is Hamas' last stronghold.

News of Hamas' announcement sent people in Rafah cheering in the streets. People rushed into the streets in front of Al-Aqsa Hospital in Deir al-Balah in the Gaza Strip, chanting and cheering the news.

Details of the proposal were not immediately released. But in recent days, Egyptian and Hamas officials have said the cease-fire would take place in a series of stages in which Hamas would release hostages it is holding in exchange for Israeli troop pullbacks from Gaza.

It is not clear whether the deal will meet Hamas' key demand of bringing about an end to the war and complete Israeli withdrawal.

GENEVA -- The U.N. human rights chief says it's ""inhumane"" that people in Gaza are being told to move again as Israel plans an invasion into the southern city of Rafah.

Volker Türk warned that civilian suffering, death and destruction appear set to swell further, insisting that protection of civilians is the ""overriding concern"" of international humanitarian and human rights law -- and those who ""flout"" it must be held to account.

""Forcibly relocating hundreds of thousands from Rafah to areas which have already been flattened and where there is little shelter and virtually no access to humanitarian assistance necessary for their survival is inconceivable,"" he said in a statement.

Türk noted that Rafah has become the main hub for distribution of humanitarian aid into the Gaza Strip. He reiterated calls for a cease-fire, the free flow of aid into Gaza, and the release of Israeli hostages held in the territory.

Hundreds of thousands of people in Gaza have been ordered to evacuate their homes and shelters since Israeli forces launched a military action in the strip following the Oct. 7 attacks in Israel

JERUSALEM -- Israel's blockage of Al Jazeera's news website appeared to take effect Monday, a day after Israel shut the local offices of the Qatari network and halted its broadcasts in Israel.

The network's website was no longer accessible on local Wi-Fi networks in Israel as of Monday afternoon, although it could still be viewed using virtual private networks, or VPNs. Access to the network's YouTube livestream and social media feeds appeared undisturbed. Al Jazeera went off Israel's main cable and satellite providers Sunday.

Believed to be the first time Israel has closed a foreign news outlet operating in the country, the shuttering of Al-Jazeera's operation marks the culmination of a long-running feud that has only been exacerbated by the network's coverage of the current Israel-Hamas war.

Since Hamas militants' initial cross-border attack Oct. 7, the network has maintained 24-hour coverage of Israel's grinding ground offensive in the Gaza Strip. While including on-the-ground reporting of the war's casualties, including the deaths of members of its own staff, its Arabic arm often publishes verbatim video statements from Hamas and other regional militant groups.

Israel's Prime Minister Benjamin Netanyahu said Sunday that it had become necessary to remove the network, calling it a ""Hamas mouthpiece.""

The Foreign Press Association in Israel criticized the order.

""With this decision, Israel joins a dubious club of authoritarian governments to ban the station,"" it said. ""This is a dark day for the media."" The New York-based Committee to Project Journalists similarly warned the move represented an ""extremely alarming precedent for restricting international media outlets working in Israel.""

JERUSALEM -- The U.N. children's agency says an Israeli ground operation in Rafah would pose ""catastrophic risks"" to children sheltering in the southern Gaza city.

UNICEF estimates some 600,000 children are in Rafah - roughly half the city's population. Most of those people are huddling in tents and overcrowded apartments after fleeing Israel's military offensive in other parts of the territory.

In a statement Monday, UNICEF warned that many of the children are ""highly vulnerable.""

It said an estimated 65,000 children suffer from a pre-existing disability and an estimated 175,000 children under the age of 5 suffer from one or more infectious diseases. Almost all children, it said require mental health services.

""More than 200 days of war have taken an unimaginable toll on the lives of children,"" said Catherine Russell, UNICEF's executive director. ""Rafah is now a city of children, who have nowhere safe to go in Gaza. If large scale military operations start, not only will children be at risk from the violence, but also from chaos and panic, and at a time where their physical and mental states are already weakened.""

UNICEF called for a lasting cease-fire and release of hostages held by Hamas.

WASHINGTON -- President Joe Biden and Israeli Prime Minister Benjamin Netanyahu spoke Monday morning, a White House official said, as Israel appeared closer to launching an offensive on the southern Gaza city of Rafah -- a move staunchly opposed by the U.S. on humanitarian grounds.

A National Security Council spokesperson said Biden reiterated U.S. concerns about an invasion of Rafah said he believes reaching a ceasefire with Hamas is the best way to protect the lives of Israeli hostages held in Gaza.

The two officials spoke on the condition of anonymity to discuss the call before an official White House statement was released.

The Biden administration, which provides Israel crucial military and diplomatic support, says it opposes a Rafah invasion unless Israel provides a ""credible"" plan for protecting civilians there.

The United Nations humanitarian aid agency has warned that hundreds of thousands of people would be ""at imminent risk of death"" if Israel carries out a military assault into Rafah. The city on the border with Egypt is a critical entry point for humanitarian aid and is filled with displaced Palestinians, many in densely packed tent camps.

___

Associated Press writer Zeke Miller contributed to this report.

CAIRO -- Egypt has urged Israel to ""exercise maximum restraint and avoid further escalation at this extremely sensitive time in the process of cease-fire negotiations.""

In a statement Monday, the Egyptian Foreign Ministry warned against Israel's imminent offensive in Gaza's southernmost city of Rafah. It says such an escalation will cause grave humanitarian risks to over a million Palestinians packed in the city.

The statement said Egypt continues to communicate with all parties to ""prevent the situation from getting worse or getting out of control.""

Egypt has been a key mediator in ongoing efforts to broker a cease-fire that would halt Israel's offensive in Gaza in exchange for the release of Israeli hostages held by Hamas.

BERLIN -- Germany and France have reiterated their opposition to Israel's planned offensive on Rafah in the south of the Gaza Strip.

A spokesperson for the German Foreign Office said Monday that more than 1 million people are currently living in the area, adding that ""these people need protection ... and the German government and the foreign minister have already said repeatedly in the past that a large-scale ground offensive on Rafah would be a humanitarian disaster.""

At the same time, the spokesperson, Kathrin Deschauer, condemned the continued attacks by Hamas on Israel from the Gaza Strip, and called for the release of over 100 people ""who are still held hostage by Hamas, who need to be freed.""

All sides must now make ""maximum efforts,"" she said, so that Palestinians in Gaza can be supplied with humanitarian goods and the hostages can be freed at the same time.

In Paris, the Foreign Ministry reiterated France's ""firm opposition to Israel's offensive in Rafah,"" saying more than 1.3 million people are ""in grave situation"" after seeking shelter there.

France warned that ""displacing civilian population by force constitutes a war crime under international law.""

The Foreign Ministry reiterated its position on the Israel-Hamas war, demanding an immediate release of Israeli hostages and a sustained cease-fire in Gaza to protect civilians.

On Sunday, French President Emmanuel Macron spoke with Israeli Prime Minister Netanyahu and urged him to follow through with the negotiations that could ''lead to the release of hostages, the protection of civilians by a cease-fire and regional de-escalation,'' according to Macron's office.

""'The destiny of the Palestinians of Gaza can no longer be subject to the terrorist actions of Hamas, and the Israeli operations should stop,'' Macron said, and reiterated his ''firmest opposition'' to an Israeli offensive in Rafah.

BEIRUT -- The militant Palestinian group Hamas warned Israel on Monday that any military operation in the southern city of Rafah in the Gaza Strip ""will not be a picnic.""

Hamas said in statement that Palestinian militant groups, led by Hamas' military wing, the Qassam Brigades, ""are ready to defend our people and defeat the enemy.""

The statement was the first official comment since the Israeli army ordered tens of thousands of Palestinians in Rafah to start evacuating, signaling that a long-promised ground invasion could be imminent.

Hamas called on the international community to move quickly ""to stop the crime that is threatening the lives of hundreds of thousands of civilians."" It also called on international agencies including the U.N. agency for Palestinian refugees to stay in Rafah and support the people there.

BEIRUT -- The Gaza Health Ministry said Monday the bodies of 52 people killed by Israeli strikes have been brought to local hospitals over the past 24 hours. Hospitals also received 90 wounded, it said in its daily report.

That brings the overall Palestinian death toll from the Israel-Hamas war to at least 34,735 the ministry said, and 78,108 wounded.

The Health Ministry does not distinguish between fighters and civilians in its tallies, but says that women and children make up around two-thirds of those killed.

The Israeli military says it has killed 13,000 militants, without providing evidence to back up the claim.

BEIRUT -- Dutch Foreign Minister Hanke Bruins Slot on Monday called for an urgent ""diplomatic solution"" to end intensifying clashes between the Lebanese Hezbollah militant group and the Israeli military along the tense Lebanon-Israel border.

""The Netherlands has grave concerns about rising tensions in the border region and intensified fighting, and we regret the loss of innocent civilian lives,"" Bruins Slot said following a meeting with her Lebanese counterpart, caretaker Foreign Minister Fouad Bou Habib in Beirut. ""And this has implications for Lebanon and the wider region.""

Israel, which sees Hezbollah as its most direct threat, has not ruled out a war in southern Lebanon. It estimates that the Iran-backed Shiite group has some 150,000 rockets and missiles aimed at the country. Hezbollah and Israel fought a monthlong war in 2006 that ended in a tense stalemate.

Western diplomats have scrambled to halt the hostilities. Hezbollah, and ally of the militant Palestinian group Hamas, has maintained that it would stop its attacks on northern Israel when the Hamas-Israel war ends.

JERUSALEM -- The Norwegian Refugee Council has condemned the Israeli army's ""forced, unlawful"" evacuation order in Rafah, saying that it could lead to ""the deadliest phase of this conflict.""

Jan Egeland, secretary-general of the international nonprofit organization, says there are not enough resources in Israel's self-declared Muwasi humanitarian zone, where the army instructed some 100,000 people in Rafah to relocate on Monday.

""The area is already overstretched and devoid of vital services,"" Egeland said.

He says his organization and other international humanitarian groups are struggling to provide essential support for Palestinians in Gaza. More than half of Gaza's 2.3 million residents are currently located in Rafah, while Israel's government has vowed to press on with a military operation in Gaza's southernmost city.

JERUSALEM -- The Israeli army says a fourth soldier has died from wounds sustained in a Hamas rocket attack on the border with Gaza.

Hamas launched at least 10 rockets toward soldiers positioned on the border Sunday, killing three other soldiers.

The attack occurred near Kerem Shalom, a major crossing point for international aid being delivered to Gaza, and came as Israel is preparing a possible invasion into the nearby Palestinian city of Rafah.

Israel has shuttered Kerem Shalom indefinitely, and on Monday, it began ordering civilians to evacuate parts of eastern Rafah, near the border, ahead of an expected military operation.

RAFAH, Gaza Strip -- The United Nations agency serving Palestinian refugees says it will not comply with an Israeli military order to evacuate parts of the southern Gaza city of Rafah.

Juliette Touma, communications director for UNRWA, says the agency has not evacuated the area and has no plans to do so. She says it has thousands of employees in the city.

""UNRWA will not take part in any forced evacuation of the population in Rafah or elsewhere in Gaza,"" she said. ""We are committed to staying and delivering humanitarian assistance."" She called for a cease-fire.

Relations between Israel and UNRWA have long been strained and further deteriorated during the seven-month war.

Israel has accused UNRWA of collaborating with the Hamas militant group and called for the agency's closure.

UNRWA, the largest international provider of aid and services in Gaza, denies the accusations.

BERLIN -- Germany's Foreign Office on Monday condemned the shutdown of Qatar's Al Jazeera satellite news network in Israel.

The Foreign Office wrote on X that ""a free and diverse press landscape is the cornerstone of every liberal democracy. In times of conflict especially, it is of crucial importance to protect the freedom of the press.""

""The decision of the Israeli authorities to shut down Al Jazeera in Israel is the wrong signal,"" the ministry said.

Germany has for decades been a staunch supporter of Israel. Berlin, however, has gradually shifted its tone as civilian casualties in Gaza have soared, becoming increasingly critical of the humanitarian situation in Gaza and speaking out against a ground offensive in Rafah.

JERUSALEM -- The Israeli army has ordered tens of thousands of people in the southern Gaza city of Rafah to begin evacuating, signaling that a long-promised ground invasion could be imminent.

The announcement on Monday complicated last-ditch efforts by international mediators, including the director of the CIA, to broker a cease-fire. Hamas and Qatar, a key mediator, have warned that an invasion of Rafah could derail the talks.

Israel has described Rafah as the last significant Hamas stronghold after seven months of war, and its leaders have repeatedly said they need to carry out a ground invasion to defeat the Islamic militant group.

Lt. Col. Nadav Shoshani, an army spokesman, said some 100,000 people were being ordered to move to a nearby Israel-declared humanitarian zone called Muwasi. He said Israel was preparing a ""limited scope operation"" and would not say whether this was the beginning of a broader invasion of the city. But last October, Israel did not formally announce the launch of a ground invasion that continues to this day.

BEIRUT -- An Israeli airstrike on northeastern Lebanon wounded three people and destroyed a building, Lebanon's state-run National News Agency says.

The strike on the village of Safri early Monday targeted a factory in the eastern Bekaa Valley, the agency said without giving further details.

The Israeli military said its fighter jets struck a Hezbollah military structure in Safri.

Monday's strike came after a tense day along the Lebanon-Israel border during which an Israeli airstrike on a village near the border killed four Lebanese civilians.

The militant Hezbollah group said it fired dozens of rockets in retaliation toward northern Israel.

The Lebanon-Israel border has seen almost daily exchange of fire since a day after the Israel-Hamas war started on Oct. 7.

Israeli strikes have killed more than 350 people in Lebanon, most of them fighters with Hezbollah and allied groups but also including more than 50 civilians. In Israel, strikes from Lebanon have killed at least 10 civilians and 12 soldiers.",[],"[{'uri': 'http://en.wikipedia.org/wiki/2014_Gaza_War', 'type': 'wiki', 'score': 5, 'label': {'eng': '2014 Gaza War'}}, {'uri': 'http://en.wikipedia.org/wiki/Presidency_of_Joe_Biden', 'type': 'wiki', 'score': 5, 'label': {'eng': 'Presidency of Joe Biden'}}, {'uri': 'http://en.wikipedia.org/wiki/2019_Turkish_offensive_into_north-eastern_Syria', 'type': 'wiki', 'score': 5, 'label': {'eng': '2019 Turkish offensive into north-eastern Syria'}}, {'uri': 'http://en.wikipedia.org/wiki/Rafah_Border_Crossing', 'type': 'wiki', 'score': 5, 'label': {'eng': 'Rafah Border Crossing'}}, {'uri': 'http://en.wikipedia.org/wiki/Palestinians', 'type': 'wiki', 'score': 5, 'label': {'eng': 'Palestinians'}}, {'uri': 'http://en.wikipedia.org/wiki/Cabinet_of_the_United_Kingdom', 'type': 'wiki', 'score': 5, 'label': {'eng': 'Cabinet of the United Kingdom'}}, {'uri': 'http://en.wikipedia.org/wiki/Ceasefire', 'type': 'wiki', 'score': 5, 'label': {'eng': 'Ceasefire'}}, {'uri': 'http://en.wikipedia.org/wiki/Military_operation', 'type': 'wiki', 'score': 5, 'label': {'eng': 'Military operation'}}, {'uri': 'http://en.wikipedia.org/wiki/Al_Jazeera', 'type': 'org', 'score': 5, 'label': {'eng': 'Al Jazeera'}}, {'uri': 'http://en.wikipedia.org/wiki/Hamas', 'type': 'org', 'score': 5, 'label': {'eng': 'Hamas'}}, {'uri': 'http://en.wikipedia.org/wiki/Benjamin_Netanyahu', 'type': 'person', 'score': 5, 'label': {'eng': 'Benjamin Netanyahu'}}, {'uri': 'http://en.wikipedia.org/wiki/Prime_Minister_of_Israel', 'type': 'wiki', 'score': 5, 'label': {'eng': 'Prime Minister of Israel'}}, {'uri': 'http://en.wikipedia.org/wiki/Israel_Defense_Forces', 'type': 'wiki', 'score': 5, 'label': {'eng': 'Israel Defense Forces'}}, {'uri': 'http://en.wikipedia.org/wiki/Humanitarian_aid', 'type': 'wiki', 'score': 5, 'label': {'eng': 'Humanitarian aid'}}, {'uri': 'http://en.wikipedia.org/wiki/Joe_Biden', 'type': 'person', 'score': 5, 'label': {'eng': 'Joe Biden'}}, {'uri': 'http://en.wikipedia.org/wiki/Hostage', 'type': 'wiki', 'score': 5, 'label': {'eng': 'Hostage'}}, {'uri': 'http://en.wikipedia.org/wiki/United_Nations', 'type': 'org', 'score': 5, 'label': {'eng': 'United Nations'}}, {'uri': 'http://en.wikipedia.org/wiki/White_House', 'type': 'wiki', 'score': 5, 'label': {'eng': 'White House'}}, {'uri': 'http://en.wikipedia.org/wiki/Gaza_Strip', 'type': 'loc', 'score': 5, 'label': {'eng': 'Gaza Strip'}, 'location': {'type': 'place', 'label': {'eng': 'Gaza Strip'}, 'country': {'type': 'country', 'label': {'eng': 'Palestine'}}}}, {'uri': 'http://en.wikipedia.org/wiki/Rafah', 'type': 'loc', 'score': 5, 'label': {'eng': 'Rafah'}, 'location': {'type': 'place', 'label': {'eng': 'Rafah'}, 'country': {'type': 'country', 'label': {'eng': 'Palestine'}}}}, {'uri': 'http://en.wikipedia.org/wiki/Qatar', 'type': 'loc', 'score': 5, 'label': {'eng': 'Qatar'}, 'location': {'type': 'country', 'label': {'eng': 'Qatar'}}}, {'uri': 'http://en.wikipedia.org/wiki/Israel', 'type': 'loc', 'score': 5, 'label': {'eng': 'Israel'}, 'location': {'type': 'country', 'label': {'eng': 'Israel'}}}, {'uri': 'http://en.wikipedia.org/wiki/Egypt', 'type': 'loc', 'score': 5, 'label': {'eng': 'Egypt'}, 'location': {'type': 'country', 'label': {'eng': 'Egypt'}}}, {'uri': 'http://en.wikipedia.org/wiki/Temple_Mount', 'type': 'wiki', 'score': 4, 'label': {'eng': 'Temple Mount'}}, {'uri': 'http://en.wikipedia.org/wiki/Gaza_City', 'type': 'loc', 'score': 4, 'label': {'eng': 'Gaza City'}, 'location': {'type': 'place', 'label': {'eng': 'Gaza City'}, 'country': {'type': 'country', 'label': {'eng': 'Palestine'}}}}, {'uri': 'http://en.wikipedia.org/wiki/Mortar_(weapon)', 'type': 'wiki', 'score': 4, 'label': {'eng': 'Mortar (weapon)'}}, {'uri': 'http://en.wikipedia.org/wiki/UNICEF', 'type': 'wiki', 'score': 4, 'label': {'eng': 'UNICEF'}}, {'uri': 'http://en.wikipedia.org/wiki/Recep_Tayyip_Erdoğan', 'type': 'person', 'score': 4, 'label': {'eng': 'Recep Tayyip Erdoğan'}}, {'uri': 'http://en.wikipedia.org/wiki/Tel_Aviv', 'type': 'loc', 'score': 4, 'label': {'eng': 'Tel Aviv'}, 'location': {'type': 'place', 'label': {'eng': 'Tel Aviv'}, 'country': {'type': 'country', 'label': {'eng': 'Israel'}}}}, {'uri': 'http://en.wikipedia.org/wiki/United_States', 'type': 'loc', 'score': 4, 'label': {'eng': 'United States'}, 'location': {'type': 'country', 'label': {'eng': 'United States'}}}, {'uri': 'http://en.wikipedia.org/wiki/Russian_invasion_of_Ukraine', 'type': 'wiki', 'score': 3, 'label': {'eng': 'Russian invasion of Ukraine'}}, {'uri': 'http://en.wikipedia.org/wiki/The_Holocaust', 'type': 'wiki', 'score': 3, 'label': {'eng': 'The Holocaust'}}, {'uri': 'http://en.wikipedia.org/wiki/Six-Day_War', 'type': 'wiki', 'score': 3, 'label': {'eng': 'Six-Day War'}}, {'uri': 'http://en.wikipedia.org/wiki/United_States_National_Security_Council', 'type': 'wiki', 'score': 3, 'label': {'eng': 'United States National Security Council'}}, {'uri': 'http://en.wikipedia.org/wiki/Beersheba', 'type': 'loc', 'score': 3, 'label': {'eng': 'Beersheba'}, 'location': {'type': 'place', 'label': {'eng': 'Beersheba'}, 'country': {'type': 'country', 'label': {'eng': 'Israel'}}}}, {'uri': 'http://en.wikipedia.org/wiki/Haifa', 'type': 'loc', 'score': 3, 'label': {'eng': 'Haifa'}, 'location': {'type': 'place', 'label': {'eng': 'Haifa'}, 'country': {'type': 'country', 'label': {'eng': 'Israel'}}}}, {'uri': 'http://en.wikipedia.org/wiki/Jerusalem', 'type': 'loc', 'score': 3, 'label': {'eng': 'Jerusalem'}, 'location': {'type': 'place', 'label': {'eng': 'Jerusalem'}, 'country': {'type': 'country', 'label': {'eng': 'Israel'}}}}, {'uri': 'http://en.wikipedia.org/wiki/Turkey', 'type': 'loc', 'score': 3, 'label': {'eng': 'Turkey'}, 'location': {'type': 'country', 'label': {'eng': 'Turkey'}}}, {'uri': 'http://en.wikipedia.org/wiki/John_Kirby_(admiral)', 'type': 'person', 'score': 2, 'label': {'eng': 'John Kirby (admiral)'}}, {'uri': 'http://en.wikipedia.org/wiki/Ismail_Haniyeh', 'type': 'person', 'score': 2, 'label': {'eng': 'Ismail Haniyeh'}}, {'uri': 'http://en.wikipedia.org/wiki/Deir_al-Balah', 'type': 'loc', 'score': 2, 'label': {'eng': 'Deir al-Balah'}, 'location': {'type': 'place', 'label': {'eng': 'Deir al-Balah'}, 'country': {'type': 'country', 'label': {'eng': 'Palestine'}}}}, {'uri': 'http://en.wikipedia.org/wiki/Hezbollah', 'type': 'org', 'score': 2, 'label': {'eng': 'Hezbollah'}}, {'uri': 'http://en.wikipedia.org/wiki/Western_world', 'type': 'loc', 'score': 2, 'label': {'eng': 'Western world'}, 'location': None}, {'uri': 'http://en.wikipedia.org/wiki/Middle_East', 'type': 'loc', 'score': 2, 'label': {'eng': 'Middle East'}, 'location': None}, {'uri': 'http://en.wikipedia.org/wiki/Washington,_D.C.', 'type': 'loc', 'score': 2, 'label': {'eng': 'Washington, D.C.'}, 'location': {'type': 'place', 'label': {'eng': 'Washington, D.C.'}, 'country': {'type': 'country', 'label': {'eng': 'United States'}}}}, {'uri': 'http://en.wikipedia.org/wiki/Ankara', 'type': 'loc', 'score': 2, 'label': {'eng': 'Ankara'}, 'location': {'type': 'place', 'label': {'eng': 'Ankara'}, 'country': {'type': 'country', 'label': {'eng': 'Turkey'}}}}, {'uri': 'http://en.wikipedia.org/wiki/France', 'type': 'loc', 'score': 2, 'label': {'eng': 'France'}, 'location': {'type': 'country', 'label': {'eng': 'France'}}}, {'uri': 'http://en.wikipedia.org/wiki/Germany', 'type': 'loc', 'score': 2, 'label': {'eng': 'Germany'}, 'location': {'type': 'country', 'label': {'eng': 'Germany'}}}, {'uri': 'http://en.wikipedia.org/wiki/Northern_District_(Israel)', 'type': 'loc', 'score': 1, 'label': {'eng': 'Northern District (Israel)'}, 'location': {'type': 'place', 'label': {'eng': 'Northern District (Israel)'}, 'country': {'type': 'country', 'label': {'eng': 'Israel'}}}}, {'uri': 'http://en.wikipedia.org/wiki/Caretaker_government', 'type': 'org', 'score': 1, 'label': {'eng': 'Caretaker government'}}, {'uri': 'http://en.wikipedia.org/wiki/Ministry_of_Foreign_Affairs_(Egypt)', 'type': 'org', 'score': 1, 'label': {'eng': 'Ministry of Foreign Affairs (Egypt)'}}, {'uri': 'http://en.wikipedia.org/wiki/Jan_Egeland', 'type': 'person', 'score': 1, 'label': {'eng': 'Jan Egeland'}}, {'uri': 'http://en.wikipedia.org/wiki/Emmanuel_Macron', 'type': 'person', 'score': 1, 'label': {'eng': 'Emmanuel Macron'}}, {'uri': 'http://en.wikipedia.org/wiki/Associated_Press', 'type': 'org', 'score': 1, 'label': {'eng': 'Associated Press'}}]",summary_large_image,eng-9541882,-0.317647059,452734711,1,hosted.ap.org,news,Associated Press,"2014 Gaza War Presidency of Joe Biden 2019 Turkish offensive into north-eastern Syria Rafah Border Crossing Palestinians Cabinet of the United Kingdom Ceasefire Military operation Al Jazeera Hamas Benjamin Netanyahu Prime Minister of Israel Israel Defense Forces Humanitarian aid Joe Biden Hostage United Nations White House Gaza Strip Rafah Qatar Israel Egypt Temple Mount Gaza City Mortar (weapon) UNICEF Recep Tayyip Erdoğan Tel Aviv United States Russian invasion of Ukraine The Holocaust Six-Day War United States National Security Council Beersheba Haifa Jerusalem Turkey John Kirby (admiral) Ismail Haniyeh Deir al-Balah Hezbollah Western world Middle East Washington, D.C. Ankara France Germany Northern District (Israel) Caretaker government Ministry of Foreign Affairs (Egypt) Jan Egeland Emmanuel Macron Associated Press",ap.org,4476,Chat-GPT,2024,5,6,38,23,2024-05-06
