,Unnamed: 0,uri,lang,isDuplicate,date,time,dateTime,dateTimePub,dataType,sim,url,title,body,authors,concepts,image,eventUri,sentiment,wgt,relevance,source.uri,source.dataType,source.title,all_concepts,url2,word_count,Category,year,month,day,min,hour,MD
216,9112,8115554393,eng,False,2024-05-07,12:31:10,5/7/2024 12:31,2024-05-07 12:30:35,news,0.788235307,http://hosted.ap.org/article/07f27c40c8712594b5488b6de80e84ce/latest-stormy-daniels-expected-appear-tuesday-witness,The Latest | Stormy Daniels is expected to appear Tuesday as a witness in Trump's hush money trial,"NEW YORK (AP) -- As the third week of witness testimony in Donald Trump's hush money trial takes place, all eyes are on who will be called next and whether the former president will be able to abide by the terms of his now twice-broken gag order that bars him from speaking publicly about jurors, witnesses and some others connected to the case.

Before Monday's testimony began, Judge Juan M. Merchan found Trump in contempt of court for a second time, fining him $1,000 for a single violation and sternly warning the loquacious former president that jail time would be considered for future violations ""if necessary and appropriate.""

Two people tied to the Trump Organization took the stand on Monday -- former controller Jeffrey McConney and accounts payable supervisor Deborah Tarasoff -- elaborating on a key piece of the charges against Trump: Michael Cohen's reimbursement for the $130,000 Stormy Daniels payment.

Tuesday's witness testimony is set to dig further into the events and people involved in what prosecutors have said was a scheme to influence the 2016 presidential election by buying and burying negative stories about the then-candidate.

The trial is in its 13th day.

Trump is accused of falsifying internal business records to cover up hush money payments -- including the payment to Daniels -- recording them instead as legal expenses.

Trump has pleaded not guilty to 34 felony counts of falsifying business records.

The case is the first-ever criminal trial of a former U.S. president and the first of four prosecutions of Trump to reach a jury.

An attorney for Stormy Daniels says the porn actor is expected to appear as a witness in Donald Trump's hush money trial on Tuesday.

Clark Brewster tells The Associated Press that Daniels, whose real name is Stephanie Clifford, is ""likely"" to be called as a witness in the trial on Tuesday.

Trump said earlier Tuesday that he was ""recently told"" who the witness would be on Tuesday and complained he should've been given more notice.

Assistant District Attorney Joshua Steinglass on Monday afternoon told Judge Juan M. Merchan in Donald Trump's hush money trial that the prosecution's case is proceeding ahead of schedule.

Steinglass said he estimates being finished with calling witnesses two weeks from Tuesday. While there's the possibility of rebuttal witnesses, the estimate is related to the primary portions of the trial.

Once the prosecution is done, Trump's lawyers can then call their witnesses.

The judge presiding over former President Donald Trump's hush money trial fined him $1,000 on Monday for again violating a gag order barring him from speaking publicly about jurors, witnesses and some others connected to the case.

Judge Juan M. Merchan warned Trump that additional gag order violations could potentially result in jail time.

""The last thing I want to do is put you in jail. You are the former president of the United States and possibly the next president as well,"" Merchan said. ""There are many reasons why incarceration is truly a last resort for me. To take that step would be disruptive to these proceedings.""

While prosecutors flagged four prospective violations, Merchan only concurred with one -- comments that Trump gave to a program called ""Just the News No Noise"" on April 22, which is broadcast on Real America's Voice.

On the program, Trump criticized the speed at which the jury was picked and claimed it was stacked with Democrats. ""The jury was picked so fast. 95 percent Democrats. The area's mostly all Democrat,"" he is quoted as saying.

Trump was fined $9,000 last week for nine earlier violations of the order.

Donald Trump was set to return to the courthouse in lower Manhattan on Tuesday for the 13th day of his hush money trial.

The third week of witness testimony began on Monday with two people tied to the Trump Organization taking the stand to elaborate on the hows and whys of Michael Cohen's financial reimbursement for a $130,000 hush money payment paid to lawyer Keith Davidson in exchange for porn actor Stormy Daniels' silence about a sexual encounter she said she had with Trump years earlier.

During the course of testimony, jurors saw notes, bank statements and other documents related to the financial reimbursement that is at the heart of the charges against the former president.

The 34 felony counts of falsifying business records accuse Trump of labeling the money paid to Cohen in his company's records as legal fees. Prosecutors contend that by paying him income and giving him extra to account for taxes, the Trump executives were able to conceal the reimbursement.",[],"[{'uri': 'http://en.wikipedia.org/wiki/Stormy_Daniels', 'type': 'person', 'score': 5, 'label': {'eng': 'Stormy Daniels'}}, {'uri': 'http://en.wikipedia.org/wiki/Hush_money', 'type': 'wiki', 'score': 5, 'label': {'eng': 'Hush money'}}, {'uri': 'http://en.wikipedia.org/wiki/Donald_Trump', 'type': 'person', 'score': 5, 'label': {'eng': 'Donald Trump'}}, {'uri': 'http://en.wikipedia.org/wiki/Gag_order', 'type': 'wiki', 'score': 4, 'label': {'eng': 'Gag order'}}, {'uri': 'http://en.wikipedia.org/wiki/The_Trump_Organization', 'type': 'org', 'score': 3, 'label': {'eng': 'The Trump Organization'}}, {'uri': 'http://en.wikipedia.org/wiki/Contempt_of_court', 'type': 'wiki', 'score': 3, 'label': {'eng': 'Contempt of court'}}, {'uri': 'http://en.wikipedia.org/wiki/2016_United_States_presidential_election', 'type': 'wiki', 'score': 3, 'label': {'eng': '2016 United States presidential election'}}, {'uri': 'http://en.wikipedia.org/wiki/Jury', 'type': 'wiki', 'score': 3, 'label': {'eng': 'Jury'}}, {'uri': 'http://en.wikipedia.org/wiki/Plea', 'type': 'wiki', 'score': 2, 'label': {'eng': 'Plea'}}, {'uri': 'http://en.wikipedia.org/wiki/Michael_Cohen_(lawyer)', 'type': 'wiki', 'score': 2, 'label': {'eng': 'Michael Cohen (lawyer)'}}, {'uri': 'http://en.wikipedia.org/wiki/Falsifying_business_records', 'type': 'wiki', 'score': 2, 'label': {'eng': 'Falsifying business records'}}, {'uri': 'http://en.wikipedia.org/wiki/District_attorney', 'type': 'wiki', 'score': 2, 'label': {'eng': 'District attorney'}}, {'uri': 'http://en.wikipedia.org/wiki/Criminal_procedure', 'type': 'wiki', 'score': 2, 'label': {'eng': 'Criminal procedure'}}, {'uri': 'http://en.wikipedia.org/wiki/Lawyer', 'type': 'wiki', 'score': 2, 'label': {'eng': 'Lawyer'}}, {'uri': 'http://en.wikipedia.org/wiki/Democratic_Party_(United_States)', 'type': 'org', 'score': 2, 'label': {'eng': 'Democratic Party (United States)'}}, {'uri': 'http://en.wikipedia.org/wiki/Felony', 'type': 'wiki', 'score': 2, 'label': {'eng': 'Felony'}}, {'uri': 'http://en.wikipedia.org/wiki/Clark_County,_Nevada', 'type': 'loc', 'score': 2, 'label': {'eng': 'Clark County, Nevada'}, 'location': {'type': 'place', 'label': {'eng': 'Clark County, Nevada'}, 'country': {'type': 'country', 'label': {'eng': 'United States'}}}}, {'uri': 'http://en.wikipedia.org/wiki/Lower_Manhattan', 'type': 'wiki', 'score': 1, 'label': {'eng': 'Lower Manhattan'}}, {'uri': 'http://en.wikipedia.org/wiki/Associated_Press', 'type': 'org', 'score': 1, 'label': {'eng': 'Associated Press'}}, {'uri': 'http://en.wikipedia.org/wiki/Davidson_County,_Tennessee', 'type': 'loc', 'score': 1, 'label': {'eng': 'Davidson County, Tennessee'}, 'location': {'type': 'place', 'label': {'eng': 'Davidson County, Tennessee'}, 'country': {'type': 'country', 'label': {'eng': 'United States'}}}}, {'uri': 'http://en.wikipedia.org/wiki/United_States', 'type': 'loc', 'score': 1, 'label': {'eng': 'United States'}, 'location': {'type': 'country', 'label': {'eng': 'United States'}}}]",summary_large_image,eng-9543332,-0.388235294,452781070,1,hosted.ap.org,news,Associated Press,"Stormy Daniels Hush money Donald Trump Gag order The Trump Organization Contempt of court 2016 United States presidential election Jury Plea Michael Cohen (lawyer) Falsifying business records District attorney Criminal procedure Lawyer Democratic Party (United States) Felony Clark County, Nevada Lower Manhattan Associated Press Davidson County, Tennessee United States",ap.org,763,Graph Neural Networks,2024,5,7,31,12,2024-05-07
217,9285,8115774528,eng,False,2024-05-07,14:47:23,5/7/2024 14:47,2024-05-07 14:47:02,news,0.717647076,http://hosted.ap.org/article/07f27c40c8712594b5488b6de80e84ce/latest-stormy-daniels-takes-witness-stand-trumps-hush,The Latest | Stormy Daniels takes the witness stand in Trump's hush money trial,"NEW YORK (AP) -- As the third week of witness testimony in Donald Trump's hush money trial takes place, all eyes are on who will be called next and whether the former president will be able to abide by the terms of his now twice-broken gag order that bars him from speaking publicly about jurors, witnesses and some others connected to the case.

Porn actor Stormy Daniels, whose real name is Stephanie Clifford, was called to the witness stand by mid-morning, following testimony of a Penguin Random House executive.

Before Monday's testimony began, Judge Juan M. Merchan found Trump in contempt of court for a second time, fining him $1,000 for a single violation and sternly warning the loquacious former president that jail time would be considered for future violations ""if necessary and appropriate.""

Two people tied to the Trump Organization took the stand on Monday -- former controller Jeffrey McConney and accounts payable supervisor Deborah Tarasoff -- elaborating on a key piece of the charges against Trump: Michael Cohen's reimbursement for the $130,000 Daniels payment.

Tuesday's witness testimony is set to dig further into the events and people involved in what prosecutors have said was a scheme to influence the 2016 presidential election by buying and burying negative stories about the then-candidate.

The trial is in its 13th day.

Trump is accused of falsifying internal business records to cover up hush money payments -- including the payment to Daniels -- recording them instead as legal expenses.

Trump has pleaded not guilty to 34 felony counts of falsifying business records.

The case is the first-ever criminal trial of a former U.S. president and the first of four prosecutions of Trump to reach a jury.

Stormy Daniels has been called to the witness stand in Donald Trump's hush money trial.

The porn actor was paid $130,000 in the final weeks of the 2016 presidential race to keep quiet about what she says was an awkward and unexpected sexual encounter with Trump at a celebrity golf outing in Lake Tahoe in July 2006.

Trump denies having sex with Daniels.

At the time of the payment, Trump and his campaign were reeling from the Oct. 7, 2016 publication of the never-before-seen 2005 ""Access Hollywood"" footage -- in which he boasted about grabbing women without their permission.

Michael Cohen, Trump's personal attorney, paid Daniels through a shell corporation he created and the deal was finalized on Nov. 1, 2016, just a week before Election Day.

Prosecutors have said that payments from Trump reimbursing Cohen were falsely -- and illegally -- logged as legal fees to cover up their actual purpose. Trump's lawyers contend the payments were legitimate legal expenses.

Over the objections of defense attorneys, prosecutors in Donald Trump's hush money trial on Tuesday introduced additional excerpts from one of his books, ""How to Get Rich,"" including an epigraph from Trump's mother and a page thanking the book's co-writer, Meredith McIver.

The line of questioning seems designed to undercut the defense's suggestion, made on cross-examination, that the books were written by a ghostwriter, with little involvement from Trump.

""Are quotes attributed to an author's mother typically written by a ghost writer or the author?"" Mangold asked.

""The author,"" Franklin replied.

While sitting in court Tuesday morning, Donald Trump's son Eric posted on the social platform X about his father's hush money trial, calling it ""unbelievable"" that a former president and current presidential candidate ""is being tried for 34 felonies (based on a bookkeepers entry who never spoke with the President and sat in New York while he was in the Oval Office 240 miles away from Washington DC).""

Sally Franklin, an executive at Penguin Random House, was the first witness to take the stand Tuesday in Donald Trump's hush money trial. One of the publishing house's imprints published a couple of Trump's books, ""Trump: How to Get Rich"" and ""Trump: Think Like a Billionaire.""

Prosecutor Becky Mangold began questioning by having Franklin read excerpts from the 2004 volume ""Trump: How to Get Rich"" that get at Trump's approach to business.

The readings appeared to be designed to show that Trump was hands-on at his company and willing to retaliate against those he perceived to have done him wrong.

Among the excerpts: ""If you don't know every aspect of what you're doing, down to the paper clips, you're setting yourself up for some unwanted surprises,"" and ""for many years, I've said that if someone screws you, screw them back.""

Testimony eventually moved on to excerpts from Trump's 2005 ""Trump: Think Like a Billionaire,"" including sections in praise of penny-pinching (""I call it financial smarts"") and keeping a close eye on bills.

As Trump lawyer Todd Blanche got his chance to cross-examine Franklin, he underscored that Trump worked with a writer on the manuscripts.

Judge Juan M. Merchan will allow limited testimony about Stormy Daniels' alleged sexual encounter with Donald Trump when she takes the stand in his hush money case.

Merchan agreed with the prosecution that the details will be necessary because of the porn actor's credibility concerns and past denials. Prosecutor Susan Hoffinger said that prosecutors intend to establish that Daniels and Trump did have intercourse but that the testimony ""will not involve descriptions of genitalia"" or other seamy details.

After court got underway in Donald Trump's criminal trial on Tuesday morning, Trump lawyer Susan Necheles asked that Stormy Daniels, who is expected to appear as a witness today, be barred from testifying about ""the details"" of her alleged sexual encounter with Trump. Necheles said it's irrelevant to ""a case about books and records.""

Prosecutor Susan Hoffinger countered that the details are important to buttress Daniels' credibility, which the defense has questioned. Hoffinger assured Judge Juan M. Merchan that the description of the alleged sexual act would be ""really basic,"" and would not ""involve any details of genitalia.""

Trump has denied having sex with Daniels.

Donald Trump spoke to reporters as he entered the courtroom Tuesday morning and read from a piece of paper he held that he said had statements of people commenting on television about the hush money case's weakness.

He then started defending some of the actions at the heart of the case, saying that paying his lawyer and listing it as a ""legal expense"" is what it was.

'We didn't put it down as construction costs,"" he said. ""The legal expense that we paid was put down as legal expense. There's nothing else you could say.""

Monday's testimony, from Trump Organization controller Jeffrey McConney, had focused on whether money paid to Michael Cohen -- reimbursing him for payments to Stormy Daniels -- was correctly logged as a legal expense.

Donald Trump has arrived at court in lower Manhattan for the 13th day of his hush money trial.

Ahead of his arrival, Trump dove back into local New York City news, posting on his social media network a complaint about a plan to charge a $15 toll to most drivers entering Manhattan's central business district. ""What office tenant or business would want to be here with this tax,"" Trump said.

An attorney for Stormy Daniels says the porn actor is expected to appear as a witness in Donald Trump's hush money trial on Tuesday.

Clark Brewster tells The Associated Press that Daniels, whose real name is Stephanie Clifford, is ""likely"" to be called as a witness in the trial on Tuesday.

Trump said earlier Tuesday that he was ""recently told"" who the witness would be on Tuesday and complained he should've been given more notice.

Assistant District Attorney Joshua Steinglass on Monday afternoon told Judge Juan M. Merchan in Donald Trump's hush money trial that the prosecution's case is proceeding ahead of schedule.

Steinglass said he estimates being finished with calling witnesses two weeks from Tuesday. While there's the possibility of rebuttal witnesses, the estimate is related to the primary portions of the trial.

Once the prosecution is done, Trump's lawyers can then call their witnesses.

The judge presiding over former President Donald Trump's hush money trial fined him $1,000 on Monday for again violating a gag order barring him from speaking publicly about jurors, witnesses and some others connected to the case.

Judge Juan M. Merchan warned Trump that additional gag order violations could potentially result in jail time.

""The last thing I want to do is put you in jail. You are the former president of the United States and possibly the next president as well,"" Merchan said. ""There are many reasons why incarceration is truly a last resort for me. To take that step would be disruptive to these proceedings.""

While prosecutors flagged four prospective violations, Merchan only concurred with one -- comments that Trump gave to a program called ""Just the News No Noise"" on April 22, which is broadcast on Real America's Voice.

On the program, Trump criticized the speed at which the jury was picked and claimed it was stacked with Democrats. ""The jury was picked so fast. 95 percent Democrats. The area's mostly all Democrat,"" he is quoted as saying.

Trump was fined $9,000 last week for nine earlier violations of the order.

Donald Trump was set to return to the courthouse in lower Manhattan on Tuesday for the 13th day of his hush money trial.

The third week of witness testimony began on Monday with two people tied to the Trump Organization taking the stand to elaborate on the hows and whys of Michael Cohen's financial reimbursement for a $130,000 hush money payment paid to lawyer Keith Davidson in exchange for porn actor Stormy Daniels' silence about a sexual encounter she said she had with Trump years earlier.

During the course of testimony, jurors saw notes, bank statements and other documents related to the financial reimbursement that is at the heart of the charges against the former president.

The 34 felony counts of falsifying business records accuse Trump of labeling the money paid to Cohen in his company's records as legal fees. Prosecutors contend that by paying him income and giving him extra to account for taxes, the Trump executives were able to conceal the reimbursement.",[],"[{'uri': 'http://en.wikipedia.org/wiki/Pornographic_film_actor', 'type': 'wiki', 'score': 5, 'label': {'eng': 'Pornographic film actor'}}, {'uri': 'http://en.wikipedia.org/wiki/Stormy_Daniels', 'type': 'person', 'score': 5, 'label': {'eng': 'Stormy Daniels'}}, {'uri': 'http://en.wikipedia.org/wiki/Hush_money', 'type': 'wiki', 'score': 5, 'label': {'eng': 'Hush money'}}, {'uri': 'http://en.wikipedia.org/wiki/Lawyer', 'type': 'wiki', 'score': 5, 'label': {'eng': 'Lawyer'}}, {'uri': 'http://en.wikipedia.org/wiki/Donald_Trump', 'type': 'person', 'score': 5, 'label': {'eng': 'Donald Trump'}}, {'uri': 'http://en.wikipedia.org/wiki/Franklin_County,_Ohio', 'type': 'loc', 'score': 5, 'label': {'eng': 'Franklin County, Ohio'}, 'location': {'type': 'place', 'label': {'eng': 'Franklin County, Ohio'}, 'country': {'type': 'country', 'label': {'eng': 'United States'}}}}, {'uri': 'http://en.wikipedia.org/wiki/Michael_Cohen_(lawyer)', 'type': 'wiki', 'score': 4, 'label': {'eng': 'Michael Cohen (lawyer)'}}, {'uri': 'http://en.wikipedia.org/wiki/Ghostwriter', 'type': 'person', 'score': 4, 'label': {'eng': 'Ghostwriter'}}, {'uri': 'http://en.wikipedia.org/wiki/Penguin_Random_House', 'type': 'wiki', 'score': 4, 'label': {'eng': 'Penguin Random House'}}, {'uri': 'http://en.wikipedia.org/wiki/2016_United_States_presidential_election', 'type': 'wiki', 'score': 4, 'label': {'eng': '2016 United States presidential election'}}, {'uri': 'http://en.wikipedia.org/wiki/Plea', 'type': 'wiki', 'score': 3, 'label': {'eng': 'Plea'}}, {'uri': 'http://en.wikipedia.org/wiki/The_Trump_Organization', 'type': 'org', 'score': 3, 'label': {'eng': 'The Trump Organization'}}, {'uri': 'http://en.wikipedia.org/wiki/Gag_order', 'type': 'wiki', 'score': 3, 'label': {'eng': 'Gag order'}}, {'uri': 'http://en.wikipedia.org/wiki/Access_(U.S._TV_series)', 'type': 'wiki', 'score': 3, 'label': {'eng': 'Access (U.S. TV series)'}}, {'uri': 'http://en.wikipedia.org/wiki/Contempt_of_court', 'type': 'wiki', 'score': 3, 'label': {'eng': 'Contempt of court'}}, {'uri': 'http://en.wikipedia.org/wiki/Election_Day_(United_States)', 'type': 'wiki', 'score': 3, 'label': {'eng': 'Election Day (United States)'}}, {'uri': 'http://en.wikipedia.org/wiki/Lake_Tahoe', 'type': 'loc', 'score': 3, 'label': {'eng': 'Lake Tahoe'}, 'location': None}, {'uri': 'http://en.wikipedia.org/wiki/Shell_corporation', 'type': 'wiki', 'score': 3, 'label': {'eng': 'Shell corporation'}}, {'uri': 'http://en.wikipedia.org/wiki/Cross-examination', 'type': 'wiki', 'score': 3, 'label': {'eng': 'Cross-examination'}}, {'uri': 'http://en.wikipedia.org/wiki/Criminal_procedure', 'type': 'wiki', 'score': 3, 'label': {'eng': 'Criminal procedure'}}, {'uri': 'http://en.wikipedia.org/wiki/Felony', 'type': 'wiki', 'score': 3, 'label': {'eng': 'Felony'}}, {'uri': 'http://en.wikipedia.org/wiki/Jury', 'type': 'wiki', 'score': 3, 'label': {'eng': 'Jury'}}, {'uri': 'http://en.wikipedia.org/wiki/Golf', 'type': 'wiki', 'score': 3, 'label': {'eng': 'Golf'}}, {'uri': 'http://en.wikipedia.org/wiki/Social_media', 'type': 'wiki', 'score': 3, 'label': {'eng': 'Social media'}}, {'uri': 'http://en.wikipedia.org/wiki/Oval_Office', 'type': 'wiki', 'score': 2, 'label': {'eng': 'Oval Office'}}, {'uri': 'http://en.wikipedia.org/wiki/New_York_(state)', 'type': 'wiki', 'score': 2, 'label': {'eng': 'New York (state)'}}, {'uri': 'http://en.wikipedia.org/wiki/Washington,_D.C.', 'type': 'loc', 'score': 2, 'label': {'eng': 'Washington, D.C.'}, 'location': {'type': 'place', 'label': {'eng': 'Washington, D.C.'}, 'country': {'type': 'country', 'label': {'eng': 'United States'}}}}, {'uri': 'http://en.wikipedia.org/wiki/Democratic_Party_(United_States)', 'type': 'org', 'score': 1, 'label': {'eng': 'Democratic Party (United States)'}}, {'uri': 'http://en.wikipedia.org/wiki/Associated_Press', 'type': 'org', 'score': 1, 'label': {'eng': 'Associated Press'}}, {'uri': 'http://en.wikipedia.org/wiki/Brewster_County,_Texas', 'type': 'loc', 'score': 1, 'label': {'eng': 'Brewster County, Texas'}, 'location': {'type': 'place', 'label': {'eng': 'Brewster County, Texas'}, 'country': {'type': 'country', 'label': {'eng': 'United States'}}}}, {'uri': 'http://en.wikipedia.org/wiki/Clark_County,_Nevada', 'type': 'loc', 'score': 1, 'label': {'eng': 'Clark County, Nevada'}, 'location': {'type': 'place', 'label': {'eng': 'Clark County, Nevada'}, 'country': {'type': 'country', 'label': {'eng': 'United States'}}}}, {'uri': 'http://en.wikipedia.org/wiki/New_York_City', 'type': 'loc', 'score': 1, 'label': {'eng': 'New York City'}, 'location': {'type': 'place', 'label': {'eng': 'New York City'}, 'country': {'type': 'country', 'label': {'eng': 'United States'}}}}, {'uri': 'http://en.wikipedia.org/wiki/Manhattan', 'type': 'loc', 'score': 1, 'label': {'eng': 'Manhattan'}, 'location': {'type': 'place', 'label': {'eng': 'Manhattan'}, 'country': {'type': 'country', 'label': {'eng': 'United States'}}}}, {'uri': 'http://en.wikipedia.org/wiki/United_States', 'type': 'loc', 'score': 1, 'label': {'eng': 'United States'}, 'location': {'type': 'country', 'label': {'eng': 'United States'}}}]",summary_large_image,eng-9543332,-0.341176471,452789243,1,hosted.ap.org,news,Associated Press,"Pornographic film actor Stormy Daniels Hush money Lawyer Donald Trump Franklin County, Ohio Michael Cohen (lawyer) Ghostwriter Penguin Random House 2016 United States presidential election Plea The Trump Organization Gag order Access (U.S. TV series) Contempt of court Election Day (United States) Lake Tahoe Shell corporation Cross-examination Criminal procedure Felony Jury Golf Social media Oval Office New York (state) Washington, D.C. Democratic Party (United States) Associated Press Brewster County, Texas Clark County, Nevada New York City Manhattan United States",ap.org,1683,Graph Neural Networks,2024,5,7,47,14,2024-05-07
