,Unnamed: 0,uri,lang,isDuplicate,date,time,dateTime,dateTimePub,dataType,sim,url,title,body,authors,concepts,image,eventUri,sentiment,wgt,relevance,source.uri,source.dataType,source.title,all_concepts,url2,word_count,Category,year,month,day,min,hour,MD
214,14475,8114534613,eng,False,2024-05-06,22:41:44,5/6/2024 22:41,2024-05-06 22:41:12,news,0.768627465,http://hosted.ap.org/article/d85423ad066fe41ac5783db5bd9ecffd/biden-speaks-netanyahu-israelis-appear-closer-major-rafah,Biden speaks with Netanyahu as Israelis appear closer to major Rafah offensive,"WASHINGTON (AP) -- President Joe Biden again urged Israeli Prime Minister Benjamin Netanyahu against launching an offensive in the southern Gaza city of Rafah as Israel on Monday appeared to be moving closer to a major offensive to root out Hamas militants.

But soon after Israel announced that it was ordering about 100,000 Palestinians to begin evacuating from Rafah, Hamas said in a statement it has accepted an Egyptian-Qatari proposal for a cease-fire to halt the seven-month-long war with Israel in Gaza.

Israeli military spokesman Rear Adm. Daniel Hagari said Israel will continue its operations in Gaza as officials deliberate the cease-fire proposal approved by Hamas. And the Israeli War Cabinet voted unanimously to approve a Rafah military operation but will continue cease-fire efforts.

The Israeli military also said it was conducting ""targeted strikes"" against Hamas in eastern Rafah. The nature of the strikes was not immediately known, but the move appeared aimed at keeping the pressure on as talks continue.

Biden administration officials on Monday continued to express concerns to the Israelis that a major military operation into Rafah's densely populated areas could be catastrophic.

White House officials on Monday also were privately concerned about the latest strikes on Rafah -- though they did not appear to be the widescale attack Netanyahu has been threatening, according to a person familiar with administration thinking who was not authorized to comment publicly.

White House national security spokesman John Kirby said that Biden had been briefed on Hamas' response. CIA Director William Burns, who was in Qatar for hostage talks with regional officials, was discussing the Hamas statement with allies in the region. Kirby declined to discuss the parameters of what Hamas is saying it has agreed to.

""Bill Burns is looking at that response. He's talking to the Israelis about it,"" Kirby told reporters. ""And we'll see where this goes. Hopefully, it can lead to those hostages getting out real, real soon.""

In recent days, Egyptian and Hamas officials have said the cease-fire would take place in a series of stages during which Hamas would release hostages it is holding in exchange for Israeli troop pullbacks from Gaza.

Top Biden administration officials have been publicly pressing Hamas to accept what they have described as a generous offer by the Israelis that would also lead to an extended truce and the release of Palestinian prisoners being held in Israeli prisons and perhaps lay the groundwork for a permanent end to the current conflict.

The White House said Biden in a Monday morning phone call with Netanyahu underscored U.S. concerns about an invasion of Rafah, where more than 1 million civilians from other parts of Gaza are sheltering as the war sparked by Hamas' Oct. 7 attack on Israel has led to the deaths of more than 34,000 Palestinians and deprivation in the territory.

Biden told Netanyahu he still believes reaching a cease-fire with Hamas is the best way to protect the lives of Israeli hostages held in Gaza, officials said. Israel says Hamas is holding about 100 hostages and the remains of more than 30 others in Gaza.

The leaders' call occurred before Hamas announced it had accepted a cease-fire proposal.

""The president was consistent again this morning that we don't support ground operations in Rafah,"" Kirby said.

The latest developments come as Biden hosted King Abdullah II of Jordan for a private lunch meeting at the White House on Monday to discuss the war and hostage talks. Jordan's embassy in Washington said in a posting on the social media site X following the leaders' meeting that Abdullah warned that an Israeli operation on Rafah ""threatens to lead to a new massacre.""

On Sunday, Netanyahu rejected international pressure to halt the war in Gaza in a fiery speech marking the country's annual Holocaust memorial day, declaring, ""If Israel is forced to stand alone, Israel will stand alone.""

""I say to the leaders of the world: No amount of pressure, no decision by any international forum will stop Israel from defending itself,"" he said, speaking in English. ""Never again is now.""

The Israeli army ordered about 100,000 Palestinians on Monday to begin evacuating from Rafah, signaling that a ground invasion there could be imminent and further complicating efforts to broker a cease-fire.

Tensions escalated Sunday when Hamas fired rockets at Israeli troops positioned on the border with Gaza near Israel's main crossing for delivering humanitarian aid, killing four soldiers. Meanwhile, Israeli airstrikes on Rafah killed 22 people, including children and two infants, according to a hospital.

Netanyahu also told Biden that he would ensure the Kerem Shalom crossing between Gaza and Israel would remain open for humanitarian aid deliveries, according to the White House.

Israeli officials last week briefed Biden administration officials on a plan to evacuate Palestinian civilians ahead of a potential operation, according to U.S. officials familiar with the matter.

The officials, who were not authorized to comment publicly and requested anonymity to speak about the sensitive exchange, said the plan detailed by the Israelis did not change the U.S. administration's view that moving forward with an operation in Rafah would put too many innocent Palestinian civilians at risk.

Pentagon press secretary Maj. Gen. Pat Ryder said Defense Secretary Lloyd Austin had previously stressed with Israeli Defense Minister Yoav Gallant that Israel needed a ""credible plan"" to evacuate those civilians and maintain humanitarian aid. Ryder said Austin had seen ""the concepts"" from the Israelis on their plan for an operation in Rafah ""but nothing detailed at this point.""

Israeli officials said those being ordered evacuated would move from parts of Rafah to a nearby Israel-declared humanitarian zone called Muwasi, a makeshift camp on the coast.

___

AP writers Tara Copp in Washington and Josef Federman in Jerusalem contributed reporting.",[],"[{'uri': 'http://en.wikipedia.org/wiki/Palestinians', 'type': 'wiki', 'score': 5, 'label': {'eng': 'Palestinians'}}, {'uri': 'http://en.wikipedia.org/wiki/Ceasefire', 'type': 'wiki', 'score': 5, 'label': {'eng': 'Ceasefire'}}, {'uri': 'http://en.wikipedia.org/wiki/Hamas', 'type': 'org', 'score': 5, 'label': {'eng': 'Hamas'}}, {'uri': 'http://en.wikipedia.org/wiki/Gaza_City', 'type': 'loc', 'score': 5, 'label': {'eng': 'Gaza City'}, 'location': {'type': 'place', 'label': {'eng': 'Gaza City'}, 'country': {'type': 'country', 'label': {'eng': 'Palestine'}}}}, {'uri': 'http://en.wikipedia.org/wiki/Benjamin_Netanyahu', 'type': 'person', 'score': 5, 'label': {'eng': 'Benjamin Netanyahu'}}, {'uri': 'http://en.wikipedia.org/wiki/Israel_Defense_Forces', 'type': 'wiki', 'score': 5, 'label': {'eng': 'Israel Defense Forces'}}, {'uri': 'http://en.wikipedia.org/wiki/Joe_Biden', 'type': 'person', 'score': 5, 'label': {'eng': 'Joe Biden'}}, {'uri': 'http://en.wikipedia.org/wiki/Hostage', 'type': 'wiki', 'score': 5, 'label': {'eng': 'Hostage'}}, {'uri': 'http://en.wikipedia.org/wiki/White_House', 'type': 'wiki', 'score': 5, 'label': {'eng': 'White House'}}, {'uri': 'http://en.wikipedia.org/wiki/Rafah', 'type': 'loc', 'score': 5, 'label': {'eng': 'Rafah'}, 'location': {'type': 'place', 'label': {'eng': 'Rafah'}, 'country': {'type': 'country', 'label': {'eng': 'Palestine'}}}}, {'uri': 'http://en.wikipedia.org/wiki/Israel', 'type': 'loc', 'score': 5, 'label': {'eng': 'Israel'}, 'location': {'type': 'country', 'label': {'eng': 'Israel'}}}, {'uri': 'http://en.wikipedia.org/wiki/William_J._Burns_(diplomat)', 'type': 'wiki', 'score': 4, 'label': {'eng': 'William J. Burns (diplomat)'}}, {'uri': 'http://en.wikipedia.org/wiki/Presidency_of_Joe_Biden', 'type': 'wiki', 'score': 4, 'label': {'eng': 'Presidency of Joe Biden'}}, {'uri': 'http://en.wikipedia.org/wiki/Military_operation', 'type': 'wiki', 'score': 4, 'label': {'eng': 'Military operation'}}, {'uri': 'http://en.wikipedia.org/wiki/2021_Taliban_offensive', 'type': 'wiki', 'score': 3, 'label': {'eng': '2021 Taliban offensive'}}, {'uri': 'http://en.wikipedia.org/wiki/Six-Day_War', 'type': 'wiki', 'score': 3, 'label': {'eng': 'Six-Day War'}}, {'uri': 'http://en.wikipedia.org/wiki/Izz_ad-Din_al-Qassam_Brigades', 'type': 'wiki', 'score': 3, 'label': {'eng': 'Izz ad-Din al-Qassam Brigades'}}, {'uri': 'http://en.wikipedia.org/wiki/Prime_Minister_of_Israel', 'type': 'wiki', 'score': 3, 'label': {'eng': 'Prime Minister of Israel'}}, {'uri': 'http://en.wikipedia.org/wiki/National_security', 'type': 'wiki', 'score': 3, 'label': {'eng': 'National security'}}, {'uri': 'http://en.wikipedia.org/wiki/Cabinet_(government)', 'type': 'wiki', 'score': 3, 'label': {'eng': 'Cabinet (government)'}}, {'uri': 'http://en.wikipedia.org/wiki/Washington,_D.C.', 'type': 'loc', 'score': 3, 'label': {'eng': 'Washington, D.C.'}, 'location': {'type': 'place', 'label': {'eng': 'Washington, D.C.'}, 'country': {'type': 'country', 'label': {'eng': 'United States'}}}}, {'uri': 'http://en.wikipedia.org/wiki/John_Kirby_(admiral)', 'type': 'person', 'score': 2, 'label': {'eng': 'John Kirby (admiral)'}}, {'uri': 'http://en.wikipedia.org/wiki/Director_of_the_Central_Intelligence_Agency', 'type': 'wiki', 'score': 2, 'label': {'eng': 'Director of the Central Intelligence Agency'}}, {'uri': 'http://en.wikipedia.org/wiki/Abdullah_II_of_Jordan', 'type': 'person', 'score': 2, 'label': {'eng': 'Abdullah II of Jordan'}}, {'uri': 'http://en.wikipedia.org/wiki/Qatar', 'type': 'loc', 'score': 2, 'label': {'eng': 'Qatar'}, 'location': {'type': 'country', 'label': {'eng': 'Qatar'}}}, {'uri': 'http://en.wikipedia.org/wiki/Egypt', 'type': 'loc', 'score': 2, 'label': {'eng': 'Egypt'}, 'location': {'type': 'country', 'label': {'eng': 'Egypt'}}}, {'uri': 'http://en.wikipedia.org/wiki/2014_Gaza_War', 'type': 'wiki', 'score': 1, 'label': {'eng': '2014 Gaza War'}}, {'uri': 'http://en.wikipedia.org/wiki/The_Holocaust', 'type': 'wiki', 'score': 1, 'label': {'eng': 'The Holocaust'}}, {'uri': 'http://en.wikipedia.org/wiki/Lloyd_Austin', 'type': 'person', 'score': 1, 'label': {'eng': 'Lloyd Austin'}}, {'uri': 'http://en.wikipedia.org/wiki/Ministry_of_Defense_(Israel)', 'type': 'wiki', 'score': 1, 'label': {'eng': 'Ministry of Defense (Israel)'}}, {'uri': 'http://en.wikipedia.org/wiki/United_States_Secretary_of_Defense', 'type': 'wiki', 'score': 1, 'label': {'eng': 'United States Secretary of Defense'}}, {'uri': 'http://en.wikipedia.org/wiki/Major_general', 'type': 'wiki', 'score': 1, 'label': {'eng': 'Major general'}}, {'uri': 'http://en.wikipedia.org/wiki/Associated_Press', 'type': 'org', 'score': 1, 'label': {'eng': 'Associated Press'}}, {'uri': 'http://en.wikipedia.org/wiki/Jerusalem', 'type': 'loc', 'score': 1, 'label': {'eng': 'Jerusalem'}, 'location': {'type': 'place', 'label': {'eng': 'Jerusalem'}, 'country': {'type': 'country', 'label': {'eng': 'Israel'}}}}]",summary_large_image,eng-9541882,-0.364705882,452731304,1,hosted.ap.org,news,Associated Press,"Palestinians Ceasefire Hamas Gaza City Benjamin Netanyahu Israel Defense Forces Joe Biden Hostage White House Rafah Israel William J. Burns (diplomat) Presidency of Joe Biden Military operation 2021 Taliban offensive Six-Day War Izz ad-Din al-Qassam Brigades Prime Minister of Israel National security Cabinet (government) Washington, D.C. John Kirby (admiral) Director of the Central Intelligence Agency Abdullah II of Jordan Qatar Egypt 2014 Gaza War The Holocaust Lloyd Austin Ministry of Defense (Israel) United States Secretary of Defense Major general Associated Press Jerusalem",ap.org,958,Chat-GPT,2024,5,6,41,22,2024-05-06
