,uri,lang,isDuplicate,date,time,dateTime,dateTimePub,dataType,sim,url,title,body,authors,concepts,image,eventUri,sentiment,wgt,relevance,source.uri,source.dataType,source.title,all_concepts,con-name,country,lang-name,language,Political-Alignment,wiki-url,Cultural-Class,Economic-Class,Continent-name,Continent,Religions,2019Rank-From,SafetyandSecurity,PersonalFreedom,Governance,SocialCapital,InvestmentEnvironment,EnterpriseConditions,MarketAccessandInfrastructure,EconomicQuality,LivingConditions,Health,Education,NaturalEnvironment,PowerDistance,Individualism,Masculinity,UncertaintyAvoidance,LongTermOrientation,Indulgence,economicblocs-name,economicblocs,militarydefenseblocs-name,militarydefenseblocs,politicalregionalblocs-name,politicalregionalblocs,linguisticblocs-name,linguisticblocs,proScore,destination,parent,count,status,year,month,day,min,hour,MD
220,7444656266,eng,False,2023-03-13,13:24:00,2023-03-13 13:24:00,2023-03-13T13:19:00Z,news,0.8039215803146362,https://www.irishtimes.com/world/africa/2023/03/13/at-least-17-dead-in-mozambique-and-malawi-after-tropical-storm-freddy/,At least 17 dead in Mozambique and Malawi after Tropical Storm Freddy,"Freddy is one of strongest storms ever recorded in southern hemisphere and could be longest-lasting tropical cyclone

Mozambique and Malawi were on Monday counting the cost of Tropical Storm Freddy, which ripped through southern Africa for the second time in a month over the weekend, leaving a trail of destruction and killing at least 17 people.

Freddy is one of the strongest storms ever recorded in the southern hemisphere and could be the longest-lasting tropical cyclone, according to the World Meteorological Organization.

It pummelled central Mozambique on Saturday, ripping roofs off buildings and bringing widespread flooding around the port of Quelimane, before moving inland towards Malawi with torrential rains that caused landslides.

The full extent of the damage and loss of life in Mozambique in particular is not yet clear, as the power supply and phone signals were cut off in some parts of the affected area.

In Malawi's second-largest city Blantyre, at least 11 people were killed and 16 are missing, police spokesman Peter Kalaya told Reuters, adding that those numbers were likely to rise as so far casualties were only in for Blantyre and the storm had affected 10 districts.

He said rescue teams were looking for people in Chilobwe and Ndirande, two of the worst-affected townships in Blantyre, where it was still raining on Monday and many residents were without power.

""Some missing people are feared buried in rubble,"" Kalaya said.

At least six people died in Mozambique port Quelimane, which was right in the eye of the storm, authorities announced on the public broadcaster on Monday.

The total number killed by storm Freddy in Mozambique, Malawi and Madagascar since it first made landfall last month is now at least 44.

Guy Taylor, chief of advocacy, communications and partnerships for United Nations children's agency Unicef in Mozambique, told Reuters from Quelimane that humanitarian agencies in Mozambique did not currently have the capacity to deal with a disaster of this size.

""We saw a lot of destroyed buildings and clinics. People's homes had their roofs torn off by the wind. Even before the cyclone hit we saw localised flooding,"" he said.

He said the wind had died down on Monday but there was still a lot of flooding that had destroyed crops and created a risk of waterborne diseases.

Mozambique has seen more than a year's worth of rainfall in the past four weeks, prompting concern that rivers could burst their banks and cause wide-scale flooding.

Malawi has been battling the deadliest cholera outbreak in its history, and UN agencies have warned the situation could worsen because of Freddy's heavy rains. Scientists say climate change is making tropical storms stronger, as oceans absorb heat from greenhouse gas emissions and when warm seawater evaporates heat energy is transferred to the atmosphere. - Reuters",[],"[{'uri': 'http://en.wikipedia.org/wiki/Southern_Hemisphere', 'type': 'wiki', 'score': 5, 'label': {'eng': 'Southern Hemisphere'}}, {'uri': 'http://en.wikipedia.org/wiki/Mozambique', 'type': 'loc', 'score': 5, 'label': {'eng': 'Mozambique'}, 'location': {'type': 'country', 'label': {'eng': 'Mozambique'}}}, {'uri': 'http://en.wikipedia.org/wiki/Malawi', 'type': 'loc', 'score': 5, 'label': {'eng': 'Malawi'}, 'location': {'type': 'country', 'label': {'eng': 'Malawi'}}}, {'uri': 'http://en.wikipedia.org/wiki/Tropical_cyclone', 'type': 'wiki', 'score': 4, 'label': {'eng': 'Tropical cyclone'}}, {'uri': 'http://en.wikipedia.org/wiki/Quelimane', 'type': 'loc', 'score': 4, 'label': {'eng': 'Quelimane'}, 'location': {'type': 'place', 'label': {'eng': 'Quelimane'}, 'country': {'type': 'country', 'label': {'eng': 'Mozambique'}}}}, {'uri': 'http://en.wikipedia.org/wiki/Blantyre', 'type': 'loc', 'score': 4, 'label': {'eng': 'Blantyre'}, 'location': {'type': 'place', 'label': {'eng': 'Blantyre'}, 'country': {'type': 'country', 'label': {'eng': 'Malawi'}}}}, {'uri': 'http://en.wikipedia.org/wiki/Southern_Africa', 'type': 'loc', 'score': 3, 'label': {'eng': 'Southern Africa'}, 'location': None}, {'uri': 'http://en.wikipedia.org/wiki/World_Meteorological_Organization', 'type': 'org', 'score': 3, 'label': {'eng': 'World Meteorological Organization'}}, {'uri': 'http://en.wikipedia.org/wiki/Flood', 'type': 'wiki', 'score': 3, 'label': {'eng': 'Flood'}}, {'uri': 'http://en.wikipedia.org/wiki/Port', 'type': 'wiki', 'score': 3, 'label': {'eng': 'Port'}}, {'uri': 'http://en.wikipedia.org/wiki/Landslide', 'type': 'wiki', 'score': 2, 'label': {'eng': 'Landslide'}}, {'uri': 'http://en.wikipedia.org/wiki/Waterborne_diseases', 'type': 'wiki', 'score': 1, 'label': {'eng': 'Waterborne diseases'}}, {'uri': 'http://en.wikipedia.org/wiki/Evaporation', 'type': 'wiki', 'score': 1, 'label': {'eng': 'Evaporation'}}, {'uri': 'http://en.wikipedia.org/wiki/Landfall', 'type': 'wiki', 'score': 1, 'label': {'eng': 'Landfall'}}, {'uri': 'http://en.wikipedia.org/wiki/Seawater', 'type': 'wiki', 'score': 1, 'label': {'eng': 'Seawater'}}, {'uri': 'http://en.wikipedia.org/wiki/Cholera', 'type': 'wiki', 'score': 1, 'label': {'eng': 'Cholera'}}, {'uri': 'http://en.wikipedia.org/wiki/UNICEF', 'type': 'org', 'score': 1, 'label': {'eng': 'UNICEF'}}, {'uri': 'http://en.wikipedia.org/wiki/Ocean', 'type': 'wiki', 'score': 1, 'label': {'eng': 'Ocean'}}, {'uri': 'http://en.wikipedia.org/wiki/Greenhouse_gas_emissions', 'type': 'wiki', 'score': 1, 'label': {'eng': 'Greenhouse gas emissions'}}, {'uri': 'http://en.wikipedia.org/wiki/River', 'type': 'wiki', 'score': 1, 'label': {'eng': 'River'}}, {'uri': 'http://en.wikipedia.org/wiki/Climate_change', 'type': 'wiki', 'score': 1, 'label': {'eng': 'Climate change'}}, {'uri': 'http://en.wikipedia.org/wiki/Cyclone', 'type': 'wiki', 'score': 1, 'label': {'eng': 'Cyclone'}}, {'uri': 'http://en.wikipedia.org/wiki/Rain', 'type': 'wiki', 'score': 1, 'label': {'eng': 'Rain'}}, {'uri': 'http://en.wikipedia.org/wiki/Heat', 'type': 'wiki', 'score': 1, 'label': {'eng': 'Heat'}}, {'uri': 'http://en.wikipedia.org/wiki/United_Nations', 'type': 'org', 'score': 1, 'label': {'eng': 'United Nations'}}, {'uri': 'http://en.wikipedia.org/wiki/Atmosphere', 'type': 'wiki', 'score': 1, 'label': {'eng': 'Atmosphere'}}, {'uri': 'http://en.wikipedia.org/wiki/Reuters', 'type': 'wiki', 'score': 1, 'label': {'eng': 'Reuters'}}, {'uri': 'http://en.wikipedia.org/wiki/Madagascar', 'type': 'loc', 'score': 1, 'label': {'eng': 'Madagascar'}, 'location': {'type': 'country', 'label': {'eng': 'Madagascar'}}}]",https://www.irishtimes.com/resizer/QTs_AKQpfikudHUrwL0KMwLESAQ=/1200x630/filters:format(jpg):quality(70):focal(982x360:992x370)/cloudfront-eu-central-1.images.arcpublishing.com/irishtimes/OXTFHDT6KPJLYB4G5MH46HXLQ4.jpg,eng-8467663,-0.3333333333333334,416409840,1,irishtimes.com,news,The Irish Times,Southern Hemisphere Mozambique Malawi Tropical cyclone Quelimane Blantyre Southern Africa World Meteorological Organization Flood Port Landslide Waterborne diseases Evaporation Landfall Seawater Cholera UNICEF Ocean Greenhouse gas emissions River Climate change Cyclone Rain Heat United Nations Atmosphere Reuters Madagascar,Ireland,IE,,,,,C4,C2,Europe,EU,Christian,11.0,11.0,8.0,13.0,16.0,14.0,16.0,24.0,4.0,19.0,23.0,12.0,17.0,28.0,70.0,68.0,35.0,24.0,65.0,European Union (EU),EU,,,,,English-speaking,Eng,-1,,,0,False,2023,3,13,24,13,2023-03-13
119,7445265440,eng,False,2023-03-13,20:46:00,2023-03-13 20:46:00,2023-03-13T20:45:00Z,news,0.729411780834198,https://www.belfasttelegraph.co.uk/news/world-news/death-toll-climbs-as-cyclone-freddy-hits-malawi-and-mozambique/1983352732.html,Death toll climbs as Cyclone Freddy hits Malawi and Mozambique,"Local police said 51 people in Malawi, including 36 in Chilobwe in the financial hub of Blantyre in the centre of the country, have died, with several others missing or injured.

Authorities in Mozambique reported that five people had been killed in the country since Saturday.

The deaths in Malawi include five members of a single family who died in Blantyre's Ndirande township after Freddy's destructive winds and heavy rains demolished their house, according to a police report.

A three-year-old child who was ""trapped in the debris"" is also among the victims, with her parents among those reported missing, authorities also said.

""We suspect that this figure will rise as we are trying to compile one national report from our south-west, south-east and eastern police offices which cover the affected areas,"" Malawi police spokesperson Peter Kalaya told The Associated Press.

The cyclone lashed over Mozambique and Malawi over the weekend and into Monday.

It is the second time the record-breaking cyclone - which has been causing destruction in southern Africa since late February - made landfall in mainland Africa.

It also pummelled the island states of Madagascar and Reunion as it traversed across the ocean.

The cyclone has intensified a record seven times and has the highest-ever recorded accumulated cyclone energy, or ACE, which is a measurement of how much energy a cyclone has released over time.

Freddy recorded more energy over its lifetime than an entire typical US hurricane season.

Freddy first developed near Australia in early February and travelled across the entire southern Indian Ocean.

It is set to be the longest-ever recorded tropical cyclone.

The UN's weather agency has convened an expert panel to determine whether it has broken the record set by Hurricane John in 1994 of 31 days.

Freddy made landfall in the seaport of Quelimane in Mozambique on Saturday where there are reports of damage to houses and farmlands, although the extent of the destruction is not yet clear.

Telecommunications and other essential infrastructure are still cut off in much of the affected Zambezia province, impeding rescue and other humanitarian efforts.

French weather agency Meteo-France's regional tropical cyclone monitoring centre in Reunion warned on Monday that ""the heaviest rains will continue over the next 48 hours"" as Freddy barrels on.

Mozambique's central provinces and Malawi have been identified as especially vulnerable to ""floods and landslides in mountainous areas"" by weather monitors.

Much of the damage experienced in Malawi is in homes built in areas prohibited by law such as in mountainous regions or near rivers where they are battling landslides, unprecedented flooding and rivers bursting their banks.

The cyclone has forced the Malawian government to suspend schools in 10 districts in its southern region ""as a precautionary measure"".

Freddy is expected to weaken and to exit back to sea on Wednesday, according to Meteo-France.",[],"[{'uri': 'http://en.wikipedia.org/wiki/Cyclone', 'type': 'wiki', 'score': 5, 'label': {'eng': 'Cyclone'}}, {'uri': 'http://en.wikipedia.org/wiki/Blantyre', 'type': 'loc', 'score': 5, 'label': {'eng': 'Blantyre'}, 'location': {'type': 'place', 'label': {'eng': 'Blantyre'}, 'country': {'type': 'country', 'label': {'eng': 'Malawi'}}}}, {'uri': 'http://en.wikipedia.org/wiki/Mozambique', 'type': 'loc', 'score': 5, 'label': {'eng': 'Mozambique'}, 'location': {'type': 'country', 'label': {'eng': 'Mozambique'}}}, {'uri': 'http://en.wikipedia.org/wiki/Malawi', 'type': 'loc', 'score': 5, 'label': {'eng': 'Malawi'}, 'location': {'type': 'country', 'label': {'eng': 'Malawi'}}}, {'uri': 'http://en.wikipedia.org/wiki/Landfall', 'type': 'wiki', 'score': 3, 'label': {'eng': 'Landfall'}}, {'uri': 'http://en.wikipedia.org/wiki/Financial_centre', 'type': 'wiki', 'score': 3, 'label': {'eng': 'Financial centre'}}, {'uri': 'http://en.wikipedia.org/wiki/Township', 'type': 'wiki', 'score': 3, 'label': {'eng': 'Township'}}, {'uri': 'http://en.wikipedia.org/wiki/Tropical_cyclone', 'type': 'wiki', 'score': 3, 'label': {'eng': 'Tropical cyclone'}}, {'uri': 'http://en.wikipedia.org/wiki/Accumulated_cyclone_energy', 'type': 'wiki', 'score': 2, 'label': {'eng': 'Accumulated cyclone energy'}}, {'uri': 'http://en.wikipedia.org/wiki/Southern_Africa', 'type': 'loc', 'score': 2, 'label': {'eng': 'Southern Africa'}, 'location': None}, {'uri': 'http://en.wikipedia.org/wiki/South_India', 'type': 'wiki', 'score': 2, 'label': {'eng': 'South India'}}, {'uri': 'http://en.wikipedia.org/wiki/Africa', 'type': 'loc', 'score': 2, 'label': {'eng': 'Africa'}, 'location': None}, {'uri': 'http://en.wikipedia.org/wiki/United_States', 'type': 'loc', 'score': 2, 'label': {'eng': 'United States'}, 'location': {'type': 'country', 'label': {'eng': 'United States'}}}, {'uri': 'http://en.wikipedia.org/wiki/Réunion', 'type': 'loc', 'score': 2, 'label': {'eng': 'Réunion'}, 'location': {'type': 'country', 'label': {'eng': 'Réunion'}}}, {'uri': 'http://en.wikipedia.org/wiki/Madagascar', 'type': 'loc', 'score': 2, 'label': {'eng': 'Madagascar'}, 'location': {'type': 'country', 'label': {'eng': 'Madagascar'}}}, {'uri': 'http://en.wikipedia.org/wiki/Australia', 'type': 'loc', 'score': 2, 'label': {'eng': 'Australia'}, 'location': {'type': 'country', 'label': {'eng': 'Australia'}}}, {'uri': 'http://en.wikipedia.org/wiki/Hurricane_John_(1994)', 'type': 'wiki', 'score': 1, 'label': {'eng': 'Hurricane John (1994)'}}, {'uri': 'http://en.wikipedia.org/wiki/Province', 'type': 'wiki', 'score': 1, 'label': {'eng': 'Province'}}, {'uri': 'http://en.wikipedia.org/wiki/French_language', 'type': 'wiki', 'score': 1, 'label': {'eng': 'French language'}}, {'uri': 'http://en.wikipedia.org/wiki/River', 'type': 'wiki', 'score': 1, 'label': {'eng': 'River'}}, {'uri': 'http://en.wikipedia.org/wiki/Flood', 'type': 'wiki', 'score': 1, 'label': {'eng': 'Flood'}}, {'uri': 'http://en.wikipedia.org/wiki/Landslide', 'type': 'wiki', 'score': 1, 'label': {'eng': 'Landslide'}}, {'uri': 'http://en.wikipedia.org/wiki/Port', 'type': 'wiki', 'score': 1, 'label': {'eng': 'Port'}}, {'uri': 'http://en.wikipedia.org/wiki/United_Nations', 'type': 'org', 'score': 1, 'label': {'eng': 'United Nations'}}, {'uri': 'http://en.wikipedia.org/wiki/Associated_Press', 'type': 'org', 'score': 1, 'label': {'eng': 'Associated Press'}}, {'uri': 'http://en.wikipedia.org/wiki/Quelimane', 'type': 'loc', 'score': 1, 'label': {'eng': 'Quelimane'}, 'location': {'type': 'place', 'label': {'eng': 'Quelimane'}, 'country': {'type': 'country', 'label': {'eng': 'Mozambique'}}}}, {'uri': 'http://en.wikipedia.org/wiki/Zambezia_Province', 'type': 'loc', 'score': 1, 'label': {'eng': 'Zambezia Province'}, 'location': {'type': 'place', 'label': {'eng': 'Zambezia Province'}, 'country': {'type': 'country', 'label': {'eng': 'Mozambique'}}}}]",https://www.belfasttelegraph.co.uk/extra/assets/img/dummy-social.gif,eng-8467663,-0.3254901960784313,416436360,1,belfasttelegraph.co.uk,news,Belfast Telegraph,Cyclone Blantyre Mozambique Malawi Landfall Financial centre Township Tropical cyclone Accumulated cyclone energy Southern Africa South India Africa United States Réunion Madagascar Australia Hurricane John (1994) Province French language River Flood Landslide Port United Nations Associated Press Quelimane Zambezia Province,Ireland,IE,,,,,C4,C2,Europe,EU,Christian,11.0,11.0,8.0,13.0,16.0,14.0,16.0,24.0,4.0,19.0,23.0,12.0,17.0,28.0,70.0,68.0,35.0,24.0,65.0,European Union (EU),EU,,,,,English-speaking,Eng,-1,,,0,False,2023,3,13,46,20,2023-03-13
116,7445289912,eng,False,2023-03-13,21:07:00,2023-03-13 21:07:00,2023-03-13T20:43:00Z,news,0.7647058963775635,https://www.independent.ie/world-news/death-toll-climbs-as-cyclone-freddy-hits-malawi-and-mozambique-42384565.html,Death toll climbs as Cyclone Freddy hits Malawi and Mozambique,"By Vitus-Gregory Gondwe and Wanjohi Kabukuru, Associated Press

An unrelenting Cyclone Freddy that is currently battering southern Africa has killed at least 56 people in Malawi and Mozambique since it struck the continent for a second time on Saturday night, authorities in both countries have confirmed.

Local police said 51 people in Malawi, including 36 in Chilobwe in the financial hub of Blantyre in the centre of the country, have died, with several others missing or injured.

Authorities in Mozambique reported that five people had been killed in the country since Saturday.

The deaths in Malawi include five members of a single family who died in Blantyre's Ndirande township after Freddy's destructive winds and heavy rains demolished their house, according to a police report.

A three-year-old child who was ""trapped in the debris"" is also among the victims, with her parents among those reported missing, authorities also said.

""We suspect that this figure will rise as we are trying to compile one national report from our south-west, south-east and eastern police offices which cover the affected areas,"" Malawi police spokesperson Peter Kalaya told The Associated Press.

The cyclone lashed over Mozambique and Malawi over the weekend and into Monday.

It is the second time the record-breaking cyclone - which has been causing destruction in southern Africa since late February - made landfall in mainland Africa.

It also pummelled the island states of Madagascar and Reunion as it traversed across the ocean.

The cyclone has intensified a record seven times and has the highest-ever recorded accumulated cyclone energy, or ACE, which is a measurement of how much energy a cyclone has released over time.

Freddy recorded more energy over its lifetime than an entire typical US hurricane season.

Freddy first developed near Australia in early February and travelled across the entire southern Indian Ocean.

It is set to be the longest-ever recorded tropical cyclone.

The UN's weather agency has convened an expert panel to determine whether it has broken the record set by Hurricane John in 1994 of 31 days.

Freddy made landfall in the seaport of Quelimane in Mozambique on Saturday where there are reports of damage to houses and farmlands, although the extent of the destruction is not yet clear.

Telecommunications and other essential infrastructure are still cut off in much of the affected Zambezia province, impeding rescue and other humanitarian efforts.

French weather agency Meteo-France's regional tropical cyclone monitoring centre in Reunion warned on Monday that ""the heaviest rains will continue over the next 48 hours"" as Freddy barrels on.

Mozambique's central provinces and Malawi have been identified as especially vulnerable to ""floods and landslides in mountainous areas"" by weather monitors.

Much of the damage experienced in Malawi is in homes built in areas prohibited by law such as in mountainous regions or near rivers where they are battling landslides, unprecedented flooding and rivers bursting their banks.

The cyclone has forced the Malawian government to suspend schools in 10 districts in its southern region ""as a precautionary measure"".

Freddy is expected to weaken and to exit back to sea on Wednesday, according to Meteo-France.",[],"[{'uri': 'http://en.wikipedia.org/wiki/Cyclone', 'type': 'wiki', 'score': 5, 'label': {'eng': 'Cyclone'}}, {'uri': 'http://en.wikipedia.org/wiki/Mozambique', 'type': 'loc', 'score': 5, 'label': {'eng': 'Mozambique'}, 'location': {'type': 'country', 'label': {'eng': 'Mozambique'}}}, {'uri': 'http://en.wikipedia.org/wiki/Malawi', 'type': 'loc', 'score': 5, 'label': {'eng': 'Malawi'}, 'location': {'type': 'country', 'label': {'eng': 'Malawi'}}}, {'uri': 'http://en.wikipedia.org/wiki/Southern_Africa', 'type': 'loc', 'score': 4, 'label': {'eng': 'Southern Africa'}, 'location': None}, {'uri': 'http://en.wikipedia.org/wiki/Blantyre', 'type': 'loc', 'score': 4, 'label': {'eng': 'Blantyre'}, 'location': {'type': 'place', 'label': {'eng': 'Blantyre'}, 'country': {'type': 'country', 'label': {'eng': 'Malawi'}}}}, {'uri': 'http://en.wikipedia.org/wiki/Financial_centre', 'type': 'wiki', 'score': 3, 'label': {'eng': 'Financial centre'}}, {'uri': 'http://en.wikipedia.org/wiki/Township', 'type': 'wiki', 'score': 3, 'label': {'eng': 'Township'}}, {'uri': 'http://en.wikipedia.org/wiki/Accumulated_cyclone_energy', 'type': 'wiki', 'score': 2, 'label': {'eng': 'Accumulated cyclone energy'}}, {'uri': 'http://en.wikipedia.org/wiki/Landfall', 'type': 'wiki', 'score': 2, 'label': {'eng': 'Landfall'}}, {'uri': 'http://en.wikipedia.org/wiki/Tropical_cyclone', 'type': 'wiki', 'score': 2, 'label': {'eng': 'Tropical cyclone'}}, {'uri': 'http://en.wikipedia.org/wiki/Africa', 'type': 'loc', 'score': 2, 'label': {'eng': 'Africa'}, 'location': None}, {'uri': 'http://en.wikipedia.org/wiki/United_States', 'type': 'loc', 'score': 2, 'label': {'eng': 'United States'}, 'location': {'type': 'country', 'label': {'eng': 'United States'}}}, {'uri': 'http://en.wikipedia.org/wiki/Réunion', 'type': 'loc', 'score': 2, 'label': {'eng': 'Réunion'}, 'location': {'type': 'country', 'label': {'eng': 'Réunion'}}}, {'uri': 'http://en.wikipedia.org/wiki/Madagascar', 'type': 'loc', 'score': 2, 'label': {'eng': 'Madagascar'}, 'location': {'type': 'country', 'label': {'eng': 'Madagascar'}}}, {'uri': 'http://en.wikipedia.org/wiki/Hurricane_John_(1994)', 'type': 'wiki', 'score': 1, 'label': {'eng': 'Hurricane John (1994)'}}, {'uri': 'http://en.wikipedia.org/wiki/South_India', 'type': 'wiki', 'score': 1, 'label': {'eng': 'South India'}}, {'uri': 'http://en.wikipedia.org/wiki/Province', 'type': 'wiki', 'score': 1, 'label': {'eng': 'Province'}}, {'uri': 'http://en.wikipedia.org/wiki/French_language', 'type': 'wiki', 'score': 1, 'label': {'eng': 'French language'}}, {'uri': 'http://en.wikipedia.org/wiki/River', 'type': 'wiki', 'score': 1, 'label': {'eng': 'River'}}, {'uri': 'http://en.wikipedia.org/wiki/Flood', 'type': 'wiki', 'score': 1, 'label': {'eng': 'Flood'}}, {'uri': 'http://en.wikipedia.org/wiki/Landslide', 'type': 'wiki', 'score': 1, 'label': {'eng': 'Landslide'}}, {'uri': 'http://en.wikipedia.org/wiki/Port', 'type': 'wiki', 'score': 1, 'label': {'eng': 'Port'}}, {'uri': 'http://en.wikipedia.org/wiki/United_Nations', 'type': 'org', 'score': 1, 'label': {'eng': 'United Nations'}}, {'uri': 'http://en.wikipedia.org/wiki/Associated_Press', 'type': 'org', 'score': 1, 'label': {'eng': 'Associated Press'}}, {'uri': 'http://en.wikipedia.org/wiki/Quelimane', 'type': 'loc', 'score': 1, 'label': {'eng': 'Quelimane'}, 'location': {'type': 'place', 'label': {'eng': 'Quelimane'}, 'country': {'type': 'country', 'label': {'eng': 'Mozambique'}}}}, {'uri': 'http://en.wikipedia.org/wiki/Zambezia_Province', 'type': 'loc', 'score': 1, 'label': {'eng': 'Zambezia Province'}, 'location': {'type': 'place', 'label': {'eng': 'Zambezia Province'}, 'country': {'type': 'country', 'label': {'eng': 'Mozambique'}}}}, {'uri': 'http://en.wikipedia.org/wiki/Australia', 'type': 'loc', 'score': 1, 'label': {'eng': 'Australia'}, 'location': {'type': 'country', 'label': {'eng': 'Australia'}}}]",https://www.independent.ie/world-news/e6c93/42384564.ece/AUTOCROP/w1240h700/ipanews_8b0ebd3a-8fef-41c6-b83c-fbeafd620973_1,eng-8467663,-0.5372549019607843,416437620,1,independent.ie,news,Irish Independent,Cyclone Mozambique Malawi Southern Africa Blantyre Financial centre Township Accumulated cyclone energy Landfall Tropical cyclone Africa United States Réunion Madagascar Hurricane John (1994) South India Province French language River Flood Landslide Port United Nations Associated Press Quelimane Zambezia Province Australia,Ireland,IE,,,,,C4,C2,Europe,EU,Christian,11.0,11.0,8.0,13.0,16.0,14.0,16.0,24.0,4.0,19.0,23.0,12.0,17.0,28.0,70.0,68.0,35.0,24.0,65.0,European Union (EU),EU,,,,,English-speaking,Eng,-1,,,0,False,2023,3,13,7,21,2023-03-13
