,uri,lang,dateTime,sim,url,title,body,source,concepts,categories,links,videos,image,eventUri,location,sentiment,keyword,source.uri,year_month,con_name,country,lang-name,language,Political_Alignment,wiki-url,Cultural_Class,Economic_Class,Continent-name,Continent,Religions,2019Rank-From,SafetyandSecurity,PersonalFreedom,Governance,SocialCapital,InvestmentEnvironment,EnterpriseConditions,MarketAccessandInfrastructure,EconomicQuality,LivingConditions,Health,Education,NaturalEnvironment,PowerDistance,Individualism,Masculinity,UncertaintyAvoidance,LongTermOrientation,Indulgence,economicblocs-name,economicblocs,militarydefenseblocs-name,militarydefenseblocs,politicalregionalblocs-name,politicalregionalblocs,linguisticblocs-name,linguisticblocs,concepts_str,all_concepts,year,month,day,date,min,hour,MD
724,7514134368,eng,2023-04-25 13:24:00+00:00,0.0,https://www.tehrantimes.com/news/483988/Moscow-to-host-rectors-of-Iranian-Russian-universities,"Moscow to host rectors of Iranian, Russian universities","TEHRAN - The Sixth Forum of Rectors of Russian and Iranian Universities will be held on April 27 at the University of Lomonosov, Moscow.

The event is organized in order to expand and deepen international cooperation in scientific, research, and academic fields between the top universities of the two countries, ISNA reported.

The event is an opportunity to exchange views on cooperation in the field of student exchange and hold joint educational courses and research programs.

In August 2022, Mohammad Javad Salmanpour, the deputy head of the Organization for Student Affairs, and Dmitry Kalinichenko, head of the Russian Federal Agency for the Commonwealth of Independent States Affairs, Compatriots Living Abroad, and the International Humanitarian Cooperation, met in Tehran.

During the meeting, Kalinichenko noted that there are 300 Iranian students with scholarships in Russia and that the number can increase in the future.

Salmanpour, for his part, said that most of the Russian students in Iran are studying without a scholarship mostly in the fields of Persian language and literature, linguistics, etc., and the Islamic Republic welcomes the increasing number of foreign students in these fields.

Iran is among the 15 successful countries in attracting international students, according to Salmanpour.

We have the ability and capacity to have more than 250,000 foreign students by 2026, he stated.

According to unofficial statistics, more than 300,000 Iranian students study abroad.

Russia is one of the prioritized countries for scientific and technological relations with Iran. Since 2016, various specialized working groups formed by the two countries in the fields of space, aerospace, cognitive sciences, biotechnology, nanotechnology, university cooperation, mega-science, information technology, energy, and regional cooperation.

During the last 5-6 years, the capacity of international interactions has been considered by Iran and Russia, and this cooperation has expanded by forming bilateral agreements through inter-sectoral coordination.

Reviewing the status of universities worldwide shows that the number of Iranian universities has increased in nearly all subject rankings.

At the beginning of its formation, rating systems provided a comprehensive view of institutions and evaluated them from all aspects and as a whole. But in the past few years, many of these systems evaluate and rank institutions in various scientific fields.

This new ranking method has emerged to meet the needs of users who seek to know the position of an institution in a special field.

Some of these systems evaluate broad scientific fields such as humanities and social sciences, technical and engineering, and medicine, and others measure special fields such as chemistry, mathematics, artificial intelligence, anthropology, and nursing in institutions.

A total of 94,406 foreign students from 91 countries are studying in Iranian universities, according to statistics released in the Iranian year 1400 (March 2021-March 2022).

One of the policies of the Ministry of Science, Research and Technology is to try to promote diversity in the admission of international students, ILNA quoted deputy science minister Hashem Dadashpour as saying.

In other words, ""admitting from all countries and sending only to top universities,"" he added.

""We are determined and try to admit students from all nationalities, although, in line with the goals and strategic policies of higher education, we have priority over the countries of origin for admitting students.""

""Now we have students from 91 nationalities in the country's universities, some of them are from European and American countries,"" Dadashpour said.","{'uri': 'tehrantimes.com', 'dataType': 'news', 'title': 'Tehran Times', 'description': ""Iran's Leading International Daily Newspaper"", 'location': {'type': 'country', 'geoNamesId': '130758', 'wikiUri': 'http://en.wikipedia.org/wiki/Iran', 'label': {'eng': 'Iran'}, 'population': 76923300, 'lat': 32, 'long': 53, 'area': 1648000, 'code2': 'IR', 'code3': 'IRN', 'webExt': '.ir', 'currencyCode': 'IRR', 'currencyName': 'Rial', 'continent': 'Asia'}, 'locationValidated': False, 'image': None, 'thumbImage': None, 'favicon': None, 'ranking': {'importanceRank': 320557, 'alexaGlobalRank': 44674, 'alexaCountryRank': 2839}, 'socialMedia': {'twitter': 'TehranTimes79', 'facebook': 'tehrantimes79'}}","[{'uri': 'http://en.wikipedia.org/wiki/Tehran', 'type': 'loc', 'score': 5, 'label': {'eng': 'Tehran'}, 'synonyms': {'eng': ['Teheran']}, 'trendingScore': {'news': {'score': 0, 'testPopFq': 0, 'nullPopFq': 0}}, 'location': {'type': 'place', 'geoNamesId': '112931', 'wikiUri': 'http://en.wikipedia.org/wiki/Tehran', 'label': {'eng': 'Tehran'}, 'population': 7153309, 'lat': 35.69439, 'long': 51.42151, 'featureCode': 'P.PPLC', 'country': {'type': 'country', 'geoNamesId': '130758', 'wikiUri': 'http://en.wikipedia.org/wiki/Iran', 'label': {'eng': 'Iran'}, 'population': 76923300, 'lat': 32, 'long': 53, 'area': 1648000, 'code2': 'IR', 'code3': 'IRN', 'webExt': '.ir', 'currencyCode': 'IRR', 'currencyName': 'Rial', 'continent': 'Asia'}}}, {'uri': 'http://en.wikipedia.org/wiki/Russia', 'type': 'loc', 'score': 5, 'label': {'eng': 'Russia'}, 'synonyms': {'_ANY_': ['Russian Federation'], 'eng': ['Rossiya', 'RU', 'Ru', 'Russian Federation', 'Rus']}, 'trendingScore': {'news': {'score': 0, 'testPopFq': 0, 'nullPopFq': 0}}, 'location': {'type': 'country', 'geoNamesId': '2017370', 'wikiUri': 'http://en.wikipedia.org/wiki/Russia', 'label': {'eng': 'Russia'}, 'population': 140702000, 'lat': 60, 'long': 100, 'area': 17100000, 'code2': 'RU', 'code3': 'RUS', 'webExt': '.ru', 'currencyCode': 'RUB', 'currencyName': 'Ruble', 'continent': 'Europe'}}, {'uri': 'http://en.wikipedia.org/wiki/Iran', 'type': 'loc', 'score': 5, 'label': {'eng': 'Iran'}, 'synonyms': {'eng': ['Islamic Republic of Iran', 'Persia', 'Ir']}, 'trendingScore': {'news': {'score': 0, 'testPopFq': 0, 'nullPopFq': 0}}, 'location': {'type': 'country', 'geoNamesId': '130758', 'wikiUri': 'http://en.wikipedia.org/wiki/Iran', 'label': {'eng': 'Iran'}, 'population': 76923300, 'lat': 32, 'long': 53, 'area': 1648000, 'code2': 'IR', 'code3': 'IRN', 'webExt': '.ir', 'currencyCode': 'IRR', 'currencyName': 'Rial', 'continent': 'Asia'}}, {'uri': 'http://en.wikipedia.org/wiki/Student_exchange_program', 'type': 'wiki', 'score': 3, 'label': {'eng': 'Student exchange program'}, 'synonyms': {}, 'trendingScore': {'news': {'score': 0, 'testPopFq': 0, 'nullPopFq': 0}}}, {'uri': 'http://en.wikipedia.org/wiki/Commonwealth_of_Independent_States', 'type': 'loc', 'score': 3, 'label': {'eng': 'Commonwealth of Independent States'}, 'synonyms': {'eng': ['CIS']}, 'trendingScore': {'news': {'score': 0, 'testPopFq': 0, 'nullPopFq': 0}}, 'location': None}, {'uri': 'http://en.wikipedia.org/wiki/Iranian_Students_News_Agency', 'type': 'wiki', 'score': 3, 'label': {'eng': 'Iranian Students News Agency'}, 'synonyms': {'eng': ['ISNA']}, 'trendingScore': {'news': {'score': 0, 'testPopFq': 0, 'nullPopFq': 0}}}, {'uri': 'http://en.wikipedia.org/wiki/International_student', 'type': 'wiki', 'score': 3, 'label': {'eng': 'International student'}, 'synonyms': {}, 'trendingScore': {'news': {'score': 0, 'testPopFq': 0, 'nullPopFq': 0}}}, {'uri': 'http://en.wikipedia.org/wiki/Scholarship', 'type': 'wiki', 'score': 3, 'label': {'eng': 'Scholarship'}, 'synonyms': {}, 'trendingScore': {'news': {'score': 0, 'testPopFq': 0, 'nullPopFq': 0}}}, {'uri': 'http://en.wikipedia.org/wiki/Moscow', 'type': 'loc', 'score': 3, 'label': {'eng': 'Moscow'}, 'synonyms': {'eng': ['Moskva', 'Москва', 'Moscow, Russia', 'City of Moscow', 'Moscow, Soviet Union']}, 'trendingScore': {'news': {'score': 0, 'testPopFq': 0, 'nullPopFq': 0}}, 'location': {'type': 'place', 'geoNamesId': '524894', 'wikiUri': 'http://en.wikipedia.org/wiki/Moscow', 'label': {'eng': 'Moscow'}, 'population': 11503501, 'lat': 55.76167, 'long': 37.60667, 'featureCode': 'A.ADM1', 'country': {'type': 'country', 'geoNamesId': '2017370', 'wikiUri': 'http://en.wikipedia.org/wiki/Russia', 'label': {'eng': 'Russia'}, 'population': 140702000, 'lat': 60, 'long': 100, 'area': 17100000, 'code2': 'RU', 'code3': 'RUS', 'webExt': '.ru', 'currencyCode': 'RUB', 'currencyName': 'Ruble', 'continent': 'Europe'}}}, {'uri': 'http://en.wikipedia.org/wiki/Higher_education_in_Iran', 'type': 'wiki', 'score': 2, 'label': {'eng': 'Higher education in Iran'}, 'synonyms': {}, 'trendingScore': {'news': {'score': 0, 'testPopFq': 0, 'nullPopFq': 0}}}, {'uri': 'http://en.wikipedia.org/wiki/Cognitive_science', 'type': 'wiki', 'score': 2, 'label': {'eng': 'Cognitive science'}, 'synonyms': {}, 'trendingScore': {'news': {'score': 0, 'testPopFq': 0, 'nullPopFq': 0}}}, {'uri': 'http://en.wikipedia.org/wiki/Nanotechnology', 'type': 'wiki', 'score': 2, 'label': {'eng': 'Nanotechnology'}, 'synonyms': {'eng': ['Nanotech', 'Nanoscience']}, 'trendingScore': {'news': {'score': 0, 'testPopFq': 0, 'nullPopFq': 0}}}, {'uri': 'http://en.wikipedia.org/wiki/Linguistics', 'type': 'wiki', 'score': 2, 'label': {'eng': 'Linguistics'}, 'synonyms': {'eng': ['Linguistic']}, 'trendingScore': {'news': {'score': 0, 'testPopFq': 0, 'nullPopFq': 0}}}, {'uri': 'http://en.wikipedia.org/wiki/Persian_language', 'type': 'wiki', 'score': 2, 'label': {'eng': 'Persian language'}, 'synonyms': {'eng': ['Farsi', 'Farsi language', 'Iranian language', 'Dari', 'Fa', 'Iranian']}, 'trendingScore': {'news': {'score': 0, 'testPopFq': 0, 'nullPopFq': 0}}}, {'uri': 'http://en.wikipedia.org/wiki/Aerospace', 'type': 'wiki', 'score': 2, 'label': {'eng': 'Aerospace'}, 'synonyms': {}, 'trendingScore': {'news': {'score': 0, 'testPopFq': 0, 'nullPopFq': 0}}}, {'uri': 'http://en.wikipedia.org/wiki/Information_technology', 'type': 'wiki', 'score': 2, 'label': {'eng': 'Information technology'}, 'synonyms': {'eng': ['IT']}, 'trendingScore': {'news': {'score': 0, 'testPopFq': 0, 'nullPopFq': 0}}}, {'uri': 'http://en.wikipedia.org/wiki/Biotechnology', 'type': 'wiki', 'score': 2, 'label': {'eng': 'Biotechnology'}, 'synonyms': {'eng': ['Biotech']}, 'trendingScore': {'news': {'score': 0, 'testPopFq': 0, 'nullPopFq': 0}}}, {'uri': 'http://en.wikipedia.org/wiki/University', 'type': 'wiki', 'score': 2, 'label': {'eng': 'University'}, 'synonyms': {'eng': ['College']}, 'trendingScore': {'news': {'score': 0, 'testPopFq': 0, 'nullPopFq': 0}}}, {'uri': 'http://en.wikipedia.org/wiki/Ministry_of_Science,_Research_and_Technology_(Iran)', 'type': 'wiki', 'score': 1, 'label': {'eng': 'Ministry of Science, Research and Technology (Iran)'}, 'synonyms': {}, 'trendingScore': {'news': {'score': 0, 'testPopFq': 0, 'nullPopFq': 0}}}, {'uri': 'http://en.wikipedia.org/wiki/Social_science', 'type': 'wiki', 'score': 1, 'label': {'eng': 'Social science'}, 'synonyms': {'eng': ['Social sciences']}, 'trendingScore': {'news': {'score': 0, 'testPopFq': 0, 'nullPopFq': 0}}}, {'uri': 'http://en.wikipedia.org/wiki/Iranian_Labour_News_Agency', 'type': 'wiki', 'score': 1, 'label': {'eng': 'Iranian Labour News Agency'}, 'synonyms': {}, 'trendingScore': {'news': {'score': 0, 'testPopFq': 0, 'nullPopFq': 0}}}, {'uri': 'http://en.wikipedia.org/wiki/Humanities', 'type': 'wiki', 'score': 1, 'label': {'eng': 'Humanities'}, 'synonyms': {}, 'trendingScore': {'news': {'score': 0, 'testPopFq': 0, 'nullPopFq': 0}}}, {'uri': 'http://en.wikipedia.org/wiki/Chemistry', 'type': 'wiki', 'score': 1, 'label': {'eng': 'Chemistry'}, 'synonyms': {'eng': ['Chemical']}, 'trendingScore': {'news': {'score': 0, 'testPopFq': 0, 'nullPopFq': 0}}}, {'uri': 'http://en.wikipedia.org/wiki/Anthropology', 'type': 'wiki', 'score': 1, 'label': {'eng': 'Anthropology'}, 'synonyms': {}, 'trendingScore': {'news': {'score': 0, 'testPopFq': 0, 'nullPopFq': 0}}}, {'uri': 'http://en.wikipedia.org/wiki/Nursing', 'type': 'wiki', 'score': 1, 'label': {'eng': 'Nursing'}, 'synonyms': {}, 'trendingScore': {'news': {'score': 0, 'testPopFq': 0, 'nullPopFq': 0}}}, {'uri': 'http://en.wikipedia.org/wiki/United_States', 'type': 'loc', 'score': 1, 'label': {'eng': 'United States'}, 'synonyms': {'eng': ['USA', 'U.S.A.', 'America', 'The States', 'U.S.', 'US', 'The US', 'The United States', 'The United States of America', '🇺🇸']}, 'trendingScore': {'news': {'score': 0, 'testPopFq': 0, 'nullPopFq': 0}}, 'location': {'type': 'country', 'geoNamesId': '6252001', 'wikiUri': 'http://en.wikipedia.org/wiki/United_States', 'label': {'eng': 'United States'}, 'population': 310232863, 'lat': 39.76, 'long': -98.5, 'area': 9629091, 'code2': 'US', 'code3': 'USA', 'webExt': '.us', 'currencyCode': 'USD', 'currencyName': 'Dollar', 'continent': 'Noth America'}}]","[{'uri': 'news/Politics', 'label': 'news/Politics', 'wgt': 49}, {'uri': 'news/Science', 'label': 'news/Science', 'wgt': 48}, {'uri': 'dmoz/Science/Environment/Academic_Departments', 'label': 'dmoz/Science/Environment/Academic Departments', 'wgt': 100}, {'uri': 'dmoz/Science/Social_Sciences/Political_Science', 'label': 'dmoz/Science/Social Sciences/Political Science', 'wgt': 100}, {'uri': 'dmoz/Science/Agriculture/Academic_Departments', 'label': 'dmoz/Science/Agriculture/Academic Departments', 'wgt': 100}]",[],[],https://media.tehrantimes.com/d/t/2023/04/25/4/4507628.jpg?ts=1682428761244,,"{'type': 'place', 'geoNamesId': '112931', 'wikiUri': 'http://en.wikipedia.org/wiki/Tehran', 'label': {'eng': 'Tehran'}, 'population': 7153309, 'lat': 35.69439, 'long': 51.42151, 'featureCode': 'P.PPLC', 'country': {'type': 'country', 'geoNamesId': '130758', 'wikiUri': 'http://en.wikipedia.org/wiki/Iran', 'label': {'eng': 'Iran'}, 'population': 76923300, 'lat': 32, 'long': 53, 'area': 1648000, 'code2': 'IR', 'code3': 'IRN', 'webExt': '.ir', 'currencyCode': 'IRR', 'currencyName': 'Rial', 'continent': 'Asia'}}",0.2862745098039217,Russia,tehrantimes.com,2023-04,Iran,IR,,,,,C20,C5,Asia,AS,Muslim,126.0,worst,average,worst,worst,worst,worst,average,worst,average,average,average,worst,high,low,low,high,low,low,,,,,,,,,"[{'uri': 'http://en.wikipedia.org/wiki/Tehran', 'type': 'loc', 'score': 5, 'label': {'eng': 'Tehran'}, 'synonyms': {'eng': ['Teheran']}, 'trendingScore': {'news': {'score': 0, 'testPopFq': 0, 'nullPopFq': 0}}, 'location': {'type': 'place', 'geoNamesId': '112931', 'wikiUri': 'http://en.wikipedia.org/wiki/Tehran', 'label': {'eng': 'Tehran'}, 'population': 7153309, 'lat': 35.69439, 'long': 51.42151, 'featureCode': 'P.PPLC', 'country': {'type': 'country', 'geoNamesId': '130758', 'wikiUri': 'http://en.wikipedia.org/wiki/Iran', 'label': {'eng': 'Iran'}, 'population': 76923300, 'lat': 32, 'long': 53, 'area': 1648000, 'code2': 'IR', 'code3': 'IRN', 'webExt': '.ir', 'currencyCode': 'IRR', 'currencyName': 'Rial', 'continent': 'Asia'}}}, {'uri': 'http://en.wikipedia.org/wiki/Russia', 'type': 'loc', 'score': 5, 'label': {'eng': 'Russia'}, 'synonyms': {'_ANY_': ['Russian Federation'], 'eng': ['Rossiya', 'RU', 'Ru', 'Russian Federation', 'Rus']}, 'trendingScore': {'news': {'score': 0, 'testPopFq': 0, 'nullPopFq': 0}}, 'location': {'type': 'country', 'geoNamesId': '2017370', 'wikiUri': 'http://en.wikipedia.org/wiki/Russia', 'label': {'eng': 'Russia'}, 'population': 140702000, 'lat': 60, 'long': 100, 'area': 17100000, 'code2': 'RU', 'code3': 'RUS', 'webExt': '.ru', 'currencyCode': 'RUB', 'currencyName': 'Ruble', 'continent': 'Europe'}}, {'uri': 'http://en.wikipedia.org/wiki/Iran', 'type': 'loc', 'score': 5, 'label': {'eng': 'Iran'}, 'synonyms': {'eng': ['Islamic Republic of Iran', 'Persia', 'Ir']}, 'trendingScore': {'news': {'score': 0, 'testPopFq': 0, 'nullPopFq': 0}}, 'location': {'type': 'country', 'geoNamesId': '130758', 'wikiUri': 'http://en.wikipedia.org/wiki/Iran', 'label': {'eng': 'Iran'}, 'population': 76923300, 'lat': 32, 'long': 53, 'area': 1648000, 'code2': 'IR', 'code3': 'IRN', 'webExt': '.ir', 'currencyCode': 'IRR', 'currencyName': 'Rial', 'continent': 'Asia'}}, {'uri': 'http://en.wikipedia.org/wiki/Student_exchange_program', 'type': 'wiki', 'score': 3, 'label': {'eng': 'Student exchange program'}, 'synonyms': {}, 'trendingScore': {'news': {'score': 0, 'testPopFq': 0, 'nullPopFq': 0}}}, {'uri': 'http://en.wikipedia.org/wiki/Commonwealth_of_Independent_States', 'type': 'loc', 'score': 3, 'label': {'eng': 'Commonwealth of Independent States'}, 'synonyms': {'eng': ['CIS']}, 'trendingScore': {'news': {'score': 0, 'testPopFq': 0, 'nullPopFq': 0}}, 'location': None}, {'uri': 'http://en.wikipedia.org/wiki/Iranian_Students_News_Agency', 'type': 'wiki', 'score': 3, 'label': {'eng': 'Iranian Students News Agency'}, 'synonyms': {'eng': ['ISNA']}, 'trendingScore': {'news': {'score': 0, 'testPopFq': 0, 'nullPopFq': 0}}}, {'uri': 'http://en.wikipedia.org/wiki/International_student', 'type': 'wiki', 'score': 3, 'label': {'eng': 'International student'}, 'synonyms': {}, 'trendingScore': {'news': {'score': 0, 'testPopFq': 0, 'nullPopFq': 0}}}, {'uri': 'http://en.wikipedia.org/wiki/Scholarship', 'type': 'wiki', 'score': 3, 'label': {'eng': 'Scholarship'}, 'synonyms': {}, 'trendingScore': {'news': {'score': 0, 'testPopFq': 0, 'nullPopFq': 0}}}, {'uri': 'http://en.wikipedia.org/wiki/Moscow', 'type': 'loc', 'score': 3, 'label': {'eng': 'Moscow'}, 'synonyms': {'eng': ['Moskva', 'Москва', 'Moscow, Russia', 'City of Moscow', 'Moscow, Soviet Union']}, 'trendingScore': {'news': {'score': 0, 'testPopFq': 0, 'nullPopFq': 0}}, 'location': {'type': 'place', 'geoNamesId': '524894', 'wikiUri': 'http://en.wikipedia.org/wiki/Moscow', 'label': {'eng': 'Moscow'}, 'population': 11503501, 'lat': 55.76167, 'long': 37.60667, 'featureCode': 'A.ADM1', 'country': {'type': 'country', 'geoNamesId': '2017370', 'wikiUri': 'http://en.wikipedia.org/wiki/Russia', 'label': {'eng': 'Russia'}, 'population': 140702000, 'lat': 60, 'long': 100, 'area': 17100000, 'code2': 'RU', 'code3': 'RUS', 'webExt': '.ru', 'currencyCode': 'RUB', 'currencyName': 'Ruble', 'continent': 'Europe'}}}, {'uri': 'http://en.wikipedia.org/wiki/Higher_education_in_Iran', 'type': 'wiki', 'score': 2, 'label': {'eng': 'Higher education in Iran'}, 'synonyms': {}, 'trendingScore': {'news': {'score': 0, 'testPopFq': 0, 'nullPopFq': 0}}}, {'uri': 'http://en.wikipedia.org/wiki/Cognitive_science', 'type': 'wiki', 'score': 2, 'label': {'eng': 'Cognitive science'}, 'synonyms': {}, 'trendingScore': {'news': {'score': 0, 'testPopFq': 0, 'nullPopFq': 0}}}, {'uri': 'http://en.wikipedia.org/wiki/Nanotechnology', 'type': 'wiki', 'score': 2, 'label': {'eng': 'Nanotechnology'}, 'synonyms': {'eng': ['Nanotech', 'Nanoscience']}, 'trendingScore': {'news': {'score': 0, 'testPopFq': 0, 'nullPopFq': 0}}}, {'uri': 'http://en.wikipedia.org/wiki/Linguistics', 'type': 'wiki', 'score': 2, 'label': {'eng': 'Linguistics'}, 'synonyms': {'eng': ['Linguistic']}, 'trendingScore': {'news': {'score': 0, 'testPopFq': 0, 'nullPopFq': 0}}}, {'uri': 'http://en.wikipedia.org/wiki/Persian_language', 'type': 'wiki', 'score': 2, 'label': {'eng': 'Persian language'}, 'synonyms': {'eng': ['Farsi', 'Farsi language', 'Iranian language', 'Dari', 'Fa', 'Iranian']}, 'trendingScore': {'news': {'score': 0, 'testPopFq': 0, 'nullPopFq': 0}}}, {'uri': 'http://en.wikipedia.org/wiki/Aerospace', 'type': 'wiki', 'score': 2, 'label': {'eng': 'Aerospace'}, 'synonyms': {}, 'trendingScore': {'news': {'score': 0, 'testPopFq': 0, 'nullPopFq': 0}}}, {'uri': 'http://en.wikipedia.org/wiki/Information_technology', 'type': 'wiki', 'score': 2, 'label': {'eng': 'Information technology'}, 'synonyms': {'eng': ['IT']}, 'trendingScore': {'news': {'score': 0, 'testPopFq': 0, 'nullPopFq': 0}}}, {'uri': 'http://en.wikipedia.org/wiki/Biotechnology', 'type': 'wiki', 'score': 2, 'label': {'eng': 'Biotechnology'}, 'synonyms': {'eng': ['Biotech']}, 'trendingScore': {'news': {'score': 0, 'testPopFq': 0, 'nullPopFq': 0}}}, {'uri': 'http://en.wikipedia.org/wiki/University', 'type': 'wiki', 'score': 2, 'label': {'eng': 'University'}, 'synonyms': {'eng': ['College']}, 'trendingScore': {'news': {'score': 0, 'testPopFq': 0, 'nullPopFq': 0}}}, {'uri': 'http://en.wikipedia.org/wiki/Ministry_of_Science,_Research_and_Technology_(Iran)', 'type': 'wiki', 'score': 1, 'label': {'eng': 'Ministry of Science, Research and Technology (Iran)'}, 'synonyms': {}, 'trendingScore': {'news': {'score': 0, 'testPopFq': 0, 'nullPopFq': 0}}}, {'uri': 'http://en.wikipedia.org/wiki/Social_science', 'type': 'wiki', 'score': 1, 'label': {'eng': 'Social science'}, 'synonyms': {'eng': ['Social sciences']}, 'trendingScore': {'news': {'score': 0, 'testPopFq': 0, 'nullPopFq': 0}}}, {'uri': 'http://en.wikipedia.org/wiki/Iranian_Labour_News_Agency', 'type': 'wiki', 'score': 1, 'label': {'eng': 'Iranian Labour News Agency'}, 'synonyms': {}, 'trendingScore': {'news': {'score': 0, 'testPopFq': 0, 'nullPopFq': 0}}}, {'uri': 'http://en.wikipedia.org/wiki/Humanities', 'type': 'wiki', 'score': 1, 'label': {'eng': 'Humanities'}, 'synonyms': {}, 'trendingScore': {'news': {'score': 0, 'testPopFq': 0, 'nullPopFq': 0}}}, {'uri': 'http://en.wikipedia.org/wiki/Chemistry', 'type': 'wiki', 'score': 1, 'label': {'eng': 'Chemistry'}, 'synonyms': {'eng': ['Chemical']}, 'trendingScore': {'news': {'score': 0, 'testPopFq': 0, 'nullPopFq': 0}}}, {'uri': 'http://en.wikipedia.org/wiki/Anthropology', 'type': 'wiki', 'score': 1, 'label': {'eng': 'Anthropology'}, 'synonyms': {}, 'trendingScore': {'news': {'score': 0, 'testPopFq': 0, 'nullPopFq': 0}}}, {'uri': 'http://en.wikipedia.org/wiki/Nursing', 'type': 'wiki', 'score': 1, 'label': {'eng': 'Nursing'}, 'synonyms': {}, 'trendingScore': {'news': {'score': 0, 'testPopFq': 0, 'nullPopFq': 0}}}, {'uri': 'http://en.wikipedia.org/wiki/United_States', 'type': 'loc', 'score': 1, 'label': {'eng': 'United States'}, 'synonyms': {'eng': ['USA', 'U.S.A.', 'America', 'The States', 'U.S.', 'US', 'The US', 'The United States', 'The United States of America', '🇺🇸']}, 'trendingScore': {'news': {'score': 0, 'testPopFq': 0, 'nullPopFq': 0}}, 'location': {'type': 'country', 'geoNamesId': '6252001', 'wikiUri': 'http://en.wikipedia.org/wiki/United_States', 'label': {'eng': 'United States'}, 'population': 310232863, 'lat': 39.76, 'long': -98.5, 'area': 9629091, 'code2': 'US', 'code3': 'USA', 'webExt': '.us', 'currencyCode': 'USD', 'currencyName': 'Dollar', 'continent': 'Noth America'}}]","Tehran Tehran Iran Russia Russia Iran Iran Student_exchange_program Commonwealth_of_Independent_States Iranian_Students_News_Agency International_student Scholarship Moscow Moscow Russia Higher_education_in_Iran Cognitive_science Nanotechnology Linguistics Persian_language Aerospace Information_technology Biotechnology University Ministry_of_Science,_Research_and_Technology_(Iran) Social_science Iranian_Labour_News_Agency Humanities Chemistry Anthropology Nursing United_States United_States",2023,4,25,2023-04-25,24,13,2023-04-25
