,uri,lang,dateTime,sim,url,title,body,source,concepts,categories,links,videos,image,eventUri,location,sentiment,keyword,source.uri,year_month,con_name,country,lang-name,language,Political_Alignment,wiki-url,Cultural_Class,Economic_Class,Continent-name,Continent,Religions,2019Rank-From,SafetyandSecurity,PersonalFreedom,Governance,SocialCapital,InvestmentEnvironment,EnterpriseConditions,MarketAccessandInfrastructure,EconomicQuality,LivingConditions,Health,Education,NaturalEnvironment,PowerDistance,Individualism,Masculinity,UncertaintyAvoidance,LongTermOrientation,Indulgence,economicblocs-name,economicblocs,militarydefenseblocs-name,militarydefenseblocs,politicalregionalblocs-name,politicalregionalblocs,linguisticblocs-name,linguisticblocs,concepts_str,all_concepts,year,month,day,date,min,hour,MD
3104,7479815965,eng,2023-04-03 19:00:00+00:00,0.9921568632125854,https://kayhanlife.com/special-reports/analysis-how-russian-and-iranian-drone-strikes-further-dehumanize-warfare/,ANALYSIS: How Russian and Iranian Drone Strikes Further Dehumanize Warfare - KAYHAN LIFE,"Disclaimer: This asset - including all text, audio and imagery - is provided by The Conversation. Reuters Connect has not verified or endorsed the material, which is being made available to professional media customers to facilitate the free flow of global news and information.

Along with the recent reciprocal drone strikes by Iran and the United States in Syria, Russia continues to unleash its arsenal on Ukrainian civilian and military targets alike. While the Russian armies have started using outdated weapons, novel technologies remain the objects of fascination on the battlefield.

Hypersonic missiles and nuclear weapons have understandably grabbed media attention. However, drone warfare continues to occupy a central role in the conflict.

Ukraine's not the only battlefield. Drone warfare has played a significant role in the Azerbaijan-Armenian conflict, with Armenia's superior conventional forces being challenged by the kamikaze drones, strike UAVs and remotely controlled planes of Azerbaijan. A world away, China's drones continue to test Taiwan's defensive capabilities and readiness.

Drones are not the only weapons. As the global Summit on Responsible AI in the Military Domain (REAIM) illustrates, there is a growing recognition that lethal autonomous weapons systems (LAWS) pose a threat that must be reckoned with.

Understanding this threat requires grasping the psychological, social and technological challenges they present.

Psychology is at the heart of all conflicts. Whether in terms of perceived existential or territorial threats, individuals band together in groups to make gains or avoid losses.

A reluctance to kill stems from our perceived humanity and membership in the same community. By turning people into statistics and dehumanizing them, we further dull our moral sense.

LAWS remove us from the battlefield. As we distance ourselves from human suffering, lethal decisions become easier. Research has demonstrated that distance is also associated with more antisocial behaviours. When viewing potential targets from drone-like perspectives, people become morally disengaged.

Many modern weapons rely on artificial intelligence (AI), but not all forms of AI are autonomous. Autonomy and intelligence are two distinct characteristics.

Autonomy has to do with control over specific operations. A weapons system might gather information and identify a target autonomously, while firing decisions are left to human operators. Alternatively, a human operator might decide on a target, releasing a self-guided weapon to target and detonate autonomously.

Autonomous weapons are not new to warfare. In the sea, self-propelled torpedos and naval mines have been in use since the mid-1800s. On the ground, elementary land mines have given way to autonomous turrets.

In the air, Nazi Germany wielded V1 and V2 rockets and radio-controlled munitions. Heat-seeking and laser-guided precisions followed by the 1960s and were used by the U.S. in Vietnam. By the 1990s, the era of ""smart weapons"" was upon us, bringing with it questions of our ethical obligations.

Contemporary LAWS have been framed as the ""natural evolutionary path"" of warfare. We can draw parallels between single drones and smart weapons, although drone swarms represent a new kind of weapon.

The ability to co-ordinate their actions gives them the potential to overwhelm human forces. The degree of co-ordination, in fact, requires a higher level of autonomy. If the swarm is sufficiently large, a single human operator could not hope to maintain sufficient situational awareness to control it.

By ceding lethal decisions to LAWS, their accuracy and reliability become paramount concerns.

The potential for reduced human error is often used to recommend LAWS. While an actuarial approach to AI ethics is hardly the best or only way to make moral decisions about AI, reliable data is essential to judge the accuracy and improve the operations of LAWS. However, it is often lacking.

A review of U.S. drone strikes over a 15-year period suggested that only about 20 per cent of more than 700 strikes were acknowledged by the government, with an estimated 400 civilian casualties.

In the early stages of the Russian invasion of Ukraine, reports suggested that Ukrainians destroyed about 85 per cent of the drones launched against them. In the most recent attacks, they have destroyed more than 75 per cent of the drones.

These statistics might suggest drones aren't particularly effective. But the minimal cost and large numbers of drones mean that even if a small proportion of the weapons are successful, the damage and casualties can be significant.

When assigning responsibility, we have to consider who manufactures these weapons. They are not always homegrown. Drones used by Russia in the Ukrainian conflict hail from China and Iran.

Inside these drones, many parts come from western manufacturers. Understanding responsibility and accountability in conflicts requires that we consider the international supply chains that enable LAWS.

Whether LAWS represent a unique threat to human rights that must be banned -- like landmines -- or otherwise controlled by international laws, there is widespread agreement that we must re-evaluate existing approaches to regulation.

REAIM's work is not alone in attempting to regulate LAWS. The United Nations, multilateral proposals and countries like the U.S. and Canada have all developed, proposed or are reviewing the sufficiency of existing standards.

These efforts face an array of practical issues. In many cases, the principles are framed as best practices and viewed as voluntary rather than being enforceable. States might also be reluctant in order to ensure consistency with their allies.

Treaties and regulations also create social dilemmas -- just as they do when contemplating cyberweapons, nations must decide whether they adhere to the rules while others develop superior capabilities.

Even if LAWS are wholly or partially banned, there is still considerable room for interpretation and rationalization.

In July 2022, Russia said responsibility lies with their operators and that LAWS can ""reduce the risk of intentional strikes against civilians and civilian facilities"" and support ""missions of maintaining or restoring international peace and security ... [in] compliance with international law."" These are hollow statements made by a hollow regime.

No matter how elegant the regulatory framework nor how straightforward the principles, adversarial nations are unlikely to abide by international agreements -- especially knowing weapons like drones make it easier for soldiers psychologically removed from the realities of the battlefield to kill others.

As Russia's war in Ukraine illustrates, by reframing conflicts, the use of LAWS can always be justified. Their ability to desensitize their users from the act of killing, however, must not be.","{'uri': 'kayhanlife.com', 'dataType': 'news', 'title': 'KAYHAN LIFE', 'description': 'Kayhan Life is an independent media outlet focusing on Iran. We offer in-depth news coverage of Iran’s politics, economy, society, and culture.', 'location': {'type': 'place', 'geoNamesId': '2643743', 'wikiUri': 'http://en.wikipedia.org/wiki/London', 'label': {'eng': 'London'}, 'population': 7556900, 'lat': 51.50853, 'long': -0.12574, 'featureCode': 'P.PPLC', 'country': {'type': 'country', 'geoNamesId': '2635167', 'wikiUri': 'http://en.wikipedia.org/wiki/United_Kingdom', 'label': {'eng': 'United Kingdom'}, 'population': 62348447, 'lat': 54.75844, 'long': -2.69531, 'area': 244820, 'code2': 'GB', 'code3': 'GBR', 'webExt': '.uk', 'currencyCode': 'GBP', 'currencyName': 'Pound', 'continent': 'Europe'}}, 'locationValidated': False, 'image': None, 'thumbImage': None, 'favicon': None, 'ranking': {'importanceRank': 628055, 'alexaGlobalRank': 999085}, 'socialMedia': {'twitter': 'KayhanLife', 'facebook': 'kayhanl'}}","[{'uri': 'http://en.wikipedia.org/wiki/Drone_strike', 'type': 'wiki', 'score': 5, 'label': {'eng': 'Drone strike'}, 'synonyms': {}, 'trendingScore': {'news': {'score': 0, 'testPopFq': 0, 'nullPopFq': 0}}}, {'uri': 'http://en.wikipedia.org/wiki/Unmanned_aerial_vehicle', 'type': 'wiki', 'score': 5, 'label': {'eng': 'Unmanned aerial vehicle'}, 'synonyms': {'eng': ['UAV', 'Drone', 'Unmanned Aircraft', 'Unmanned Aerial Vehicle', 'Unmanned Aircraft System']}, 'trendingScore': {'news': {'score': 0, 'testPopFq': 0, 'nullPopFq': 0}}}, {'uri': 'http://en.wikipedia.org/wiki/Artificial_intelligence', 'type': 'wiki', 'score': 5, 'label': {'eng': 'Artificial intelligence'}, 'synonyms': {'eng': ['AI', 'MI', 'Machine intelligence']}, 'trendingScore': {'news': {'score': 0, 'testPopFq': 0, 'nullPopFq': 0}}}, {'uri': 'http://en.wikipedia.org/wiki/United_States', 'type': 'loc', 'score': 5, 'label': {'eng': 'United States'}, 'synonyms': {'eng': ['USA', 'U.S.A.', 'America', 'The States', 'U.S.', 'US', 'The US', 'The United States', 'The United States of America', '🇺🇸']}, 'trendingScore': {'news': {'score': 0, 'testPopFq': 0, 'nullPopFq': 0}}, 'location': {'type': 'country', 'geoNamesId': '6252001', 'wikiUri': 'http://en.wikipedia.org/wiki/United_States', 'label': {'eng': 'United States'}, 'population': 310232863, 'lat': 39.76, 'long': -98.5, 'area': 9629091, 'code2': 'US', 'code3': 'USA', 'webExt': '.us', 'currencyCode': 'USD', 'currencyName': 'Dollar', 'continent': 'Noth America'}}, {'uri': 'http://en.wikipedia.org/wiki/Ukraine', 'type': 'loc', 'score': 5, 'label': {'eng': 'Ukraine'}, 'synonyms': {'eng': ['UA', 'UKR', 'Ua', 'Ukrainia']}, 'trendingScore': {'news': {'score': 0, 'testPopFq': 0, 'nullPopFq': 0}}, 'location': {'type': 'country', 'geoNamesId': '690791', 'wikiUri': 'http://en.wikipedia.org/wiki/Ukraine', 'label': {'eng': 'Ukraine'}, 'population': 45415596, 'lat': 49, 'long': 32, 'area': 603700, 'code2': 'UA', 'code3': 'UKR', 'webExt': '.ua', 'currencyCode': 'UAH', 'currencyName': 'Hryvnia', 'continent': 'Europe'}}, {'uri': 'http://en.wikipedia.org/wiki/Russia', 'type': 'loc', 'score': 5, 'label': {'eng': 'Russia'}, 'synonyms': {'_ANY_': ['Russian Federation'], 'eng': ['Rossiya', 'RU', 'Ru', 'Russian Federation', 'Rus']}, 'trendingScore': {'news': {'score': 0, 'testPopFq': 0, 'nullPopFq': 0}}, 'location': {'type': 'country', 'geoNamesId': '2017370', 'wikiUri': 'http://en.wikipedia.org/wiki/Russia', 'label': {'eng': 'Russia'}, 'population': 140702000, 'lat': 60, 'long': 100, 'area': 17100000, 'code2': 'RU', 'code3': 'RUS', 'webExt': '.ru', 'currencyCode': 'RUB', 'currencyName': 'Ruble', 'continent': 'Europe'}}, {'uri': 'http://en.wikipedia.org/wiki/Psychology', 'type': 'wiki', 'score': 4, 'label': {'eng': 'Psychology'}, 'synonyms': {}, 'trendingScore': {'news': {'score': 0, 'testPopFq': 0, 'nullPopFq': 0}}}, {'uri': 'http://en.wikipedia.org/wiki/Autonomy', 'type': 'wiki', 'score': 4, 'label': {'eng': 'Autonomy'}, 'synonyms': {}, 'trendingScore': {'news': {'score': 0, 'testPopFq': 0, 'nullPopFq': 0}}}, {'uri': 'http://en.wikipedia.org/wiki/Lethal_autonomous_weapon', 'type': 'wiki', 'score': 3, 'label': {'eng': 'Lethal autonomous weapon'}, 'synonyms': {}, 'trendingScore': {'news': {'score': 0, 'testPopFq': 0, 'nullPopFq': 0}}}, {'uri': 'http://en.wikipedia.org/wiki/Conventional_warfare', 'type': 'wiki', 'score': 3, 'label': {'eng': 'Conventional warfare'}, 'synonyms': {}, 'trendingScore': {'news': {'score': 0, 'testPopFq': 0, 'nullPopFq': 0}}}, {'uri': 'http://en.wikipedia.org/wiki/Precision-guided_munition', 'type': 'wiki', 'score': 3, 'label': {'eng': 'Precision-guided munition'}, 'synonyms': {'eng': ['PGM', 'Smart munition']}, 'trendingScore': {'news': {'score': 0, 'testPopFq': 0, 'nullPopFq': 0}}}, {'uri': 'http://en.wikipedia.org/wiki/Kamikaze', 'type': 'wiki', 'score': 3, 'label': {'eng': 'Kamikaze'}, 'synonyms': {}, 'trendingScore': {'news': {'score': 0, 'testPopFq': 0, 'nullPopFq': 0}}}, {'uri': 'http://en.wikipedia.org/wiki/Arsenal', 'type': 'org', 'score': 3, 'label': {'eng': 'Arsenal'}, 'synonyms': {}, 'trendingScore': {'news': {'score': 0, 'testPopFq': 0, 'nullPopFq': 0}}}, {'uri': 'http://en.wikipedia.org/wiki/Ethics', 'type': 'wiki', 'score': 3, 'label': {'eng': 'Ethics'}, 'synonyms': {'eng': ['Ethical theory']}, 'trendingScore': {'news': {'score': 0, 'testPopFq': 0, 'nullPopFq': 0}}}, {'uri': 'http://en.wikipedia.org/wiki/Strike_action', 'type': 'wiki', 'score': 3, 'label': {'eng': 'Strike action'}, 'synonyms': {'eng': ['Labor strike', 'Labour strike', 'Greve']}, 'trendingScore': {'news': {'score': 0, 'testPopFq': 0, 'nullPopFq': 0}}}, {'uri': 'http://en.wikipedia.org/wiki/Missile', 'type': 'wiki', 'score': 3, 'label': {'eng': 'Missile'}, 'synonyms': {'eng': ['Guided missile']}, 'trendingScore': {'news': {'score': 0, 'testPopFq': 0, 'nullPopFq': 0}}}, {'uri': 'http://en.wikipedia.org/wiki/Nuclear_weapon', 'type': 'wiki', 'score': 3, 'label': {'eng': 'Nuclear weapon'}, 'synonyms': {'eng': ['Nuke', 'Nuclear bomb', 'Nuclear warhead', 'Nuclear arms', 'Nuclear weaponry', 'Atomic bomb']}, 'trendingScore': {'news': {'score': 0, 'testPopFq': 0, 'nullPopFq': 0}}}, {'uri': 'http://en.wikipedia.org/wiki/The_Conversation_(website)', 'type': 'org', 'score': 3, 'label': {'eng': 'The Conversation (website)'}, 'synonyms': {}, 'trendingScore': {'news': {'score': 0, 'testPopFq': 0, 'nullPopFq': 0}}}, {'uri': 'http://en.wikipedia.org/wiki/Existentialism', 'type': 'wiki', 'score': 3, 'label': {'eng': 'Existentialism'}, 'synonyms': {}, 'trendingScore': {'news': {'score': 0, 'testPopFq': 0, 'nullPopFq': 0}}}, {'uri': 'http://en.wikipedia.org/wiki/Taiwan', 'type': 'loc', 'score': 3, 'label': {'eng': 'Taiwan'}, 'synonyms': {'eng': ['ROC', 'Chinese Taipei', 'Republic of China', 'Tw', 'Formosa']}, 'trendingScore': {'news': {'score': 0, 'testPopFq': 0, 'nullPopFq': 0}}, 'location': {'type': 'country', 'geoNamesId': '1668284', 'wikiUri': 'http://en.wikipedia.org/wiki/Taiwan', 'label': {'eng': 'Taiwan'}, 'population': 22894384, 'lat': 24, 'long': 121, 'area': 35980, 'code2': 'TW', 'code3': 'TWN', 'webExt': '.tw', 'currencyCode': 'TWD', 'currencyName': 'Dollar', 'continent': 'Asia'}}, {'uri': 'http://en.wikipedia.org/wiki/Syria', 'type': 'loc', 'score': 3, 'label': {'eng': 'Syria'}, 'synonyms': {'_ANY_': ['Syrian Arab Republic'], 'eng': ['Sy', 'Syrian Arab Republic']}, 'trendingScore': {'news': {'score': 0, 'testPopFq': 0, 'nullPopFq': 0}}, 'location': {'type': 'country', 'geoNamesId': '163843', 'wikiUri': 'http://en.wikipedia.org/wiki/Syria', 'label': {'eng': 'Syria'}, 'population': 22198110, 'lat': 35, 'long': 38, 'area': 185180, 'code2': 'SY', 'code3': 'SYR', 'webExt': '.sy', 'currencyCode': 'SYP', 'currencyName': 'Pound', 'continent': 'Asia'}}, {'uri': 'http://en.wikipedia.org/wiki/Iran', 'type': 'loc', 'score': 3, 'label': {'eng': 'Iran'}, 'synonyms': {'eng': ['Islamic Republic of Iran', 'Persia', 'Ir']}, 'trendingScore': {'news': {'score': 0, 'testPopFq': 0, 'nullPopFq': 0}}, 'location': {'type': 'country', 'geoNamesId': '130758', 'wikiUri': 'http://en.wikipedia.org/wiki/Iran', 'label': {'eng': 'Iran'}, 'population': 76923300, 'lat': 32, 'long': 53, 'area': 1648000, 'code2': 'IR', 'code3': 'IRN', 'webExt': '.ir', 'currencyCode': 'IRR', 'currencyName': 'Rial', 'continent': 'Asia'}}, {'uri': 'http://en.wikipedia.org/wiki/China', 'type': 'loc', 'score': 3, 'label': {'eng': 'China'}, 'synonyms': {'eng': ['CN', 'PR China', 'PRC', 'Cn']}, 'trendingScore': {'news': {'score': 0, 'testPopFq': 0, 'nullPopFq': 0}}, 'location': {'type': 'country', 'geoNamesId': '1814991', 'wikiUri': 'http://en.wikipedia.org/wiki/China', 'label': {'eng': 'China'}, 'population': 1330044000, 'lat': 35, 'long': 105, 'area': 9596960, 'code2': 'CN', 'code3': 'CHN', 'webExt': '.cn', 'currencyCode': 'CNY', 'currencyName': 'Yuan Renminbi', 'continent': 'Asia'}}, {'uri': 'http://en.wikipedia.org/wiki/Azerbaijan', 'type': 'loc', 'score': 3, 'label': {'eng': 'Azerbaijan'}, 'synonyms': {'eng': ['Republic of Azerbaijan', 'Az']}, 'trendingScore': {'news': {'score': 0, 'testPopFq': 0, 'nullPopFq': 0}}, 'location': {'type': 'country', 'geoNamesId': '587116', 'wikiUri': 'http://en.wikipedia.org/wiki/Azerbaijan', 'label': {'eng': 'Azerbaijan'}, 'population': 8303512, 'lat': 40.5, 'long': 47.5, 'area': 86600, 'code2': 'AZ', 'code3': 'AZE', 'webExt': '.az', 'currencyCode': 'AZN', 'currencyName': 'Manat', 'continent': 'Asia'}}, {'uri': 'http://en.wikipedia.org/wiki/Armenia', 'type': 'loc', 'score': 3, 'label': {'eng': 'Armenia'}, 'synonyms': {'eng': ['Republic of Armenia']}, 'trendingScore': {'news': {'score': 0, 'testPopFq': 0, 'nullPopFq': 0}}, 'location': {'type': 'country', 'geoNamesId': '174982', 'wikiUri': 'http://en.wikipedia.org/wiki/Armenia', 'label': {'eng': 'Armenia'}, 'population': 2968000, 'lat': 40.25, 'long': 45, 'area': 29800, 'code2': 'AM', 'code3': 'ARM', 'webExt': '.am', 'currencyCode': 'AMD', 'currencyName': 'Dram', 'continent': 'Asia'}}, {'uri': 'http://en.wikipedia.org/wiki/Laser_guidance', 'type': 'wiki', 'score': 2, 'label': {'eng': 'Laser guidance'}, 'synonyms': {}, 'trendingScore': {'news': {'score': 0, 'testPopFq': 0, 'nullPopFq': 0}}}, {'uri': 'http://en.wikipedia.org/wiki/V-2_rocket', 'type': 'wiki', 'score': 2, 'label': {'eng': 'V-2 rocket'}, 'synonyms': {'eng': ['V-2', 'A4']}, 'trendingScore': {'news': {'score': 0, 'testPopFq': 0, 'nullPopFq': 0}}}, {'uri': 'http://en.wikipedia.org/wiki/V-1_flying_bomb', 'type': 'wiki', 'score': 2, 'label': {'eng': 'V-1 flying bomb'}, 'synonyms': {'eng': ['V-1', 'Fieseler Fi 103']}, 'trendingScore': {'news': {'score': 0, 'testPopFq': 0, 'nullPopFq': 0}}}, {'uri': 'http://en.wikipedia.org/wiki/Radio_control', 'type': 'wiki', 'score': 2, 'label': {'eng': 'Radio control'}, 'synonyms': {}, 'trendingScore': {'news': {'score': 0, 'testPopFq': 0, 'nullPopFq': 0}}}, {'uri': 'http://en.wikipedia.org/wiki/Infrared_homing', 'type': 'wiki', 'score': 2, 'label': {'eng': 'Infrared homing'}, 'synonyms': {}, 'trendingScore': {'news': {'score': 0, 'testPopFq': 0, 'nullPopFq': 0}}}, {'uri': 'http://en.wikipedia.org/wiki/Naval_mine', 'type': 'wiki', 'score': 2, 'label': {'eng': 'Naval mine'}, 'synonyms': {'eng': ['Underwater mine', 'Sea mine']}, 'trendingScore': {'news': {'score': 0, 'testPopFq': 0, 'nullPopFq': 0}}}, {'uri': 'http://en.wikipedia.org/wiki/Nazi_Germany', 'type': 'loc', 'score': 2, 'label': {'eng': 'Nazi Germany'}, 'synonyms': {'eng': ['Third Reich', 'Greater German Reich']}, 'trendingScore': {'news': {'score': 0, 'testPopFq': 0, 'nullPopFq': 0}}, 'location': None}, {'uri': 'http://en.wikipedia.org/wiki/Vietnam', 'type': 'loc', 'score': 2, 'label': {'eng': 'Vietnam'}, 'synonyms': {'_ANY_': ['Viet Nam'], 'eng': ['Viet Nam', 'Socialist Republic of Vietnam', 'VN', 'VIE']}, 'trendingScore': {'news': {'score': 0, 'testPopFq': 0, 'nullPopFq': 0}}, 'location': {'type': 'country', 'geoNamesId': '1562822', 'wikiUri': 'http://en.wikipedia.org/wiki/Vietnam', 'label': {'eng': 'Vietnam'}, 'population': 89571130, 'lat': 16.16667, 'long': 107.83333, 'area': 329560, 'code2': 'VN', 'code3': 'VNM', 'webExt': '.vn', 'currencyCode': 'VND', 'currencyName': 'Dong', 'continent': 'Asia'}}, {'uri': 'http://en.wikipedia.org/wiki/United_Nations', 'type': 'org', 'score': 1, 'label': {'eng': 'United Nations'}, 'synonyms': {'eng': ['UN']}, 'trendingScore': {'news': {'score': 0, 'testPopFq': 0, 'nullPopFq': 0}}}, {'uri': 'http://en.wikipedia.org/wiki/Canada', 'type': 'loc', 'score': 1, 'label': {'eng': 'Canada'}, 'synonyms': {'eng': ['Dominion of Canada', 'British North America', 'CAN', 'CA', 'Ca', 'CDN']}, 'trendingScore': {'news': {'score': 0, 'testPopFq': 0, 'nullPopFq': 0}}, 'location': {'type': 'country', 'geoNamesId': '6251999', 'wikiUri': 'http://en.wikipedia.org/wiki/Canada', 'label': {'eng': 'Canada'}, 'population': 33679000, 'lat': 60.10867, 'long': -113.64258, 'area': 9984670, 'code2': 'CA', 'code3': 'CAN', 'webExt': '.ca', 'currencyCode': 'CAD', 'currencyName': 'Dollar', 'continent': 'Noth America'}}]","[{'uri': 'news/Politics', 'label': 'news/Politics', 'wgt': 94}, {'uri': 'dmoz/Society/Issues', 'label': 'dmoz/Society/Issues', 'wgt': 100}, {'uri': 'dmoz/Society/Issues/Warfare_and_Conflict', 'label': 'dmoz/Society/Issues/Warfare and Conflict', 'wgt': 100}, {'uri': 'dmoz/Society/Crime/Theft', 'label': 'dmoz/Society/Crime/Theft', 'wgt': 100}, {'uri': 'dmoz/Society/Issues/Government_Operations', 'label': 'dmoz/Society/Issues/Government Operations', 'wgt': 100}, {'uri': 'dmoz/Society/Issues/Intellectual_Property', 'label': 'dmoz/Society/Issues/Intellectual Property', 'wgt': 100}]",[],[],https://kayhanlife.com/wp-content/uploads/2022/12/2022-05-28T113237Z_823678150_RC2IAU9W0R7K_RTRMADP_3_IRAN-MILITARY-DRONE-UNDERGROUND-BASE.jpg,eng-8526827,,0.1058823529411765,Russia,kayhanlife.com,2023-04,Iran,IR,,,Pro-Constitution-Principalist-Conservative,https:en.wikipedia.orgwikiKayhan,C20,C5,Asia,AS,Muslim,126.0,worst,average,worst,worst,worst,worst,average,worst,average,average,average,worst,high,low,low,high,low,low,,,,,,,,,"[{'uri': 'http://en.wikipedia.org/wiki/Drone_strike', 'type': 'wiki', 'score': 5, 'label': {'eng': 'Drone strike'}, 'synonyms': {}, 'trendingScore': {'news': {'score': 0, 'testPopFq': 0, 'nullPopFq': 0}}}, {'uri': 'http://en.wikipedia.org/wiki/Unmanned_aerial_vehicle', 'type': 'wiki', 'score': 5, 'label': {'eng': 'Unmanned aerial vehicle'}, 'synonyms': {'eng': ['UAV', 'Drone', 'Unmanned Aircraft', 'Unmanned Aerial Vehicle', 'Unmanned Aircraft System']}, 'trendingScore': {'news': {'score': 0, 'testPopFq': 0, 'nullPopFq': 0}}}, {'uri': 'http://en.wikipedia.org/wiki/Artificial_intelligence', 'type': 'wiki', 'score': 5, 'label': {'eng': 'Artificial intelligence'}, 'synonyms': {'eng': ['AI', 'MI', 'Machine intelligence']}, 'trendingScore': {'news': {'score': 0, 'testPopFq': 0, 'nullPopFq': 0}}}, {'uri': 'http://en.wikipedia.org/wiki/United_States', 'type': 'loc', 'score': 5, 'label': {'eng': 'United States'}, 'synonyms': {'eng': ['USA', 'U.S.A.', 'America', 'The States', 'U.S.', 'US', 'The US', 'The United States', 'The United States of America', '🇺🇸']}, 'trendingScore': {'news': {'score': 0, 'testPopFq': 0, 'nullPopFq': 0}}, 'location': {'type': 'country', 'geoNamesId': '6252001', 'wikiUri': 'http://en.wikipedia.org/wiki/United_States', 'label': {'eng': 'United States'}, 'population': 310232863, 'lat': 39.76, 'long': -98.5, 'area': 9629091, 'code2': 'US', 'code3': 'USA', 'webExt': '.us', 'currencyCode': 'USD', 'currencyName': 'Dollar', 'continent': 'Noth America'}}, {'uri': 'http://en.wikipedia.org/wiki/Ukraine', 'type': 'loc', 'score': 5, 'label': {'eng': 'Ukraine'}, 'synonyms': {'eng': ['UA', 'UKR', 'Ua', 'Ukrainia']}, 'trendingScore': {'news': {'score': 0, 'testPopFq': 0, 'nullPopFq': 0}}, 'location': {'type': 'country', 'geoNamesId': '690791', 'wikiUri': 'http://en.wikipedia.org/wiki/Ukraine', 'label': {'eng': 'Ukraine'}, 'population': 45415596, 'lat': 49, 'long': 32, 'area': 603700, 'code2': 'UA', 'code3': 'UKR', 'webExt': '.ua', 'currencyCode': 'UAH', 'currencyName': 'Hryvnia', 'continent': 'Europe'}}, {'uri': 'http://en.wikipedia.org/wiki/Russia', 'type': 'loc', 'score': 5, 'label': {'eng': 'Russia'}, 'synonyms': {'_ANY_': ['Russian Federation'], 'eng': ['Rossiya', 'RU', 'Ru', 'Russian Federation', 'Rus']}, 'trendingScore': {'news': {'score': 0, 'testPopFq': 0, 'nullPopFq': 0}}, 'location': {'type': 'country', 'geoNamesId': '2017370', 'wikiUri': 'http://en.wikipedia.org/wiki/Russia', 'label': {'eng': 'Russia'}, 'population': 140702000, 'lat': 60, 'long': 100, 'area': 17100000, 'code2': 'RU', 'code3': 'RUS', 'webExt': '.ru', 'currencyCode': 'RUB', 'currencyName': 'Ruble', 'continent': 'Europe'}}, {'uri': 'http://en.wikipedia.org/wiki/Psychology', 'type': 'wiki', 'score': 4, 'label': {'eng': 'Psychology'}, 'synonyms': {}, 'trendingScore': {'news': {'score': 0, 'testPopFq': 0, 'nullPopFq': 0}}}, {'uri': 'http://en.wikipedia.org/wiki/Autonomy', 'type': 'wiki', 'score': 4, 'label': {'eng': 'Autonomy'}, 'synonyms': {}, 'trendingScore': {'news': {'score': 0, 'testPopFq': 0, 'nullPopFq': 0}}}, {'uri': 'http://en.wikipedia.org/wiki/Lethal_autonomous_weapon', 'type': 'wiki', 'score': 3, 'label': {'eng': 'Lethal autonomous weapon'}, 'synonyms': {}, 'trendingScore': {'news': {'score': 0, 'testPopFq': 0, 'nullPopFq': 0}}}, {'uri': 'http://en.wikipedia.org/wiki/Conventional_warfare', 'type': 'wiki', 'score': 3, 'label': {'eng': 'Conventional warfare'}, 'synonyms': {}, 'trendingScore': {'news': {'score': 0, 'testPopFq': 0, 'nullPopFq': 0}}}, {'uri': 'http://en.wikipedia.org/wiki/Precision-guided_munition', 'type': 'wiki', 'score': 3, 'label': {'eng': 'Precision-guided munition'}, 'synonyms': {'eng': ['PGM', 'Smart munition']}, 'trendingScore': {'news': {'score': 0, 'testPopFq': 0, 'nullPopFq': 0}}}, {'uri': 'http://en.wikipedia.org/wiki/Kamikaze', 'type': 'wiki', 'score': 3, 'label': {'eng': 'Kamikaze'}, 'synonyms': {}, 'trendingScore': {'news': {'score': 0, 'testPopFq': 0, 'nullPopFq': 0}}}, {'uri': 'http://en.wikipedia.org/wiki/Arsenal', 'type': 'org', 'score': 3, 'label': {'eng': 'Arsenal'}, 'synonyms': {}, 'trendingScore': {'news': {'score': 0, 'testPopFq': 0, 'nullPopFq': 0}}}, {'uri': 'http://en.wikipedia.org/wiki/Ethics', 'type': 'wiki', 'score': 3, 'label': {'eng': 'Ethics'}, 'synonyms': {'eng': ['Ethical theory']}, 'trendingScore': {'news': {'score': 0, 'testPopFq': 0, 'nullPopFq': 0}}}, {'uri': 'http://en.wikipedia.org/wiki/Strike_action', 'type': 'wiki', 'score': 3, 'label': {'eng': 'Strike action'}, 'synonyms': {'eng': ['Labor strike', 'Labour strike', 'Greve']}, 'trendingScore': {'news': {'score': 0, 'testPopFq': 0, 'nullPopFq': 0}}}, {'uri': 'http://en.wikipedia.org/wiki/Missile', 'type': 'wiki', 'score': 3, 'label': {'eng': 'Missile'}, 'synonyms': {'eng': ['Guided missile']}, 'trendingScore': {'news': {'score': 0, 'testPopFq': 0, 'nullPopFq': 0}}}, {'uri': 'http://en.wikipedia.org/wiki/Nuclear_weapon', 'type': 'wiki', 'score': 3, 'label': {'eng': 'Nuclear weapon'}, 'synonyms': {'eng': ['Nuke', 'Nuclear bomb', 'Nuclear warhead', 'Nuclear arms', 'Nuclear weaponry', 'Atomic bomb']}, 'trendingScore': {'news': {'score': 0, 'testPopFq': 0, 'nullPopFq': 0}}}, {'uri': 'http://en.wikipedia.org/wiki/The_Conversation_(website)', 'type': 'org', 'score': 3, 'label': {'eng': 'The Conversation (website)'}, 'synonyms': {}, 'trendingScore': {'news': {'score': 0, 'testPopFq': 0, 'nullPopFq': 0}}}, {'uri': 'http://en.wikipedia.org/wiki/Existentialism', 'type': 'wiki', 'score': 3, 'label': {'eng': 'Existentialism'}, 'synonyms': {}, 'trendingScore': {'news': {'score': 0, 'testPopFq': 0, 'nullPopFq': 0}}}, {'uri': 'http://en.wikipedia.org/wiki/Taiwan', 'type': 'loc', 'score': 3, 'label': {'eng': 'Taiwan'}, 'synonyms': {'eng': ['ROC', 'Chinese Taipei', 'Republic of China', 'Tw', 'Formosa']}, 'trendingScore': {'news': {'score': 0, 'testPopFq': 0, 'nullPopFq': 0}}, 'location': {'type': 'country', 'geoNamesId': '1668284', 'wikiUri': 'http://en.wikipedia.org/wiki/Taiwan', 'label': {'eng': 'Taiwan'}, 'population': 22894384, 'lat': 24, 'long': 121, 'area': 35980, 'code2': 'TW', 'code3': 'TWN', 'webExt': '.tw', 'currencyCode': 'TWD', 'currencyName': 'Dollar', 'continent': 'Asia'}}, {'uri': 'http://en.wikipedia.org/wiki/Syria', 'type': 'loc', 'score': 3, 'label': {'eng': 'Syria'}, 'synonyms': {'_ANY_': ['Syrian Arab Republic'], 'eng': ['Sy', 'Syrian Arab Republic']}, 'trendingScore': {'news': {'score': 0, 'testPopFq': 0, 'nullPopFq': 0}}, 'location': {'type': 'country', 'geoNamesId': '163843', 'wikiUri': 'http://en.wikipedia.org/wiki/Syria', 'label': {'eng': 'Syria'}, 'population': 22198110, 'lat': 35, 'long': 38, 'area': 185180, 'code2': 'SY', 'code3': 'SYR', 'webExt': '.sy', 'currencyCode': 'SYP', 'currencyName': 'Pound', 'continent': 'Asia'}}, {'uri': 'http://en.wikipedia.org/wiki/Iran', 'type': 'loc', 'score': 3, 'label': {'eng': 'Iran'}, 'synonyms': {'eng': ['Islamic Republic of Iran', 'Persia', 'Ir']}, 'trendingScore': {'news': {'score': 0, 'testPopFq': 0, 'nullPopFq': 0}}, 'location': {'type': 'country', 'geoNamesId': '130758', 'wikiUri': 'http://en.wikipedia.org/wiki/Iran', 'label': {'eng': 'Iran'}, 'population': 76923300, 'lat': 32, 'long': 53, 'area': 1648000, 'code2': 'IR', 'code3': 'IRN', 'webExt': '.ir', 'currencyCode': 'IRR', 'currencyName': 'Rial', 'continent': 'Asia'}}, {'uri': 'http://en.wikipedia.org/wiki/China', 'type': 'loc', 'score': 3, 'label': {'eng': 'China'}, 'synonyms': {'eng': ['CN', 'PR China', 'PRC', 'Cn']}, 'trendingScore': {'news': {'score': 0, 'testPopFq': 0, 'nullPopFq': 0}}, 'location': {'type': 'country', 'geoNamesId': '1814991', 'wikiUri': 'http://en.wikipedia.org/wiki/China', 'label': {'eng': 'China'}, 'population': 1330044000, 'lat': 35, 'long': 105, 'area': 9596960, 'code2': 'CN', 'code3': 'CHN', 'webExt': '.cn', 'currencyCode': 'CNY', 'currencyName': 'Yuan Renminbi', 'continent': 'Asia'}}, {'uri': 'http://en.wikipedia.org/wiki/Azerbaijan', 'type': 'loc', 'score': 3, 'label': {'eng': 'Azerbaijan'}, 'synonyms': {'eng': ['Republic of Azerbaijan', 'Az']}, 'trendingScore': {'news': {'score': 0, 'testPopFq': 0, 'nullPopFq': 0}}, 'location': {'type': 'country', 'geoNamesId': '587116', 'wikiUri': 'http://en.wikipedia.org/wiki/Azerbaijan', 'label': {'eng': 'Azerbaijan'}, 'population': 8303512, 'lat': 40.5, 'long': 47.5, 'area': 86600, 'code2': 'AZ', 'code3': 'AZE', 'webExt': '.az', 'currencyCode': 'AZN', 'currencyName': 'Manat', 'continent': 'Asia'}}, {'uri': 'http://en.wikipedia.org/wiki/Armenia', 'type': 'loc', 'score': 3, 'label': {'eng': 'Armenia'}, 'synonyms': {'eng': ['Republic of Armenia']}, 'trendingScore': {'news': {'score': 0, 'testPopFq': 0, 'nullPopFq': 0}}, 'location': {'type': 'country', 'geoNamesId': '174982', 'wikiUri': 'http://en.wikipedia.org/wiki/Armenia', 'label': {'eng': 'Armenia'}, 'population': 2968000, 'lat': 40.25, 'long': 45, 'area': 29800, 'code2': 'AM', 'code3': 'ARM', 'webExt': '.am', 'currencyCode': 'AMD', 'currencyName': 'Dram', 'continent': 'Asia'}}, {'uri': 'http://en.wikipedia.org/wiki/Laser_guidance', 'type': 'wiki', 'score': 2, 'label': {'eng': 'Laser guidance'}, 'synonyms': {}, 'trendingScore': {'news': {'score': 0, 'testPopFq': 0, 'nullPopFq': 0}}}, {'uri': 'http://en.wikipedia.org/wiki/V-2_rocket', 'type': 'wiki', 'score': 2, 'label': {'eng': 'V-2 rocket'}, 'synonyms': {'eng': ['V-2', 'A4']}, 'trendingScore': {'news': {'score': 0, 'testPopFq': 0, 'nullPopFq': 0}}}, {'uri': 'http://en.wikipedia.org/wiki/V-1_flying_bomb', 'type': 'wiki', 'score': 2, 'label': {'eng': 'V-1 flying bomb'}, 'synonyms': {'eng': ['V-1', 'Fieseler Fi 103']}, 'trendingScore': {'news': {'score': 0, 'testPopFq': 0, 'nullPopFq': 0}}}, {'uri': 'http://en.wikipedia.org/wiki/Radio_control', 'type': 'wiki', 'score': 2, 'label': {'eng': 'Radio control'}, 'synonyms': {}, 'trendingScore': {'news': {'score': 0, 'testPopFq': 0, 'nullPopFq': 0}}}, {'uri': 'http://en.wikipedia.org/wiki/Infrared_homing', 'type': 'wiki', 'score': 2, 'label': {'eng': 'Infrared homing'}, 'synonyms': {}, 'trendingScore': {'news': {'score': 0, 'testPopFq': 0, 'nullPopFq': 0}}}, {'uri': 'http://en.wikipedia.org/wiki/Naval_mine', 'type': 'wiki', 'score': 2, 'label': {'eng': 'Naval mine'}, 'synonyms': {'eng': ['Underwater mine', 'Sea mine']}, 'trendingScore': {'news': {'score': 0, 'testPopFq': 0, 'nullPopFq': 0}}}, {'uri': 'http://en.wikipedia.org/wiki/Nazi_Germany', 'type': 'loc', 'score': 2, 'label': {'eng': 'Nazi Germany'}, 'synonyms': {'eng': ['Third Reich', 'Greater German Reich']}, 'trendingScore': {'news': {'score': 0, 'testPopFq': 0, 'nullPopFq': 0}}, 'location': None}, {'uri': 'http://en.wikipedia.org/wiki/Vietnam', 'type': 'loc', 'score': 2, 'label': {'eng': 'Vietnam'}, 'synonyms': {'_ANY_': ['Viet Nam'], 'eng': ['Viet Nam', 'Socialist Republic of Vietnam', 'VN', 'VIE']}, 'trendingScore': {'news': {'score': 0, 'testPopFq': 0, 'nullPopFq': 0}}, 'location': {'type': 'country', 'geoNamesId': '1562822', 'wikiUri': 'http://en.wikipedia.org/wiki/Vietnam', 'label': {'eng': 'Vietnam'}, 'population': 89571130, 'lat': 16.16667, 'long': 107.83333, 'area': 329560, 'code2': 'VN', 'code3': 'VNM', 'webExt': '.vn', 'currencyCode': 'VND', 'currencyName': 'Dong', 'continent': 'Asia'}}, {'uri': 'http://en.wikipedia.org/wiki/United_Nations', 'type': 'org', 'score': 1, 'label': {'eng': 'United Nations'}, 'synonyms': {'eng': ['UN']}, 'trendingScore': {'news': {'score': 0, 'testPopFq': 0, 'nullPopFq': 0}}}, {'uri': 'http://en.wikipedia.org/wiki/Canada', 'type': 'loc', 'score': 1, 'label': {'eng': 'Canada'}, 'synonyms': {'eng': ['Dominion of Canada', 'British North America', 'CAN', 'CA', 'Ca', 'CDN']}, 'trendingScore': {'news': {'score': 0, 'testPopFq': 0, 'nullPopFq': 0}}, 'location': {'type': 'country', 'geoNamesId': '6251999', 'wikiUri': 'http://en.wikipedia.org/wiki/Canada', 'label': {'eng': 'Canada'}, 'population': 33679000, 'lat': 60.10867, 'long': -113.64258, 'area': 9984670, 'code2': 'CA', 'code3': 'CAN', 'webExt': '.ca', 'currencyCode': 'CAD', 'currencyName': 'Dollar', 'continent': 'Noth America'}}]",Drone_strike Unmanned_aerial_vehicle Artificial_intelligence United_States United_States Ukraine Ukraine Russia Russia Psychology Autonomy Lethal_autonomous_weapon Conventional_warfare Precision-guided_munition Kamikaze Arsenal Ethics Strike_action Missile Nuclear_weapon The_Conversation_(website) Existentialism Taiwan Taiwan Syria Syria Iran Iran China China Azerbaijan Azerbaijan Armenia Armenia Laser_guidance V-2_rocket V-1_flying_bomb Radio_control Infrared_homing Naval_mine Nazi_Germany Vietnam Vietnam United_Nations Canada Canada,2023,4,3,2023-04-03,0,19,2023-04-03
