,uri,lang,isDuplicate,date,time,dateTime,dateTimePub,dataType,sim,url,title,userHasPermissions,body,authors,concepts,image,eventUri,sentiment,wgt,relevance,source.uri,source.dataType,source.title,source.private,all_concepts,con-name,country,lang-name,language,Political-Alignment,wiki-url,Cultural-Class,Economic-Class,Continent-name,Continent,Religions,2019Rank-From,SafetyandSecurity,PersonalFreedom,Governance,SocialCapital,InvestmentEnvironment,EnterpriseConditions,MarketAccessandInfrastructure,EconomicQuality,LivingConditions,Health,Education,NaturalEnvironment,PowerDistance,Individualism,Masculinity,UncertaintyAvoidance,LongTermOrientation,Indulgence,economicblocs-name,economicblocs,militarydefenseblocs-name,militarydefenseblocs,politicalregionalblocs-name,politicalregionalblocs,linguisticblocs-name,linguisticblocs,proScore,destination,parent,count,status,year,month,day,min,hour,MD
84,324612812,eng,False,2015-10-21,16:35:00,2015-10-21 16:35:00,,news,0.5803921818733215,http://www.iran-daily.com/News/129475.html,EU calls mini-summit as Balkans buckle under refugee crisis,,"The leaders of Austria, Bulgaria, Croatia, Germany, Greece, Hungary, Romania and Slovenia will meet on Sunday with their counterparts from non-EU states Macedonia and Serbia, the office of European Commission President Jean-Claude Juncker said, AFP wrote.

""In view of the unfolding emergency in the countries along the western Balkans migratory route, there is a need for much greater cooperation, more extensive consultation and immediate operational action,"" a statement said.

The continent has been struggling to find a unified response on how to tackle its biggest migration crisis since 1945.

More than 600,000 migrants and refugees, mainly fleeing violence in Syria, Iraq and Afghanistan, have braved the dangerous journey to Europe so far this year, the UN said.

The goal for many travelling is the EU's biggest economy Germany, which expects to receive up to a million asylum requests this year.

Since Saturday, when Hungary sealed off its border with Croatia, more than 24,455 migrants have arrived in Slovenia, a nation of two million people.

In response, the Slovenian parliament amended a law which would allow soldiers to join border police in patrolling the 670-kilometre (416-mile) frontier with Croatia.

The amendment now means troops can detain people and hand them over to the police, as well as issue orders to civilians in the border area.

""The last 24 hours have been the toughest and most demanding since the start of the crisis,"" the Slovenian government said, warning it was ""delusional"" to expect small countries to succeed where larger ones had failed.

Around 11,000 people were still stuck in Slovenian registration centers on Wednesday morning, waiting to continue their journey.

And tensions briefly flared in southern Austria when some 1,000 migrants broke through a police barrier at the Spielfeld border crossing and started marching north.

Police eventually convinced them to return to the checkpoint and wait for buses provided by the government to transport them toward Germany.

Vienna said more than 6,000 migrants had entered Austria since Tuesday night, with most only passing through.",[],"[{'uri': 'http://en.wikipedia.org/wiki/Balkans', 'type': 'wiki', 'score': 5, 'label': {'eng': 'Balkans'}}, {'uri': 'http://en.wikipedia.org/wiki/Slovenia', 'type': 'loc', 'score': 5, 'label': {'eng': 'Slovenia'}, 'location': {'type': 'country', 'label': {'eng': 'Slovenia'}}}, {'uri': 'http://en.wikipedia.org/wiki/European_migrant_crisis', 'type': 'wiki', 'score': 4, 'label': {'eng': 'European migrant crisis'}}, {'uri': 'http://en.wikipedia.org/wiki/European_Union', 'type': 'loc', 'score': 4, 'label': {'eng': 'European Union'}, 'location': None}, {'uri': 'http://en.wikipedia.org/wiki/Romania', 'type': 'loc', 'score': 4, 'label': {'eng': 'Romania'}, 'location': {'type': 'country', 'label': {'eng': 'Romania'}}}, {'uri': 'http://en.wikipedia.org/wiki/Hungary', 'type': 'loc', 'score': 4, 'label': {'eng': 'Hungary'}, 'location': {'type': 'country', 'label': {'eng': 'Hungary'}}}, {'uri': 'http://en.wikipedia.org/wiki/Croatia', 'type': 'loc', 'score': 4, 'label': {'eng': 'Croatia'}, 'location': {'type': 'country', 'label': {'eng': 'Croatia'}}}, {'uri': 'http://en.wikipedia.org/wiki/Greece', 'type': 'loc', 'score': 4, 'label': {'eng': 'Greece'}, 'location': {'type': 'country', 'label': {'eng': 'Greece'}}}, {'uri': 'http://en.wikipedia.org/wiki/Germany', 'type': 'loc', 'score': 4, 'label': {'eng': 'Germany'}, 'location': {'type': 'country', 'label': {'eng': 'Germany'}}}, {'uri': 'http://en.wikipedia.org/wiki/Bulgaria', 'type': 'loc', 'score': 4, 'label': {'eng': 'Bulgaria'}, 'location': {'type': 'country', 'label': {'eng': 'Bulgaria'}}}, {'uri': 'http://en.wikipedia.org/wiki/North_Macedonia', 'type': 'loc', 'score': 3, 'label': {'eng': 'North Macedonia'}, 'location': {'type': 'country', 'label': {'eng': 'North Macedonia'}}}, {'uri': 'http://en.wikipedia.org/wiki/Jean-Claude_Juncker', 'type': 'person', 'score': 3, 'label': {'eng': 'Jean-Claude Juncker'}}, {'uri': 'http://en.wikipedia.org/wiki/President_of_the_European_Commission', 'type': 'wiki', 'score': 3, 'label': {'eng': 'President of the European Commission'}}, {'uri': 'http://en.wikipedia.org/wiki/Human_migration', 'type': 'wiki', 'score': 3, 'label': {'eng': 'Human migration'}}, {'uri': 'http://en.wikipedia.org/wiki/Refugee', 'type': 'wiki', 'score': 3, 'label': {'eng': 'Refugee'}}, {'uri': 'http://en.wikipedia.org/wiki/Right_of_asylum', 'type': 'wiki', 'score': 3, 'label': {'eng': 'Right of asylum'}}, {'uri': 'http://en.wikipedia.org/wiki/United_Nations', 'type': 'org', 'score': 3, 'label': {'eng': 'United Nations'}}, {'uri': 'http://en.wikipedia.org/wiki/Agence_France-Presse', 'type': 'org', 'score': 3, 'label': {'eng': 'Agence France-Presse'}}, {'uri': 'http://en.wikipedia.org/wiki/Iraq', 'type': 'loc', 'score': 3, 'label': {'eng': 'Iraq'}, 'location': {'type': 'country', 'label': {'eng': 'Iraq'}}}, {'uri': 'http://en.wikipedia.org/wiki/Europe', 'type': 'loc', 'score': 3, 'label': {'eng': 'Europe'}, 'location': None}, {'uri': 'http://en.wikipedia.org/wiki/Syria', 'type': 'loc', 'score': 3, 'label': {'eng': 'Syria'}, 'location': {'type': 'country', 'label': {'eng': 'Syria'}}}, {'uri': 'http://en.wikipedia.org/wiki/Serbia', 'type': 'loc', 'score': 3, 'label': {'eng': 'Serbia'}, 'location': {'type': 'country', 'label': {'eng': 'Serbia'}}}, {'uri': 'http://en.wikipedia.org/wiki/Austria', 'type': 'loc', 'score': 3, 'label': {'eng': 'Austria'}, 'location': {'type': 'country', 'label': {'eng': 'Austria'}}}, {'uri': 'http://en.wikipedia.org/wiki/Afghanistan', 'type': 'loc', 'score': 3, 'label': {'eng': 'Afghanistan'}, 'location': {'type': 'country', 'label': {'eng': 'Afghanistan'}}}, {'uri': 'http://en.wikipedia.org/wiki/Parliament', 'type': 'wiki', 'score': 2, 'label': {'eng': 'Parliament'}}, {'uri': 'http://en.wikipedia.org/wiki/Vienna', 'type': 'loc', 'score': 1, 'label': {'eng': 'Vienna'}, 'location': {'type': 'place', 'label': {'eng': 'Vienna'}, 'country': {'type': 'country', 'label': {'eng': 'Austria'}}}}]",,eng-1692899,-0.1607843137254902,183141300,1,iran-daily.com,news,Iran daily,,Balkans Slovenia European migrant crisis European Union Romania Hungary Croatia Greece Germany Bulgaria North Macedonia Jean-Claude Juncker President of the European Commission Human migration Refugee Right of asylum United Nations Agence France-Presse Iraq Europe Syria Serbia Austria Afghanistan Parliament Vienna,Iran,IR,,,,,C20,C5,Asia,AS,Muslim,126.0,130.0,165.0,146.0,122.0,129.0,162.0,102.0,138.0,81.0,58.0,78.0,158.0,58.0,41.0,43.0,59.0,14.0,40.0,,,,,,,,,-1,,,0,False,2015,10,21,35,16,2015-10-21
41,324907773,eng,False,2015-10-22,09:33:00,2015-10-22 09:33:00,2015-10-22T09:33:00Z,news,0.6196078658103943,http://www.iran-daily.com/News/129505.html,Slovenia asks for EU police force over refugee crisis,,"Late on Wednesday, Slovenian Interior Minister Vesna Gyorkos Znidar told TV Sloveni, the state news agency, that ""Slovenia has already asked other EU member states for police units.""

More than 12,600 asylum seekers have entered Slovenia in the past 24 hours on their way to their preferred destinations of northern and western Europe, authorities said.

Earlier this week, Slovenia's parliament gave more power to the army to help police control the borders as the country plans to call in retired police back into the force to help administer the huge inflow of refugees.

Since Saturday, a huge number of migrants started coming to Slovenia after Hungary on Friday sealed its border with Croatia.

Croatia and neighboring Slovenia agreed earlier this week that they would keep their borders open under the condition that Germany and Austria would also do the same.

'Let us go'

On Wednesday, a dozen tents were destroyed by a fire that broke out at the main refugee camp on Slovenia's border with Croatia.

According to reports, there were hundreds of mostly young male refugees nearby who chanted, ""Let us go! Let us go!""

The government said that it was still investigating the cause of the blaze, but police at the scene told AP that asylum seekers set a stack of blankets, supplied by the UN refugee agency UNHCR, deliberately on fire to protest against the conditions in the camp on the outskirts of the town of Brezice in eastern Slovenia.

Many of those demanding to leave the Slovenian border town for Austria, Germany and other European Union nations to the north were complaining about the conditions and the lack of help they needed.

Emergency Meeting

This is while the European Union (EU) has called an extraordinary summit with Balkan countries on the refugee crisis.

On Sunday, the leaders of Austria, Bulgaria, Croatia, Germany, Greece, Hungary, Romania and Slovenia will meet in Brussels with their counterparts from non-EU states like Macedonia and Serbia, according to the office of European Commission President Jean-Claude Juncker.

According to the International Organization for Migration, over 600,000 people fleeing foreign-backed wars, terrorism, and unrest in the Middle East and North Africa have landed on European shores this year after making dangerous sea journeys from Turkey to Greece and across the Mediterranean to Italy.",[],"[{'uri': 'http://en.wikipedia.org/wiki/Slovenia', 'type': 'loc', 'score': 5, 'label': {'eng': 'Slovenia'}, 'location': {'type': 'country', 'label': {'eng': 'Slovenia'}}}, {'uri': 'http://en.wikipedia.org/wiki/Croatia', 'type': 'loc', 'score': 5, 'label': {'eng': 'Croatia'}, 'location': {'type': 'country', 'label': {'eng': 'Croatia'}}}, {'uri': 'http://en.wikipedia.org/wiki/European_migrant_crisis', 'type': 'wiki', 'score': 4, 'label': {'eng': 'European migrant crisis'}}, {'uri': 'http://en.wikipedia.org/wiki/Asylum_seeker', 'type': 'wiki', 'score': 4, 'label': {'eng': 'Asylum seeker'}}, {'uri': 'http://en.wikipedia.org/wiki/Refugee', 'type': 'wiki', 'score': 4, 'label': {'eng': 'Refugee'}}, {'uri': 'http://en.wikipedia.org/wiki/European_Union', 'type': 'loc', 'score': 4, 'label': {'eng': 'European Union'}, 'location': None}, {'uri': 'http://en.wikipedia.org/wiki/United_Nations_High_Commissioner_for_Refugees', 'type': 'org', 'score': 3, 'label': {'eng': 'United Nations High Commissioner for Refugees'}}, {'uri': 'http://en.wikipedia.org/wiki/Member_state_of_the_European_Union', 'type': 'wiki', 'score': 3, 'label': {'eng': 'Member state of the European Union'}}, {'uri': 'http://en.wikipedia.org/wiki/Parliament', 'type': 'wiki', 'score': 3, 'label': {'eng': 'Parliament'}}, {'uri': 'http://en.wikipedia.org/wiki/Western_Europe', 'type': 'loc', 'score': 3, 'label': {'eng': 'Western Europe'}, 'location': None}, {'uri': 'http://en.wikipedia.org/wiki/Hungary', 'type': 'loc', 'score': 3, 'label': {'eng': 'Hungary'}, 'location': {'type': 'country', 'label': {'eng': 'Hungary'}}}, {'uri': 'http://en.wikipedia.org/wiki/Germany', 'type': 'loc', 'score': 3, 'label': {'eng': 'Germany'}, 'location': {'type': 'country', 'label': {'eng': 'Germany'}}}, {'uri': 'http://en.wikipedia.org/wiki/Austria', 'type': 'loc', 'score': 3, 'label': {'eng': 'Austria'}, 'location': {'type': 'country', 'label': {'eng': 'Austria'}}}, {'uri': 'http://en.wikipedia.org/wiki/Bre탑ice', 'type': 'loc', 'score': 2, 'label': {'eng': 'Bre탑ice'}, 'location': {'type': 'place', 'label': {'eng': 'Bre탑ice'}, 'country': {'type': 'country', 'label': {'eng': 'Slovenia'}}}}, {'uri': 'http://en.wikipedia.org/wiki/Balkans', 'type': 'wiki', 'score': 2, 'label': {'eng': 'Balkans'}}, {'uri': 'http://en.wikipedia.org/wiki/Brussels', 'type': 'loc', 'score': 2, 'label': {'eng': 'Brussels'}, 'location': {'type': 'place', 'label': {'eng': 'Brussels'}, 'country': {'type': 'country', 'label': {'eng': 'Belgium'}}}}, {'uri': 'http://en.wikipedia.org/wiki/Romania', 'type': 'loc', 'score': 2, 'label': {'eng': 'Romania'}, 'location': {'type': 'country', 'label': {'eng': 'Romania'}}}, {'uri': 'http://en.wikipedia.org/wiki/Bulgaria', 'type': 'loc', 'score': 2, 'label': {'eng': 'Bulgaria'}, 'location': {'type': 'country', 'label': {'eng': 'Bulgaria'}}}, {'uri': 'http://en.wikipedia.org/wiki/North_Macedonia', 'type': 'loc', 'score': 1, 'label': {'eng': 'North Macedonia'}, 'location': {'type': 'country', 'label': {'eng': 'North Macedonia'}}}, {'uri': 'http://en.wikipedia.org/wiki/International_Organization_for_Migration', 'type': 'org', 'score': 1, 'label': {'eng': 'International Organization for Migration'}}, {'uri': 'http://en.wikipedia.org/wiki/Jean-Claude_Juncker', 'type': 'person', 'score': 1, 'label': {'eng': 'Jean-Claude Juncker'}}, {'uri': 'http://en.wikipedia.org/wiki/President_of_the_European_Commission', 'type': 'wiki', 'score': 1, 'label': {'eng': 'President of the European Commission'}}, {'uri': 'http://en.wikipedia.org/wiki/Mediterranean_Sea', 'type': 'loc', 'score': 1, 'label': {'eng': 'Mediterranean Sea'}, 'location': None}, {'uri': 'http://en.wikipedia.org/wiki/North_Africa', 'type': 'loc', 'score': 1, 'label': {'eng': 'North Africa'}, 'location': None}, {'uri': 'http://en.wikipedia.org/wiki/Middle_East', 'type': 'loc', 'score': 1, 'label': {'eng': 'Middle East'}, 'location': None}, {'uri': 'http://en.wikipedia.org/wiki/Terrorism', 'type': 'wiki', 'score': 1, 'label': {'eng': 'Terrorism'}}, {'uri': 'http://en.wikipedia.org/wiki/Turkey', 'type': 'loc', 'score': 1, 'label': {'eng': 'Turkey'}, 'location': {'type': 'country', 'label': {'eng': 'Turkey'}}}, {'uri': 'http://en.wikipedia.org/wiki/Serbia', 'type': 'loc', 'score': 1, 'label': {'eng': 'Serbia'}, 'location': {'type': 'country', 'label': {'eng': 'Serbia'}}}, {'uri': 'http://en.wikipedia.org/wiki/Italy', 'type': 'loc', 'score': 1, 'label': {'eng': 'Italy'}, 'location': {'type': 'country', 'label': {'eng': 'Italy'}}}, {'uri': 'http://en.wikipedia.org/wiki/Greece', 'type': 'loc', 'score': 1, 'label': {'eng': 'Greece'}, 'location': {'type': 'country', 'label': {'eng': 'Greece'}}}]",,eng-1692899,-0.07450980392156858,183202380,1,iran-daily.com,news,Iran daily,,Slovenia Croatia European migrant crisis Asylum seeker Refugee European Union United Nations High Commissioner for Refugees Member state of the European Union Parliament Western Europe Hungary Germany Austria Bre탑ice Balkans Brussels Romania Bulgaria North Macedonia International Organization for Migration Jean-Claude Juncker President of the European Commission Mediterranean Sea North Africa Middle East Terrorism Turkey Serbia Italy Greece,Iran,IR,,,,,C20,C5,Asia,AS,Muslim,126.0,130.0,165.0,146.0,122.0,129.0,162.0,102.0,138.0,81.0,58.0,78.0,158.0,58.0,41.0,43.0,59.0,14.0,40.0,,,,,,,,,-1,,,0,False,2015,10,22,33,9,2015-10-22
