,uri,lang,isDuplicate,date,time,dateTime,dateTimePub,dataType,sim,url,title,body,authors,concepts,image,eventUri,sentiment,wgt,relevance,source.uri,source.dataType,source.title,all_concepts,con_name,country,lang-name,language,Political-Alignment,wiki-url,Cultural-Class,Economic-Class,Continent-name,Continent,Religions,2019Rank-From,SafetyandSecurity,PersonalFreedom,Governance,SocialCapital,InvestmentEnvironment,EnterpriseConditions,MarketAccessandInfrastructure,EconomicQuality,LivingConditions,Health,Education,NaturalEnvironment,PowerDistance,Individualism,Masculinity,UncertaintyAvoidance,LongTermOrientation,Indulgence,economicblocs-name,economicblocs,militarydefenseblocs-name,militarydefenseblocs,politicalregionalblocs-name,politicalregionalblocs,linguisticblocs-name,linguisticblocs,proScore,destination,parent,count,status,year,month,day,min,hour,MD
18,7446713376,eng,False,2023-03-14,16:02:00,2023-03-14 16:02:00,2023-03-14T15:12:00Z,news,0.4941176474094391,https://www.albawaba.com/news/death-toll-cyclone-freddy-rises-190-1512048,Death toll from Cyclone Freddy rises to 190 | Al Bawaba,"ALBAWABA - The death toll from Tropical Cyclone Freddy jumped to 190 in Malawi, while 584 others were injured, the Department of Disaster Management Affairs reported on Tuesday.

Cyclone Freddy also left 37 people missing despite the fact that the Malawi Ministry of Natural Resources and Climate Change said it is weakening.

The ministry said: ""It will continue to cause torrential rains associated with windy conditions in most parts of Southern Malawi districts.""

Furthermore, it warned of the threat of heavy flooding and damaging winds in the southern African country.

Freddy made landfall with maximum wind speeds at sea measuring 155 kilometers (around 100 miles) an hour and sea gusts averaging 220 kilometers (around 140 miles) an hour, the Associated Press reported.

Videos were shared online showing heavy floods breaking homes and buildings in Malawi",[],"[{'uri': 'http://en.wikipedia.org/wiki/Cyclone', 'type': 'wiki', 'score': 4, 'label': {'eng': 'Cyclone'}}, {'uri': 'http://en.wikipedia.org/wiki/Malawi', 'type': 'loc', 'score': 4, 'label': {'eng': 'Malawi'}, 'location': {'type': 'country', 'label': {'eng': 'Malawi'}}}, {'uri': 'http://en.wikipedia.org/wiki/Köppen_climate_classification', 'type': 'wiki', 'score': 2, 'label': {'eng': 'Köppen climate classification'}}, {'uri': 'http://en.wikipedia.org/wiki/Southern_Africa', 'type': 'loc', 'score': 1, 'label': {'eng': 'Southern Africa'}, 'location': None}, {'uri': 'http://en.wikipedia.org/wiki/Flood', 'type': 'wiki', 'score': 1, 'label': {'eng': 'Flood'}}, {'uri': 'http://en.wikipedia.org/wiki/Associated_Press', 'type': 'org', 'score': 1, 'label': {'eng': 'Associated Press'}}]",https://www.albawaba.com/sites/default/files/styles/default/public/2023-03/33BA989-preview.jpg?itok=JI0L3fzj,eng-8467663,-0.2705882352941177,416505720,1,albawaba.com,news,Al Bawaba,Cyclone Malawi Köppen climate classification Southern Africa Flood Associated Press,Jordan,JO,,,,,C20,C15,Asia,AS,Muslim,86.0,average,average,average,worst,best,best,average,worst,average,average,average,worst,high,low,low,high,low,low,,,,,Arab League,AL,Arabic-speaking,Ara,-1,,,0,False,2023,3,14,2,16,2023-03-14
