,uri,lang,isDuplicate,date,time,dateTime,dateTimePub,dataType,sim,url,title,userHasPermissions,body,authors,concepts,image,eventUri,sentiment,wgt,relevance,source.uri,source.dataType,source.title,source.private,all_concepts,con-name,country,lang-name,language,Political-Alignment,wiki-url,Cultural-Class,Economic-Class,Continent-name,Continent,Religions,2019Rank-From,SafetyandSecurity,PersonalFreedom,Governance,SocialCapital,InvestmentEnvironment,EnterpriseConditions,MarketAccessandInfrastructure,EconomicQuality,LivingConditions,Health,Education,NaturalEnvironment,PowerDistance,Individualism,Masculinity,UncertaintyAvoidance,LongTermOrientation,Indulgence,economicblocs-name,economicblocs,militarydefenseblocs-name,militarydefenseblocs,politicalregionalblocs-name,politicalregionalblocs,linguisticblocs-name,linguisticblocs,proScore,destination,parent,count,status,year,month,day,min,hour,MD
51,324797473,eng,False,2015-10-22,03:10:00,2015-10-22 03:10:00,,news,0.6627451181411743,http://www.japantimes.co.jp/news/2015/10/22/world/social-issues-world/cold-rain-soaked-refugees-crowding-slovenia-camp-demand-transit-wage-fiery-protest/,"Cold, rain-soaked refugees crowding Slovenia camp demand transit, wage fiery protest",,"BREZICE, SLOVENIA - After too many days and nights stuck outside in the rain and cold, tempers are fraying among the tens of thousands of migrants trying to get through the Balkans to the heart of Europe.

A fire at the main refugee camp on Slovenia's border with Croatia destroyed a dozen lime green army-issue tents Wednesday as scores of mostly young male migrants nearby chanted, ""Let us go! Let us go!""

While the government said it was still investigating the cause, police at the scene told The Associated Press that migrants had set a stack of UNHCR-supplied blankets deliberately on fire to protest conditions in the camp on the outskirts of Brezice.

Many of those demanding to leave the Slovenian border town for Austria, Germany and other European Union nations to the north had waded the previous night through the Sutla River, which marks the border between Slovenia and Croatia, in frigid conditions made worse by their soaked clothes. Sometimes in the pitch dark, at other times aided by light from a police helicopter's searchlight, more than 1,000 souls strode chest-deep into the muddy waters on the Croat side and struggled up the muddy embankment into Slovenia.

Many migrants from the Middle East, Asia and Africa expressed bewilderment and disappointment because they had been told as they began their journeys in Turkey that the hard part would end once they reached EU countries like Croatia and Slovenia. Many had expected other countries to permit them free passage to wealthier Western countries, particularly Germany, that they hope to make home.

""I am sorry for Europe,"" said Ari Omar, an Iraqi, who was resting in a Slovenian pasture a few hundred meters (yards) from the border with Croatia. ""We did not think Europe is like this: no respect for refugees, not treating us with dignity. Why is Europe like this?""

More than 21,500 people have crossed that frontier in the five days since Hungary -- the previous favored EU entry point for migrants crossing the Balkans -- closed its borders with Croatia and forced the human tide further west into Slovenia. This Alpine country of barely 2 million says it cannot cope with the volume of human traffic and is appealing for EU financial and security aid. Lawmakers passed an emergency bill permitting Slovenia's military to operate more freely along the border, and more than 200 troops were deployed Wednesday in armored personnel carriers at several crossing points and camps.

Slovenia's interior secretary of state, Bostjan Sefic, told reporters in the Slovenian capital of Ljubljana that troops would have greater freedom to tackle crowd-control tasks on their own, because the country didn't have enough police for the job. He said tensions were running highest at the camp in Brezice, the scene of Wednesday's fire. He said the facility -- tents in fields beside a warehouse -- was designed to hold 250 people, not the 4,000 or more who have passed through since Tuesday.

In a statement Sefic blamed the tensions on ""unannounced excessive numbers of people deliberately sent to the border by Croatia."" Reflecting Slovenia's lack of sufficient shelters, more than 3,000 people who crossed the border Wednesday night were ordered to sit in cornfields, surrounded by police and soldiers, until buses could deliver them north to Austria.

Sefic said the travelers ""just want to go on their way as soon as possible. They are very dissatisfied and unrestful.""

Slovenia's president, Borut Pahor, has spent the past two days in Brussels lobbying EU leaders for help. European Commission President Jean Claude Juncker announced a special summit Sunday seeking a regional strategy for managing the migrant flow involving Austria, Bulgaria, Croatia, Macedonia, Germany, Greece, Hungary, Romania, Serbia as well as Slovenia. For months, a steady stream of asylum seekers has traveled from EU member Greece north through non-EU members Macedonia and Serbia to reach what the travelers hope will be an easy entry point to the passport-free EU zone. But the route has grown increasingly difficult as Hungary shut access from Serbia in mid-September and then closed the door to Croatia on Saturday.

A statement from Juncker's office said the summit would seek to promote ""greater cooperation, more extensive consultation and immediate operational action.""

Those already freezing in Balkans fields cannot wait any more days for improved EU management of the humanitarian crisis and are voting with their feet whenever police permit them.

In Austria, at least 1,000 people broke free from a police-supervised camp and walked north on a small road parallel to the highway leading to the city of Graz. Police spokesman Fritz Grundnig said officers were accompanying the marchers and not trying to stop them, merely barring them from directly walking on the highway.

A similar border breakout took place Wednesday morning on the Serbian-Croat border, where hundreds who had spent the night trying to sleep unsheltered in freezing farm fields marched across the frontier in a challenge to Croat border police, who deployed to block them but backed off. A U.N. refugee agency official, Francesca Bonelli, said about 3,000 people in total camped out overnight on that border, including many elderly and ailing people.",[],"[{'uri': 'http://en.wikipedia.org/wiki/Brežice', 'type': 'loc', 'score': 5, 'label': {'eng': 'Brežice'}, 'location': {'type': 'place', 'label': {'eng': 'Brežice'}, 'country': {'type': 'country', 'label': {'eng': 'Slovenia'}}}}, {'uri': 'http://en.wikipedia.org/wiki/Europe', 'type': 'loc', 'score': 5, 'label': {'eng': 'Europe'}, 'location': None}, {'uri': 'http://en.wikipedia.org/wiki/European_Union', 'type': 'loc', 'score': 5, 'label': {'eng': 'European Union'}, 'location': None}, {'uri': 'http://en.wikipedia.org/wiki/Slovenia', 'type': 'loc', 'score': 5, 'label': {'eng': 'Slovenia'}, 'location': {'type': 'country', 'label': {'eng': 'Slovenia'}}}, {'uri': 'http://en.wikipedia.org/wiki/Croatia', 'type': 'loc', 'score': 5, 'label': {'eng': 'Croatia'}, 'location': {'type': 'country', 'label': {'eng': 'Croatia'}}}, {'uri': 'http://en.wikipedia.org/wiki/Balkans', 'type': 'wiki', 'score': 4, 'label': {'eng': 'Balkans'}}, {'uri': 'http://en.wikipedia.org/wiki/Refugee_camp', 'type': 'wiki', 'score': 4, 'label': {'eng': 'Refugee camp'}}, {'uri': 'http://en.wikipedia.org/wiki/Refugee', 'type': 'wiki', 'score': 4, 'label': {'eng': 'Refugee'}}, {'uri': 'http://en.wikipedia.org/wiki/Germany', 'type': 'loc', 'score': 4, 'label': {'eng': 'Germany'}, 'location': {'type': 'country', 'label': {'eng': 'Germany'}}}, {'uri': 'http://en.wikipedia.org/wiki/Austria', 'type': 'loc', 'score': 4, 'label': {'eng': 'Austria'}, 'location': {'type': 'country', 'label': {'eng': 'Austria'}}}, {'uri': 'http://en.wikipedia.org/wiki/Associated_Press', 'type': 'org', 'score': 3, 'label': {'eng': 'Associated Press'}}, {'uri': 'http://en.wikipedia.org/wiki/Levee', 'type': 'wiki', 'score': 3, 'label': {'eng': 'Levee'}}, {'uri': 'http://en.wikipedia.org/wiki/Alps', 'type': 'loc', 'score': 3, 'label': {'eng': 'Alps'}, 'location': None}, {'uri': 'http://en.wikipedia.org/wiki/Middle_East', 'type': 'loc', 'score': 3, 'label': {'eng': 'Middle East'}, 'location': None}, {'uri': 'http://en.wikipedia.org/wiki/Africa', 'type': 'loc', 'score': 3, 'label': {'eng': 'Africa'}, 'location': None}, {'uri': 'http://en.wikipedia.org/wiki/Western_world', 'type': 'wiki', 'score': 3, 'label': {'eng': 'Western world'}}, {'uri': 'http://en.wikipedia.org/wiki/Iraq', 'type': 'loc', 'score': 3, 'label': {'eng': 'Iraq'}, 'location': {'type': 'country', 'label': {'eng': 'Iraq'}}}, {'uri': 'http://en.wikipedia.org/wiki/Asia', 'type': 'loc', 'score': 3, 'label': {'eng': 'Asia'}, 'location': None}, {'uri': 'http://en.wikipedia.org/wiki/Turkey', 'type': 'loc', 'score': 3, 'label': {'eng': 'Turkey'}, 'location': {'type': 'country', 'label': {'eng': 'Turkey'}}}, {'uri': 'http://en.wikipedia.org/wiki/Hungary', 'type': 'loc', 'score': 3, 'label': {'eng': 'Hungary'}, 'location': {'type': 'country', 'label': {'eng': 'Hungary'}}}, {'uri': 'http://en.wikipedia.org/wiki/North_Macedonia', 'type': 'loc', 'score': 2, 'label': {'eng': 'North Macedonia'}, 'location': {'type': 'country', 'label': {'eng': 'North Macedonia'}}}, {'uri': 'http://en.wikipedia.org/wiki/Borut_Pahor', 'type': 'person', 'score': 2, 'label': {'eng': 'Borut Pahor'}}, {'uri': 'http://en.wikipedia.org/wiki/Jean-Claude_Juncker', 'type': 'person', 'score': 2, 'label': {'eng': 'Jean-Claude Juncker'}}, {'uri': 'http://en.wikipedia.org/wiki/President_of_the_European_Commission', 'type': 'wiki', 'score': 2, 'label': {'eng': 'President of the European Commission'}}, {'uri': 'http://en.wikipedia.org/wiki/Armoured_personnel_carrier', 'type': 'wiki', 'score': 2, 'label': {'eng': 'Armoured personnel carrier'}}, {'uri': 'http://en.wikipedia.org/wiki/Immigration', 'type': 'wiki', 'score': 2, 'label': {'eng': 'Immigration'}}, {'uri': 'http://en.wikipedia.org/wiki/Maize', 'type': 'wiki', 'score': 2, 'label': {'eng': 'Maize'}}, {'uri': 'http://en.wikipedia.org/wiki/Brussels', 'type': 'loc', 'score': 2, 'label': {'eng': 'Brussels'}, 'location': {'type': 'place', 'label': {'eng': 'Brussels'}, 'country': {'type': 'country', 'label': {'eng': 'Belgium'}}}}, {'uri': 'http://en.wikipedia.org/wiki/United_States_Secretary_of_State', 'type': 'wiki', 'score': 2, 'label': {'eng': 'United States Secretary of State'}}, {'uri': 'http://en.wikipedia.org/wiki/Bus', 'type': 'wiki', 'score': 2, 'label': {'eng': 'Bus'}}, {'uri': 'http://en.wikipedia.org/wiki/Lobbying', 'type': 'wiki', 'score': 2, 'label': {'eng': 'Lobbying'}}, {'uri': 'http://en.wikipedia.org/wiki/Ljubljana', 'type': 'loc', 'score': 2, 'label': {'eng': 'Ljubljana'}, 'location': {'type': 'place', 'label': {'eng': 'Ljubljana'}, 'country': {'type': 'country', 'label': {'eng': 'Slovenia'}}}}, {'uri': 'http://en.wikipedia.org/wiki/Serbia', 'type': 'loc', 'score': 2, 'label': {'eng': 'Serbia'}, 'location': {'type': 'country', 'label': {'eng': 'Serbia'}}}, {'uri': 'http://en.wikipedia.org/wiki/Romania', 'type': 'loc', 'score': 2, 'label': {'eng': 'Romania'}, 'location': {'type': 'country', 'label': {'eng': 'Romania'}}}, {'uri': 'http://en.wikipedia.org/wiki/Greece', 'type': 'loc', 'score': 2, 'label': {'eng': 'Greece'}, 'location': {'type': 'country', 'label': {'eng': 'Greece'}}}, {'uri': 'http://en.wikipedia.org/wiki/United_Nations', 'type': 'org', 'score': 1, 'label': {'eng': 'United Nations'}}]",http://jto.s3.amazonaws.com/wp-content/uploads/2015/10/f-refugees-a-20151023-870x552.jpg,eng-1692899,-0.4588235294117647,183179400,1,japantimes.co.jp,news,The Japan Times,,Brežice Europe European Union Slovenia Croatia Balkans Refugee camp Refugee Germany Austria Associated Press Levee Alps Middle East Africa Western world Iraq Asia Turkey Hungary North Macedonia Borut Pahor Jean-Claude Juncker President of the European Commission Armoured personnel carrier Immigration Maize Brussels United States Secretary of State Bus Lobbying Ljubljana Serbia Romania Greece United Nations,Japan,JP,,,Center,ChatGPT,C1,C3,Asia,AS,Irreligion,16.0,5.0,27.0,17.0,141.0,5.0,5.0,8.0,28.0,17.0,2.0,13.0,15.0,54.0,46.0,95.0,92.0,88.0,42.0,,,,,,,,,-1,,,0,False,2015,10,22,10,3,2015-10-22
