,uri,lang,isDuplicate,date,time,dateTime,dateTimePub,dataType,sim,url,title,userHasPermissions,body,authors,concepts,image,eventUri,sentiment,wgt,relevance,source.uri,source.dataType,source.title,source.private,all_concepts,con-name,country,lang-name,language,Political-Alignment,wiki-url,Cultural-Class,Economic-Class,Continent-name,Continent,Religions,2019Rank-From,SafetyandSecurity,PersonalFreedom,Governance,SocialCapital,InvestmentEnvironment,EnterpriseConditions,MarketAccessandInfrastructure,EconomicQuality,LivingConditions,Health,Education,NaturalEnvironment,PowerDistance,Individualism,Masculinity,UncertaintyAvoidance,LongTermOrientation,Indulgence,economicblocs-name,economicblocs,militarydefenseblocs-name,militarydefenseblocs,politicalregionalblocs-name,politicalregionalblocs,linguisticblocs-name,linguisticblocs,proScore,destination,parent,count,status,year,month,day,min,hour,MD
167,324328117,eng,False,2015-10-20,23:11:00,2015-10-20 23:11:00,2015-10-20T23:11:00Z,news,0.0,http://www.japantimes.co.jp/news/2015/10/21/world/social-issues-world/europe-bound-migrant-exodus-swells-several-routes-slovenia-border-overwhelmed/,Europe-bound migrant exodus swells on several routes; Slovenia border overwhelmed,,"BREZICE, SLOVENIA - Led by riot police on horseback, thousands of weary migrants marched across western Balkans borderlands as far as the eye could see Tuesday as authorities cautiously lowered barriers and intensified efforts to cope with a human tide unseen in Europe since World War II.

Leaders of Slovenia deployed military units to support police on their overwhelmed southern border with Croatia, which delivered more than 6,000 asylum seekers by train and bus to the frontier in bitterly disputed circumstances between the former Yugoslav rivals.

With far too few buses available in Slovenia to cope, most people walked 15 km (9 miles) on rural lanes past cornfields and pastures to reach a refugee camp, a challenge eased by sunny weather after days of torrential rain, fog and frigid winds.

On Slovenia's frontiers with Croatia and Austria, aid workers toiled to erect enough tents and other emergency accommodations to shelter up to 14,000 travelers, more than five times the tiny nation's previous official limit.

Interior Secretary of State Bostjan Sefic told reporters in the Slovene capital, Ljubljana, that the pressure on border security with Croatia had grown ""very difficult with an enormous number of people."" He said Slovenia, an Alpine land of barely 2 million, needed much more help immediately from bigger EU partners to cope or the country might have to adopt border-toughening measures.

""If this continues we will have extreme problems. Slovenia is already in dire straits, an impossible situation,"" Sefic said as lawmakers debated whether to increase the military's powers to manage border security.

In Brussels, Slovenian President Borut Pahor met European Union leaders and said he expected his country to apply for emergency financial aid and border patrol reinforcements from EU partners.

Hungary, long the most popular eastern gateway for people fleeing conflict and poverty in the Middle East, Asia and Africa, has padlocked its borders for migrants progressively over the past month, forcing the tide west through Croatia and Slovenia. All three nations have expressed fears of ending up stuck accommodating tens of thousands of asylum-seekers indefinitely if other EU nations farther north close their borders too.

Croatia, which has erected relatively few shelters along its borders with Serbia and Slovenia, directed thousands into special trains and bus convoys Tuesday to Slovenia in an apparently concerted effort to clear a backlog built up since Saturday, when Hungary closed its borders with Croatia.

The Slovenes complained bitterly that Croat officials were ignoring their requests for advance warnings of migrant deliveries. But Croatia's interior minister, Ranko Ostojic, insisted that the opposite was true and Slovenia was dragging its heels in accepting people quickly enough. He asserted that Croatia was admitting people twice as quickly from Serbia.

""If we are receiving 10,000, then 5,000 people have to be transited to Slovenia,"" he told The Associated Press in an interview near the Serb-Croat border.

Tensions flared on Slovenia's border with Austria as police in both countries struggled to keep migrants walking in orderly lines to buses bound for Austrian refugee centers. At one point, a few hundred people being confined by Slovene police broke free and ran across the border -- seeking to get in front of others waiting hours for buses. Slovene officers' bursts of pepper spray failed to stop them, but Austrian police erected physical barriers that blocked the interlopers' path to buses. They eventually were persuaded to walk back to the end of the line.

The trekkers' primary goal is to reach Germany or Scandinavian nations, which traditionally have offered strong supports for asylum seekers. But even the most liberal and wealthy European countries are signaling plans to increase deterrents to what they view as an unwanted overflow of immigration that should be managed closer to home. To that end, EU leaders last month pledged to boost financial aid by at least €1 billion ($1.1 billion) to camps hosting an estimated 4 million people in Turkey, Lebanon and Jordan.

Yet the EU often fails to meet its own more modest targets. The bloc's border security agency, Frontex, announced Tuesday that EU members had fulfilled barely a fourth of its months-old appeal to provide border guard reinforcements for Greece and Italy, the two biggest entry points for refugees and other migrants. Frontex said 291 guards would be deployed to both countries immediately but the director, Fabrice Leggeri, said he hoped EU members would provide more staff to permit Frontex to move ""much closer to our goal.""

The Netherlands, another common destination for asylum seekers, unveiled a new letter of caution for those seeking a Dutch refuge. The letter, to be provided to all new arrivals, warned they would face lengthy legal delays and spend a year or more living in ""an austere reception, such as in sports centers or tents, where many people share the same lodgings"" while their asylum applications are considered.

Dutch Junior Justice Minister Klaas Dijkhoff said that given the country's shortage of public housing, even successful applicants might be assigned to long-term housing in converted shipping containers or disused office blocks.

The history of undocumented immigration to Europe suggests that, every time one route is closed, another opens. To that end, nations bordering Russia signaled Tuesday that they intended to tighten security at border crossings to deter increased traffic from the Middle East and Vietnam.

Norway said it intended to reject asylum applicants at the border if they had a legal right to reside in Russia. Justice Minister Anders Anundsen highlighted the increased flow of people seeking to enter Norway via the remote Arctic border post in Storskog, many of whom arrive on bicycles because pedestrian crossings are not permitted there. Last week, he said, about a quarter of Norway's total intake of 2,000 asylum-seekers entered via Storskog.

Anundsen said Norway intended to reject refuge-seekers with ""strong connections to Russia through dual citizenship, residence permits or visas.""

The Baltic nation Latvia, meanwhile, said it plans to erect a fence along parts of its 270-km (168-mile) border with Russia.

Interior Ministry spokeswoman Daiga Holma said a fence with motion-detection sensors would cover a third of the frontier as part of a €20 million ($23 million) project to boost border security. She said about 300 people mostly from Vietnam, Iraq and Syria have entered the Baltic country this year from Russia.",[],"[{'uri': 'http://en.wikipedia.org/wiki/Asylum_seeker', 'type': 'wiki', 'score': 5, 'label': {'eng': 'Asylum seeker'}}, {'uri': 'http://en.wikipedia.org/wiki/Immigration', 'type': 'wiki', 'score': 5, 'label': {'eng': 'Immigration'}}, {'uri': 'http://en.wikipedia.org/wiki/Bus', 'type': 'wiki', 'score': 5, 'label': {'eng': 'Bus'}}, {'uri': 'http://en.wikipedia.org/wiki/European_Union', 'type': 'loc', 'score': 5, 'label': {'eng': 'European Union'}, 'location': None}, {'uri': 'http://en.wikipedia.org/wiki/Slovenia', 'type': 'loc', 'score': 5, 'label': {'eng': 'Slovenia'}, 'location': {'type': 'country', 'label': {'eng': 'Slovenia'}}}, {'uri': 'http://en.wikipedia.org/wiki/Croatia', 'type': 'loc', 'score': 5, 'label': {'eng': 'Croatia'}, 'location': {'type': 'country', 'label': {'eng': 'Croatia'}}}, {'uri': 'http://en.wikipedia.org/wiki/Austria', 'type': 'loc', 'score': 5, 'label': {'eng': 'Austria'}, 'location': {'type': 'country', 'label': {'eng': 'Austria'}}}, {'uri': 'http://en.wikipedia.org/wiki/Brežice', 'type': 'loc', 'score': 4, 'label': {'eng': 'Brežice'}, 'location': {'type': 'place', 'label': {'eng': 'Brežice'}, 'country': {'type': 'country', 'label': {'eng': 'Slovenia'}}}}, {'uri': 'http://en.wikipedia.org/wiki/Border_control', 'type': 'wiki', 'score': 4, 'label': {'eng': 'Border control'}}, {'uri': 'http://en.wikipedia.org/wiki/Balkans', 'type': 'wiki', 'score': 4, 'label': {'eng': 'Balkans'}}, {'uri': 'http://en.wikipedia.org/wiki/Riot', 'type': 'wiki', 'score': 4, 'label': {'eng': 'Riot'}}, {'uri': 'http://en.wikipedia.org/wiki/World_War_II', 'type': 'wiki', 'score': 4, 'label': {'eng': 'World War II'}}, {'uri': 'http://en.wikipedia.org/wiki/Europe', 'type': 'loc', 'score': 4, 'label': {'eng': 'Europe'}, 'location': None}, {'uri': 'http://en.wikipedia.org/wiki/Hungary', 'type': 'loc', 'score': 4, 'label': {'eng': 'Hungary'}, 'location': {'type': 'country', 'label': {'eng': 'Hungary'}}}, {'uri': 'http://en.wikipedia.org/wiki/European_Border_and_Coast_Guard_Agency', 'type': 'wiki', 'score': 3, 'label': {'eng': 'European Border and Coast Guard Agency'}}, {'uri': 'http://en.wikipedia.org/wiki/Borut_Pahor', 'type': 'person', 'score': 3, 'label': {'eng': 'Borut Pahor'}}, {'uri': 'http://en.wikipedia.org/wiki/President_of_Slovenia', 'type': 'wiki', 'score': 3, 'label': {'eng': 'President of Slovenia'}}, {'uri': 'http://en.wikipedia.org/wiki/Slovenes', 'type': 'loc', 'score': 3, 'label': {'eng': 'Slovenes'}, 'location': None}, {'uri': 'http://en.wikipedia.org/wiki/Strait_of_Gibraltar', 'type': 'wiki', 'score': 3, 'label': {'eng': 'Strait of Gibraltar'}}, {'uri': 'http://en.wikipedia.org/wiki/Border_guard', 'type': 'wiki', 'score': 3, 'label': {'eng': 'Border guard'}}, {'uri': 'http://en.wikipedia.org/wiki/Alps', 'type': 'loc', 'score': 3, 'label': {'eng': 'Alps'}, 'location': None}, {'uri': 'http://en.wikipedia.org/wiki/Socialist_Federal_Republic_of_Yugoslavia', 'type': 'loc', 'score': 3, 'label': {'eng': 'Socialist Federal Republic of Yugoslavia'}, 'location': None}, {'uri': 'http://en.wikipedia.org/wiki/Refugee_camp', 'type': 'wiki', 'score': 3, 'label': {'eng': 'Refugee camp'}}, {'uri': 'http://en.wikipedia.org/wiki/Refugee', 'type': 'wiki', 'score': 3, 'label': {'eng': 'Refugee'}}, {'uri': 'http://en.wikipedia.org/wiki/Fog', 'type': 'wiki', 'score': 3, 'label': {'eng': 'Fog'}}, {'uri': 'http://en.wikipedia.org/wiki/Maize', 'type': 'wiki', 'score': 3, 'label': {'eng': 'Maize'}}, {'uri': 'http://en.wikipedia.org/wiki/Humanitarian_aid', 'type': 'wiki', 'score': 3, 'label': {'eng': 'Humanitarian aid'}}, {'uri': 'http://en.wikipedia.org/wiki/Brussels', 'type': 'loc', 'score': 3, 'label': {'eng': 'Brussels'}, 'location': {'type': 'place', 'label': {'eng': 'Brussels'}, 'country': {'type': 'country', 'label': {'eng': 'Belgium'}}}}, {'uri': 'http://en.wikipedia.org/wiki/Middle_East', 'type': 'loc', 'score': 3, 'label': {'eng': 'Middle East'}, 'location': None}, {'uri': 'http://en.wikipedia.org/wiki/Africa', 'type': 'loc', 'score': 3, 'label': {'eng': 'Africa'}, 'location': None}, {'uri': 'http://en.wikipedia.org/wiki/United_States_Secretary_of_State', 'type': 'wiki', 'score': 3, 'label': {'eng': 'United States Secretary of State'}}, {'uri': 'http://en.wikipedia.org/wiki/Asia', 'type': 'loc', 'score': 3, 'label': {'eng': 'Asia'}, 'location': None}, {'uri': 'http://en.wikipedia.org/wiki/Ljubljana', 'type': 'loc', 'score': 3, 'label': {'eng': 'Ljubljana'}, 'location': {'type': 'place', 'label': {'eng': 'Ljubljana'}, 'country': {'type': 'country', 'label': {'eng': 'Slovenia'}}}}, {'uri': 'http://en.wikipedia.org/wiki/Serbia', 'type': 'loc', 'score': 3, 'label': {'eng': 'Serbia'}, 'location': {'type': 'country', 'label': {'eng': 'Serbia'}}}, {'uri': 'http://en.wikipedia.org/wiki/Associated_Press', 'type': 'org', 'score': 2, 'label': {'eng': 'Associated Press'}}, {'uri': 'http://en.wikipedia.org/wiki/Immigration_to_Europe', 'type': 'wiki', 'score': 2, 'label': {'eng': 'Immigration to Europe'}}, {'uri': 'http://en.wikipedia.org/wiki/Pepper_spray', 'type': 'wiki', 'score': 2, 'label': {'eng': 'Pepper spray'}}, {'uri': 'http://en.wikipedia.org/wiki/Scandinavia', 'type': 'wiki', 'score': 2, 'label': {'eng': 'Scandinavia'}}, {'uri': 'http://en.wikipedia.org/wiki/Turkey', 'type': 'loc', 'score': 2, 'label': {'eng': 'Turkey'}, 'location': {'type': 'country', 'label': {'eng': 'Turkey'}}}, {'uri': 'http://en.wikipedia.org/wiki/Russia', 'type': 'loc', 'score': 2, 'label': {'eng': 'Russia'}, 'location': {'type': 'country', 'label': {'eng': 'Russia'}}}, {'uri': 'http://en.wikipedia.org/wiki/Norway', 'type': 'loc', 'score': 2, 'label': {'eng': 'Norway'}, 'location': {'type': 'country', 'label': {'eng': 'Norway'}}}, {'uri': 'http://en.wikipedia.org/wiki/Netherlands', 'type': 'loc', 'score': 2, 'label': {'eng': 'Netherlands'}, 'location': {'type': 'country', 'label': {'eng': 'Netherlands'}}}]",http://jto.s3.amazonaws.com/wp-content/uploads/2015/10/f-migrants-a-20151022-870x596.jpg,eng-1692899,-0.1137254901960785,183078660,1,japantimes.co.jp,news,The Japan Times,,Asylum seeker Immigration Bus European Union Slovenia Croatia Austria Brežice Border control Balkans Riot World War II Europe Hungary European Border and Coast Guard Agency Borut Pahor President of Slovenia Slovenes Strait of Gibraltar Border guard Alps Socialist Federal Republic of Yugoslavia Refugee camp Refugee Fog Maize Humanitarian aid Brussels Middle East Africa United States Secretary of State Asia Ljubljana Serbia Associated Press Immigration to Europe Pepper spray Scandinavia Turkey Russia Norway Netherlands,Japan,JP,,,Center,ChatGPT,C1,C3,Asia,AS,Irreligion,16.0,5.0,27.0,17.0,141.0,5.0,5.0,8.0,28.0,17.0,2.0,13.0,15.0,54.0,46.0,95.0,92.0,88.0,42.0,,,,,,,,,-1,,,0,False,2015,10,20,11,23,2015-10-20
