,Unnamed: 0,uri,lang,isDuplicate,date,time,dateTime,dateTimePub,dataType,sim,url,title,body,authors,concepts,image,eventUri,sentiment,wgt,relevance,source.uri,source.dataType,source.title,all_concepts,url2,word_count,Category,year,month,day,min,hour,MD
261,15318,8116194370,eng,False,2024-05-07,20:08:13,5/7/2024 20:08,2024-05-07 20:07:50,news,0.639215708,https://arstechnica.com/apple/2024/05/hands-on-with-the-new-ipad-pros-and-airs-a-surprisingly-refreshing-refresh/,Hands-on with the new iPad Pros and Airs: A surprisingly refreshing refresh,"Apple has a brand-new lineup of iPad Pro and Air models for the first time in well over a year. Most people would probably be hard-pressed to tell the new ones from the old ones just by looking at them, but after hands-on sessions with both sizes of both tablets, the small details (especially for the Pros) all add up to a noticeably refined iPad experience.

iPad Airs: Bigger is better

But let's begin with the new Airs, since there's a bit less to talk about. The 11-inch iPad Air (technically the 6th-generation model) is mostly the same as the previous-generation A14 and M1 models, design-wise, with identical physical dimensions and weight. It's still the same slim-bezel design Apple introduced with the 2018 iPad Pro, just with a 60 Hz LCD display panel and Touch ID on the power button rather than Face ID.

Further Reading

So when Apple says it's been ""redesigned,"" what the company is mainly referencing is the fact that the webcam is now mounted on the long edge of the tablet rather than the short edge. This makes its positioning more laptop-y when it's docked to the Magic Keyboard or some other keyboard.

The most welcome change to the Air is the introduction of a 13-inch model (blessedly, no longer ""12.9 inches""). It looks like the old 12.9-inch iPad Pro design from circa 2018 but with the simpler single-lens 12MP camera and the Touch ID button rather than the Face ID sensor.

With the iPad Pro and the Air next to each other, it's clear which has the superior screen -- the 120 Hz refresh rate of ProMotion and the infinite contrast of OLED are definitely major points in the Pro's favor. But if you're just looking for a big screen for watching videos, reading books, or playing games, or if you're just looking for a general-use laptop replacement tablet, Apple is still using a great 60 Hz LCD panel here. And the $799 price tag is considerably lower than any of Apple's past 12.9-inch iPad Pros.

Like the 15-inch MacBook Air, it's a way for people to get a bigger screen without paying for advanced screen technologies or faster processors if they don't want or need them. It's hard to find a downside to that, as long as you're OK with iPadOS' differences and restrictions relative to macOS.","[{'uri': 'andrew_cunningham@arstechnica.com', 'name': 'Andrew Cunningham', 'type': 'author', 'isAgency': False}]","[{'uri': 'http://en.wikipedia.org/wiki/IPad_Pro', 'type': 'wiki', 'score': 5, 'label': {'eng': 'IPad Pro'}}, {'uri': 'http://en.wikipedia.org/wiki/IPad', 'type': 'wiki', 'score': 5, 'label': {'eng': 'IPad'}}, {'uri': 'http://en.wikipedia.org/wiki/Apple_Inc.', 'type': 'org', 'score': 5, 'label': {'eng': 'Apple Inc.'}}, {'uri': 'http://en.wikipedia.org/wiki/Tablet_computer', 'type': 'wiki', 'score': 4, 'label': {'eng': 'Tablet computer'}}, {'uri': 'http://en.wikipedia.org/wiki/Face_ID', 'type': 'wiki', 'score': 3, 'label': {'eng': 'Face ID'}}, {'uri': 'http://en.wikipedia.org/wiki/Touch_ID', 'type': 'wiki', 'score': 3, 'label': {'eng': 'Touch ID'}}, {'uri': 'http://en.wikipedia.org/wiki/Apple_A14', 'type': 'wiki', 'score': 2, 'label': {'eng': 'Apple A14'}}, {'uri': 'http://en.wikipedia.org/wiki/Magic_Keyboard_(Mac)', 'type': 'wiki', 'score': 2, 'label': {'eng': 'Magic Keyboard (Mac)'}}, {'uri': 'http://en.wikipedia.org/wiki/Apple_M1', 'type': 'wiki', 'score': 2, 'label': {'eng': 'Apple M1'}}, {'uri': 'http://en.wikipedia.org/wiki/Liquid-crystal_display', 'type': 'wiki', 'score': 2, 'label': {'eng': 'Liquid-crystal display'}}, {'uri': 'http://en.wikipedia.org/wiki/Computer_keyboard', 'type': 'wiki', 'score': 2, 'label': {'eng': 'Computer keyboard'}}, {'uri': 'http://en.wikipedia.org/wiki/IPadOS', 'type': 'wiki', 'score': 1, 'label': {'eng': 'IPadOS'}}, {'uri': 'http://en.wikipedia.org/wiki/MacOS', 'type': 'wiki', 'score': 1, 'label': {'eng': 'MacOS'}}, {'uri': 'http://en.wikipedia.org/wiki/MacBook_Air', 'type': 'wiki', 'score': 1, 'label': {'eng': 'MacBook Air'}}, {'uri': 'http://en.wikipedia.org/wiki/OLED', 'type': 'wiki', 'score': 1, 'label': {'eng': 'OLED'}}, {'uri': 'http://en.wikipedia.org/wiki/Laptop', 'type': 'wiki', 'score': 1, 'label': {'eng': 'Laptop'}}]",https://cdn.arstechnica.net/wp-content/uploads/2024/05/IMG_1991-760x380.jpeg,eng-9541713,0.192156863,452808493,1,arstechnica.com,news,Ars Technica,IPad Pro IPad Apple Inc. Tablet computer Face ID Touch ID Apple A14 Magic Keyboard (Mac) Apple M1 Liquid-crystal display Computer keyboard IPadOS MacOS MacBook Air OLED Laptop,arstechnica.com,393,Chat-GPT,2024,5,7,8,20,2024-05-07
