,Unnamed: 0,uri,lang,isDuplicate,date,time,dateTime,dateTimePub,dataType,sim,url,title,body,authors,concepts,image,eventUri,sentiment,wgt,relevance,source.uri,source.dataType,source.title,all_concepts,url2,word_count,Category,year,month,day,min,hour,MD
258,7308,8103493032,eng,False,2024-04-29,20:26:03,4/29/2024 20:26,2024-04-29 20:25:42,news,0.690196097,https://arstechnica.com/information-technology/2024/04/us-department-of-homeland-security-names-ai-safety-and-security-board-members/,Critics question tech-heavy lineup of new Homeland Security AI safety board,"CEO-heavy board to tackle elusive AI safety concept and apply it to US infrastructure.

On Friday, the US Department of Homeland Security announced the formation of an Artificial Intelligence Safety and Security Board that consists of 22 members pulled from the tech industry, government, academia, and civil rights organizations. But given the nebulous nature of the term ""AI,"" which can apply to a broad spectrum of computer technology, it's unclear if this group will even be able to agree on what exactly they are safeguarding us from.

Further Reading

President Biden directed DHS Secretary Alejandro Mayorkas to establish the board, which will meet for the first time in early May and subsequently on a quarterly basis.

The fundamental assumption posed by the board's existence, and reflected in Biden's AI executive order from October, is that AI is an inherently risky technology and that American citizens and businesses need to be protected from its misuse. Along those lines, the goal of the group is to help guard against foreign adversaries using AI to disrupt US infrastructure; develop recommendations to ensure the safe adoption of AI tech into transportation, energy, and Internet services; foster cross-sector collaboration between government and businesses; and create a forum where AI leaders to share information on AI security risks with the DHS.

It's worth noting that the ill-defined nature of the term ""Artificial Intelligence"" does the new board no favors regarding scope and focus. AI can mean many different things: It can power a chatbot, fly an airplane, control the ghosts in Pac-Man, regulate the temperature of a nuclear reactor, or play a great game of chess. It can be all those things and more, and since many of those applications of AI work very differently, there's no guarantee any two people on the board will be thinking about the same type of AI.

This confusion is reflected in the quotes provided by the DHS press release from new board members, some of whom are already talking about different types of AI. While OpenAI, Microsoft, and Anthropic are monetizing generative AI systems like ChatGPT based on large language models (LLMs), Ed Bastian, the CEO of Delta Air Lines, refers to entirely different classes of machine learning when he says, ""By driving innovative tools like crew resourcing and turbulence prediction, AI is already making significant contributions to the reliability of our nation's air travel system.""

So, defining the scope of what AI exactly means -- and which applications of AI are new or dangerous -- might be one of the key challenges for the new board.

A roundtable of Big Tech CEOs attracts criticism

For the inaugural meeting of the AI Safety and Security Board, the DHS selected a tech industry-heavy group, populated with CEOs of four major AI vendors (Sam Altman of OpenAI, Satya Nadella of Microsoft, Sundar Pichai of Alphabet, and Dario Amodei of Anthopic), CEO Jensen Huang of top AI chipmaker Nvidia, and representatives from other major tech companies like IBM, Adobe, Amazon, Cisco, and AMD. There are also reps from big aerospace and aviation: Northrop Grumman and Delta Air Lines.

Upon reading the announcement, some critics took issue with the board composition. On LinkedIn, founder of The Distributed AI Research Institute (DAIR) Timnit Gebru especially criticized OpenAI's presence on the board and wrote, ""I've now seen the full list and it is hilarious. Foxes guarding the hen house is an understatement.""","[{'uri': 'benj_edwards@arstechnica.com', 'name': 'Benj Edwards', 'type': 'author', 'isAgency': False}]","[{'uri': 'http://en.wikipedia.org/wiki/United_States_Department_of_Homeland_Security', 'type': 'org', 'score': 5, 'label': {'eng': 'United States Department of Homeland Security'}}, {'uri': 'http://en.wikipedia.org/wiki/Artificial_intelligence', 'type': 'wiki', 'score': 5, 'label': {'eng': 'Artificial intelligence'}}, {'uri': 'http://en.wikipedia.org/wiki/Alejandro_Mayorkas', 'type': 'person', 'score': 3, 'label': {'eng': 'Alejandro Mayorkas'}}, {'uri': 'http://en.wikipedia.org/wiki/United_States_Secretary_of_Homeland_Security', 'type': 'wiki', 'score': 3, 'label': {'eng': 'United States Secretary of Homeland Security'}}, {'uri': 'http://en.wikipedia.org/wiki/Executive_order_(United_States)', 'type': 'wiki', 'score': 3, 'label': {'eng': 'Executive order (United States)'}}, {'uri': 'http://en.wikipedia.org/wiki/Civil_and_political_rights', 'type': 'wiki', 'score': 3, 'label': {'eng': 'Civil and political rights'}}, {'uri': 'http://en.wikipedia.org/wiki/AI_safety', 'type': 'wiki', 'score': 3, 'label': {'eng': 'AI safety'}}, {'uri': 'http://en.wikipedia.org/wiki/Technology_company', 'type': 'wiki', 'score': 3, 'label': {'eng': 'Technology company'}}, {'uri': 'http://en.wikipedia.org/wiki/Computing', 'type': 'wiki', 'score': 3, 'label': {'eng': 'Computing'}}, {'uri': 'http://en.wikipedia.org/wiki/Joe_Biden', 'type': 'person', 'score': 3, 'label': {'eng': 'Joe Biden'}}, {'uri': 'http://en.wikipedia.org/wiki/Pac-Man', 'type': 'wiki', 'score': 2, 'label': {'eng': 'Pac-Man'}}, {'uri': 'http://en.wikipedia.org/wiki/Internet_service_provider', 'type': 'wiki', 'score': 2, 'label': {'eng': 'Internet service provider'}}, {'uri': 'http://en.wikipedia.org/wiki/Nuclear_reactor', 'type': 'wiki', 'score': 2, 'label': {'eng': 'Nuclear reactor'}}, {'uri': 'http://en.wikipedia.org/wiki/Chatbot', 'type': 'wiki', 'score': 2, 'label': {'eng': 'Chatbot'}}, {'uri': 'http://en.wikipedia.org/wiki/Microsoft', 'type': 'org', 'score': 2, 'label': {'eng': 'Microsoft'}}, {'uri': 'http://en.wikipedia.org/wiki/Chess', 'type': 'wiki', 'score': 2, 'label': {'eng': 'Chess'}}, {'uri': 'http://en.wikipedia.org/wiki/Chief_executive_officer', 'type': 'wiki', 'score': 2, 'label': {'eng': 'Chief executive officer'}}, {'uri': 'http://en.wikipedia.org/wiki/Airplane', 'type': 'wiki', 'score': 2, 'label': {'eng': 'Airplane'}}, {'uri': 'http://en.wikipedia.org/wiki/United_States', 'type': 'loc', 'score': 2, 'label': {'eng': 'United States'}, 'location': {'type': 'country', 'label': {'eng': 'United States'}}}, {'uri': 'http://en.wikipedia.org/wiki/Timnit_Gebru', 'type': 'wiki', 'score': 1, 'label': {'eng': 'Timnit Gebru'}}, {'uri': 'http://en.wikipedia.org/wiki/Ed_Bastian', 'type': 'wiki', 'score': 1, 'label': {'eng': 'Ed Bastian'}}, {'uri': 'http://en.wikipedia.org/wiki/Sundar_Pichai', 'type': 'wiki', 'score': 1, 'label': {'eng': 'Sundar Pichai'}}, {'uri': 'http://en.wikipedia.org/wiki/Satya_Nadella', 'type': 'wiki', 'score': 1, 'label': {'eng': 'Satya Nadella'}}, {'uri': 'http://en.wikipedia.org/wiki/Northrop_Grumman', 'type': 'org', 'score': 1, 'label': {'eng': 'Northrop Grumman'}}, {'uri': 'http://en.wikipedia.org/wiki/IBM', 'type': 'org', 'score': 1, 'label': {'eng': 'IBM'}}, {'uri': 'http://en.wikipedia.org/wiki/Cisco', 'type': 'org', 'score': 1, 'label': {'eng': 'Cisco'}}, {'uri': 'http://en.wikipedia.org/wiki/Adobe_Inc.', 'type': 'org', 'score': 1, 'label': {'eng': 'Adobe Inc.'}}, {'uri': 'http://en.wikipedia.org/wiki/Delta_Air_Lines', 'type': 'org', 'score': 1, 'label': {'eng': 'Delta Air Lines'}}, {'uri': 'http://en.wikipedia.org/wiki/Large_language_model', 'type': 'wiki', 'score': 1, 'label': {'eng': 'Large language model'}}, {'uri': 'http://en.wikipedia.org/wiki/Generative_artificial_intelligence', 'type': 'wiki', 'score': 1, 'label': {'eng': 'Generative artificial intelligence'}}, {'uri': 'http://en.wikipedia.org/wiki/Alphabet_Inc.', 'type': 'org', 'score': 1, 'label': {'eng': 'Alphabet Inc.'}}, {'uri': 'http://en.wikipedia.org/wiki/Jensen_Huang', 'type': 'person', 'score': 1, 'label': {'eng': 'Jensen Huang'}}, {'uri': 'http://en.wikipedia.org/wiki/LinkedIn', 'type': 'org', 'score': 1, 'label': {'eng': 'LinkedIn'}}, {'uri': 'http://en.wikipedia.org/wiki/Amazon_(company)', 'type': 'org', 'score': 1, 'label': {'eng': 'Amazon (company)'}}, {'uri': 'http://en.wikipedia.org/wiki/Nvidia', 'type': 'org', 'score': 1, 'label': {'eng': 'Nvidia'}}]",https://cdn.arstechnica.net/wp-content/uploads/2024/04/dangerous_ai_hero-760x380.jpg,eng-9516085,0.490196078,452118363,1,arstechnica.com,news,Ars Technica,United States Department of Homeland Security Artificial intelligence Alejandro Mayorkas United States Secretary of Homeland Security Executive order (United States) Civil and political rights AI safety Technology company Computing Joe Biden Pac-Man Internet service provider Nuclear reactor Chatbot Microsoft Chess Chief executive officer Airplane United States Timnit Gebru Ed Bastian Sundar Pichai Satya Nadella Northrop Grumman IBM Cisco Adobe Inc. Delta Air Lines Large language model Generative artificial intelligence Alphabet Inc. Jensen Huang LinkedIn Amazon (company) Nvidia,arstechnica.com,567,Artificial Intelligence,2024,4,29,26,20,2024-04-29
259,6419,8106607113,eng,False,2024-05-01,16:54:07,5/1/2024 16:54,2024-05-01 16:53:43,news,0.486274511,https://arstechnica.com/gadgets/2024/05/rabbit-r1-ai-box-is-just-an-android-app-and-the-software-can-run-on-a-phone/,"Rabbit R1 AI box is just an Android app, and the software can run on a phone","It sounds like the company is now blocking access from ""bootleg"" APKs.

If you haven't heard of the Rabbit R1, this is yet another ""AI box"" that is trying to replace your smartphone with a voice command device that runs zero apps. Just like the Humane AI Pin, this thing recently launched and seems to be dead on arrival as a completely non-viable device that doesn't solve any real problems, has terrible battery life, and is missing big chunks of core functionality. Before the device fades into obscurity, though, Android Authority's Mishaal Rahman looked at the software and found the ""smartphone replacement"" device just runs a smartphone OS. It's Android -- both an Android OS and Android app, just in a very limited $200 box.

OK, technically, we can't call it ""Android"" since that's a Google trademark that you only get access to after licensing Google Play. It runs AOSP (the Android Open Source Project codebase), which is the open source bits of Android without any proprietary Google code. The interface -- which is mostly just a clock, settings screen, and voice input -- is also just an Android app. Being a normal Android app means you can install it on an Android phone, and Rahman was able to get the Rabbit R1 software running on a Pixel 6. He even got the AI assistant to answer questions on the phone.

Rabbit Inc. does not sound happy about Rahman's discovery. The company posted on X that it is ""aware there are some unofficial rabbit OS app/website emulators out there"" and that since it does not want to support ""third-party clients,"" a ""local bootleg APK without the proper OS and Cloud endpoints won't be able to access our service."" The company describes its device as a ""very bespoke AOSP and lower level firmware modifications,"" but that's a statement that would be true for many phones. In another statement to Rahman, the company threatens that ""We reserve all rights for any malicious and illegal cyber security activities towards our services.""

It's unclear why the company seems to be so mad about the details of its tech stack being public, but from a technical standpoint, Rabbit Inc. is right to use Android, or specifically as much of AOSP as it can. Forget about all the Google Play stuff -- if you have something that needs to connect a mobile network, manage charge states, light up a touchscreen, work hardware inputs and a camera, and use an SoC in a power-efficient way, AOSP already does all of this for you. It's open source and can be used without any connections, obligations, or tracking from Google. You'd need to have a very good reason to spend a bunch of time and money reinventing all of this code when AOSP is free, it works well, and it's the de facto industry standard to run mobile components. This line of thinking aligns with Google's master plan in making Android open source, and it ultimately makes sense.

Further ReadingThe next question for a hardware developer is, ""Should we use the app framework?"" and that's another thing that is hard to argue with re-inventing. The Android app framework will solve a million problems you probably already need to solve, let you define screens and navigation, handle inputs and settings, and countless other features. The next part of Android's strategy is ""Why not also sign up for Google Play and sign on the dotted line with Google, Inc?"" This comes with a lot of cloud stuff like push notifications, online storage, millions of smartphone apps, all the proprietary Google code and tracking, and many restrictions and qualifications. A big chunk of those restrictions are around app compatibility, and that makes Google Play non-viable for a weird in-betweener device like the Rabbit R1. If you can't smoothly slot into one of the categories of ""smartwatch,"" ""smartphone,"" ""tablet,"" ""TV"" or ""car app,"" Google Play doesn't have a place for you.

The Rabbit devs didn't want to make a normal device with a million smartphone apps, so skipping Google Play was the right choice. Since you can only use the name ""Android"" -- a registered Google trademark -- in marketing if you sign up with Google Play, the company can't exactly shout from the rooftops about what codebase it's using. Rabbit's opening sales pitch that it wants to ""break away from the app-based operating system currently used by smartphones"" feels a bit disingenuous when it's using the exact operating system it's hinting at, but from a technical standpoint, these feel like all the right decisions.

For the record, the Humane AI Pin also ran AOSP. The free and open source nature of AOSP makes it the obvious choice for mobile hardware that's smaller than a laptop, VR headsets, digital signage, and a million other things that don't need the expense or app compatibility of Windows. Nowadays, I just assume any new device from a startup is AOSP-based unless proven otherwise.","[{'uri': 'ron_amadeo@arstechnica.com', 'name': 'Ron Amadeo', 'type': 'author', 'isAgency': False}]","[{'uri': 'http://en.wikipedia.org/wiki/Android_(operating_system)', 'type': 'wiki', 'score': 5, 'label': {'eng': 'Android (operating system)'}}, {'uri': 'http://en.wikipedia.org/wiki/Operating_system', 'type': 'wiki', 'score': 5, 'label': {'eng': 'Operating system'}}, {'uri': 'http://en.wikipedia.org/wiki/Google_Play', 'type': 'wiki', 'score': 5, 'label': {'eng': 'Google Play'}}, {'uri': 'http://en.wikipedia.org/wiki/Smartphone', 'type': 'wiki', 'score': 5, 'label': {'eng': 'Smartphone'}}, {'uri': 'http://en.wikipedia.org/wiki/Google', 'type': 'org', 'score': 5, 'label': {'eng': 'Google'}}, {'uri': 'http://en.wikipedia.org/wiki/Artificial_intelligence', 'type': 'wiki', 'score': 5, 'label': {'eng': 'Artificial intelligence'}}, {'uri': 'http://en.wikipedia.org/wiki/Copyright_infringement', 'type': 'wiki', 'score': 4, 'label': {'eng': 'Copyright infringement'}}, {'uri': 'http://en.wikipedia.org/wiki/Open-source_software', 'type': 'wiki', 'score': 4, 'label': {'eng': 'Open-source software'}}, {'uri': 'http://en.wikipedia.org/wiki/Software', 'type': 'wiki', 'score': 4, 'label': {'eng': 'Software'}}, {'uri': 'http://en.wikipedia.org/wiki/Mobile_app', 'type': 'wiki', 'score': 4, 'label': {'eng': 'Mobile app'}}, {'uri': 'http://en.wikipedia.org/wiki/Voice_user_interface', 'type': 'wiki', 'score': 3, 'label': {'eng': 'Voice user interface'}}, {'uri': 'http://en.wikipedia.org/wiki/Bit', 'type': 'wiki', 'score': 3, 'label': {'eng': 'Bit'}}, {'uri': 'http://en.wikipedia.org/wiki/Proprietary_software', 'type': 'wiki', 'score': 3, 'label': {'eng': 'Proprietary software'}}, {'uri': 'http://en.wikipedia.org/wiki/Trademark', 'type': 'wiki', 'score': 3, 'label': {'eng': 'Trademark'}}, {'uri': 'http://en.wikipedia.org/wiki/Pixel_6', 'type': 'wiki', 'score': 2, 'label': {'eng': 'Pixel 6'}}, {'uri': 'http://en.wikipedia.org/wiki/Emulator', 'type': 'wiki', 'score': 2, 'label': {'eng': 'Emulator'}}, {'uri': 'http://en.wikipedia.org/wiki/Firmware', 'type': 'wiki', 'score': 2, 'label': {'eng': 'Firmware'}}, {'uri': 'http://en.wikipedia.org/wiki/Cellular_network', 'type': 'wiki', 'score': 2, 'label': {'eng': 'Cellular network'}}, {'uri': 'http://en.wikipedia.org/wiki/Virtual_assistant', 'type': 'wiki', 'score': 2, 'label': {'eng': 'Virtual assistant'}}, {'uri': 'http://en.wikipedia.org/wiki/System_on_a_chip', 'type': 'wiki', 'score': 2, 'label': {'eng': 'System on a chip'}}, {'uri': 'http://en.wikipedia.org/wiki/Computer_security', 'type': 'wiki', 'score': 2, 'label': {'eng': 'Computer security'}}]",https://cdn.arstechnica.net/wp-content/uploads/2024/05/r1-interface.desktop-760x380.jpg,eng-9525510,-0.050980392,452278447,1,arstechnica.com,news,Ars Technica,Android (operating system) Operating system Google Play Smartphone Google Artificial intelligence Copyright infringement Open-source software Software Mobile app Voice user interface Bit Proprietary software Trademark Pixel 6 Emulator Firmware Cellular network Virtual assistant System on a chip Computer security,arstechnica.com,827,Artificial Intelligence,2024,5,1,54,16,2024-05-01
260,6339,8106925760,eng,False,2024-05-01,21:58:21,5/1/2024 21:58,2024-05-01 21:57:38,news,0.854901969,https://arstechnica.com/information-technology/2024/05/anthropic-releases-claude-ai-chatbot-ios-app/,Anthropic releases Claude AI chatbot iOS app,"Anthropic finally comes to mobile, launches plan for teams that includes 200K context window.

On Wednesday, Anthropic announced the launch of an iOS mobile app for its Claude 3 AI language models that are similar to OpenAI's ChatGPT. It also introduced a new subscription tier designed for group collaboration. Before the app launch, Claude was only available through a website, an API, and other apps that integrated Claude through API.

Further Reading

Like the ChatGPT app, Claude's new mobile app serves as a gateway to chatbot interactions, and it also allows uploading photos for analysis. While it's only available on Apple devices for now, Anthropic says that an Android app is coming soon.

Anthropic rolled out the Claude 3 large language model (LLM) family in March, featuring three different model sizes: Claude Opus, Claude Sonnet, and Claude Haiku. Currently, the app utilizes Sonnet for regular users and Opus for Pro users.

While Anthropic has been a key player in the AI field for several years, it's entering the mobile space after many of its competitors have already established footprints on mobile platforms. OpenAI released its ChatGPT app for iOS in May 2023, with an Android version arriving two months later. Microsoft released a Copilot iOS app in January. Google Gemini is available through the Google app on iPhone.

The app is freely available to all users of Claude, including those using the free version, subscribers paying $20 per month for Claude Pro, and members of the newly introduced Claude Team plan. Conversation history is saved and shared between the web app version of Claude and the mobile app version after logging in.

Speaking of that Team plan, it's designed for groups of at least five and is priced at $30 per seat per month. It offers more chat queries (higher rate limits), access to all three Claude models, and a larger context window (200K tokens) for processing lengthy documents or maintaining detailed conversations. It also includes group admin tools and billing management, and users can easily switch between Pro and Team plans.","[{'uri': 'benj_edwards@arstechnica.com', 'name': 'Benj Edwards', 'type': 'author', 'isAgency': False}]","[{'uri': 'http://en.wikipedia.org/wiki/Anthropic', 'type': 'wiki', 'score': 5, 'label': {'eng': 'Anthropic'}}, {'uri': 'http://en.wikipedia.org/wiki/ChatGPT', 'type': 'wiki', 'score': 5, 'label': {'eng': 'ChatGPT'}}, {'uri': 'http://en.wikipedia.org/wiki/Mobile_app', 'type': 'wiki', 'score': 5, 'label': {'eng': 'Mobile app'}}, {'uri': 'http://en.wikipedia.org/wiki/IOS', 'type': 'wiki', 'score': 4, 'label': {'eng': 'IOS'}}, {'uri': 'http://en.wikipedia.org/wiki/API', 'type': 'wiki', 'score': 4, 'label': {'eng': 'API'}}, {'uri': 'http://en.wikipedia.org/wiki/Artificial_intelligence', 'type': 'wiki', 'score': 4, 'label': {'eng': 'Artificial intelligence'}}, {'uri': 'http://en.wikipedia.org/wiki/Language_model', 'type': 'wiki', 'score': 3, 'label': {'eng': 'Language model'}}, {'uri': 'http://en.wikipedia.org/wiki/Android_(operating_system)', 'type': 'wiki', 'score': 3, 'label': {'eng': 'Android (operating system)'}}, {'uri': 'http://en.wikipedia.org/wiki/Chatbot', 'type': 'wiki', 'score': 3, 'label': {'eng': 'Chatbot'}}, {'uri': 'http://en.wikipedia.org/wiki/OpenAI', 'type': 'wiki', 'score': 3, 'label': {'eng': 'OpenAI'}}, {'uri': 'http://en.wikipedia.org/wiki/Mobile_operating_system', 'type': 'wiki', 'score': 2, 'label': {'eng': 'Mobile operating system'}}, {'uri': 'http://en.wikipedia.org/wiki/Large_language_model', 'type': 'wiki', 'score': 2, 'label': {'eng': 'Large language model'}}, {'uri': 'http://en.wikipedia.org/wiki/Apple_Inc.', 'type': 'org', 'score': 2, 'label': {'eng': 'Apple Inc.'}}, {'uri': 'http://en.wikipedia.org/wiki/Google', 'type': 'org', 'score': 2, 'label': {'eng': 'Google'}}, {'uri': 'http://en.wikipedia.org/wiki/Web_application', 'type': 'wiki', 'score': 1, 'label': {'eng': 'Web application'}}, {'uri': 'http://en.wikipedia.org/wiki/App_Store_(iOS/iPadOS)', 'type': 'wiki', 'score': 1, 'label': {'eng': 'App Store (iOS/iPadOS)'}}, {'uri': 'http://en.wikipedia.org/wiki/Microsoft', 'type': 'org', 'score': 1, 'label': {'eng': 'Microsoft'}}, {'uri': 'http://en.wikipedia.org/wiki/IPhone', 'type': 'wiki', 'score': 1, 'label': {'eng': 'IPhone'}}]",https://cdn.arstechnica.net/wp-content/uploads/2024/05/Claude-iOS-App-2-760x380.jpg,eng-9528124,0.035294118,452296701,1,arstechnica.com,news,Ars Technica,Anthropic ChatGPT Mobile app IOS API Artificial intelligence Language model Android (operating system) Chatbot OpenAI Mobile operating system Large language model Apple Inc. Google Web application App Store (iOS/iPadOS) Microsoft IPhone,arstechnica.com,342,Artificial Intelligence,2024,5,1,58,21,2024-05-01
