,uri,lang,isDuplicate,date,time,dateTime,dateTimePub,dataType,sim,url,title,body,authors,concepts,image,eventUri,sentiment,wgt,relevance,source.uri,source.dataType,source.title,all_concepts,con_name,country,lang-name,language,Political-Alignment,wiki-url,Cultural-Class,Economic-Class,Continent-name,Continent,Religions,2019Rank-From,SafetyandSecurity,PersonalFreedom,Governance,SocialCapital,InvestmentEnvironment,EnterpriseConditions,MarketAccessandInfrastructure,EconomicQuality,LivingConditions,Health,Education,NaturalEnvironment,PowerDistance,Individualism,Masculinity,UncertaintyAvoidance,LongTermOrientation,Indulgence,economicblocs-name,economicblocs,militarydefenseblocs-name,militarydefenseblocs,politicalregionalblocs-name,politicalregionalblocs,linguisticblocs-name,linguisticblocs,proScore,destination,parent,count,status,year,month,day,min,hour,MD
266,7443549724,eng,False,2023-03-12,21:43:00,2023-03-12 21:43:00,2023-03-12T21:40:00Z,news,0.5921568870544434,https://tribune.net.ph/2023/03/13/storm-floods-california-returning-cyclone-batters-mozambique/,"Storm floods California, returning cyclone batters Mozambique - Daily Tribune","A California storm caused a river to overflow and flood a largely Latino community overnight into Saturday while nearly 17,000 kilometers away in Mozambique, a cyclone returned and battered the south African country with heavy rains and strong winds.

The Pajaro River in Monterey County overflowed at about midnight Friday, Luis Alejo, its supervisor, said Saturday on Twitter.

Friday night, United States emergency services director Nancy Ward announced that the storm had already claimed at least two lives, according to Agence France-Presse.

Images posted on Twitter by the state's National Guard account showed guardsmen rescuing residents trapped in their cars by high water.

The area remained under a flood warning Saturday afternoon, the National Weather Service said.

Part of a powerful atmospheric river known as a ""Pineapple express"" -- for the warm, subtropical moisture it brings from Hawaii -- this latest storm will speed the melting of the enormous snowpack that has built up in higher elevations of California.

The resulting runoff threatens to aggravate already serious flooding.

Meanwhile, ""Cyclone Freddy"" made landfall near the eastern Mozambique seaport of Quelimane district, Zambezia province at around 10 p.m. as it kept on track to become the longest-lasting cyclone on record.

Authorities and the United Nations' Office for the Coordination of Humanitarian Affairs said heavy rains and winds caused water levels at several river basins to rise to above alert level.

""There is already quite substantial flooding,"" Guy Taylor, a spokesperson for the UN children's agency UNICEF, told AFP from Quelimane earlier on Saturday.

On Friday, authorities said more than half a million people were at risk.

The storm was expected to drop up to 400 millimeters of rain over the next few days, more than twice the usual monthly rainfall.

No casualty was reported so far.

According to the UN World Meteorological Organization, Freddy, formed off northwestern Australia in the first week of February

It crossed the entire southern Indian Ocean and battered Madagascar from 21 February, crossing the island before reaching Mozambique on 24 February.

Following what meteorologists describe as a ""rare"" loop trajectory, Freddy then headed back towards Madagascar before moving once more towards Mozambique.

During the first deadly visit it destroyed, damaged or flooded more than 28,000 homes, affecting about 166,000 people.

In total, Freddy has so far killed at least 27 people -- 10 in Mozambique and 17 in Madagascar.",[],"[{'uri': 'http://en.wikipedia.org/wiki/Cyclone', 'type': 'wiki', 'score': 5, 'label': {'eng': 'Cyclone'}}, {'uri': 'http://en.wikipedia.org/wiki/Twitter', 'type': 'org', 'score': 4, 'label': {'eng': 'Twitter'}}, {'uri': 'http://en.wikipedia.org/wiki/California', 'type': 'loc', 'score': 4, 'label': {'eng': 'California'}, 'location': {'type': 'place', 'label': {'eng': 'California'}, 'country': {'type': 'country', 'label': {'eng': 'United States'}}}}, {'uri': 'http://en.wikipedia.org/wiki/Pajaro_River', 'type': 'wiki', 'score': 3, 'label': {'eng': 'Pajaro River'}}, {'uri': 'http://en.wikipedia.org/wiki/Hispanic_and_Latino_Americans', 'type': 'wiki', 'score': 3, 'label': {'eng': 'Hispanic and Latino Americans'}}, {'uri': 'http://en.wikipedia.org/wiki/United_Nations', 'type': 'org', 'score': 3, 'label': {'eng': 'United Nations'}}, {'uri': 'http://en.wikipedia.org/wiki/Monterey_County,_California', 'type': 'loc', 'score': 3, 'label': {'eng': 'Monterey County, California'}, 'location': {'type': 'place', 'label': {'eng': 'Monterey County, California'}, 'country': {'type': 'country', 'label': {'eng': 'United States'}}}}, {'uri': 'http://en.wikipedia.org/wiki/United_States', 'type': 'loc', 'score': 3, 'label': {'eng': 'United States'}, 'location': {'type': 'country', 'label': {'eng': 'United States'}}}, {'uri': 'http://en.wikipedia.org/wiki/Mozambique', 'type': 'loc', 'score': 3, 'label': {'eng': 'Mozambique'}, 'location': {'type': 'country', 'label': {'eng': 'Mozambique'}}}, {'uri': 'http://en.wikipedia.org/wiki/Subtropics', 'type': 'wiki', 'score': 2, 'label': {'eng': 'Subtropics'}}, {'uri': 'http://en.wikipedia.org/wiki/Landfall', 'type': 'wiki', 'score': 2, 'label': {'eng': 'Landfall'}}, {'uri': 'http://en.wikipedia.org/wiki/Snowpack', 'type': 'wiki', 'score': 2, 'label': {'eng': 'Snowpack'}}, {'uri': 'http://en.wikipedia.org/wiki/United_Nations_Office_for_the_Coordination_of_Humanitarian_Affairs', 'type': 'wiki', 'score': 2, 'label': {'eng': 'United Nations Office for the Coordination of Humanitarian Affairs'}}, {'uri': 'http://en.wikipedia.org/wiki/Pineapple_Express', 'type': 'wiki', 'score': 2, 'label': {'eng': 'Pineapple Express'}}, {'uri': 'http://en.wikipedia.org/wiki/Flood', 'type': 'wiki', 'score': 2, 'label': {'eng': 'Flood'}}, {'uri': 'http://en.wikipedia.org/wiki/National_Weather_Service', 'type': 'org', 'score': 2, 'label': {'eng': 'National Weather Service'}}, {'uri': 'http://en.wikipedia.org/wiki/Surface_runoff', 'type': 'wiki', 'score': 2, 'label': {'eng': 'Surface runoff'}}, {'uri': 'http://en.wikipedia.org/wiki/Atmospheric_river', 'type': 'wiki', 'score': 2, 'label': {'eng': 'Atmospheric river'}}, {'uri': 'http://en.wikipedia.org/wiki/Port', 'type': 'wiki', 'score': 2, 'label': {'eng': 'Port'}}, {'uri': 'http://en.wikipedia.org/wiki/Hawaii', 'type': 'loc', 'score': 2, 'label': {'eng': 'Hawaii'}, 'location': {'type': 'place', 'label': {'eng': 'Hawaii'}, 'country': {'type': 'country', 'label': {'eng': 'United States'}}}}, {'uri': 'http://en.wikipedia.org/wiki/Quelimane', 'type': 'loc', 'score': 2, 'label': {'eng': 'Quelimane'}, 'location': {'type': 'place', 'label': {'eng': 'Quelimane'}, 'country': {'type': 'country', 'label': {'eng': 'Mozambique'}}}}, {'uri': 'http://en.wikipedia.org/wiki/Zambezia_Province', 'type': 'loc', 'score': 2, 'label': {'eng': 'Zambezia Province'}, 'location': {'type': 'place', 'label': {'eng': 'Zambezia Province'}, 'country': {'type': 'country', 'label': {'eng': 'Mozambique'}}}}, {'uri': 'http://en.wikipedia.org/wiki/Drainage_basin', 'type': 'wiki', 'score': 1, 'label': {'eng': 'Drainage basin'}}, {'uri': 'http://en.wikipedia.org/wiki/World_Meteorological_Organization', 'type': 'org', 'score': 1, 'label': {'eng': 'World Meteorological Organization'}}, {'uri': 'http://en.wikipedia.org/wiki/UNICEF', 'type': 'org', 'score': 1, 'label': {'eng': 'UNICEF'}}, {'uri': 'http://en.wikipedia.org/wiki/Meteorologist', 'type': 'wiki', 'score': 1, 'label': {'eng': 'Meteorologist'}}, {'uri': 'http://en.wikipedia.org/wiki/Indian_Ocean', 'type': 'loc', 'score': 1, 'label': {'eng': 'Indian Ocean'}, 'location': None}, {'uri': 'http://en.wikipedia.org/wiki/Agence_France-Presse', 'type': 'org', 'score': 1, 'label': {'eng': 'Agence France-Presse'}}, {'uri': 'http://en.wikipedia.org/wiki/Rain', 'type': 'wiki', 'score': 1, 'label': {'eng': 'Rain'}}, {'uri': 'http://en.wikipedia.org/wiki/Madagascar', 'type': 'loc', 'score': 1, 'label': {'eng': 'Madagascar'}, 'location': {'type': 'country', 'label': {'eng': 'Madagascar'}}}, {'uri': 'http://en.wikipedia.org/wiki/Australia', 'type': 'loc', 'score': 1, 'label': {'eng': 'Australia'}, 'location': {'type': 'country', 'label': {'eng': 'Australia'}}}]",https://tribune.net.ph/wp-content/uploads/2023/03/fbb31b8cdbb046b01b152e77d440e426.jpg,eng-8467663,0.0117647058823529,416353380,1,tribune.net.ph,news,Daily Tribune,"Cyclone Twitter California Pajaro River Hispanic and Latino Americans United Nations Monterey County, California United States Mozambique Subtropics Landfall Snowpack United Nations Office for the Coordination of Humanitarian Affairs Pineapple Express Flood National Weather Service Surface runoff Atmospheric river Port Hawaii Quelimane Zambezia Province Drainage basin World Meteorological Organization UNICEF Meteorologist Indian Ocean Agence France-Presse Rain Madagascar Australia",Philippines,PH,English,eng,Center-right-populist,https:en.wikipedia.orgwikiDaily_Tribune_(Philippines),C18,C18,Asia,AS,Christian,84.0,worst,average,average,best,average,average,average,best,average,average,average,average,high,low,high,low,low,low,Association of Southeast Asian Nations (ASEAN) ,ASEAN,,,,,,,-1,,,0,False,2023,3,12,43,21,2023-03-12
