,uri,lang,isDuplicate,date,time,dateTime,dateTimePub,dataType,sim,url,title,body,authors,concepts,image,eventUri,sentiment,wgt,relevance,source.uri,source.dataType,source.title,all_concepts,con_name,country,lang-name,language,Political-Alignment,wiki-url,Cultural-Class,Economic-Class,Continent-name,Continent,Religions,2019Rank-From,SafetyandSecurity,PersonalFreedom,Governance,SocialCapital,InvestmentEnvironment,EnterpriseConditions,MarketAccessandInfrastructure,EconomicQuality,LivingConditions,Health,Education,NaturalEnvironment,PowerDistance,Individualism,Masculinity,UncertaintyAvoidance,LongTermOrientation,Indulgence,economicblocs-name,economicblocs,militarydefenseblocs-name,militarydefenseblocs,politicalregionalblocs-name,politicalregionalblocs,linguisticblocs-name,linguisticblocs,proScore,destination,parent,count,status,year,month,day,min,hour,MD
230,7444573365,eng,False,2023-03-13,12:34:00,2023-03-13 12:34:00,2023-03-13T12:33:00Z,news,0.6235294342041016,https://tribuneonlineng.com/storm-freddy-triggers-floods-in-malawi-kills-11/,"Storm Freddy triggers floods in Malawi, kills 11","At least 11 people have died and 16 are missing around Blantyre, Malawi's second-largest city after tropical storm Freddy brought torrential rains that triggered floods and landslides, police have said.

Freddy, one of the strongest storms ever recorded in the southern hemisphere, is believed to also be the longest-lasting tropical cyclone, with the previous record held by a 31-day hurricane in 1994, according to the World Meteorological Organization.

The full extent of the damage and loss of life in Mozambique is not yet clear, as the power supply and phone signals were cut off in the affected area.

Malawi police spokesman, Peter Kalaya said that the number of people killed and missing because of the storm was likely to grow as it had affected 10 districts in Blantyre.

He said rescue teams were looking for people in Chilobwe and Ndirande, two of the worst affected townships in Blantyre, where it was still raining on Monday and most residents were without power.

""Some missing people are feared buried in rubble and our team is working with other cooperating national agencies,"" Kalaya said.

Mozambique has received more than a year's worth of rainfall in the past four weeks, and there has been concern that Freddy could cause rivers to burst in its path.

Scientists say climate change is making tropical storms stronger, as oceans absorb much of the heat from greenhouse gas emissions and when warm seawater evaporates heat energy is transferred to the atmosphere.",[],"[{'uri': 'http://en.wikipedia.org/wiki/Tropical_cyclone', 'type': 'wiki', 'score': 5, 'label': {'eng': 'Tropical cyclone'}}, {'uri': 'http://en.wikipedia.org/wiki/Blantyre', 'type': 'loc', 'score': 4, 'label': {'eng': 'Blantyre'}, 'location': {'type': 'place', 'label': {'eng': 'Blantyre'}, 'country': {'type': 'country', 'label': {'eng': 'Malawi'}}}}, {'uri': 'http://en.wikipedia.org/wiki/Malawi', 'type': 'loc', 'score': 4, 'label': {'eng': 'Malawi'}, 'location': {'type': 'country', 'label': {'eng': 'Malawi'}}}, {'uri': 'http://en.wikipedia.org/wiki/Southern_Hemisphere', 'type': 'wiki', 'score': 3, 'label': {'eng': 'Southern Hemisphere'}}, {'uri': 'http://en.wikipedia.org/wiki/Flood', 'type': 'wiki', 'score': 3, 'label': {'eng': 'Flood'}}, {'uri': 'http://en.wikipedia.org/wiki/Landslide', 'type': 'wiki', 'score': 3, 'label': {'eng': 'Landslide'}}, {'uri': 'http://en.wikipedia.org/wiki/World_Meteorological_Organization', 'type': 'org', 'score': 2, 'label': {'eng': 'World Meteorological Organization'}}, {'uri': 'http://en.wikipedia.org/wiki/Mozambique', 'type': 'loc', 'score': 2, 'label': {'eng': 'Mozambique'}, 'location': {'type': 'country', 'label': {'eng': 'Mozambique'}}}, {'uri': 'http://en.wikipedia.org/wiki/Evaporation', 'type': 'wiki', 'score': 1, 'label': {'eng': 'Evaporation'}}, {'uri': 'http://en.wikipedia.org/wiki/Seawater', 'type': 'wiki', 'score': 1, 'label': {'eng': 'Seawater'}}, {'uri': 'http://en.wikipedia.org/wiki/Ocean', 'type': 'wiki', 'score': 1, 'label': {'eng': 'Ocean'}}, {'uri': 'http://en.wikipedia.org/wiki/Greenhouse_gas_emissions', 'type': 'wiki', 'score': 1, 'label': {'eng': 'Greenhouse gas emissions'}}, {'uri': 'http://en.wikipedia.org/wiki/River', 'type': 'wiki', 'score': 1, 'label': {'eng': 'River'}}, {'uri': 'http://en.wikipedia.org/wiki/Climate_change', 'type': 'wiki', 'score': 1, 'label': {'eng': 'Climate change'}}, {'uri': 'http://en.wikipedia.org/wiki/Rain', 'type': 'wiki', 'score': 1, 'label': {'eng': 'Rain'}}, {'uri': 'http://en.wikipedia.org/wiki/Heat', 'type': 'wiki', 'score': 1, 'label': {'eng': 'Heat'}}, {'uri': 'http://en.wikipedia.org/wiki/Atmosphere', 'type': 'wiki', 'score': 1, 'label': {'eng': 'Atmosphere'}}]",https://tribuneonlineng.com/wp-content/uploads/2023/03/Storm.jpg,eng-8467663,-0.2392156862745098,416406840,1,tribuneonlineng.com,news,Tribune Online,Tropical cyclone Blantyre Malawi Southern Hemisphere Flood Landslide World Meteorological Organization Mozambique Evaporation Seawater Ocean Greenhouse gas emissions River Climate change Rain Heat Atmosphere,Nigeria,NG,English,eng,,,C12,C5,Africa,AF,Muslim,142.0,worst,average,worst,average,worst,worst,worst,worst,worst,worst,worst,worst,high,low,high,high,low,high,African Continental Free Trade Area (AfCFTA),AfCFTA,,,African Union,AU,,,-1,,,0,False,2023,3,13,34,12,2023-03-13
135,7445172640,eng,False,2023-03-13,19:22:00,2023-03-13 19:22:00,2023-03-13T19:17:00Z,news,0.5529412031173706,https://www.newtelegraphng.com/dozens-killed-as-storm-freddy-overwhelms-malawi/,Dozens killed as Storm Freddy 'overwhelms' Malawi,"More than 60 bodies have been recovered in Malawi's main commercial hub of Blantyre after Tropical Storm Freddy hit southern Africa for the second time in a month.

Strong winds and rains continue to cause severe destruction.

""We have rivers overflowing, we have people being carried away by running waters, we have buildings collapsing,"" police spokesman Peter Kalaya told BBC Focus on Africa radio.

Malawi was ""overwhelmed"" he added.

Relentless rain and strong winds have hampered overstretched emergency teams in the country's southern and central regions, which are worst affected, Kalaya said.

Victims taken to a hospital in Blantyre had injuries caused by falling trees, landslides and flash floods, Doctors Without Borders (MSF) country director, Marion Pechayre told Reuters news agency.

""A lot of [homes] are mud houses with tin roofs, so the roofs fall on people's heads,"" she is quoted as saying.

Casualties were still arriving from affected areas, said Chipiliro Khamula, spokesperson for Malawi's department of disaster management. Officials expect the death toll to rise as some areas remain cut off.

Freddy is the strongest tropical cyclone on record and could also be the long-lasting one, according to the World Meteorological Organisation.

On Sunday the storm struck Mozambique as a cyclone - for the second time in a less than a month after battering the island nation of Madagascar in the Indian Ocean, causing severe destruction.

It has been difficult to determine the extent of the damage caused in Mozambique and the number of deaths as power supply and phone signals were cut off in some parts of the affected areas.

The timing of the storm could exacerbate Malawi's cholera outbreak, the UN and other agencies have warned, as the country battles one of its worst public heath crises.

Experts says climate change is making tropical storms around the world wetter, windier and more intense.

Freddy had broken records for the strength it has accumulated over the 8,000-km (5,000-mile) path it travelled across the Indian Ocean from north-western Australia.",[],"[{'uri': 'http://en.wikipedia.org/wiki/Malawi', 'type': 'loc', 'score': 5, 'label': {'eng': 'Malawi'}, 'location': {'type': 'country', 'label': {'eng': 'Malawi'}}}, {'uri': 'http://en.wikipedia.org/wiki/Blantyre', 'type': 'loc', 'score': 4, 'label': {'eng': 'Blantyre'}, 'location': {'type': 'place', 'label': {'eng': 'Blantyre'}, 'country': {'type': 'country', 'label': {'eng': 'Malawi'}}}}, {'uri': 'http://en.wikipedia.org/wiki/Médecins_Sans_Frontières', 'type': 'org', 'score': 3, 'label': {'eng': 'Médecins Sans Frontières'}}, {'uri': 'http://en.wikipedia.org/wiki/Southern_Africa', 'type': 'loc', 'score': 3, 'label': {'eng': 'Southern Africa'}, 'location': None}, {'uri': 'http://en.wikipedia.org/wiki/BBC', 'type': 'org', 'score': 3, 'label': {'eng': 'BBC'}}, {'uri': 'http://en.wikipedia.org/wiki/River', 'type': 'wiki', 'score': 3, 'label': {'eng': 'River'}}, {'uri': 'http://en.wikipedia.org/wiki/Africa', 'type': 'loc', 'score': 3, 'label': {'eng': 'Africa'}, 'location': None}, {'uri': 'http://en.wikipedia.org/wiki/Emergency_management', 'type': 'wiki', 'score': 2, 'label': {'eng': 'Emergency management'}}, {'uri': 'http://en.wikipedia.org/wiki/Tin', 'type': 'wiki', 'score': 2, 'label': {'eng': 'Tin'}}, {'uri': 'http://en.wikipedia.org/wiki/Flash_flood', 'type': 'wiki', 'score': 2, 'label': {'eng': 'Flash flood'}}, {'uri': 'http://en.wikipedia.org/wiki/Landslide', 'type': 'wiki', 'score': 2, 'label': {'eng': 'Landslide'}}, {'uri': 'http://en.wikipedia.org/wiki/Mozambique', 'type': 'loc', 'score': 2, 'label': {'eng': 'Mozambique'}, 'location': {'type': 'country', 'label': {'eng': 'Mozambique'}}}, {'uri': 'http://en.wikipedia.org/wiki/World_Meteorological_Organization', 'type': 'org', 'score': 1, 'label': {'eng': 'World Meteorological Organization'}}, {'uri': 'http://en.wikipedia.org/wiki/Cholera', 'type': 'wiki', 'score': 1, 'label': {'eng': 'Cholera'}}, {'uri': 'http://en.wikipedia.org/wiki/Tropical_cyclone', 'type': 'wiki', 'score': 1, 'label': {'eng': 'Tropical cyclone'}}, {'uri': 'http://en.wikipedia.org/wiki/Indian_Ocean', 'type': 'loc', 'score': 1, 'label': {'eng': 'Indian Ocean'}, 'location': None}, {'uri': 'http://en.wikipedia.org/wiki/Climate_change', 'type': 'wiki', 'score': 1, 'label': {'eng': 'Climate change'}}, {'uri': 'http://en.wikipedia.org/wiki/Cyclone', 'type': 'wiki', 'score': 1, 'label': {'eng': 'Cyclone'}}, {'uri': 'http://en.wikipedia.org/wiki/United_Nations', 'type': 'org', 'score': 1, 'label': {'eng': 'United Nations'}}, {'uri': 'http://en.wikipedia.org/wiki/Reuters', 'type': 'wiki', 'score': 1, 'label': {'eng': 'Reuters'}}, {'uri': 'http://en.wikipedia.org/wiki/Madagascar', 'type': 'loc', 'score': 1, 'label': {'eng': 'Madagascar'}, 'location': {'type': 'country', 'label': {'eng': 'Madagascar'}}}, {'uri': 'http://en.wikipedia.org/wiki/Australia', 'type': 'loc', 'score': 1, 'label': {'eng': 'Australia'}, 'location': {'type': 'country', 'label': {'eng': 'Australia'}}}]",https://i0.wp.com/www.newtelegraphng.com/wp-content/uploads/2023/03/malawi-flood.webp?fit=976%2C549&ssl=1&w=640,eng-8467663,-0.2470588235294118,416431320,1,newtelegraphng.com,news,New Telegraph,Malawi Blantyre Médecins Sans Frontières Southern Africa BBC River Africa Emergency management Tin Flash flood Landslide Mozambique World Meteorological Organization Cholera Tropical cyclone Indian Ocean Climate change Cyclone United Nations Reuters Madagascar Australia,Nigeria,NG,English,eng,,,C12,C5,Africa,AF,Muslim,142.0,worst,average,worst,average,worst,worst,worst,worst,worst,worst,worst,worst,high,low,high,high,low,high,African Continental Free Trade Area (AfCFTA),AfCFTA,,,African Union,AU,,,-1,,,0,False,2023,3,13,22,19,2023-03-13
128,7445195040,eng,False,2023-03-13,19:42:00,2023-03-13 19:42:00,2023-03-13T19:42:00Z,news,0.5098039507865906,https://www.nairaland.com/7609592/dozens-killed-cyclone-freddy-slams,Dozens Killed As Cyclone Freddy Slams Malawi And Mozambique (Photos),"At least six people died in the Mozambique port town of Quelimane, which was struck hard by the cyclone, authorities told the public broadcaster on Monday.

The full extent of the damage and loss of life in Mozambique is not yet clear because power supplies and phone signals were cut off in some parts of the affected area.

Mozambique has seen more than a year's worth of rainfall in the past four weeks, prompting concern that rivers could burst their banks and cause wide-scale flooding.

Malawi also has been battling the deadliest cholera outbreak in its history, and UN agencies have warned the situation could worsen because of Freddy.

Scientists say climate change is making tropical storms stronger as greenhouse gases trap heat in the atmosphere and oceans become warmer.

When warm seawater evaporates, heat energy is transferred to the atmosphere, generating more powerful storms.",[],"[{'uri': 'http://en.wikipedia.org/wiki/Mozambique', 'type': 'loc', 'score': 5, 'label': {'eng': 'Mozambique'}, 'location': {'type': 'country', 'label': {'eng': 'Mozambique'}}}, {'uri': 'http://en.wikipedia.org/wiki/Cyclone', 'type': 'wiki', 'score': 3, 'label': {'eng': 'Cyclone'}}, {'uri': 'http://en.wikipedia.org/wiki/Port', 'type': 'wiki', 'score': 3, 'label': {'eng': 'Port'}}, {'uri': 'http://en.wikipedia.org/wiki/Quelimane', 'type': 'loc', 'score': 3, 'label': {'eng': 'Quelimane'}, 'location': {'type': 'place', 'label': {'eng': 'Quelimane'}, 'country': {'type': 'country', 'label': {'eng': 'Mozambique'}}}}, {'uri': 'http://en.wikipedia.org/wiki/Flood', 'type': 'wiki', 'score': 2, 'label': {'eng': 'Flood'}}, {'uri': 'http://en.wikipedia.org/wiki/Rain', 'type': 'wiki', 'score': 2, 'label': {'eng': 'Rain'}}, {'uri': 'http://en.wikipedia.org/wiki/Malawi', 'type': 'loc', 'score': 2, 'label': {'eng': 'Malawi'}, 'location': {'type': 'country', 'label': {'eng': 'Malawi'}}}, {'uri': 'http://en.wikipedia.org/wiki/Evaporation', 'type': 'wiki', 'score': 1, 'label': {'eng': 'Evaporation'}}, {'uri': 'http://en.wikipedia.org/wiki/Seawater', 'type': 'wiki', 'score': 1, 'label': {'eng': 'Seawater'}}, {'uri': 'http://en.wikipedia.org/wiki/Cholera', 'type': 'wiki', 'score': 1, 'label': {'eng': 'Cholera'}}, {'uri': 'http://en.wikipedia.org/wiki/Tropical_cyclone', 'type': 'wiki', 'score': 1, 'label': {'eng': 'Tropical cyclone'}}, {'uri': 'http://en.wikipedia.org/wiki/Ocean', 'type': 'wiki', 'score': 1, 'label': {'eng': 'Ocean'}}, {'uri': 'http://en.wikipedia.org/wiki/Greenhouse_gas', 'type': 'wiki', 'score': 1, 'label': {'eng': 'Greenhouse gas'}}, {'uri': 'http://en.wikipedia.org/wiki/Climate_change', 'type': 'wiki', 'score': 1, 'label': {'eng': 'Climate change'}}, {'uri': 'http://en.wikipedia.org/wiki/Heat', 'type': 'wiki', 'score': 1, 'label': {'eng': 'Heat'}}, {'uri': 'http://en.wikipedia.org/wiki/United_Nations', 'type': 'org', 'score': 1, 'label': {'eng': 'United Nations'}}, {'uri': 'http://en.wikipedia.org/wiki/Atmosphere', 'type': 'wiki', 'score': 1, 'label': {'eng': 'Atmosphere'}}]",,eng-8467663,-0.1607843137254902,416432520,1,nairaland.com,news,Nairaland,Mozambique Cyclone Port Quelimane Flood Rain Malawi Evaporation Seawater Cholera Tropical cyclone Ocean Greenhouse gas Climate change Heat United Nations Atmosphere,Nigeria,NG,,,,,C12,C5,Africa,AF,Muslim,142.0,worst,average,worst,average,worst,worst,worst,worst,worst,worst,worst,worst,high,low,high,high,low,high,African Continental Free Trade Area (AfCFTA),AfCFTA,,,African Union,AU,,,-1,,,0,False,2023,3,13,42,19,2023-03-13
